comment,parent
kill mother grab snicker hungry,False
low football game,False
well still hope still seen much,False
yeah highly doubt disney would take strong female character turn villain would backlash nightmare,False
never refer sportsball therapist also told developmentally delayed,False
look thread look almost every movie thread like movie justice league given movie flavor day circlejerk subject actoractressdirectorfranchisewhatever get mercilessly shit even one trailer lot people still see good open mind except see shit even think bunch self important masturbation get tiresome,False
yeah half made someone username getfreecash,False
mean like force push pull gun,False
rsadbuttrue,False
moment someone dared critique jumped immediately onto tired sexist nonargument clearly alright getting incredibly hostile reason someone dared criticize female character reddit thread take deep breath relax,False
ha even tv trope named thing happen time story far commonuninteresting trope people sitting chair,False
course always fun,False
idek man old eu crazy power even made dragon ball look bit funny last jedi going old eu stand reason luke scared,False
think likely talking young jedi began training flipped destroyed entire order fostering,False
could mental flash la luke failure cave burning new jedi temple,False
adam driver good actor whole movie know talking,False
except clearly pc get pc even people seemingly favor refuse admit employed way someone truly ability fill specific identifier disney selling movie two thousand and seventeen young millennial crowd know white people would article article calling star war white headed bad publicity making specific casting choice,False
choked guy like new hope fight exceedingly efficient,False
one snow two walker common imperial vehicle like tank three answer question unless maybe attacking sort entrenched resistance base resistance mounting evacuation,False
cue word queue obviously spliced together scene,False
imperial march mixed jedi step tfa mixed song particularly battle hero revenge sith,False
mean fairness vader scare always saw attitude going cave acting tough yoda actuality never confronted vader claim afraid yoda know idea going luke go cloud city cockywithout fear go necessity friend knowing full well two wise adviser galaxy telling ready let u say referring vader going without fear resulting losing hand much le impacting luke psyche guiding kylo resulting bunch people cared getting killed referring kylo,False
really know felt teaser tlj way better term music,False
cgi killing use practical effect model puppet disappointed saw,False
fucking issue putting woman lead role pc putting actress main role end fucking story nothing favor role story wrong people like disgusting,False
disney pushing hard look rebel look every star war story since disney taken jedi sith cult true balance force something middle,False
right mean wanted see ot stuff like oh look x wing wing kind forward oh stormtroopers different eye oh look tie fighter star destroyer different paintjob look darth revan combined darth vader oh look stormtrooper spinny tazer thing cool atat sort hump meanwhile first prequel movie hit u battle droids droidikas elephant tank thing ten new kind ship staff saber planet covered skyscraper victorian londan style city atop waterfall underwater city shield first film alone attack clone doubled amount unit planet got see yes writing dialogue as story something new action fantastic made feel like galaxy far far away tfa felt like scifi movie star war movie,False
antagonist fyi,False
like theory han turned light saber killed preventing kylo thus preventing truly joining dark side another chance time leia,False
obviously disney antichrist one fun anymore urban legend,False
argument equivalent nuh uh hard argue saying emotion logic,False
yes maybe reveal rey parent least father god would fucking brilliant,False
hoping going end way think luke talking knight ren try assassinate water planet,False
think might either happen ix would sum series nicely light dark middle seem path kylo dark light pulling rey light susceptible dark,False
trailer looked like garbage dude,False
oh catch part yeah sure would case could always changed needed robotics,False
lol done snope look like shitty version emperor,False
love woman hater spew sjw sjw sjw everything conform backwards way thinking keep racist sexist going get everywhere fuck terrible person,False
maybe people expect teenager whine given extra chore plan friend expect complain getting jedi master right away,False
except eu crazy god like character movie remove sort tension worry god luke solve everything disney made clear thing possibly taking whatever idea eu feel work reworking fit new era star war eu matter anymore say someone enjoyed quite number book eu,False
incredibly common vehicle attacking something else make reboot like battle hoth gotcha _,False
reaction ridiculous guy directed going make bad star war movie,True
see storyline deep rey going end villain even temporarily much like idea one suggested back great story choice slightly better zero chance happens,False
last jedi based old eu,False
woman hater perfect example wrong modern liberal single brain cell functioning,False
everyone behind way calm bridge starship middle battle handily losing definitely different scene,False
totally agree happy disney,False
really kind fakeout though expect scene dramatic looking shot like going pivotal scene film generic tie fighter,False
mean original three movie prequels terrible,False
think need accept reboot sw new sw new generation focused young actor promote next decade luke position ultimate jedi replaced rey disney pay billion dollar held lucas vision realizing way ill able enjoy new movie though always side star war like game book,False
trooper propaganda holo tape faulty blaster worry everything sorted,False
training kylo saw kylos power failed kylo seduced dark side,False
sure,False
look bad sad,False
even tell disappointed trailer made fuck disney thinking,False
going lie think upcoming star war film either insane amount hype behind tfa first star war film followed original trilogy think going getting film reaching two billion film might come close though,False
"expect rmovies giant circlejerk repeating thing moon underrated movie one thousand, nine hundred and ninety-four best year movie avatar cultural impact quote individual thread echo chamber modssub rule allows want serious discussion film place full fanboys retard shill come blockbuster news",False
please claim know reason calling quite okay people criticizing character got nitpicks regarding rey never called sexist either inferred maybe reason expected people call problem term used make look like reactionary child right start lessens rest criticism,False
asked,False
seems mostly misdirection,False
yeah like one follows formula dark movie kind like empire original character le directed personality come naturally last movie character somewhat rigid adhere tot character developed persona bad character somewhat made though make feel kind fakeforced,False
far one movie going judge entire trilogy first movie,False
hahaa twelve btw xd,False
hated clip trailer much looked like cgi anime,False
game time started,True
judging completely seeing pattern like people obviously could wrong hope,False
least agree something,False
seen episode seven finn good pilot shoot would visually boring,False
would ruin finn ending ep vii great force power face jedi trained probably birth use force lightsaber battle one hundred definitely going lose turn lightsaber fight anyway protect first friend despite historically massive coward chance winning action turning lightsaber would meant nearly much afraid knew going die anyway,False
yeah american football touchdown worth seven usually per game final score two thousand and seventeen though ended exciting,False
yeah prequels light hope star war fan,False
one watched film two pretty much anything disney touch nowadays carefully crafted target audience friend worked pay well also controlling three art goal profit,False
dark side go damn,False
kylo,False
canon though nonjedis useful force user like imagine trying block bullet sword would difficult whatever kind premonitionsixth sense crap would much better carrying around gun mostly see jedis think boba fett expert fighter without force power make use though,False
yes see icedogs,False
saw raw power sidious vader trained named darth way almost sith lord,False
mean hamill live acting never strong begin,False
guess rule obvious finn snoke theory,False
gt seen much raw power great mary sue equivalent yoda wonderful,True
luke strongest jedi ever book book fanfiction pretend jon snow know nothing everything read past twenty year forget dream,False
tagging goddamn trailer spoiler actual fuck whiney fucktards,True
holy shit old star war gangsta rap old albino blacksheep day fkn junior high first saw video lol,False
see make sense,False
know looking giant laser sky,False
thought obi wan put luke tatooine family mom told obi wan rey episode seven talk waiting someone family return never mentioned ditched jakku awhile must old enough aware ditched seem recognize kylo see han solo leai etc think mom dad would introduced uncleauntcousin etc never actually said luke kid even related anyway skywalker assumed think totally new jedi person entirely,False
think mean convinced say mean know nothing nothing,False
could entirely different planet one look like asking question sunset lava planet fakenews,False
ironic,False
know fuck going take moment predict kyle katarn woodwork save day,False
tldr described raw power,False
would equally badass,False
little,False
clearly chose glass front,False
want movie,False
pirate caribbean another example,False
real way find watch movie guess p would like become grey jedi though,False
war space disney making obvious clone esb,True
bet he talking snoke palpatine,False
snoke voice beginning could talking rey know,False
teasing expanding many isolated part mesh well together,False
dark knight,False
look like know term mean,False
well questioned bit honestly matter enough pull movie,False
lol liking shitty uninteresting character cinema make racist ok rey shitty uninteresting bland character personality charisma despite screen time quite amazing actually,False
say three time,False
really much spoiler like going see carrie fisher movie,False
gt kylo ought fucking small fry guy took darth vader emperor palpatine yet know fact dude whole story arc luke postjedi kylo scared abandoning training new jedi gt kylo ren lost fight untrained rey rey also luke scared raw force power see whole circle already complete already shown everything need know also seem severely missing word raw kylo lot raw force strength discipline compare composure even anakin anakin killing sand people anakin still using finesse simply hearing bad news sends kylo hissyfit vader never exhibited kind raw power kylo deflected blaster bolt hand never froze midair interrogated people choking never directly read mind palpatine vader lot power kind power get attunement well natural ability kylo rey natural power far outstrips untrained ability vader presumably palpatine incredibly obvious trying draw parallel rey ren,False
aware thanks playing,False
except person blocked point also go casting black point lie let guess prequel fan 20,False
see people say still feel far away cantina point hear land falcon could even see cantina feel like codehabit people would frequent question asked type place though perspectiveopinion point,False
really talking either finn luke scene show kylo tha shot,False
must really hate firefox,False
dammit ben go around calling tusken raider sand people,False
emosith,False
one hate adam driver kylo ren swear would play better jar jar binks intimidating enough going,True
made pretty big point showing u much raw read untrained unrefined power kylo right beginning film showed freezing blaster bolt midair dragging person air afar clearly establishing using force whole new level fact lightsaber much power need vent crossguard supposed parallel well establishing luke though kylo power could harnessed underestimated scared power rey,False
feminist propaganda,True
danny rand immortal iron fist living weapon protector kun lun sworn enemy hand whatever danny rand immortal iron fist living weapon protector kun lun sworn enemy hand want,False
editing good,False
already rey kylo force awakens,False
even close baseline,False
could anything put star war fool would eat shit trailer good,False
great video lmao,False
one,False
know football lol,False
"honestly point think look better remember one alien poking head sand tfa two light stick like get going one thousand, nine hundred and ninety-nine anymore cgi always terrible said ice fox look like shit hopefully clean release",False
droid please,False
agreed hate porg hate cgi fox thing hate gorilla atat thing definitely empire redux,False
mandalorians darksaber since appears clone war sw rebel cannon non force sensitive individual used lightsabers combat well least one lightsaber,False
gt real star war serious question real star war real mean sense,False
creator rogue one thought would kill entire squad end hence reshoots however disney greenlit original ending put past dude,False
second absolutely disgusting,False
u furries already absolute nerd need really appeal furry side,False
look cringy af,True
cg entirely force awakens ton well integrated practical set effect never saw rogue one look like went similar balance new trailer however look like everything cg look quite bad going,False
one come tfa enjoyed saw flaw understand someone may enjoy two well yeah business want try maximize much cab make three business mean put good mean rude sound like automatically writing corporate,False
nah weak,False
answered earlier another reply fresh boiled pasta gt real star war luke taking plunge abyss cloud city rather facing reality vader father bruh palpatine telling anakin face killed master without batting eye ever hear story darth plagueis wise anakin spitting game padme nine year old cousin real shit disney afraid show u real fan anymore got kidding fucking minichewbacca hamster animeicewolves made spill monster energy drink morning imma go throw,False
iuuuuiiiiio iuo,False
real star war sadness darkness,False
guess finn pull away dark side,False
think snoke related skywalker family somehow think look like partially melted force lightening luke hand luke used dark side snoke banished,False
pretty sick,True
gt adventure excitement jedi craves thing yoda case missed bro direct criticism new trilogy jedi metaphor human condition must birth darkness become something truly extraordinary get dagobah training game ping begin understand beauty star war,False
thanks man,False
looked good wow wait,True
guess missed talking ren,False
trolling tell satirical,False
first thought clicked new transformer trailer accident,True
fit right theory snoke really jar jar binks,False
kyle ren going starwars vegeta tune next week year answer,False
canon movie could change canon said actually look feat instead power level prequel force user way stronger time went made force user stronger looked cooler younger obi wan stronger stuff vader ever pull ot,False
would actually make interested tfa effectively killed enthusiasm franchise,False
meatbag,False
voiced muska castle sky great ghibli film seen,False
except looked laser lol,False
awww upset nfl going gone decade okay trust fine,False
literally personification sand,False
wait dead said last command mean prerecorded message playing,False
kind left field theory sure everyone theory mine glazed like every theory want put call case turn true scene obviously stand opinion describe believe happens chronological order first although tangentially related kylo go appears mission kill mother complete dark side fails somwhat demoralized snoke take notice apprentice weakness turn eye towards rey believe tell kylo turn rey dark side instead outright killing meanwhile rey asks luke help defeating snoke refuse tell train run take snoke somewhat mirror event battle vader luke see rey kylo fight tell need someone show way kylo view opening turn wild turn event pull fake seriously injure thinking killed fashion similar luke losing hand go confront snoke pleased violence anger go fight push breaking point telling fulfill prophecy think case would kill snoke become sith lord fulfill prophecy kylo coming back pseudo luke next movie rey taking route emperor palpatine originally wanted luke take feel like would outlandish follows theme mirroring past still playing luke fear apprentice become evil would mind would hate see play super obvious luke refuse train come around la hercules kylo kill leia lose rey rey confront snoke kill get away blah blah think setting rey villain episode nine would take many surprise making way hero shine alternatively maybe kylo take good side instead go finn becomes force sensitive go battle rey episode nine last bit wishful thinking,True
still thinking he knight ren even former one,False
seeing blade runner think entirely possible could work wanted passionate two problem disney director faithful characterstone han solo faithful metasuper story antman blade runner two thousand and forty-nine see villenueve absolutely remain faithful character tone piece care project potential issue would story resolution start trilogy arc standalone currently unexplored period offer significant freedom develop story want disney approves,False
going throw crackpot idea case titular last jedi referring luke becomes fight luke sith kylo rey least movie next movie redemption one two maybe luke saying last trailer jedi tip aspiring student rey edge look somewhere else sith place belongs idk really believe calling 2v1 luke,True
even big fan sound like understand game one bit cute,False
hope filled shit ton little quip nod back original movie tendency stuff day sort break fluency movie least ymmv,False
sure though sith completely gone explain snoke furthermore disney owns star war bet going milk franchise year come mind people milking something considering freaking star war pretty solid theory snoke also awoken ancient sith time old republic make sense various reason physical appearance emergence time force user extinct brief footage seen jedi temple luke emerging salvaged presumably ancient writing old jedi order etc notably would disney financial incentive capitalize vast possibility old republic setting would offer han origin movie episode eighty-nine done need pick new source material better endless possibility old republic obviously speculating see episode eight lead u pretty much willing bet fact sith much alive one way another always different name different regime always star war star war without,False
gt kylo skilled experienced like seen light saber,False
gt right away life fighting war,False
actually superimposed saying top jedi dialogue,False
yeah snowflake skywalkers,False
goddamit reminded kyle rogue one,False
become grey jedi discover path via side,False
man got say like say spaceballs moichendising,False
alternate alternate would kylo flip rey darkside luke kick ass lol,False
necessarily possible luke strong also frightened power would explain went hiding like know power almost consumed,False
true antagonist terrible,False
nah daisy ridley good actor whole movie,False
day lovely day disney shareholder,False
fair killing cast r1 really way could happen otherwise run issue fuck people episode iv get away copy plan thing called usb drive know,False
personal headcanon ot lightsaber duel slow exerting massive pressure one another via force saber feel like greatswords hence swing twohanded heavy jump spin twirl like ninja prequels ruined canon hey else ruin,False
enjoy ep seven see ep eight nothing truth disney first order snoke walt taking fat poop franchise ridley driver boyega isaac great though garbled nonsense attempting add color argument peace bro may force,False
say guy never seen film _,False
fair exactly ben wanted needed distract vader others long enough,False
oh wow got,False
first start real weapon speak pas game sb caliber defense let u pas sentence yet certainly looked dangerous glennon,False
appearance gt poe dameron eighteen war story part ii gt poe dameron nineteen war story part iii man sit part,False
wookin pa nub,False
would rather take chance one worst film ever,False
seen multiple time actually one faves english dub bluray version know castle sky well though pretty cool,False
rey going become evil saved two hour wondering happen watch movie lol,True
money end shot kylo stretching hand towards luke rey,True
track english dubbed version hamill brilliant muska,False
love wing commander,False
yes please,False
cylon,False
actually think look remember luke metal hand rising trailer think luke got attacked lost point kylo decided go back light help uncle,False
darth lameo kept mask,True
know exactly game work fact considering pat two point conversion score level touch field goal show idea frame debate stupid sport stupid enjoy dead sport bye,False
glad look like real person,False
made comment watching trailer iphone haha,False
mean express surprise confusion understand people live life like,False
excellent point ep two three anakin talking,False
please explain way feminist propaganda besides fact main character female,False
met swamp dagoba bubble time like giant carbonated soda soda soda saw little runt sitting log asked name raspy voice said yoda yoda yoda yoyoyoyo yoda well around never seen guy look like muppet wrinkled green oh yoda yoyoyoyo yoda well dumb understand lift air raising hand oh yoda yoyoyoyo yoda yoyoyoyo yoda well left home week never ever jedi obi wan set straight course said go yoda show force well kind would argue ben look like going start yoda yoyoyoyo yoda yoyoyoyo yoda yoda yoyoyoyo yoda yoyoyoyo yoda used force picked box lifted rock stood head well forget yoda said said luke stay away darker side start go astray let force guide oh yoda yoyoyoyo yoda know darth vader really got annoyed remember kill unemployed oh yoda yoyoyoyo yoda well heard friend really got mess going leave yoda guess know coming back day playing part till old grey longterm contract sign say making movie till end time yoda yoyoyoyo yoda yoyoyoyo yoda yoda yoyoyoyo yoda yoyoyoyo yoda yoda yoyoyoyo yoda yoyoyoyo yoda yoda yoyoyoyo yoda yoyoyoyo yoda yoda yoyoyoyo yoda yoyoyoyo yoda yoda yoyoyoyo yoda yoyoyoyo yoda yoda yoyoyoyo yoda yoyoyoyo yoda,False
want maul one knight ren,True
think afraid rey last time saw power palpatine maybe palpatines granddaughter,False
convinced switch think reason luke isolated rid way contacting outside world seemingly carry green lightsaber want jedi way pas see rey saw ben participate propagating arm race one side force attempt destroy think reason last jedi luke realizes way stop fighting light dark herald old way die luke back training rey thus seek ben eventually form new entity end trilogy,False
look like sister abigail know lol,False
see cock knocker want,False
ren scar different end trailer,True
luke could bullseye womp rat t16 quite two meter size universe explanation luke could hit exhaust port without force argued without force,False
think luke snook together kylo rey team fight ultimate evil duo star war nine luke turn back light epic fight rey kylo die snook destiny know suppose sequel ten eleven tell,True
damnit totally forgot rian johnson mark hamil said avoid marketing,True
farmer insurance ad insure anything even deathstar attack alderaan blow know thing two seen thing two,False
going insert theory since tfa snoke might kylo tie dark side wrong wrong year right want sweet sweet karma mmm karma anyhow believe snoke knight ren decided invade luke training camp kill younglings tfa rey grab lightsaber first time see rey vision knight show rai three prong red lightsaber use believe snoke red lightsaber believe see rey handed away new handler roughly five year old kylo rey tfa appear age kylo able kill ton younglings youngling scare luke away believe snoke took kylo somehow kylo probably protecting someone kylo carry snoke three prong red lightsaber see year hell maybe couple month,True
luke look camerabreaks 4th wall going,False
god jedi podracers open field ned,False
look like perhaps scene pick lightsaber luke hand emerging rubble,False
luke first movie franchise literally succeeds force taking massive space station using shot described one million anything rey used power force awakens one million also find idea rogue one trying explain weakness death star silly clearly would expect someone exceptional luke shown,False
go must,False
know asking lot else want anakin force ghost contact kylo ren mean seriously would cry,True
female lead learns force quickly luke order succeed climactic scene new hope head planet luke map,False
might force sensitive way han controling force influenced getting lucky force,False
french le snock,False
almost certain nothing like hugely disappointed tfa clearly attention,True
spoiler,True
mean would show trailer fact similar lighting setting make like kylorey shot,False
opposed another skywalker seduced dark side third time much original lame,False
two separate bit dialogue likely,False
