comment,parent
disagree antagonist strike back supposed defeat destroying rebel base young jedi taught old wise master young jedi tempted dark side least one major character going killedincapacitated,False
leon shot first,False
series going become two really badass middle ground light dark jedi going sorting everyone,True
tfa good movie people disappointed much borrowed ot see anything wrong personally besides said writing decent acting good directing liked directing anh prequels honestly,False
thought saw kubrow,True
mean know know sure led garden path know sure scene even final cut fact literally dialog trailer along line end way think movie spoiled long shot,False
felt darth maul high ground,False
besides one little scene see snoke close see golden outfit later trailer rey mind fucked force standing blurred background snoke outfit previous scene luke refuse train rey monologue snoke trailer speaking rey unlock potential go bad kylo go good end extending hand likely meeting luke see one scene luke kind burning temple mansion area kylo scene also burningdestroyed area giving hand someone get ground,False
yeah would dominate swordsman really fast skilled spear user another story though,False
main character though rey might main protagonist trilogy certainly main character outlined comic relief main character also funny something,False
someone costume department certainly kylo tight leather,False
eu never canon ooooops imagine eu fan dense,False
hope right,False
know expect sound much like luke sound different adult expected speak normally talked oh god luke,False
drrrrrrrrrrr drrrrrrr drrrrrrrrrrrrrrrr,False
owo twenty thousand nuzzles seen raw power like extends laser sword,False
next darth vader rey,True
often watched disliked rather frank think tfa live immense hype well yeah doubt definitely better prequels think star war going save route bit much story rather predictable far going daring enough might lucky see change last jedi rather subjective opinion mine obviously,False
rename franchise money grab movie suck,True
snoke palestine,True
really comfortable chair gaint pillow back support even,False
one cool thing movie make comic relief character even normal comedy character least cool thing change super serious character one cool thing climax got rekt please stop misrepresenting word clearly pointed wanted larger role series disappointed essentially comic relief ninety-five movie,False
guess could simply taken issue jaded reluctant luke become rather outright refusing train rey fear even yoda yammered luke old begin training briefly,False
seems likely rey becoming gray,False
sharex masterrace,False
leaning towards,False
yeah trailer make sense thinking reverse snoke talking rey luke talking kylo kylo speeding save mommy past talking destroying temple kylo offer hand leia rey mirroring offer han even fhe background suggest rey amd kylo different location,False
rewrite copy paste original,False
seeing star war kylo holding hand like asking forcibly amputated,True
imagine luke taking back believing dangerous live cue battle angry luke kylo trying convince help stop snoke,False
porg,False
worry another star war related game franchise speak,False
mean rogue one,False
still padawan looking excuse,False
anyone else expecting pokemon theme song first two note music,True
tote see fo officer wearing outfit plus previous trailer show rose sneaking fo baseship,False
think mean trailer gave goosebump come stop downvoted poor man,False
difference competence,False
look like snow cat,False
dude rey turn third one luke hunting would shit,True
mean rey switching dark side would make female anakin exactly something seen star war,False
even seen infinity war trailer,False
saying along death ray,False
miss pretty sturdy helmet seemed smashing wall helmet lol rey asking help chance clip could event later movie put beginning throw u,False
found trailer disappointing understand want reveal much plot saw lessened hype movie would cool release trailer,True
totally plausible healing year gt scar grown wound abruptly begun soften fade begun breathe freely twenty year began sense damaged tissue healing entire body rejuvinating beneath transpirator area skin smooth youthful knew eventually would cease age altogether darth plagueis novel noncanon sidius master ability,False
wondering fuck mean raw power seen mean assuming mean daddy skywalker time luke met dad hardly raw power darth vader thirty year jedisith training point shit royally fucked obi wan,False
little ice doggo bird looing thing cute fuck,False
trailer lamest cliffhanger ever seen like mary sue rey would say something like reason trick kylo p yawn next,True
niiice catch,False
two thousand and seventeen damnit one wizard person,False
fighter incredibly skilled trained would anything like,False
think would amazing rey turned dark side,True
made ice ninetails fuck game long,False
thought anakin raw power luke leia got share kid,False
rey kill luke heard folk,False
boba fett took whatever personality left given bad as side character general grievous took sliver none phasma,False
mean problem killing entire cast rogue one pretty dark,False
light saber music sync subtle awesome,True
send space lmao,False
sell phasma merchandise without reveal get saying though would nice surprise,False
ah old doubleturn would hard audience swallow ben killed han think,False
bad never ever seen star war movie actually like scifi really sure never gave chance feel like old film might cheesy something dunno many certain order watch want sound like daft question prequels etc,True
would somewhat decent twist precisely hollywood taking risk,False
henlo mod helllo stinky mod go mod server ugly,False
agreed lamest cliffhanger attempt dumbfound audience ever,False
already got page cute merchandising animal,False
bobby b many thing silent one,False
sound good good true hollywood taking risk like p,False
luke die tragic death rey would great,False
said thing brother last night texted trailer two minute later facebook baited hooked still shot visual element trailer,False
watched cited video remotely star war film criticism comedy wasting life,False
also comment deckard brought fall rachael,False
anyone else notice atats hand,True
think got younger thirty year,False
precisely spoiled misdirected u towards theorizing rey may become dark since know obvious lame cliffhanger know truly turn would trailer tell u precisely know,False
speaks like someone loving dad,False
fan camera direction lot almost wideangle zoom in face jarring,True
meesa like waata really see repeating jarjar thing around thet must learnt,False
see clearly based rule storytelling kylo ren real last jedi,True
ah never saw tfa,False
snoke talking luke son fearsome darth vader brush dark side would love see luke succumb dark side would twist rey follows establish sith teaching snoke temptation,False
unless find kylo rey sibling parent dead might want hang onto last family member,False
watch much spoiler,True
check,False
movie hollywood product need boycotted harvey weinstein scandal showed u system operates buy movie also buy sexual assault,True
think crazy think infinity war avenger four shot two billion crazy infinity war anticipated film two thousand and eighteen trailer awesome get wonderful word mouth upon release plus finally seeing villain lurking background year totally crazy suggest make close two billion,False
fair point feel like ending shot either spoiler rey join spoiler trap,False
treason,False
spoiler looking forward move along,True
assuming anakin powerful still jedi think rey going stay jedi really got little competition,False
nerd world rejoice,True
head going sound bad ren name title name kylo apart knight ren,False
nothing say christmas like killing mother,True
year frozen two toy story four top dumbo aladdin lion king live action film could well year well two thousand and nineteen disney,False
well pay attention much universe yes seem big big right star war avenger film biggest popular blockbuster franchise right head shoulder everyone else,False
vader get mangled lost limb would strongest dark side,False
luke going need pokeball,False
well tough shit go karma whore somewhere else,False
feel like he going lose hand end,True
uh yeah quite lot fight one inexperienced force user one experience user least lot fight even one trained much much senior eg untrained user v padawan padawan v jedi knight jedi knight v jedi master sith lord level padawan kenobi v darth maul kenobi pm padawan anakin v dooku dooku aotc slightly le padawan anakin v dooku anakin rot anakin v younglings anakin win anakin v kenobi kenobi rot luke v vader vader esb going count luke v vader rematch e6 partly luke supposed jedi proper point also palpatine stepped fight vader thrown reactor thing kylo ren v reformed jedi school presumably luke skywalker spoken never seen kylo rey v kylo ren rey win,False
original garbage still garbage,False
really scifi popular around globe football popular america maybe country even come close reaching toe scifi elsewhere ment soccer still appeal everyone whereas scifi broad fanbase different medium around globe tldr comparing medium genre single sport course genre win,False
movie based around throwaway plot point new hope,False
make sense rey become dark sided se suffered anything,False
go deeper,False
look like fun good help wit hthe chemistry super excited,False
idiot replicants blade runner star war called cylons,False
let free folk,False
never said good,False
thing luke seem ultimate light movie,False
well apprentice plagueis managed reverse aging gt scar grown wound abruptly begun soften fade begun breathe freely twenty year began sense damaged tissue healing entire body rejuvinating beneath transpirator area skin smooth youthful knew eventually would cease age altogether darh plagueis noncanon novel maybe healing year,False
rey daughter snoke,False
brianne fucking tarth,False
nope,True
karma bitch,False
mean imagine palatine fucking another human existence want fetish work,False
idea going life simpler 70,True
miss parking lot full,False
rebel,False
luke han,True
killed stronger cunning every sith think,False
bad rouge one chick ruined already terrible movie,False
look like kylo opportunity blow leia ship guess pull shoot cruel twist fate someone else swoop completes kill shot enrages kylo either immediately take one kill mother set new quest revenge last episode nine,True
already happened way back picture one favourite became laptop background credit younot_charlse_grodin,False
overreact whatever,False
another one great pit carkoon someone get barge ready,False
gt infinity war special appeal outside usual audience marvel lol sound like subjective feeling bro gt end day infinity war another marvel movie team movie nothing really special considering ton wrong many way another marvel movie culmination ten year storytelling encompass two film one group popular hero avenger meeting another popular group hero guardian first time interesting dynamic avenger one age ultron villain teased almost six year villain film leading last ten year top hero may actually die two film avenger four including actual threat death saying another marvel film nothing special egregiously ignorant sound objective seem already lukewarm feeling universe already,False
like many show movie aimed child primary purpose come metric assload toy licensed merchandise compel viewer buy,False
mean really anything like mini version professional accountant stock broker time involved certain amount skill knowhow much like stock market deal rule number calculation much like accountant would primarily based luck see anyone could compare dnd play,False
disney influence real fluffy pet thingie millenium falcon snow fox dis finding luke frozen hoth ii besides really hyped movie looking great,True
old film quite cheesy time still highly entertaining watch definitely would recommend currently seven main movie episode vii well rogue one couple animated showsmovies could either watch release date iv v vi ii iii vii ro chronological order ii iii ro iv v vi vii want go really nerdy also called machete order please keep mind movie made highly different time span original movie iv v vi made 80 bit dated considered best prequels ii iii early 2000s generally perceived weaker movie vii ro upcoming movie quite popular although sometimes focus little much nostalgia fan service,False
true luke would keep calling palpatine,False
whatever want order wish,False
skip generation,False
perfect force u viewer choose side well met one far love rey interesting think begin despise side kylo please skip november year,False
would amazing luke killed tattoine say kill,False
enough woodo hide,False
rey flip serious character development near enough motivation built tfa switch really hard time believing spend movie convincingly showcasing downfall make believable likely kylo redeemed imho,False
think title movie huge hint going happens boths jedi sith vanish rey kylo join force create new type force user one relay balance light dark power called grey jedi,False
yeah jedi,False
crystalline fox bulge owo,False
think scene k wondering joi artificial like human human sure neural pathway organic much possible artificial human wondering joi humanity real finally obtained joi knew essentially suicide mission even terminated link back central server existed hired hooker even unceremoniously kicked done seemed human whole movie definitely design favorite character movie actress pulled beautifully,False
still getting death dude soon,False
true one,False
fix fifty movie cut nostalgia bullshit killed rouge one horrible acting terrible character lame story boring dialogue action,False
meh,True
wait revan malak messiah saving age since remembered story kotor,False
mildly disappointed continuity error trailer trailer continued trailer least continuity namely rey twirl around saber making final twist one hand hand dangles behind back however next shot hitting stopping saber rock holding two hand,True
else going write carrie star war,False
meant moral high ground obviously,False
dude carrie fisher passed away obvious kill character somehow film,False
wow incredible wait,True
quagmire make sure end sand people adoption agency rep oh like star war quagmire,False
gt marvel movie besides original avenger ever going bring crowd like star war subjective opinion worded like fact,False
still total queen eu canon hard time accepting anyone kyp durron strongest force user,False
watched yet someone confirm contains spoiler something like rian jonson warned u,True
dunno want kylo redeem fucking killed han,False
striaght reason mountain died poison,False
snoke absorb life force sustain rey grand mal seizure,False
want see bloody knight ren pleeeasssse,True
opposed force awakens enjoyable,False
anakin literally chosen one destined bring balance force would make sense raw power level character youswangintotomorrow say rey able great thing force day training make sense universe,False
wonder many lightsaber duel finn lose one five bet loses one child well,True
greatest scifi franchise dy remake draw thunderous applause,True
id love belive reality probably lucas imagined lightsaber duel like medieval duel insteaf see later,False
would awesome going hoping finn becomes jedi since tfa easily could force sensitive clue tfa stormtrooper break programming far know snoke asks kylo felt awakening whole finn escape thing finn hears scream people hosnian system like obiwan anh finn actually use lightsaber pretty well although could cqc training trooper,False
would think fantastic beast movie liked first avenger movie expect one successful well pretty bad,False
yep perennially hilarious people twenty thirty argue endlessly think done differently even u get say,False
gt watch wristrockets ftfy,False
canon say everything force sensitive usually low normal people use anything,False
love new luke theme calling new luke theme played end tfa played trailer rey training lightsaber rock crack,False
next sequel star war jedi reborn collapse empire war kingdom death jedi king sign peace war still war fucking end,True
video seen way back hd special edition,False
agree mostly hollywood hellbent female hero supplant previous male one party politically driven well,False
say bof,False
gray make movie kind original rest feel like empire strike back v2,False
disney fucking increidlbe,True
wow last jedi training lastlast jedi original,True
frank,False
trailer set make seem like talking kylo honesty know,False
nope seen star war theater yet,False
force guy vader would choked death make move able use sneaky ninja trick get jump vader way force sensitive madara way powerful slip unnoticed,False
shot available shall put dunno could put old shit watch internet attache ridiculous meaning star war nerd go mental anything christ could put fucking snow fox would going crazy shall,False
beautiful beautiful underrated post alert,False
ewoks movie one,True
killing leia screen use remind guarantee,False
actually may talk luke rey kylo prophecy luke would make much sense snoke really look like gray like sith turned luke gray purge force willingly going fight unknown villain jokeknown jarjar even movie title say jedi rey kylo would think dismissed look like fighting revenge gray puppet unknown dark lord,False
term actual fight yeah friend least agree oberyn dominated whole fight even koed without much threat mean stand taunting end due personal reason also like total idiot mountain would fallen coma died,False
boy tr8r life serve yo,False
wall gone boy zombie ice field,False
depends madara ten tail jinchuriki swap place vader hand seal,False
fetch mandalorian armor stretcher,False
lost,False
yeah lot work surprised hear voice side character nausicaa valley wind never expected luke skywalker show ghibli universe,False
good good let conspiracy theory flow,True
took mean someone lot raw strength force soon,False
fuck porg,True
fantastic beast seriously joke first one fantastic beast movie film nowhere near popularity avenger let alone star war harry potter fan pay attention universe nothing else seems like put fantastic beast avenger star war ignorant,False
read book kid smart enough realize dumb,False
good guess leia shit,False
anyone else hear phil destiny,True
agree would unexpected sure lot people would upset truthfully kylo rey take luke upset supposed world ahead skill luke practically god comparison,False
still confident end ninth film ren turn light side think would interesting see fallen hero archetype go way,True
fear lead anger,False
seems rey kylo stronger seen raw power scared enough,False
nah voted sexual assualt president even bragging camera ship sailed nobody care company biggest incentive straighten act disney heard story 1990s disney big let go long without huge vocal lawsuit,False
luke going bone anybody would obiwan smoking hot daughter,False
care long kylo dy stand looking butt ugly face think hired ugliest actor pay much,False
like spinning good trick,False
make karma whore appreciate people get content first,False
hey want good problem also wanted suicide squad batman v superman tp good movie turned utter shit expect movie good naive history dceu,False
well look got raw power luke like ever seen chosen one part two electric boogaloo baby,False
completely agree watching happening background make think ship suffering catastrophic damage crew running back forth light normal fire smoke spark feeling completely different ship,False
theydid gray exist thing expanded universe,False
see thanks detailed response think start oldie first four five six,False
leia book right,False
high speculation luke daughter,False
rey kylo kylo han,False
daaaamn son great link got kmfdm right record dropped instantly began collecting entire back catalog since though steady decline though going said sascha lucia lovely people helped tight spot raymond watt cool af,False
wtf bird creature chewbacca,True
cell,False
ninetales alola forme confirmed,False
yes mean since unconscious rest movie point much could flashback word every scene involves scarred kylo safely assumed posttfa timewise,False
actually seen harry potter,False
much looking forward want see load jedi fighting load sith least jedi fighting sith think ever get see unless kotor spin would cool see rey chased snoke jedi hunter knight ren luke new jedi knight trying protect still could ben betrayal taken place film start even luke gone missing jedi first film annoyed thought restoring jedi order one luke mission jedi tfa know got disillusioned ben betrayal still jedi master get,True
much want see switching side thing happen seen far many little girl dressed rey believe disney destroy image,False
way turn good suppose simply issue constantly faced rey main character bunch potential plot thrown right window reason rey represent womanhood show even slightest bit failing emotional physical would damn woman time apparently shame shoot certain speculation plot might go make sense character gender politics ultimately seems ironic mean rey end patronized treated kiddie glove male character get interesting potentially questionable thing ultimately make memorable fun follow without fear damning men time hopefully surprise u like rogue one though,False
could vader emperor kylo likely bet though,False
scared know rey wound force think malacor v kotorii,False
dual ability consider unnatural,False
canonically time anakindooku rematch several year tenure knight trained least one padawan slightly le padawan point,False
fair get blasted chewies bow aster saw would literally blow stormtroopers away toying finn like cat mouse,False
ooooh kylo return luke complete training final shot tlj remorseful grief stricken kylo kneeling luke head luke say welcome home ben see shot rey kneeling front snoke say welcome home daughter happens someone find post give gold,False
double faceheel turn difficult turn,False
unfortunately yeah civil war marvel great opportunity really shake thing avenger split middle instead substituted halfway point death comic war machine losing leg clearly recovering end made sure war never felt like avenger really turned still plenty joke one liner supposed really intense fight enjoyed civil war overall missed several chance interesting thing usual priority making sure felt like modern day power ranger everyone still pal matter,False
lot place thing movie misplaced notion humor really ruin,False
waited 4th quarter time exciting,False
porgracing,False
cheah,False
wound force hence powerful anyone continuously gain power people die around,False
watch heard quite spoiler heavy hate movie trailer,True
good,False
character could even possibly even touch madara uchiha let alone defeat talking edo tensei uchiha madara talking gedou rinne tensei uchiha madara either hell even talking juubi jinchuuriki gedou rinne tensei uchiha madara eternal mangekyou sharingan rinnegan doujutsus rikodou ability capable amateratsu tsukuyomi genjutsu equipped gunbai perfect susano control juubi gedou mazou hashirama senju dna implanted mokuton kekkei genkai perform yin yang release ninjutsu expert kenjutsu taijutsu also talking kono yo kyuseishu futarime rikudo juubi jinchuuriki gedou rinne tensei uchiha madara eternal mangekyou sharingan capable enton amaterasu izanagi izanami tsyukuyomi genjutsu two original rinnegan grant chikushodo shurado tendo ningendo jigokudo gakido gedo bansho tenin chibaku tensei shinra tensei tengai shinsei banbutsu sozo third tomoe rinnegan forehead capable using katon futon raiton doton suiton mokuton ranton inton yoton even onmyoton jutsu equipped gunbai capable using uchihagaeshi shakujo master kenjutsu taijutsu perfect susanoo use yasaka magatama control juubi gedou mazou hashirama senjus dna face implanted chest four rinbo hengoku clone guarding nine gudodama floating behind absorbed senjutsu first hokage entered rikudo senjutsu mode cast mugen tsukuyomi everybody used shin jukai kotan use chakra genjutsu definitely talking sagemode sage six path juubi jinchuuriki gedou rinne tensei super saiyan four uchiha madara eternal mangekyou sharingan rinnegan mystic eye death perception geass doujutsus equipped shining trapezohedron casting super tengen toppa gurren lagann susanoo controlling gold experience requiem stand become original vampire alucard able tap speedforce wearing kamen rider black rx suit gedou mazou hashirama senju dna implanted mokuton kekkei genkai perform yin yang release ninjutsu expert kenjutsu taijutsu eaten popeye spinach talking sagemode sage six path juubi jinchuuriki gedou rinne tensei legendary super saiyan four uchiha madara eternal mangekyou sharingan rinnegan mystic eye death perception geass doujutsus equipped shining trapezohedron casting super tengen toppa gurren lagann susanoo controlling gold experience requiem stand become original vampire absorbed alucard well god hand able tap speedforce wearing kamen rider black rx suit kryptonian dna implanted eaten popeye spinach possessing quantum power like dr manhattan mastered hokuto shinken,False
whoch madara talking though ten tail kill vader even realizes hashirama era still smahes vader access cheat like limbo take little longer lol,False
yeah skywalker kenobi,False
bruh,False
people want spoiled probably watch trailer honestly,False
yes ton book knight old republic game quigon jinni might gray example disagreement council,False
yep one highest upvoted comment pun earthquake getting pregnant something better use earth control,False
dude reddit talking bad disney starwars big,False
