comment,parent
entire first movie super obvious nose least making rey evil would interesting previous commentor absolutely correct absolutely turn strong badass female lead antagonist far much marketing done would risk disney take risk make much money possible,False
think right kylo never part hero group could see turning lone wolf sort character help good guy critical moment maybe martyr last minute save day,False
glad rey access makeup remote island luke amp nbsp kidding movie going awesome,True
rewatching trailer two comment mind make fit really well,False
wubba lubba dub dub pickle rick,False
nah kill leia someone else,False
calm geek empire strike back remake still going come two month even though comment irked,False
fetch hype stretcher,False
disney world couple week ago every store,False
actually get ticket,True
replicants say skinjob like human know,False
whoa got chill,True
awesome awesome,True
forgive helmet,False
need someone help line rey certainly seems though would directed luke editing make seem like rey ren talking doubt think meant tantalize raise question anything else smart play speculation already going every sw fan head,False
calling emperor emperor controlling someone,False
psychotic boy done something unforgivable mother say like really true life science fiction movie,False
see confused captured end film give layer ambiguity choice kylo good side end travelling go good side end probably good saturday morning cartoon may seem might break many little girl heart think kylo going good bad choice per se cliche,False
anyone else think luke realized sticking light side force mistake going train grey jedi,False
seems like may fighting rey well say scene show rey coming water wonder v rey maybe snoke kylo well,False
damn lot post,False
anyone seen last star war movie han solo dy,True
play star war trailer thought mnf,False
put disguise look like get parent trap kind situation,False
actually got hand ticket website crashed couple time got hand freaking ticket hype real,True
far palpatine show face empire actually showed jedi ill wait,False
would girl hate rey turned badass clever elegantly ruthless villain,False
c e b e,False
crossposting thought thread gt throwing watch tv caption came going go well followed way think good chance two line spliced together trailer,False
army luke waiting picked genosis,False
oh fuk,True
movie start right tfa end must gotten stitched carbon tech later took probably part character development spoiled trailer shedding old approach helmet letting past dead order kill mom lea trailer leaf u guessing guess say go team ray hence handshake moment,False
karma whore,False
fucking baby chewy,True
right like hey already fucked training anakin kylo three charm right,False
yeah kind flabbergasted lol,False
figured,False
fault still like star war one cheesiest trailer ever,True
know big dramatic moment possible outcome,False
rey theme music remember tfa thing older one even prequels extent especially maul stay film end get tfa largely forgettable,False
alderaan gone kylo mommy daddy met like going,False
always goto example disney followed 11yearold kid getting hanged next movie,False
pokemon universe confirmed,False
everyone kind needed die otherwise would kind weird lived longer part rebellion ever mentioned name following timeline,False
shit crashed almost every time tried subscribe fair tried since major hype died try sign next month sound great feel left want money reason,False
underappreciated joke,False
lot people wanted karma,False
mountain version mtat believe extended universe would surprise see show,False
crait ice planet dude,False
seen raw strength scare,False
certainly,False
c l b e,False
yeah actually official star war account official marvel account though would would monopolize post take away thrill regular folk fighting tooth nail get first,False
forget duck,False
please let new ewoks,False
calling snoke emperor weird as way,True
oh yay disney sjw trash,True
mobile city device,False
rey,False
trailer win movie year,True
one feel like trailer lacking something put finger feel like lacking,True
two word grey jedi,False
think look worse,False
saying said using cgi face said comment,False
nothing revealed tho might even rey putting hand even following similar plot first trilogy luke tempted dark side,False
rey kylo going reject master join together find way force neither sith jedi something new hence last jedi,False
spoiled blade runner shitty name pun going pissed,False
young luke said afraid yoda told welp finally took ya long enough,True
go trust hover chair without citation,False
jedi evil tricksy false,False
know original trilogy emperor barely played role third movie,False
look like shit,True
new trilogy end episode nine feature length life day special,False
think weakest trailer disney put either movie tfa,True
play devil advocate ice fox trailer different vulpix porg different jigglypuff difference probably nostalgia although objective stylistic change well,False
zing,False
luke want jedi end go back joker luke world either die hero live long enough become villain,True
look like shit,True
bizarre,False
collision rfreefolk rprequelmemes continues,False
theory since two year ago go dark side finn convince subsequently kylo come back good side finn awoke force rey happens powerful,False
look freaking awesome wait,True
yeah almost broke 20pts tonight,False
right like magnet ball pokeball eye sludge mime boxer plus whatever jynx every game animal based mon one,False
trailer always exciting see theater sure play one front thor ragnarok,False
good boy,False
swap body day realise right change side,False
trying avoid trailer avoid getting hyped decided watch one ah fuck well damn hyped,True
porg trailer look weirdly like nien nunb,False
tfa assault planet destroying super weapon like anh 2nd featuring walker assault esb expect anything 3rd movie another attack super weapon really could think something else look comment atats used arid landscape make empire admit thing atat assault arid landscape swap snow sand make lazy saying alllllllllllllll star war universe way empire could attack could come something else feel like could done shown u something new instead literally using attack 2nd movie 2nd movie,False
like ledger joker never know could,False
rogue one take place episode three four force awakens episode seven last jedi eight,False
joke bad love,False
look like mace windu,False
literally tear right,True
spent entire first movie building hero introduce villain hero root academic going villain,False
except scar exactly black bandage flashback,False
feel like elaborate direction taking,False
child literally one mindblowing discovery considering pokemon still marketed younger people think make sense pun fun,False
oh great remade empire time,True
comment check,False
soon mickey mouse return valhalla slumber feed,False
great cheap storytelling space,True
thing bug rey break bad would heartbreaker wonder finn would think join group abandoned,True
rogue one force awakens anyone say boring crazy dome plot point exciting watch prequel original trilogy need watch seeing last jedi,False
hell jar jar,True
way take big shit warner brother comparatively justice league look like burning garbage compared trailer cautiously optimistic movie saw jl le excited got see star war bluer ball get wait,True
wrong universe,False
wish revealed,False
strong emotionally cgi improved know passed know cgi know still felt real could help feel pulled expression,False
remember made u think rogue one protagonist turning bad end making trailer,False
mean idiot think disposable sith,False
sure feel rey heel turn,False
think theme movie might find balance force rey ben journey find balance side within,False
oh sweet summer child,False
kylo rey form team called calling,True
lmao,False
killed han mufasa dammit would put past,False
luke want jedi end go back joker,False
gt legend wewlad,False
fire space scene look perfect,True
kind spoil film though,False
even soft piano heavy reverb thing,False
might go grey,False
rey realizes power go full cortana,False
got catch maul,False
buuut disney know need keep least two koremskywalker fam movie two spinoffs whatever trilogy go next,False
rogue one good movie much better second half necessary watch prequel,False
yeah everything feel predictable like force awakens predictable plot predictable dialogue character effect better ever make boring actorsdialogue force awakens took chance followed every cliche hopefully one different look like,False
old jedi master training powerful apprentice remote location check kind trial cave like space check falcon chased maneuvering tight quarter check jedi master begging apprentice rush ready check big revealtwist end check thanks rian johnson planting seed expecting something,False
someone hated recent star war movie think potential good bad rest,True
oh shit karma train somebody think shitty pun fast,False
spoilery,True
switch rey seduced answer desire ben becomes repulsed answer found kill mother find hate attempt redemption luke see rey true power refuse train point know much need know becoming perfect candidate snoke,False
found pause weird like going go way think felt weird,False
rey pretend corrupted kylo,False
really cybermen doctor would crazy,False
long last,False
flipping,True
could luke daughter though,False
still confirmed know disney said cgi,False
jedi step theme ending force awakens give chill every time glad hear trailer,True
mean know even make december fifteen die least hint movie,False
yoooo look dope,True
fan trilogy think main villain lacking many aspect storyline poorly writtenportrayed,True
fun begin,True
worth,False
oy vey go hyping,True
fake kylo turn back light rey go dark,False
scene trailer felt little weird knowing dead,False
please tell others see lame possibly worse first,True
hype contained,True
betting trailer major misdirection going seem spoilery,False
like,False
csi miami,False
look like empire strike back series,True
whoop look like scene movie episode nine,False
already tent camping wake december,True
know since rank captain exact quote would applied well,False
going go way think think luke talking u,True
regret losing come twelve short two billion box office,False
episode iv new hope episode v empire strike back episode vi return jedi episode vii new hope two episode viii empire strike back two episode ix,True
keen bean,True
fuck fuck u,False
guessing duct tape looking thing face kind skin graft,False
hint key plot point mean actually mean happen could easily deceptive editing,False
looking forward long time tlj trailer yeah bet shoot dead,False
would han leia choose raise kylo yet abandom rey planet moral arewere ever good people idk like seventeen sith,False
oh god hope fight 3rd movie dark side rey light side kylo would amazing,False
look little bit similar thought one getting vibe,False
seen power level star war like dragon ball z ugh,True
rstarwarsspeculation ready theory,True
friend case goat keenum,False
would nice finally finally gave role play hyping shit first one bring darth brienne,False
definitely forty-six skip thirteen,False
look amazing really hope neuter luke let badass moment turning thing rey co much ask,False
hope wishing rey finn still finn poe dameron talking surprising audience,False
still think salacious crumb behind everything,True
super girl see rock rising fly away p,False
man fucking star war resist,False
incredibly obvious fake cut,False
cell,False
maybe dagobah cave scene thing except kylo instead vader,False
logan great perfect though say able handle carrie fischer scene without cry,False
yeah,False
agree thinking,False
boner alert,False
north carolinian happen watch lot sport uncpanthers feel like trailer strategically placed though game never going good added something people tune,False
everyone know marketing aou actually better original avenger mainly actually tried evolve character natural way aou good respected somehow top movie literally could topped,False
zero chance misleading clever,False
revival,False
also ultron impossible task following one groundbreaking superhero film ever fine movie good avenger,False
agreed look stunning thought force awakens looked good felt rogue one took visuals aesthetic star war universe whole new level ryan appears topped even last jedi,False
bullshit leaker hey mike zeroh fraud,True
way going like rey turn dark side otherwise going god damn formulaic,False
black thing beginning heal scar rey gave end force awakens presumably heals point movie remove,False
kylo absolutely set redemption,False
fucking wait shit,True
could god damn movie,False
confirmed snoke jar jar binks,True
told went watch boring half football ever seen worth,False
really look horrible appealing sequence entire trailer appears non cgi snoke would think time money could come better storyline going vanilla tfa,False
favor hit seven youtube link,True
feel like new tonal ground score way tfa like savage p made think almost bram stoker dracula fit blood red visual device loved,False
going one hell emotional scene luke sens leia death hand nephew one time pupil spoiler,True
gt yeah expected see unfolds theater espn disney son,False
quicksilver die movie coming back marvel cinematic universe,False
one liked snow leopard,False
maybe key,False
gt luke said best going go way think feel like line directed every critic tfa one spoilsport cautiously intrigued nod,False
hey kid see front page low effort comment,False
trubisky baby,False
look different lighting id willing bet almost anything rey saying line luke kylo scene flashback lack scar face definitely fake,False
still get chill first fifteen minute,False
hope world shown halftime soccer match,False
embarrassing bear,False
snoke,True
bad harrison ford died witness rip,False
wrong faaaaaaaace,False
captain phasma done trailer done entirety tfa proper rivalry finn would improvement tfa glad bringing tlj,True
edited make appear ask dark side help luke continually rebuffed imagine luke got trained planning taking dark side inside,False
two like say otherwise,False
say bb8,False
person try movie happens,False
porg side note chewie eats one,False
kylo killing leia rey turning dark side spoiler,False
oh nice catch luke definitely camping place strong force make sense area like,False
fucking amazing many misdirection even know one true,True
hype phasma neat looking costume dud character think people trying hard make phasma become thing neutralized easily last film,False
line sounded heavily edited make sound like sentence time tell,False
much read comment looked ninety-two one hundred and two field goal,False
mean supposedly biggest reason trevorrow left episode nine exactly concern may valid,False
predict flip kylo realizes kill mother massively regret killing han flip good side rey built anger powerful kylo seen tfa see snoke able provide rey end result luke provide alternative would kylo flip join force rey become mothafuckin dynamic duo jedi knight,False
though,False
absolutely,False
think shot kylo take leia misdirection thought since tfa kylo actually end hero end,False
look fucking great many misdirection almost think kylo ren come back light rey turn dark also noticed rey raise water cave luke standing almost look prepared fight luke attack could also part training though sure wait see phasma catch hand finn going badass showdown mind absolutely fucking everywhere,True
brake,False
masterpiece,False
really think trailer spolier heavy sure hint plot point force awakens trailer ever like complete summary story like spiderman homecoming trailer btw still surprise one saw coming bvs doomsday trailer fact raising interesting plot point got excited fiom,True
honestly make sense change formula previous movie like 17bn box office,False
speculation end movie rey leaf training early go confront kylo find snoke last shot kylo asking luke join kill luke rey escape snoke due poefinn rescuing leia supposed live third movie however dy due snoke kylo pull trigger,True
think look like mix glaceon alolan vulpix,False
spoiled fucking much,True
turn good asshole,False
across world pretending working tuesday morning thing,False
know going watch going watch trailer,True
hey lord ring thing keep hearing quiver jealousy,False
oh please seen soccer game twice combined score,False
giving cuddly thing love wooo would died panda,False
everyone upset force awakens similar definitely see taking criticism going completely different direction though probably already faith,False
would like see trailer remade scene last airbender series,True
would minding seeing little le plot trailer though,False
welcome suplex city bitch,False
first three great prequels bad may hear got problem force awakens,False
meh,True
others mean forty-seven,False
yes talking big name character iron man cap thor hulk spiderman iron man three even reception made billion dollar really think disney kill money maker would stupid,False
hey man watching beginning history mitchapollooza time come chicago,False
holy fuck visuals optical treat feeling lot trick term think trailer telling u feel rian johnson right warning probably spoil much later tv spot trailer reveal overall look even better tfa,True
guess going er stiffy going away anytime soon,True
also two different scene cut together end,False
talking kylo luke say seen kind power kylo talking rey,False
porguin,False
watch three skip pretty much anakin padme scene,False
finn well got force pike phasma got force pike plasma got,True
christ 4chan leak true,True
smoke could talking kylo rey even luke many different combo going keep u guessing two month,True
big true,False
would really spoil trailer,False
think little range motion cg enhancement expression favorite new idea trilogy think make sense way old chewie suit chewie creature,False
instead fighting sacrifice,False
yes,False
oh oh yes oh oh yes many emotion,True
yeah little _new_ tfa disappointed lot people included let u develop world expand much potential,False
probably going get as kicked die,False
dear god carrie fisher shot brought tear eye,True
christmas going epic,True
luke die end film kylo going last jedi almost positive kylo v rey last film kylo light rey dark,True
puffin,False
yippee,False
watched trailer concept fresh poignant writing feel forced derivative production mediocre ultimately experience left wanting,True
lot comment karma,True
seem chill,False
backpack run,False
good luck poor bastard,False
neat,False
trailer fucking mind many misdirection perfect trailer eye,True
maybe even misdirection,False
yeah think would give away turn true think rian johnson adding misdirection saying spoilery trailer fact spoiling anything,False
tiny chewyequivalent pretty cute,True
ditch respective side start second order,False
atats literally look like mammoth cool,True
porg,False
wonder could play turning away killing decision death sort spirit spock undiscovered country want irrelevant chosen hand,False
know difference assumption spoiler right,False
dilly dilly,False
better going walk,False
luke actually joined empire five twist luke rey rey joined first order convert ben back snoke wanting rey kylo,False
turn way would lose interest future disney project,False
score made think talking hockey game,False
one hundred and fifty-four death trooper bottom left,True
interesting say got feeling like sort connection parallel brother sister trailer,False
likely cousin,False
going go way think luke everyone watching trailer,True
thirty-two year old star war trailer still give goosebump hype real,True
set question manged show without showing much basically showed rey get snoke though,False
doubling misleading u ever tinfoil hat,False
interlinked,False
go heel,False
_rian johnson announces plan postpone last jedi youcdd prepared_,False
disney good track record subverting expectation lol,False
rey light saber looked kind shot,True
yankee get touchdown field goal,False
agree porg cute hugged laptop,False
jump jump say gay shit jump gay,False
sure last shot echo moment point film kylo probably reveal relation rey saying insert relation offer join rule galaxy,False
nothing amc around much worthwhile membership often make five movie tuesday,False
snoke going jarjar mark word,True
could potentially pull rogue one,False
complaint wish would end luke popping saber even explain much want see,False
bet cousin cousin luke daughter either way pumping magical skywalker blood vein,False
certainly bort abortion,False
dvr sam bradford v mitchell trubisky make sure miss trailer,False
aboard,True
would considered truly badass kill mother father within two film excuse need go change undergarment,False
think spoiled movie know maybe look good though wait see,False
scar one healed,False
meh,True
could flashback face wrecked,False
even using z6 baton traitor,False
yea terribly bad give away big moment specific context around could editingmisdirection upset watched get rian johnson felt conflicted lot cool thing would neat see first time theater bad ruining plotmovie,False
wait confirm jar jar snoke,True
could talking snoke like scene speech snoke beginning could towards rey kylo spoiler,False
theorizing awhile cynical part think disney would rey,False
always,False
think would go evil balancing dark light side,False
ewoks,False
see troll coming trying farm cool hate star war disney karma,False
fucking wait,True
super hyped seems like getting jedi step theme heard little end tfa killer theme,False
rey superman fucking confirmed justice league,True
money kylo joining light side convincing rey come back light,False
sceptical family relation twist would think case leia would remember squeezing extra kid sending jaku,False
love childish mentality bringing box office number someone voice opposing critical thought movie,False
emphasis tried think civil war far believable dramatic job showing idealogical divide starkcap age ultron undercut far many dramatic scene joke put guardian two dr strange regard,False
little hood walking really set rey wondering alone trial come back ask help,False
fur actually made salt planet inhabit salt flat world called crait filmed salt flat bolivia like snow fox crystalline,False
idk must see building stone ten year superbowl aou superbowl,False
probably still lot work vfx wise,False
please let episode nine luke v rey kylo snoke kick living shit better yoda ever could validates prophecy make whole original series get weight back whole crap first order basically empire steroid,True
kylo ren looked like michael cera end,True
rey one hundred turn evil,False
close oscar isaac face swooning gorgeous man,True
well fair force awakens establishes connection kylo vader kylo leia wholeheartedly argue could extend closer connection uncle luke alternatively leia die nine would good catalyst development well,False
personal theory something trailer luke say following gt seen raw strength scare enough way set trailer obviously meant infer talking kylo ren fair interpretation another person think statement could apply palpatine luke faced emperor without fear faced full power dark side suffered horribly see overwhelming power rey time rightly afraid could become regardless feel like safely assume luke daughter maybe since apparently skywalkers one powerful jedi p,True
p andy serkis using word raw beginning sentence gave flashback gollums love raw wriggllling fish,True
still seeing saw tfa imax ny cautious see matinee weekday local theatre week opening _ _,False
happy one bullshit teaser trailer thing become really popular,True
tbh people saying super spoilery make sense likely misleading even big spoiler question turn true like really give anything away know ending anything anyway watched liked even hyped,False
bee,False
give another ten minute front page hyyyyype,False
whedon specifically said wanted smaller darker personal something along line pretty excited mcu shoot darker theme left disappointed least got civil war year later,False
porg,False
guess could say put sunglass loses face,False
atst atst oh gawwwwwwwwd seriously tho look pretty sweet,True
black hate,False
know talking,False
rey exorcism happening two hundred mark,True
look like mesh healed wound,False
amazing trailer let hype begin,True
lighting quite part scene,False
one hundred and fifty-one phil destiny darth phil revealed,True
eh heard nothing set seem support plus leaked plot normally utter crap especially two year release romantic tension primarily finn rose seems onesided think finn rey share scene majority movie either also seem lot indication story might rhyme area drastic difference might catch people guard spoiler,False
guess like star war trilogy rogue one got hooked,False
nah think going kylo dark v rey light kylo turning light defeating snoke,False
free thanks gift card sister got,False
nine,False
side,False
going go crystalline salt fox planet red dust crait covered salt also assuming maybe scene millennium falcon flying crystal cave also crait speculation,False
smell red herring,False
interlinked,False
think think trained together luke luke used force alter memory hid seemed introduced pushed forcemind manipulation tfa interrogation scene would fit doubt lineage important hisotry probably,False
first teaser fantastic music well,False
god,True
snoke like microwaved yoda,True
really digging red black color scheme film going think definitely fit tone theme film give whole thing much ominous sinister vibe,True
crystal,False
cell interlinked,False
meh,True
