comment,parent
monday night f5ing movie trailer worth,True
waiting year ready,True
first youtube link lucky dawg op,True
gay one see,True
love amp nbsp last jedi trailer know,True
sure kidding said avoid due possible spoiler,True
may force youafrothunderzx,True
really know make goddamn trailer,True
wow,True
refresh refresh refresh finally,True
congrats karma,True
congrats winning free karma gold,True
star war penguin,True
well look fucking rad,True
let alone thirty-two snooze fest lmao,False
oh nerd boner,True
congrats first,True
oh hey early,True
congrats karma,True
finn alive,True
hype,True
evil roaring,True
carrie,True
disney finishing blow box office year,True
amazed ops speed,True
got ticket set imax thursday night going tough wait,True
look fucking awesome wish watched trailer,True
okay certainly hint quite bit really well edited trailer term wish line main force awakens trailer term ambiguity johnson right good trailer,True
new creature look amazing yes rian,True
going dark,True
know hand,True
chrome vader half chub midnight real quick,True
congrats karma op,True
fuck never seen star war movie besides new hope kid like love trailer make want catch entire series guess know winter break plan,True
december come soon enough,True
hype,True
bad,False
look like running winning posting trailer first,True
million television set tunedin suddenly silenced,True
cool care star war time,False
stayed three hundred morning trailer worth,True
sexy,True
carbon fiber healed face hype,True
convinced would watch director comment today failed c,True
really liked feel trailer getting hyped get closer know going get get closer wow,True
watching monday night football bam trailer,False
little furry thing pretty retarded,True
bigger atats attacking revel base wonder movie copy,True
engage hype speed thruster full power,True
exciting thing bear viking game,True
nice,True
goosebump goosebump everywhere,True
hand wtf definitely seems like ridiculous reveal trailer,True
finn v phasma hype,True
many meaningless internet point,False
hi,True
luke speaks,True
basically entire plot film,False
karmaaaaaa,True
well spoiled entire movie think,True
saw live tv bought ticket time totally worth,True
look gay,True
know last shot misdirection still leaf wondering,True
last bit uh,True
beautiful,True
bit luke bit underwhelming,True
bet luke replicant,True
someone tell mean,True
holy shit showed lot thought would hyped gave chill,True
bad doubt,False
movie going make much fucking money,True
watch,False
alright need indepth analysis snow fox thing,True
holy shit amazing,True
penguinnn,True
great trailer compelling rich,True
see rian necessary want people watch last shot damn wonder context two month,True
fuck face,True
analyze enough pretty bad enough connect dot teh plot might go plan watching fine,False
better watching embarrassing viking performance,False
recommend watching,True
almost bad batman v superman last trailer,False
honestly much spoil movie could tell,False
old decrepit guy,True
way many spoiler always happened previous release,True
know lol,False
else fails least know movie gorgeous,True
spoiler strong one,True
really lol,False
bathe karma fast fingered fuck,True
duuuuuuuuuuuuuude,True
personally loved movie,True
careful everyone said age ultron instead got constant quip movie look extremely intense though wait,False
mean luke say go expect worry,False
last shot,True
wooo,True
spoiled movie ending,False
bad mean couple new thing nothing screamed movie end,False
told would go spoilerfree aka trailer one caved aboard hype train,False
way avoiding trailer waiting going play thor theater sure look like maybe actually give little bit much away still look really good though,True
well made put monday night football life look pretty great,True
know trailer viagra bearsvikings game mr rodgers,False
luke scared fuck,True
new pokemon look good original one hundred and fifty-one take,True
spoiler everyone talked watched catch,True
fucking really bad,False
well trailer last movie reveal much,True
fuckin love star war man,True
wait see rey carrying luke shoulder yodastyle,True
wow kidding said avoid,True
watching awful football game marched like thirty storm trooper onto field,False
oh wow scene kylo sens leia hesitating really hit,True
mind blown,True
bad especially second half trailer,False
still could misleading stuff trailer hyped,False
guy thing laser forth,True
kylo kill mother one,True
two pretty substantial plot point,False
would kill mother would,False
okay know rian johnson said avoid spoiler naturally could resist holy shit many question wait answered got ticket reserved hour ago already need hurry eff,True
look like going juice member berry recycled pop culture instead anything inspired creative sign anything different first movie great popcorn flick least,True
kill mom fucking jerkstore called,True
force strong trailer,True
luke talking comparing rey vader,True
saw great life random person,False
damn actually look awesome,True
spoil maybe two major plot point glad saw right sure seeing movie,False
fuck looked dark,True
loving contrast red trailer medium around,True
huge hit five min trailer think cte causing,False
let u gooooo,True
holy shit spoiler fest watch,True
awesome many shot want frame wall,True
bad,False
body ready,True
lit,True
look utterly fantastic goddamn,True
lot misdirection,True
imagine really join kylo ren tho would nut,True
fuck lightsaber let u goooooo,True
holy spoiler filled trailer batman expect show,True
luke yoda said,True
phasma,False
really hope movie like empire rey training third act also really hope kylo end good side end film could good twist,True
id like give first order special thanks saving shit fest football game,True
guess empire penguin,True
kylo kill leia never forgive,True
anyone else extremely underwhelmed know want truly blow water trailer really show potential,True
like needed sold movie,True
rey going become corrupted kylo kylo going redeemed rey,True
holy shit color music visuals look good,True
keen fuck guy know star war last jedi anagram gt jet list earthwards gt hassled jar twitter disney either trying tell u movie jet list towards earth telling u leave jar jar twitter fuck alone,True
like anyone going watch even try lol shoved face month,False
new poster look great,True
phasma last one,False
holy fuck hate watching avoid,True
need,True
carrie fischer come screen hey beautiful,True
kylo rey team holy shit wonder kylo rebel v snoke rey fight together would sick luke look fuckin crazy,True
seemed pretty spoilery,True
glad remember trailer december,True
congrats man take karma,True
seen strength one time scare enough chill,True
stop smiling cute little bird thing next chewy,True
one thing force awakens missing world building amazing setting creature seems quality spade,False
bit beginning snoke monologuing totally red herring right hope actually pull double turn rey kylo would make interesting development would flesh character,True
wow rain kidding indicated trailer awesome spoilerific said wait see aboard hype train,True
watched enjoyed forget entirety watch movie unless cut force fed next two month,False
reveals pretty key characterization plot line possibly one two major event,False
scale one hundred and ten term subtlety double digit negative,False
merry christmas everyone,True
kylo still moody always,True
music blending new theme including rey kylo theme give chill people say star war music improve williams never cease amaze,False
either clever editing end write saying avoid trailer due possible story spoiler know maybe mind maybe need get together finally bring true balance force,True
mmmmm dat lightsaber woosh,True
watch trailer want spoiled,True
unlimited powaaaah,True
holy crap need watch sixteen time,True
enjoy karma op 40k look great definitely going need catch series one especially given rian johnson,True
luke metal hand,False
rey going become new vader totally misinterpret wrong,True
really want rey kenobi starting seem like least skywalkeradjacent,True
llllooouuudd nooiiissesss,True
showed much,True
really wanted red planet physic display got wanted,True
thought cub game,False
december 15th yet,True
think shut everybody complaining trilogy cheap copy original look phenomenal clue going,True
like spoiler,True
luke giving gandalf vibe,True
stop butchering franchise,True
truly esb new age vibe,True
bad talking like last trailer batman v superman bad,False
baseball score,False
man seen episode four five know like bad find hard get feel like missing,False
revealed darth jar jar binks,False
omg snoke,True
op,False
many question little clarity december,True
damn watched trailer,True
holy shit tense moment kylo,True
think,False
holy shit seems like lot spoiler,True
oh god really bad trailer imho essentially spoiled many different plot point,True
ehhhh feeling empire rehash,True
barely got ticket went sale early,True
get fucking hype,True
damn trailer showed lot thought would movie look like going insane also rey join kylo,True
watch rip bb8,False
certainly something end though,False
jedi trainer learned screw first padawan really badly get right second time around,True
holy crap please tell showed whole movie,True
idk like first one better,True
snoke gold robe shot rey getting lifted even trailer cut making seem like holy shit hyped,True
going win next year avenger infinity war,False
carrie fisher,True
cheese grater ankle atats,True
lol people said episode seven way different,False
wild porg appeared porg made pokemonlike cry,True
well wish watched,True
want spoil could help guess gave power dark side,True
watch save,True
way kylo ren go double whammy parent deluxe,True
holy spoiler,True
meh hinted thing obvious unless missed something,False
unlimited karma,True
much watch tho cmon man got give somtin,False
wtf got alolan ninetales,True
wow based trailer might mark hamill best performance yet raw emotion,True
good trailer made without spoiling entire film,False
bear fan feel special part moment,True
stunning film going one thousand and ten side tear,False
taking rian mark advice avoiding trailer going hardest two month life,True
palpatin offspring confirmed,True
shot finn fighting phasma amazeballs,True
star war last refresh,False
ah skywalker family tradition turn dark side feel misplaced,True
good lord cinematography,True
want watch feel like inevitably going play front point december,True
needed han solo oh wait,True
okay please link aforementioned plot detail leak actually spoil way cave december read,False
oh piss karma grab crap,False
luke said best going go way think perfectly describes experienced,True
think basically spoiled training aspect luke want train rey powerful idea first order resistance though,False
spoiler end,False
stayed till three worth,True
shown final second trailer rian must pisssseddddddd,False
feel wrong without han chewie side insert sad face,True
expect anything different lol,False
think reveals trailer fakeouts really think disney going spoil prize pig hell,True
hate like want badly,True
fucking lightbroadsword finn fired,True
lol give away lot,False
new animal character look phenomenal,False
although seen episode one,False
trailer exciting thing monday night game rate,True
wait,True
one thought looked cheesy fuck,True
yearly tradition point,False
walker skip leg day,True
rey chosen one supposed bring balance force join dark side,True
really important plot point enough give whole story,False
yes,False
porg,False
want screenshots analysis every frame within next hour,True
literally cry right,False
black excitement,True
porg,False
yup solid trailer begin two month insane hype,False
feel like main plot point see warned watch want surprised,True
would,False
think extended hand end context made look like doubt,False
one care,False
classic misdirect misdirection,True
least batman v superman,False
raw power talk vader right,True
yeah give general idea take show face value trailer often intentionally misleading extent,False
good sure film fine bad,True
trust r1 trailer showed ton lot even movie,False
clever enough figure full spoiler ill accept great trailer wait see take money disney,True
aboard karma train,False
lmfao making kylo ren good guy going bad,True
kylo never truly turned dark side never seem pupil yellow even kill dad supposed take dark side truly regret,True
like holy fuck way blow load early,False
many goosebump hand reaching,True
definitely check like fucking duh,True
believe showed snoke,False
care happens none going kill excitement movie,True
skip last fifteen second avoid worst would say,False
good god spoiler bother holy shit avoid,True
neat,True
yeah think people exaggerating much spoil,False
get wrong still excited come imperial walker attacking rebel snow luke seemingly hesitant train rey luke telling go way think millennium falcon flying tight space mean come,True
snoke speech beginning awesome almost primal intensity voice gave goosebump,True
first thought final scene ray talking luke trailer cut fake u really saying kylo money fakeout really saying luke thing wish show know point kylo space likely going blow mom ship killing fine scene partly spoiled pull trigger dy wish shown,True
yeah give little context dramatic guy saying spoiled ending obviously,False
yeah people overreacting classic want prophecy say stuff second part trilogy,False
due fact apparently spoilery watching killing anyone watch awesome nonspoiler screenshots hold u til december,True
really key encounter spoiled even couple fake out one two particular struck potential spoiler,False
gay star war,False
huge star war fan damn sent chill spine,True
pretty damn spoilery sure,False
look like rewatching force awakens tonight millionth time hyped december,True
f5 button broke send help,False
fair know,False
last part space thing followed island thing,False
yeah last ten second pretty egregious spoiler,False
think could predict watching news past year,False
enjoy star war,False
enough luke get going damn going dope,False
kidding sure speculate may fakeouts right position hope fakeouts instead certain,False
seen much raw power scare enough chill,True
jesus full spoiler avoid possible,True
bit spoilery,True
excited moving around fighting,False
wow look amazing tfa trailer get half excited,True
confirm snoke,True
friend never watch movie trailer always wanted go knowing thing movie got point though lot trailer take away experience,False
bad spoiler like harry potter snape kill x level,True
want possible plot point spoiler watch,True
hope stay score game finished thirty-two since twenty,False
love amp nbsp last jedi trailer know,True
look forward everyone screaming spoiled moving completely wrong always deceptively edit hell trailer like kylo probably reaching snicker bar end,True
anybody else exactly impressed cliche god,True
know whole movie,True
speaks,True
sat thru boring nfl half ever seen minute half trailer spot worth every second,True
snow battle family surprise jedi training episode v,True
love kylo ren theme music,True
people seriously overblow aou point sad smh,False
mark hamill look point,False
difference whedon part,False
kylo cyborg eye pretty awesome,True
fight finn phasma look intense hell,True
atats waiting attack easily favorite part gahhh fucking wait movie,True
luke falling dark ben returning light fucking hyped,True
wonder long erection going last,True
yeah want know anything movie even watched first trailer,False
hoooolllyyyyy fuck,True
congrats karma,True
alive end tfa,False
vader luke father along,True
rey idea intriguing would like subscribe newsletter,True
interesting see snoke definitely human based showed sideous plaugueis bandwagon sure,True
top,False
yeah expected see unfolds theater espn,False
reason watch shitty football game make sure miss trailer disappointed,False
one scene chill fuck,False
inbox end reading lot,False
holy fuck even like star war pure hype,True
referring rey thing right thought teased final fight last one,False
think looking misdirects like rogue one trailer rian say super good,False
woooooot,True
think ever torn watching trailer feel like wait movie tough,True
like finn jedi totally spoiled tfa trailer right,False
going long couple month,False
mean really surprise,False
going die mark word,True
aight,True
honestly could probably watch trailer shut last scene trailer whole got hyped last second spoiled bit much,False
one,True
twenty year telling everyone got watch greatest quarterback time debut motherfucking tittty kissing trubisky,False
yikes,False
fox made snow,False
someone explain see spoiler,True
tell ya kylo real jerk,False
even wookiees need sidekick,False
holy shit end,True
eh know spoilery people making someone else thread said hinted lot really fulfill hinted look great also first order atats though,True
man really thought rey would hook back resistance halfway would like oh buddy finn yeah died bummer,False
penguin want penguin,True
raw power probably reference anakin red highlighted title last jedi assume rey going take kylo offer join dark side,False
rey going dark side noooooooo also porgs,True
rey grey jedi,True
snoke jar jar,True
came say five month old daughter squealed delight entire time watched proud,True
fuck please need leia luke scene,False
chewy little screaming partner therapy puppy han,True
least game lol,False
gold jerry gold,False
need someone show place comment,True
kylo rey surprise sure welcome one,True
give shit feel need post star war trailer thread oh right karma,False
agree,False
stool dark,False
jealous next gunna tell never seen game throne really pour,False
instantly turned tv trailer,False
atats,True
want leave mark madness come hi,True
gave chill penguin looking thing adorable,True
take money,True
f5ing harder brock lesnar,False
everyone fear want watch trailer watch fucking amazing worth,True
like everything trailer,True
best kind surprise,False
really fucking love star war,True
marvel though pretty much every movie since first iron man constant quip movie always pretty annoying know people started get bothered ultron,False
question director rian johnson mark hamill warned watching spoilerific probably already going watch go theater often enough run also important thing tfa spoiled particularly care feel like robbed anything,False
shot chose carrie fischer strong emotionally,False
highly doubt would make something big obvious mislead opinion,False
everybody upset spoiler know misdirection really doubt would show kylo killing leia trailer spoiler trailer like,True
jar jar binks,False
yeah could tell plot watching trailer people overreacting usual,False
longer comatose mean,False
yankee v tribe seventy-three right lmao,False
regret watching,True
dem empire strike back vibe ooof,True
beat six still first person see trailer lol,True
tell happens leia,True
hype,False
whatever alien millennium falcon chewy going sell lot merch year,False
porgs quite rage actually,False
one win karma,True
top,False
either thought great certainly gave plot tfa trailer certainly nothing spoil least,False
proud op,True
star war,False
actually watched trailer people say spoil thing someone make spoiler free edit,True
gay saber bb,False
thought look like predictable cliche fest,False
interesting see much actually spoiled loved three tfa trailer still idea plot feel like three pretty good idea still loved,False
way lightsaber syncs music forty-six impressive,True
know beginning think star war thing might catch could see becoming pretty popular,True
kind thing could go either way actually want see lot watching trailer honest crazy force awakens fence,False
really play movie sw universe whole hinted rey could turn dark side anyone else really want case would make awesome turn event going least,True
without fun baseball game,False
know could handle perfect logan movie perfect blade runner movie perfect star war movie one year expectation going wayy high next year especially justice league thor end killing,False
ya hard know much misleading trailer much actually happen,False
post leak subreddit people saw luxasfilm majority people saw loved said looking forward abrams return something familiar take,False
positive least one major fake,False
well regret watching,True
new walker look amazing wait battle scene white planet red dust,True
first comment,True
totally seems like kylo hesitating thing turn good rey untapped power etc turn evil two cent,True
looking forward seeing rian johnson take star war think hope enjoy abrams came force awakens,True
excited ice wolf luke muthfuckin skywalker look different good way officially predict come december fourteen rian johnson shall declared absolute genius,True
ice fox dude got ice fox,True
snoke line beginning feeling speaking rey kylo,True
always wanted see someone take trailer people complain spoling movie compare movie far actually happened take argument seriously still know several month point one talking trailer anymore,False
goddamn carrie miss,True
thought said,False
breathe shit going remember breathe,True
porg,False
man going incredibly disappointed luke stay island whole movie,True
music especially chase clip good blend,False
hey mark hamill speaks,True
hit front page,True
snoke talking rey,True
excellent trailer get hyped idea movie hurry december,True
fam look lit,True
skip last thirty second,False
money rey joining dark side redeemed final film,False
darth emo going emo,False
snowflake,False
probably run half cocked fight empire join together defeat empire lol empire strike back fuck disney,False
brother literally walked said score looked like hockey game,False
seriously uhhhh got leia killed kylo ren,False
true,False
also know going happen avoid spoiler even trick u misdirection,False
assuming everything misdirection tfa trailer made u thing finn jedi,True
mean wtf killing mom rae dark side sure hope bait switch,True
jesus fucking christ actually put retarded penguin creature trailer boost toy sale movie even,True
williams write music tfa trailer probably either,False
fuck fam body ready,True
porg,False
fuuuuck intense bit spoilery ish really made even excited see glad watched,True
ugh would love rey turn dark side luke truly last jedi doubt happens nifty trailer editing,True
going fulfill destiny watch hell movie,True
spoiler watched think know sure say spoiler tag,False
make want see writer could zack snyderdirected darth vader film,False
horrible would given watching awhile ago trailer,False
ride,True
got 10pm imax glad 3d,False
already camping outside local theater,False
snoke look awesome end trailer could fake,True
feel like generally people take opposite stance well trailer ruined film need see,False
expect,False
kylo tie silencer look awesome whole sequence going look awesome big scree,True
red right,True
much spoiler taste mark hamill right,True
ehh last part definitely looked like two different scene really,False
kylo never truly turned dark side never seem pupil yellow even kill dad supposed take dark side truly regret,False
longer comatose mean,False
hmmm,True
aboard hype train,False
tin foil hat theory rian johnson intentionally said trailer leak major plot point fan think see trailer going happen look way trailer cut scene scene think may mostly misdirection,True
wondering kylo end changing side since broke mask,True
kylo never truly turned dark side never seem pupil yellow even kill dad supposed take dark side truly regret,False
saying pretty big plot point potentially spoiled,False
posted seven min ago four hundred and fifty comment,True
yeah really think another franchise give chill hype much trailer,False
way end,False
except rian johnson gave u breaking bad ozymandias one greatest hour tv coupled darkest moment show,False
potentially bad go way trailer make look like going go whole thing could ropeadope though,False
trooperbowl sunday,False
oh shit new john williams,True
music also spot trailer fantastically done overall contextually bad since give away lot,False
going steal explanation act like thought nothing,False
bet porg,False
rian know exactly tweet teasing huge moment like luke say going go way think think find movie full surprise,True
possible sure,False
want u think misdirection,False
gt dilly dilly sound like one rejected name bottom george lucas idea pile,False
fuck youtube,False
thinking bit might actually spoil le tfa trailer plotwise sure lot big moment still feel hid snoke though besides rey train luke beginning movie absolutely idea movie piece together kylo rey scene might happen middle movie might climax resistance base attack atat battle space battle even happening planet,False
recall specifically guess kyloben injured end force awakens perhaps lifesaver duel rey maybe offscreen surrounding destruction star killer base planet maybe carbon fiberlooking material applied injury kyloben took face perhaps beginning trailer show kyloben shortly material application end trailer show kyloben healing process complete,False
cute kind,False
believe saying star war movie suppose last two sort trailer really made le excited see movie point seeing plot point visuals care story shoehorning much memey marketing stuff even feel like star war anymore,True
awesome,True
need someone show place rip rey inbox,True
crystal actually,False
gay head would explode finn poe together,False
luke movie spoiler,False
planted idea poor tumblr trash done,False
