comment,parent
thing everything good except expectng something hela never tried make brother join legion would well know far stronger either making enemy first scene looked bit precise sister want take back throne ensure strong brother support laying hela looked bit childish good,False
dbz power level soooo big,False
mean might like scene better arguing movie shot like rennasciance art,False
isbot alterphoenix729,False
one thousand sure alterphoenix729 bot neural network trained detect spammer summon isbot lt username gt optout feedback rspambotdetection github,False
isbot perrycohen,False
one hundred and one sure perrycohen bot neural network trained detect spammer summon isbot lt username gt optout feedback rspambotdetection github,False
good bot,False
wolf sequel starring hulk incoming,False
hell undead army chance good old murica ah comforting de troy win,True
different kind 4d would take,False
sarcastic follow comic much best friend high school tried make disciple coincidence first thing ever showed cover hulk face reflected wolverine claw,False
thought murray sure looked imdb,False
well except stabbing reference thor jerked hammer,False
super obvious liked instrumental pure imagination playing background lady orientation voiceover,False
ok main point though possible plot lapse concerning infinity stone doctor strange,False
multiple mean one,False
sadly familiar enough luke recognized,False
anyone else think valkyrie hulk lowkey smashed,True
anyone else catch thor reciting prayer 13th warrior,True
zack snyder chris terrio wrote story terrio wrote initial script zack daughter passed away stepped away film joss bought reshoots reportedly carried according snyder plan doubr movie really going whedon imprint late addition primarily filling fulfill someone else vision say movie bad excited wanted clarify,False
oh wow fantastic breakdown agreed count,False
kind see blessing disguise since could get killed,False
manthing,False
review pro con thor three pro one great pace lot joke every two enjoy without watching previous part three unique take thor without hammer still powerful four get goofy talking hulk five new female warrior kicking as con one comedy action movie action comedy movie two like superhero movie villian weak consequential threat three might feel like valkyrie getting huge push,True
marvel way using sherlock forget close resemblance dr strange adobe becker street,False
13th warrior historic norse prayer version crichton variation 13th warrior stop short last line shall mourn rejoice died glorious death used version film ahmad ibn fadlan person banderas character based wrote experience travel 10th century among witnessing viking burial describes death prayer,False
true apparantly scheduling issue way seem like marvel invested keeping around may still get bit future movie,False
also hulk bleed green,False
keep mind thor necessarily know look like power represent even know loki scepter one first stone encased object confer contain power thus obscuring overt identity,False
feel like line definitely improv seems like chris hemsworth thing say,False
even think great point,False
hey man got plutonium nyborg left,False
loki asked could cut deal want,False
aether definitely could cap shield,False
think op talking korg marketing one clip usually character like really get rubbed face trailer marketing movie,False
idk felt like hela malekith le,False
know saying agree one hundred least whenever watch dc movie go mindset alternate universe dceu exists multiverse arkham game btas normal comic etc familiar marvel deal alternate universe outside ultimate occasional story guess harder pill swallow come marvel exactly used,False
really enjoyed know filmed benedict cumberbatchs american accent got much better since dr strange enjoyed scene goldblum great marvel continues make dope movie black panther look epic,True
confirm china version said orgy better touch anything,False
gt fact effortlessly destroy show completely outclassed yep worf effect,False
weird see bunch asgardians act like simple peasant raceculture almost immortal warrior acting like helpless bystander end could fight simple cannon fodder great movie favorite marvel movie date,True
nah conspiracy,False
pretty good think automatically greatest marvel film saw standard definition whatever called film look amazing believability cgi took hit personally part forgot flaw quickly proceeded enjoy action humor good probably enjoyed humor spiderman homecoming better waititi hemworth thompson feige showed screening last night vista theatre los feliz introduce film pretty serendipitous,True
gave bad salty bet flashback,False
yea acted great basically shit like every one note villain really needed focus asgard past,False
hope thompson work westworld conflict might marvel good,False
odin life force kept locked died released,False
really thor hulk movie point also ok,False
oh yeah totally,False
yeah much better one dark world think anywhere near good people saying,False
explained film bit difficult catchget without understanding trope come god stuff odin lifeforce basically keeping prisoner banished even stuck earth still wielded power asgard could break free upon death flow power went firstborn able escape whatever dimension stuck upon death flow power go thor,False
holy shit would make great conflict hope going,False
dunno man groot still pretty great,False
man love stuff like movie usually hamfisted nowadays movie need kind subtlety,False
comic fan little sad mjolnir downgraded morality sensitive conduit iconic weapon important lot story line mention may never see anyone thor vision wield mjolnir battle,False
think one joke done one many time original joke shone bit though definitely still laughed,False
superhero landing,True
demand bow instead would hey brother elder sister let u big hug bit touch fill plan succession dealing dangerous set brother needed tact,False
recent infinity war cartoon thor actually used mjolnir pin thanos look like happen unless something occurs recreate weapon,False
loki straight ptsd saw hulk,False
lol whispered friend,False
think loki said thirty-one minute rewatching movie today see memory correct,False
well wrong,False
talk haircut scene thor going intense godly threatening begging like child hard unexpected hilarious definitely top three stan lee cameo,True
maybe happy culturehistory get exposure,False
wrong thor two,False
would like think save people loki may little regard earth realm think care asgardasgardians fit charge,False
time another one loki betrayal,False
overall really enjoyed thing liked loved stylized action scene weird vibe lot humor landed really well amazing casting choice performance thing like dialogue made cringe instance joke fell flat really fell flat thor one liner felt little character,True
get hulk as ill take,False
well look like entire military population asgard murdered hela arrived throne room mention already depleted following invasion thor two,False
"first one thousand, five hundred and twenty minute really awkward humor cringy rest movie pretty good enjoyed normally huge fan comic book movie",True
float,False
cannon fodder resurrected asgardian warrior good enough fighter entombed palace apparently easy defeat unless advantage like heimdall seeing future skurge de troy thor lord p thunder,False
hela odin firstborn upon death power asgard provided odin transferred already insanely powerful odin add asgard power source unstoppable guess odin planned ragnarok happen better asgard place destroyed asgard people subject rule,False
showed cinemadome hollywood 8pm showing time showing,False
yep shocked rhys,False
said logan superhero movie read understand,False
yeah land like crater emerges like badass fucking awkwardly splat bridge,False
taika line delivery perfect,False
laughing hard made dizzy hulk ragdolled thor loki jumped cheered,True
eight hundred and forty-five hmmm screening delayed ten minute would figured would visit screening town kind hoping would one waititi said u used live los feliz area go vista often,False
infinity stone destroyed anyway literally piece universe,False
gt odin said hammer help control power getting hammer back would seem regression ever come back would imagine would see powerful form like infinity stone maybe bring back ultimate design neat idea,False
really liked liked humor well sometimes made character seem almost silly also loki acting rather ooc unless still part cunning plan stop thanos get thor full power combine everyone strength earth etc also whose friggin ship,True
sorry nobody call stupid avenger,False
thanos,False
one would think literal god could sense thing,False
fan theory odin imprison hela also held back thor power feared going dark well,True
find aggravating loki supposed studied magic thousand year yet strange beat,False
probably try give thanos peace offering,False
gt totally swoon perfect sorry beat hemsworth shirtless scene perfect acting,False
nah would survive without scratch,False
oh christ shake weight thanks reminding,False
well could mortally wounded hulk woke super regen,False
yeah think hela goddess death survived form albeit much weaker maybe skeletal form similar lady death appears comic think thanos fawning rather lady death introduced new character,False
felt zack snyderinspired,False
noooos mess superhot new thor,False
cinematic universe character crossover part franchise especially asgardians apparently relocate earth thing comic book character never really die fine skurge dead would fun see de troy,False
put hat,False
moreover strength would explaining something none character know okay mystery,False
sorry beat tessa thompson anything,False
yeah feel,False
drunken fall x,False
honestly thought using throwaway actor scene pay attention actor lol,False
god thunder god knowing infinity stone look like,False
could also share heimdall vision,False
lol love used mythological name everything still decided go cate blanchett,False
justice league look serious,False
gt saw standard definition saw 480p,False
doubt raised hela kill people raised thor save people,False
thor need prepare thy anus,False
thing looked hokey one scene dog dog lying front palace goddess death karl urban assembled kind step front addressing zombie troop background totally looked like regular dog played camera trick make look bigger,False
much watching arena introduction kept thinking would amazing know going happen,False
thor happily killed people fun till first movie started war insult,False
saw ice giant enemy threatening kill people,False
beat caught surprise time,False
sad horse thor,True
long said hiddleston reason watch thor movie magnetic think finally got thor right one stopped damned serious honestly dumb jockish always kind thick ask like would never experienced could true said end growth really finally happened,False
read review gotg2 claim story big many character problem first gotg second mile better much simplier,False
yeah like game throne set like,False
loki magic mostly tricking people god mischief strange sorcerer supreme actually ridiculously powerful,False
love hearing story like actor admire,False
saw movie last night loved loved set valkrie thor lol especially scene jumped ship together banner flying thing hilarious actually liked earth pretty much forethought film save scene dr strange odin,True
compare thor thor first movie changed myriad way basically stupid jock first movie experienced wise enough totally feel right king people,False
al way,False
gt thor already gone dramatic change film going see massive transformation character every film really disagree statement expect huge change expected character arc feature film would include character arc main character protagonist grown movie reason include crucial part feature length film cut need legitimate reason ex dunkirk gt loki bit place keeping marvel insecure mercurial confused character loki confused character care manipulates anyone get want hero movie sticked character trait instead making look cool point view movie need give character arc stick continuity want stop making movie want grow character reason show movie marvel character take away nothing ragnarok care character care,False
mythology suppressed christianity century probably worse,False
cate looked best ever seen wear straight long dark hair often,False
asgard destroyed stop hela,False
deadweight character dragged first two movie,False
good later movie incredible chemistry iron man one,False
odin created mjolnir powerful enough destroy hela inherits odi nt power dy powerful enough destroy explicitly explained intricacy godly power pretty boring movie audience,False
wondering would bring interaction upset disappointed though something notice,False
much humor,True
need watch movie hilarious oneliners,True
thanos turned ship end loki one thousand and ten stole tessert getting surtur helmet spoiler,False
good moment whole fight scene loki watching nervously brilliant,False
name brunnhilde superhero name valkyrie,True
kind revengers,False
korg funny character stake every character exactly movie begin made feel like nothing happened,False
always crush flawless elegant bad as time pretty good villain mcu film,False
loved humor movie loved gotg two get tired character trying funny loses value someone trying make quip work better simply character example thor telling story loki trying kill kid thor trying funny hilarious audience lot different rocket drax ridiculous winking yelling etc another example logan screaming laura shut fuck start speaking late movie trying funny audience enjoys exasperation guess making laugh organic minimizing slapstick stuff minimizing make slapstick moment banner splatting bifrost walkway example funny,True
wht sun getting low mean,False
second point important although complain took away movie mean involve strange future movie without another dr strange movie show improving power,False
bf child told legit sibling magic stuff would done little brother,False
referencing,False
taika bat big boy really proud feel like open ton opportunity wait watch,True
naw never saw always douche bag clearly type woman fall asshole sudden fell love honestly found annoying hate movie girl stand guy whole movie end falling madly love movie end thought woman datedfucked disposable even referred one taking trash leaving fell guy always get girl end woman always prize hero good deed glad lot marvel movie,False
seems minority think exceptional marvel film entertaining amusing predecessor see stick one best marvel film far claimed funniest marvel movie sure look laughjoke rate really try funny work time saw packed theater many joke left audience silent absolutely golden moment seemed disproportionate attempt say saved thor standalones thought thor mediocre second one boring easily best thor movie eye greatly respect filmmaker making dialogue mostly improvised trying something new seems paid people half included reason stated film gave thor depth great personality felt incredibly lacking previous appearance although fear infinity war many sarcastic cocky character one room action piece fine like bridge scene toward end hulk world fight surprised think break marvel top three best still incredibly formulaic break new ground action character get point tried something new pacing tone marvel fan like think garner new fan show marvel heading drastically new direction like movie still another marvel movie,True
luke hemsworth thor,False
gt magic hairspray call technology call magic,False
especially granted gift eternal ammunition,False
god boring basically thing every marvel movie comedy even needed comedy scene comedy score always hidden getting repetitive laugh chuckle throughout entire movie also ending really lame disappointing,True
odin death scene really weird ill give one,False
eyed infinity stone pretty hard treasure room,False
hel changed thing,False
music worked felt place different planet thing cultural reference paperrockscissors,False
must like jeff goldblum role jeff goldblum get,False
comment probably buried anyone else think hulk little underpowered film whenever see hulk expect uncontrollable rampage seem movie,True
logan,False
skurge used disguise,False
heavy metal play led zeppelin song twice played disappointing,False
good point however asgard culture warrior entire belief system state die battle go valhalla seems odd class non warrior movie never established non warrior type contradicts entire belief system,False
fucking love showed infinity gauntlet thor one fake great movie beginning end,True
really loved little reference mjolnir disguised umbrella reference frog thor skurge m16s thor love snake line stuff forgetting recall beta ray bill reference though disappointed,True
gt however asgard culture warrior entire belief system state die battle go valhalla gt mean straight viking yet still farmer priest artisan etc movie even show theatre actor choir singer attendant loki odin,False
referring resurrected asgardian warrior cannon fodder point entire thor mythology revolves around belief falling battle go valhalla non warrior asgardian resident fit within established culture,False
basically mcu romance nice realized couple together becomes pretty bad,False
legit laughed thanks friend,False
looked like beta ray bill one big stone head grandmaster tower could former champion,False
enough pamphlet look like paper beat rock,False
far know everyone choice cast thier vote way possibly want,False
probably funniest part movie movie pretty damn funny many tinfoil hat theory thanos obtained hela come along yell fake shut many fan theory two second never mentioned,False
know downvoted user asked know pist answered seems reasonable,False
got back okay several thing wrong movie action soundtrack good noticeable lack stake even thor damn hammer broken never felt like situation could win helped nonstop comedy like laugh much next guy come point movie take story seriously far character anthony hopkins really phoning time around hela great several time got feeling cate could easily playing enchantress valkyrie much better expected hulk stole show every time screen although still wish planet hulk movie unrelated ended watching movie standing back theater two woman kept laughing nothing happening heard deep chortle next felt really awkward get mad people enjoying relocated,True
saw movie hour ago still laughing snake line,False
hoping termuera morrison,False
star war,False
love movie,True
anyone else think weird thor lost eye showed pain fight basically played like meant,True
hmm good point would like think every citizen would trained warrior first allowed choose whatever profession wanted guess case mcu,False
vision dad people saying similar dad probably accepted since dad also one eye,False
downvote option disagree button merely post offtopic contribute way discussion,False
literally falling floating involved like thirty minute panic attack started suddenly,False
yes,False
may get downvoted true hyped movie year unbelievably let drowns humor us lose power get back cliche grandmaster felt wrong awkward thor thor stand comic overall horribly paced probably least favorite marvel movie,False
grandmaster tower,False
thought movie implying heading norway meeting papa,False
gt thor sun getting real low killed theatre another example taika taking joke seen among fan brilliantly changing,False
yep,False
lot fight scene look previous thor film like said slow mo sequence changed otherwise similar,False
willy wonka music killed best one date,True
never bet dbz always bet waifu,False
better blade runner two thousand and forty-nine,True
explaining able destroy,False
disagree,False
would shocked played tlj trailer disney,False
easily top five marvel movie unique refreshing compared superhero flick comedy great never sacrificed serious bit resulting great balance action comedy mean watching last twenty minute mouth open unable even move watching thor smash army zombie hulk bodyslams fenrir karl fucking urban jump space ship blasting horde undead warrior dual m16s stole texahs mental image last lifetime,True
probably worked day two,False
taika waititi fucking great job reinventing thor fly adhering mcu continuity even making fun initially bit skeptical could apply comedic sensibility budget superhero knocked part humor top notch effect mixing heavy stuff similar though different james gunn done guardian galaxy hemsworth really funny goldblum goldblumsquared fanfuckingtastic hiddleston great blanchettthompson brought badass female character korg bannerhulk really stole really liked karl urban arc going really underrated actor really wait see could go next especially scifisword sandal snarky tone went,True
someone give korg award best side character history television,True
gt reading american god one worst book experience finally found someone opinion book celebrated could get even though story intrigued tv show definitely much better,False
movie,False
really compare two world apart term genre,False
smile loki face showed damn proud memory brilliant,False
fantastic theather went sucky biy movie made action scene always cool dull moment character good development even short scene hela definitely one awesome character mcu great design actress powerful apocalypse could atop sure comedy great could dramatic well loved change pace hope marvel stick thor trilogy awesome wait black panther,True
like aou felt like stake throughout movie ultron felt like weak joke posed nearzero threat avenger directly never upper hand anything except kidnapping one weakest member team loki similarly weak avenger ultron managed legitimately outplay number time try might destruction city aou never feel impactful eye dramatic weight dry convenient plot device,False
gotten past point first episode show aware get much better another friend mine hated book also vouches show first episode way close book liking everything book boring plot element genuinely made sense thought loki god mischief could easily executed plan without relying odin mattered dedicate battle need blessing constant failure excite book god living among u possible beyond,False
hulk seemed like really enjoying life champion get smash day nobody hate probably least angry ever seen since normally around crazy supervillain threatening banner none avenger want stick around fight,False
think right remember giant head looked like,False
like painting,False
hopkins always phoned odin going valid criticism,False
yea wish gave reason able seemingly crush weapon unstoppable force one able even move unless worthy instead getting rid beginning movie sort shock value demonstrate super duper strong hela kept thinking problem problem flicking thor planet orbit maybe salty thor signature weapon underpowered fuck,False
film good dark knight,True
disagree much said subjective argue point one thing argue feel marvel going new direction one major way maturity film guardian two much cussing marvel movie black panther look pretty mature tone course ragnarok ragnarok much mature theme marvel movie date continued increase cussing alcoholic character notsovague reference sex much violence thor eye gouged pete sake calling biggest portal devil anus much le blunt option anus go death everywhere one thing improvised line,False
cut bullshit amp answer,False
like word fine prisoner job,True
yeah indicator took,False
much comedy dark knight action film joke peppered entire movie set like actioncomedy loved like previous thor movie,False
pretty solid movie enjoyed far previous thor movie bit much forced humor area oneliners overall great thor bannershulk interaction one another everything,True
also god hammer,False
like would miss natalie portman narrow as tessa would replacement,False
easily one top five best marvel movie seen like previous thor movie jeff goldblum stole show every scene hilarious,True
captain america able hold helicopter powerful enough idea dofferent mean powerful magic user easy,False
movie resembled hulk fight,False
excuse coming huge taika fan movie comedic test audience came asked comedy changed tone post,False
yes,False
better guardian galaxy,True
right different compare going solely entertaining doubt br two thousand and forty-nine different level film making certainly everyone either like film,False
one favorite part banner trying fly away chase leisure craft accidentally press wrong button intense chase sudden hologram jeff goldblum yelling birthday,False
would rather watch thor ragnorak someone never seen either two film would prefer watch blade runner two thousand and forty-nine,False
blade runner lot le action amazing beautiful movie fun movie much le serious liked think two thousand and fifty-nine memorable,False
yes loved part well managed fix continuity issue simple hilarious way,False
gt noticeable lack stake even thor damn hammer broken never felt like situation could win remember part mentioned summoned biggest bolt lightning ever seen nothing knew right could beat summoned surtur hope sacrifice home stake strongest attack nothing way winning battle destroying home,False
anybody else caught shadow reference,True
agree except last think cate blanchett stole show thor villain street ahead rest,False
god none level still damn fun movie,False
