comment,parent
yep moment rumor started floating around hulk would movie made movie anticipated upcoming mcu film like one half year definitely disappoint,False
definitely could used thunderstruck fight scene arena would dope,False
place kept casket winter wish showed putting away clip cut early basically magic away rewatching thor one thor rag noticed,False
give shit literally told,False
third brother btw,False
felt like first movie marvel said ok crazy powerful adventurer crazy powerful weapon tool ability exist crazy universe let u let run around see happens first time felt like marvel care previous story line comic keeping character lane marvel took reign let character amazing,True
many laugh loud moment snake story especially ahah,True
eh address steve diktos actual address 60 created doctor strange,False
favorite part movie jerk behind sighing saying come whenever joke dude clearly wanted movie serious probably hate fun,True
would cool learn heimdall background though look like asgardians inherently ability probably got somewhere,False
wrong sir tone problem,False
really irritated ultron always cracking joke fell flat worst one forgot word child ugh fucking dumb eye roll add love story black widow hulk movie felt like needed fleshed bit scrapped widowhulk love story could time flesh everything else movie much going add b love story one pet peeve mine movie always add love story ruin whole movie,False
ragnarok poetic edda big deal clearly ragnarok mcu crazy,False
oi hammer pulled,False
woman behind cheered iron maiden immigrant song began playing,False
witnessed birth martian cinematic universe,False
_ _ liked,False
agreed although would minded heavy metal moment somewhere,False
hammer cam shot amazing imax 3d watch 2d,False
tied loose end revolution,False
complaint obvious hulk champion supposed total surprise fucking trailer marketing everywhere insanely fun movie making humorous serious helped much,True
fresh mar,False
apparently life spared movie,False
officially multiple space ship mcu covered jizz,True
bran stark one eyed rayden,True
loved movie great fun really wish bit character development thor wish scene sad losing hammer scene realizes need hammer bit fleshed,True
want badly painted side van actually van money would get one someone paint side,False
immigrant song big huge song asskicking song nordic invader perfect use,False
well mean fact decided blow asgard,False
still think used well redundantly twice opinion though enjoyed great,False
different taste tone problem movie like movie,False
forget pepper tony always disliked love story see chemistry,False
enjoyed really tried keep tbe laugh coming confirms belief justice league flop cuz people dig serious capeshit,True
cool think ill give go aminly want action comedy notcat expense one another,False
unexpected indeed good reason place marvel movie going insert smutty joke movie least funny,False
okay one question many people asgard thought maybe like nation movie felt like small town entire population asgard able get ship fly away,True
good foundation quote joke,False
good hear,False
anyone else notice nod multiple film obviously willy wonka shadow easter egg also noticed hulk room reminded lot bathroom shinning hulk even start bouncing ball wall way jack film little reference solaris whole running around circle thing could reaching idk anyone notice anything,True
know feel,False
yeah everything else completely ridiculous best way,False
yeah westworld hemsworth,False
really dug good stuff,True
valkyrie costume,False
completely agree liked first two thor movie hemsworth hiddleston could even finish iron man two movie mcu able sit ragnorak sooooo much better first two good riddance jane felt like ruined flow first two movie,False
enjoy really wish would something different change,False
murdered whole lot people trusted skurge,False
movie reminds lot iron man three marketing misdirection opening narration main character main character realizing think hero lose signature weapon like iron man three thor ragnarok favorite movie hero franchise,True
ohhhhhhhh,False
disclosure much fan marvel movie opposed thing never seen thor movie see last avenger big fan taika waititi tho amazing see able big budget boundless effect loved flick perfect mix humor action plus tessa thompson come,True
hate whenever happens thor screening people decent except obnoxious kid screaming throughout sitting quite far could still hear logan douche bag laughing serious heart breaking moment seen movie already would pretty pissed,False
movie sam neill jeff goldblum fantastic,False
gt like iron man three thor ragnarok favorite movie hero franchise favorite far worst movie mcu odd,False
trailer review made clear lighthearted movie maybe missed hype promotion,False
one interview played waiting preview start either director producer said intentional chris wanted let box bit,False
kind felt like dropped bit left without ever anything great screen man felt like almost nothing,False
yes hate fun,False
followed feel,False
gt dude clearly wanted movie serious desperately needed,False
great touch,False
well murder opposed could consider acceptable time war also army skeleton anybody command army skeleton cool person book,False
worked fine way marvel movie funnier,False
love movie karl urban show expecting great character actor always stop second ask really karl urban,True
agree one hundred percent,False
used space gem shot looking focus infinity stone also way loki would let flout around debris anyone thanos find,False
lol certified fresh rt people disagree pretty sure butthurt nerd overinflated expectation hate,False
oh yeah forgot one could cut,False
flick gave subtle monty python vibe,True
god man enormous missed opportunity play thunderstruck,True
right still trusted skurge wrong,False
completely disagree funny think grandmaster seems like someone would orgy spaceship short handed comment like paid extreme amount attention course unexpected never heard anything like said marvel movie quickly brushed made great comedy,False
loved think deserves ninety-four rt tho,True
yeah definitely hoping seen last given goddess death would say would really easy explain bringing back dead,False
gt mfw ad hominems start flying already said good movie going seen better superhero movie lean heavily comedy,False
rock guy made cringe lengthy lol random line mind humor feel like movie go thirty second without kind joke reminded wasted ultron turning quip machine instead menacing villain got trailer,False
sure referring thor currently highest rated mcu movie ever,False
hope extra scene somewhere hela performing galadriel speech instead dark lord would queen,False
going everywhere thread shit people enjoyed good movie,False
hulk fighting fenris decided blow asgard thor look asgardians decides initiate ragnarok remember thor using surtur destroy asgard result weaken destroy hela use surtur fight hela use surtur destroy asgard last memory odin seemed ring well since flashback odin saying could asgard norway reasoning behind thor lashing hulk calling moron lol also knew hulk could possibly destroy surtur surtur destroyed asgard,False
really like trend marvel movie subverting expectation third act civil war setting iron man coming around cap viewpoint three fighting bunch soviet zombie whatever flipped completely dr strange really creative time loop fight instead normal climactic battle seemed setting hela would summon fire monster whatever four hero would banf together defeat spin completely well,True
love korg look like thing introduced describes thing,True
wonder scene improvised heard lot dialogue improvised really seemed tom hiddleston genuinely laughing chriss story,False
lady sif,False
gt honestly see knock movie comedy praise guardian guardian supposed little odd kind funny bunch misfit trying save galaxy get nerve put also guardian humor also know cut bullshit serious see whole lot joke yondo death scene peter beat shit daddy killing mom tumor throw anus joke gamora slowly freezing death guardian right ragnarok eesh tone fucking place oh dr strange funwait shit odin dying oh ok intense action scene villaiwait ok valkyrie drunk fall raoh wait badass get picture ragnarok big fucking deal go back thor one see upset thor banished asgard yeah home destroyed closest friend murdered people enslaved wiped time joke hulk banner end alien planet somehow quinjet fiji ignoring k trapped hulk brutally beat death hundred gladiator slave remember flipped town basically mental breakdown neither movie remember bruce banner fucking genius scientist stressheart rate completely control neither get point scene bridge say fuck guy wrote banner hulk two year straight real memory wake world idea pushed fucking destruction asgard despite knowing may never bruce banner leap ship save fellow avenger oh need joke guess fuck movie guardian humor done correctly little much ragnarok basically fart dick joke slapstick two boring unemotional hour,False
warrior zero,False
admit pretty cool sequence use chain film would close follow ups ragnarok use immigrant song,False
going rampant neverending warpath killing everyone stand way want conquer existence qualify something wrong anymore missing joke,False
agreed reveal would better man thor one amp two lousy attempt set movie age ultron think desperately needed big selling point people want give chance hulk selling point,False
normies like told laugh,False
get rotten tomato work,False
get morning gotg two thought much better job overall keeping tension first one despite people thinking opposite peter shout dad killed mom squished jukebox seemed totally place mention two thing sentence even close equal importance place infer joke fell flat also pacman gag fight,False
good marvel movie always toed line comedy action movie ragnarok jumped right line comedy action good comedy every single character person thor heimskr loki valkyrie name btw wtf scourge even fucking goddess death awkward personality cracking dumb oneoff joke worst time every potentially emotional scene ruined dumb wisecrack fine twice every time odin death scene terribly done rushed impactful made fucking sense fight cool though one thousand and ten need water,True
gt thor absolutely put low point powerlessness trapped entertainment jeff goldblum home conquered movie huh would great movie actually showed affecting way whatsoever guess cool great time big buddy hulk,False
discussion thread movie particularly good,False
remember frustration boiling couple time,False
gt pretty sure butthurt nerd overinflated expectation hate pretty sure dumbfucks still think dick fart joke funny liked,False
serious bad dc come super melodramatic lot feel cheesy pointless want justice league good far impressed showing really stoked see matt reef solo batman film aquaman suppose,False
believe funny ended funnier comedy last ten year still packed action hand best marvel movie yet thoroughly entertained 3d imax ftw,True
yeah thor hair bare arm made look like surfer bro throwaway line right got fight first met next time tony see slap thor arm say something like hard feeling point break,False
bit electronic mail,False
dark knight huge success,False
something really appreciated involvement dr strange going thought going bigger piece story think one comic booky thing marvel movie dr strange major character marvel universe played minor part movie pushed story along necessarily essential either instance happen time comic seeing movie saw brought big screen,True
well consider lot soldier guard wiped hela force probably managed kill fleeing refugee,False
really disappointing really sick loki going good evil evil good every single movie trope getting old predictable,False
couple serious part movie like hulk reverting back banner skurge sacrifice top head handled extremely well glad finally got thor movie let little fun,False
well lot died first soldier killed people part rebellion killed stayed around running away killed though saved heimdall spoiler,False
yeah shit dude batman also everyone favorite wallpaper joker,False
downvoted thread agree iron man three slightly worse trash,False
zachary levi character getting casually murdered hela broke damn heart jaw literally dropped thought really hela drive third dagger heart make really really clear definitely dead oh god bitch,True
ww spiderman either way go,False
hulk telling thor leave piss yell friend chase quinjet left dying,True
oh god right realization significantly lessened enjoyment movie,False
officially crush cate blanchett hela one sexy bitch,True
ah skurge evil coward wanted save life evil really want kill one person giving pas crap also understand trying save skin,False
totally agree every movie go good evil evil good trope old played mention predictable,False
odin asking thor god hammer,False
werewolf hulk,False
anyone else notice clay pot triforce background thor valkyrie talking hulk room,True
different perspective dc view hero almost mythologically marvel focus making hero relatable different stroke different folk get jl look like comic book motion regardless majority opinion sure love like bvs,False
whole devil anus bit admittedly bit much kind looked around thought kid watch movie right bit deadpoollevel joke thor joke,False
oops lol,False
marvel movie used acdc pretty sure like right impossible get think cheaped music used immigrant song twice movie trailer,False
everything enhanced smug idea thor getting as kicked champion realized hulk,False
definitely good movie biased exactly wanted critic user review show,False
easily best mcu movie man music fantastic also kind unrelated ghis movie made realize really really really want bigbudget fun scifi heman movie,True
sooooo true korg cancerous really kept kiddos laughing tho,False
hmm,False
oh alive sorry question,False
told going comedy go thinking going something every single piece advertising told,False
kickass song though,False
talk film perfectly cast grandbloom steal heart another day,True
circlejerk wear sure settle nicely bottom mcu,False
fenris also loki child well eight legged horse odin ride obviously would hard explain universe,False
"mean ninety-four critic liked movie movie ninety-four ten rating movie simply seven thousand, five hundred and ten",False
really liked although guess beginning felt bit rushed like bam thor asgard bam loki unmasked bam doctor strange bam odin dead bam hela bam ending jeff goldblum world mean used marvel movie lasting stake feel like loki banishment odin basically running asgard ground two whole year little lightly dealt mean thor got angry bit started fighting hela seemed really however said marvel movie really blending together recently really breath fresh air hemsworth hiddleston really good comic timing tom jerry type relationship really elevated movie allowed use humor maximize potential relationship hope thor movie continue style form humor lightheartedness really lends thor character,True
little play beginning caught completely guard matt damon sam neill finally mark ruffalo allowed stuff beyond turning green saying technobabble chris hemsworth great ruffalo amazing,True
yeah one got nice see chris hemsworth get goofy,False
always mo he literally god mischief,False
think kid theater really liked korg maybe need disney xd cartoon lol,False
god hope sick loki trope going good evil vice versa every single movie boring predictable point,False
feel like definitely minority pal,False
uh two dirty joke movie hammer pulling thor orgy fart joke umm actually watched movie,False
nothing want tone fucked character flat completely different established persona pacing abysmal sense tension cgi awful time costume design poor joke either fell flat put worst possible place movie good obviously reddit circlejerk flavor month director,False
damn totally missed,False
lol pretty sure infinity war going serious hold little bit drama pebble,False
witch dressed like one first many big laugh movie got,False
think based painting valkyrie,False
feel like really main villain much seemed grand master certainly movie longer plot revolves around planet,False
well batman v superman dawn justice big dark knight nowhere near nuisanced serious dark knight serious superhero film loved audienese,False
think thanos likely black order could wrong though,False
definitely worth 3d,False
would died though since hulk current grand champion mean would let brb freedom,False
could thor destroy surtur thor hulk fought thor easily,False
man even really look always get confused,False
artorias lost,False
anybody else catch thor asked hulk happened hulk said whedon coughed said something else,True
think could mischievous without switching side war every movie predictable boring character arc every movie movie,False
arm coming fucking robot insane want person soulless terminator terrifying,False
never expected comedy would almost worse movie seemed think comedy action thrown work well,False
comic,False
even played guest thor getting introduction sakaar guy,False
take plot seriously fun,False
post credit scene think missed,False
kid make butt joke time,False
film much better guardian galaxy two good also,True
loved think fun mcu flick outside guardian film goldblum fantastic loved comedy seen people say much think played well expect much come thor though know work together quote trailer much guess spending last five year human really rubbed ruffalo yet amazing banner really hope last time see enjoyed hearing hulk speak found interested say think favorite part look terror loki face first see hulk pure elation hulk ragdolls thor fantastic callback loved much league dark world really disliked question favorite thor trilogy far though still really love first one minus love story disappointed see death warrior three though especially volstagg fandral nothing die least still lady sif marvel keep knocking park wait see black panther offer,True
incoming downvotes reddit circlejerk crew,False
question bro,False
surprised seeing love tessa thompson amazing,True
funny joke got instantly meeks korg looked one another right meeks little jump seemed kind apparent joke korg made meeks fairly frequently,False
feel fresh compared last two,False
really really think people get rotten meter work,False
probably character much anything real arc resolution even get name,False
enjoyed pretty funny anyone else care cate blanchetts character really boring frustrated every time went away thor,True
gt also love marketing give away thor eye problem yeah could wrong trailer show landing bifrost lightning eye nice surprise see actual movie eye missing,False
korg reminded jim carrey bos yes man,True
thor point comedy film,False
eeh loki god mischief exactly would expect chaotic neutral god mischief stashed dad away somewhere lived lap luxury subject build statue perform presumably melodramatic play life never gotten impression mcu loki wanted asgard suffer wanted asgard worship odin fuck achieved start movie living proverbial dream thor came back around ruin fun,False
well made night,False
gave chill,False
yah everyone hated logan year,False
hide zucchini,False
sure trying say comic fan felt like dream coming true batmansuperman movie top got wonder woman potential justice league hint darkseid dark knight would single issue comic bvs would arc,False
true honestly even need villian film conflict stem one person realize probably introduce thanos storyline later bog movie,False
usually ambivalent cate blanchett oh god hot dark hair,True
think kind wasted comic relief guy first part film seem menacing voice definitely could powerful arc seemed evil,False
really looking forward movie kind delivered weird quirky especially anytime goldblum wandered onscreen gag worked part fluff feel low stake inconsequential like watching cartoon get wrong entertaining liked wow much weight substance bag potato chip also dr strange cameo pointless extreme idk could see watching hangover stoned movie,True
really good comedic actor,False
mention luke hemsworth playing thor hahaha,False
mention sif screaming coward play,False
swamp thing dc character,False
want netflix even punisher season two,False
knoooooow loki whip tesseract claim made good promise spoiler,False
hela op pls nerf,True
found almost completely immersive effect lost saw scene 2d,False
know,False
knew recognized,False
"really love many moment like thorwindowbouncy ball meant funny distracted loki feel like loki banner feel like banner gamemaster dumb anything whole thing place odin dy hella appears quick fight whoop hella asgard le minute six thousand, five hundred and ten tried fun ended weird awkward",True
glad one,False
saw imax laser theater 3d knocked sock,False
name valkyrie,False
kilgrave fisk far best marvel villain far,False
gt low stake inconsequential like watching cartoon mean like comic gasp,False
find far far hot dark hair prefer hella dark makeup evilness galadriel,False
aww love show,False
way watch xd weed brownie imax 3d gg,False
miss beta ray bill somewhere,False
tessa sooooo beautiful badass,False
"metacritic anything six thousand, five hundred and ten good",False
seen advertisement jl aqua man surf parademan sky building hope epic hair flip sure serious dc going anymore,False
lol forgot one,False
know lol random low key new zealand humor director know personally enjoy kind different ultron supposed villain,False
thought make hulk mad,False
nah deleted scene actually fire gun hulk pull hulk crush hand,False
two multiple,False
tie,False
get two immigrant song,False
thought anus medical term,False
opened one brooklyn ever back one,False
wolverine probably really high people list considering 90 push xmen deadpool level saturated bit different recognizable hero movie always great except superman personally would even consider logan super hero movie,False
yeah something visually incredible aquaman powerful comic wise flip hair like took effort point saying funny bad saying force feeding humor every five second unnecessary,False
well humor defense mechanism forget valkyrie either drowning sorrow alcohol,False
telling people like thing saying made cringe,False
think ragnarok think barrel laugh,False
forgetting sun getting real low callback,False
nailed thought refreshing bobbing little bit zeppelin started beginning thinking oh okay old music synth made movie stand better,False
agree aspect movie left disappointed huge character looking back thor past died two second screen time,False
space stone maybe survives intact among rubble know enough infinity stone,False
movie ton fun really enjoyable silly time glad went full weird thor since could really iron man cap,True
problem thor trilogy far mcu get solo movie killing second tier character big deal story,False
one hundred and ninety generic marvel comedy,False
definitely threw lol think theatre catch,False
yeah like comic like know movie entire realm destroyed end whole civilization becomes nomadic fucking guardian two waaaaay stake consequence emotion thor three mohr thor,False
karl urban seems specialize cast completely thankless role nailing,False
hate hate sword mainframe even like sword prisoner job started revolution,False
top ten marvel movie talking marvel stuff mcu top ten seventeen movie really impressive,False
red monster devil end two thousand and twelve right universe confirmed,True
hate break think go comic feel future marvel movie true movie getting formulaic,False
one laughed saw one,False
gt remember flipped town basically mental breakdown marvel expert think referring two thousand and eight incredible hulk really relate wanting serious hulk pain movie agree guy humor worked better gotg although seen vol two yet movie hard take story stake seriously like movie thor get captured trash planet knowing asgard getting fucked hoping thor escape get home lot humor deliciously evil grandmaster fucked humor pretty subjective stupid argue wrong,False
yo warrior three even get fucking mentioned anyone important supposed thor homeboy even sad face guess use time pack pointless dr strange cameo,False
lot fun think biggest strength set specific thing previous thor movie felt confident thor two particular fell weird space obligation mcu something made purpose goddamned comic book movie full effect full awareness reverence go looking thing critical big one humor one hand lot joke great really sense even laugh someone else still well executed hand movie know lay really well many joke sameness feel like person sense humor stamped twelve different character exception jeff goldblum character performance perfect funny even bit meta work little goldblum give shit comic book mirroring little grandmaster gave shit anything usual gripe pg13 spectacle knowing mainstream billion dollar pg13 movie already basically know hold punch make harder get excited biggest example random blonde female asgardian picked execution one hundred know movie going let happen seems even write scene like movie know actually show consequence impactfulfearful moment overall still great spectacle plenty enjoy one thing stood particular felt well paced scaled spent right amount time sakaar appropriately placed timeouts let character talk think guardian galaxy already made shifted landscape mainstream movie much movie would accomplished sits still example mcu best,True
wanted see uprising garbage people,False
loki lookin fine black suit,True
grand master tower bunch champion face including beta ray bill think gladiator,False
face one one shown outside grand master tower,False
thoroughly amused itching see already loki cameo beginning dying lol around one entertaining marvel movie ever,True
might escaped mean know,False
