comment,parent
taika obvi,False
considering asgardians worship warrior culture lot men probably army dark elf invasion hela big chunk population gone,False
especially back two thousand and eleven introduce main stream done everything go extreme film interesting evolution film mcu,False
best line loki tried kill u one time kid transformed snake know love snake picked snake change back go blah stabbed,True
loki odin banished like odin stated beginning,False
also hammer used beta ray bill wishful thinking maybe thor us infinity war retires serve king gard rebuild appoints new thor beta ray bill universeearth,False
probably exiled odin could figure really throne,False
never heard taika waititi voice legitimately thought korg voiced murray band agent flight concord,True
id politely like offer joke right consideration loki cheering hulk rag doll slamming thor saying yes feel like,False
think black panther going lot fun go usual super serious panther quite contrast,False
know coming,False
glad movie threw earth stuff focused crazy shit always liked thor character last two movie always seemed held back jane fosterearth stuff getting rid made movie much better visuals really incredible especially gladiator planet looked like obvious cgi feel like bit acceptable given tone film compared something like iron man god damn hulk looked damn near real noticed many subtle line like muscle shoulder slightly moving talking cgi artist deserve serious recognition also found pretty funny lot comedy gotg two felt bit forced like trying hard time one felt naturally funny still balancing serious stuff also worked pretty well overall really awesome film,True
would make negative comment movie everyone love cared karma,False
haha holy shit thought looked like matt damon actually think great,False
really liked one thor movie always least favorite mcu laughing engaged whole time loved hulk got personality taking nose dive commodore fantastic friend laughing loki request safe passage anus entire ride home action great immigrant song great battle theme,True
rachel house delightful collaboration pretty much secondary tertiary character awesome korg skurge topaz grandmaster scrapper could go great movie glad let waititi sense humor shine think earned boatload fan blank check,True
even hammer new melee weapon help channel power wield,False
cool part territory expect read thing year later knowing plot point really matter journey still fascinating excited really liked jms run know siege messing plan personally enjoy arc,False
oh shit great,False
thanks missed heard heimdall,False
movie buy zoo,False
best mcu movie opinion level laugh expected one thousand and ten,True
really never caught second one barely remember first character asgard know figure place plot context,False
maaaat daaamon,False
nine digit budget movie making money back every year pg13 rating sure marvel afford let u see hulk flaccid green bulk cmon guy dr manhatten bit twice none u would really mind hulk nudity enough opinion,True
piss ghost,False
must people theater burst laughing three vampire huddled together shoutout,True
said pretty bummed killed warrior three quickly,False
remember correctly banner mention one earlier movie tried commit suicide shooting mouth hulk spit bullet,False
assume got asgard blew,False
wait spin back around,True
one going mention grandmaster killed collector,True
dead question,False
ton fun watching finally kickass thor movie rhys darby tremendous scene darkhaired cate blanchett dear gaaaawwwwwd,True
know thor love snake,False
giant monster,False
trailer show thor lightning power arena well,False
falling thirty minute,False
id say draw,False
suggestion time travel infinity war wonder see regain way find hard believe permanent,False
love matt damon randomly showing movie thing great movie eight hundred and ten,True
stated future movie jeff goldblum still earth choose believe grandmaster,True
thor throwing stuff loki hilarious whole theater laughing actually hit loki,True
thor might god hammer think might actually god sword,False
definitely saw beta ray bill assumed ship end something thanos black hand ravagers good guess thor would natural link guardian avenger space,False
grandmaster successful minecraft player ever,True
rhys darby,False
shhhhhh,False
ever dark gritty,False
yeah going pas,False
eight time,False
sound like one liner,False
hela galadriel ring power,True
"movie freaking hilarious reminded guardian actually better humor knew trope played essentially breaking fourth wall loved solid nine thousand, three hundred and ten",True
got movie see,False
think big flying chitauri worm thing would win fight wolf,False
guy grandmaster melted cousin,False
blacklight place would look like jackson pollock painting,False
saw first showing boston adored movie see might think joke overkill great long as day work sense humor point imho holy shit know skurge played karl urban sad recognize signature sexy jawline dredd topic character pretty much trivial kill anyone alongside hela help asgard end mean died help save civilization character development among star cast thought cate blanchett shined damn believe forty-eight movie range amazing check carol blue jasmine seen fellow chick smokey eye makeup look like regular look lmao end day look like thor without eye also appreciated jeff goldblum sexy blue nailpolish tessa thompson good absolutely hated westworld low expectation let u forget matt damon astronaut,True
batshit badass thing ever seen even comprehend saw even exists please give u like marvel,True
huh show,False
really,False
anyone else notice sherlock reference 221b baker street thor appeared dr strange place spoiler,True
visiting houston soon need make point pop drafthouse cherry,False
idea hulk thor buddy cop movie definitely helped sell lot people,False
also luke better actor three brother liked character westworld,False
adorable end still thor,False
loki turned back like ahh stabbed,False
shocked see matt damon luke hemsworth totally ignored sam neill,False
god damn matt damon time end asgard hope someone save time,True
one face grandmaster tower looked lot like beta ray bill,False
really expecting like valkerie much,True
basically become surfer bro stupid goofy,False
rjustneckbeardthings,False
piss ghost,False
yeah get reference,False
horde love get downvoted hades finished drooling eachother voice reason finally cry coming realization movie clone gotg tone production design meantime let u suck downvotes oh look come,False
think title go are,False
gt grandmaster carlo collector brother,False
unfortunately nine seventeen dollar ticket get chance see hulk green bulk,False
liked 3d couple scene switch focus foreground background quickly made eye cross left theater mild headache totally worth great movie overall,False
gt tessa stole show hilarious mah gaaaaawd hot gt great movie love sassiness made character likeable,False
wanted hulk action third act really could used four major player rushing hela together failing see hulk tussle briefly fenris jump surtur disappointed bruce internal struggle come term hulk hey need big guy please stay permahulk time banner also never payoff indecisiveness hela hulk never spoke loki either quite sad reunion hulk stand bridge like trailer thought odin death bit hokey hela entrance dig much wanted specifically role goddess death perhaps return scared asgardians could bring permanent death something experienced also ah last valkyrie moment hela really hope everyone destroyed thanos beginning infinity war something tell marvel settle norway interesting world would whole civilization alien asgardians living earth,True
make comment amazing sharlto copley googled voiced director know believe anymore,False
nah mate meiks dead,False
glad loki got safe passage anus,False
really enjoyed movie funny great story cgi atrocious every time hela kind action,True
think die whole goddess death thing going,False
excellent summary ending dark world built right,False
hulkamania ran wild film seriously tho really really good like actually really enjoyed thor movie,True
would say eye situation,False
shadow,False
way marvel drama constantly undercut unnecessary humour,False
forget mjolnir getting destroyed,False
taikas movie believe shadow mockumentary vampire adjusting everyday life super funny go watch already,False
best unexpected part homage willy wonka chocolate factory loved,True
guy know else go husband watched movie tonight great time loved every moment movie got home thirty minute later smile left face stared phone found fellow manager friend died forty-five minute text message sat shock several minute exactly know happened say finished interview complained headache got really hot got really cold fainted know help sat consoled let running ifs almost beating heart break friend friend left behind two kid two four fuck,True
cameo guy portraying loki play,True
ragnarok raunchiest joke recall mcu blacklight place would look like jackon pollock painting guardian galaxy ragnarok really raised bar lol,False
guess know waiting release though,False
holy shit movie incredible humor tone music acting plot cinematography overall fun cinematic experience humor point fast pace better iron man guardian marveldisney knew classic trope played risk insert much humor paid well audience laughing throughout movie destroyer shake weight jeff blugoldblum scene spot tone music fantastic could listen music forgot fucking awesome 80s90s electric song beginning end acting near perfect stellar cast forgot hopkins elba thor movie simply phenomenal thesbians loved movie particularly humor cast plot,True
horn silly looking,False
liam hemsworth,False
soul left body started dancing led zeppelin kicked nearly end movie,True
music sound familiar,False
might work benefit since killed warrior three avoided chopping block potentially could show,False
one hemsworth bros,False
oh right stone stone thanos stone chosen especially empower thanos thanos stone,False
oh shit shadow vampire reference,False
taika film shadow vampire roommate comedy would highly recommend,False
matt damon played loki dogma fake loki ragnarok,True
thought actor looked suspiciously like damon like nah man way got psuedodamon like methdamon breaking bad,False
yes,False
shout kirby reference visual design like one comic come colorful life,True
liked movie put thor movie thor different character one kind awkward others confident manly,False
imagination arrived,False
liked look every thing could tell fake weird place compared everything else,False
fan quick ending hela know back felt halfassed,True
whoa lot deal sorry happened husband definitely need right,False
taika waititi director actor played korg wrote directed starred shadow jermaine flight concord mockumentary three well kind four vampire roommate really direct shoutout though work pretty well standalone joke,False
doug ever immortalized doug may find favor valhalla,True
little guess considering said,False
haha high,False
metal movie ever made,True
synth felt perfect movie felt natural especially knew thor god thunder extrapolate electricity electric 80 rock music spoiler almost like character film,False
due series unexpected event little control missed first ten minute never late movie ever ugh mad got matt damon playing loki dying movie good tho really liked definitely funniest marvel film ever cate blanchett super hot tessa thompson,True
valkyrie briefly mention stopping refuel xandar trying figure way get back asgard,False
one thing call sad predictable time better alternative,False
korg fucking fantastic probably favorite new mcu character nearly every line comedy gold delivery content think liked valkyrie,False
eye get,False
may dead longer draw power asgard,False
honeslty newbie mcu significance losing eye like odin,False
thor throwing loki stuff hilarious,False
spot loved,False
really surprised amount call back movie ragnarok rewarded mcu fandom way think yea sun getting real low one time thing would still one funniest mcu joke thor trying amp squealing end,False
surtur crown great chekhov gun hulk going fighting favorite part movie,True
expect good guardian galaxy vol one,True
jet black hair killed,False
like distilled 80 metal scifi fantasy gave master bar tender make incredible cocktail garnished slice kiwi,False
understood reference,False
hm good point dammit need hela cate blanchett life,False
usage song made sense whatsoever yet loved time fun sake fun nothing wrong,False
guy suck always jimmy kimmel dressing room,False
fuck done chris superior one even close,False
kept predicting would last week completely understand,False
sound like guy kiwi drunk driving commercial,False
dude stole like knock rocketgroot thing wish remembered name concept armor awesome,False
also personal bodyguard dr benton quest,False
water wet,False
thor,False
loved brought back korg meik planet hulk,True
think hela cgi bad arena fight worst cgi came background certain part thor v hulk fight fight still enjoyable like mo part could really tell cgi,False
question regard dr strange post credit scene thor seems decent friend strange film first meet one see presumably lost eye,False
saw leaked version puzzle piece finally fit,False
chain spinning joke happened twice,False
agree joke got better 2nd 3rd 4th time around,False
break fourth wall,False
great movie prof taika waititi world actor director good alamein boy shadow hunt wilderpeople best current actordirector combo,True
scene thor loki elevator genuinely excellent character moment little beat like really elevate mcu another superhero movie calling though loki going die real infinity war,True
laughed maybe twenty others packed house hope people discover shadow got big blockbuster resume,False
wish managed share scene dr ian malcolm,False
know tessa thompson top babe eye gorgeous,True
many one liner,False
well think people disagreeing vote,False
comic loos eye point king see could stay,False
yeah hoping last stone would revealed least cameo thanos,False
gt wanted specifically role goddess death title never profound seemingly expecting even thor loki title essentially reference fighting power style odin title name king asgard goddess death probably odin executioner brought quite bit death wherever went,False
loki reminiscing smile end scene great,False
went 7pm showing midway movie light go manager come tell u power went b told u receive free ticket movie movie end manager told u theater fault lel,True
rock guy fucking funny holy shit,True
apology matt damon,False
yeah guess really hoping would play movie though,False
falling thirty minute first laugh movie got hiddleston hysterical loki endlessly amusing,False
okay going see thor saturday question first thor spoil guardian galaxy two one mcu film seen yet one concerned since highly doubt thor spiderman homecoming antman spoiler hahaha,True
noticed attention detail amazing,False
dissapointed hear would returning cuz jamie busy blindspot shame kind happy come back would killed hela likely way save another movie,False
he probably missing eye actual movie,False
nope fine,False
drawing blank help,False
never outright broke fourth wall close several time teasing way example first scene classic oh want know got let tell also humor throughout film poked fun awkward thing movie typically skim audience know experience real life,False
sound like another hater passing shade without seeing film,False
body work indicative talent see point,False
even little bit,False
hela fandral volstagg dirty,False
man krog amazing hope something infinity war team groot would glorious,True
personally liked woke thor endorsing idea woman army,False
nope one bit,False
wondering elsewhere thread claimed mentioned banished early film,False
laughed hard thor threw ball window bounced back face,True
wish would least small moment thor mourning warrior three friend get brought loved movie though great new character great use existing character,True
thought pacing first act terrible introduction thor bad thor skurge together first time awkward loki odin thor together awkward rushed cool see strange thor together seemed real rushed bam odin dy first 3rd liked lot though,False
see would asgardians settle earth happened comic though pretty sure kansa,False
relate hulu account lose control time,False
uh,False
godsend thank,False
shadow movie several great film worth watching notably boy hunt wilderpeople,False
thank much,False
thank,False
happened sif,False
think name meek,False
dr strange post credit scene scene ragnarok,False
seen bro answering question getting defensive,False
enjoyed movie immensely loved surprise cameo asgard play damn hypk v thor fight tad disappointing,True
managed break heart boy actor director quite feat especially since knew comedy seeing movie,False
cast movie phenomenal cast play loki wrote phenomenal well matt damon luke hemsworth sam neill hilarious,True
like stand,False
holding teaser credit like first cap movie little disappointed good,False
absolutely loved well paced fun funny dark serious need korg stand star,True
comedy really worked take seriously spot unexpectedly laugh loud funny,False
pure imagination playing thor chair going tunnel grandmaster world explained end tunnel unlike boat ride willy wonka,False
one fun marvel movie ever really hope taika get make another one,True
surprised stephen strange offer thor plate busgetti,False
waiting valkyrie comment hela well would nice touch fuel fight,False
get help thing hilarious loki said want get help valkryie reaction priceless,True
care either much inappropriate humor usual marvel problem outside maybe cap movie part fuck broey dialogue,False
lol showed drstrange address nerd started clapping,False
thought saw gladiator,False
let u call draw,False
anyone else catch dallas cowboy reference gun called dez troy,True
yeah predicted little slide made perfect care,False
thanos ship teaser enough infinity war,False
oh god terrible sorry,False
falling thirty minute easy favorite,True
another day another doug,True
honestly surprised gave character redemption arc seemed like fuckboi would follow whoever swung biggest stick even limit god,False
doctor strange need strand hair thor man touch hair upon head stan lee bitch please,True
confirmed miek larva form right grow bigger badder korg,False
skorges redemption,False
music thor strapped chair sent meet grandmaster,False
think reference comic depiction valkyrie blonde braid,False
pretty much happened comic tbh,False
yes pure amazingness,False
realized voiced korg cool,False
seen really enjoyed perfect amount humour really good action acting performance probably favourite marvel film since winter soldier,True
meh still got see butt cheek,False
korg miek,True
went goldblum face wonderful,False
behold stuff,False
listened lyric,False
film fucking blast,True
one best line entire mcu,False
think survived fight surtr thanos pick ship,False
loved loki slight smile line,False
um totally sound like theater fault power outage exist,False
gt usage song made sense whatsoever yet loved time lyric reference norse mythology fight horde sing cry valhalla coming hammer god drive ship new land seems appropriate,False
still got see butt cheek though,False
yup look like thanks making good promise loki avenger one begun infinity war,False
maybe seeing comment yet shocked one brought appear making asgard planet hulk,True
speaking doctor strange thought minute film better entirety doctor strange film constant moving thor around hilarious,False
yup thanos seeking infinity stone since ultron really think tesseract floating ruin asgard he definitely tesseract,False
wait really missed,False
odin son jason bourne,True
mcu solo movie thor always one title could quite hit stride cap really established winter soldier dark world melodrama fell bit short dunno fine new thematic direction thor wish first two movie worked better grander scale epic fantasy befitting thor rest asgardian peer read original ragnarok arc comic always hoped cinematic treatment siege final stand thor asgardians slowly overwhelmed foe would similar scale grandeur battle helm deep siege gondor lotr movie,False
seen mentioned loved willy wonka theme right veggie thor meet grand master also color screaming reminded scary river tunnel movie,True
directed,False
yeah definitely thanos coming tesseract loki stole trophy room,False
easily,False
think thing cate blanchett,True
giant worm thing would get as kicked,False
really sad warrior three gone like,True
obviously need ghost skurge korg team movie,False
oh vaguely remember magically refilling beer probably right one,False
pretty sure know video directed guy guessing voice immediately came mind saw,False
well thanos thing lady death think would far fetched survive fight end thanos picking ship,False
lot joke getting shout one favorite thor eagerly throwing bottle chained loki confirm really marvel keeping tradition making loki avenger punching bag,True
mostly thought wolf poor cgi stuck really strangely,False
hated fact color grading bland thought gotg two would new example marvel grade movie mean designed colorful everything grey enjoyable,True
scene ragnarok much longer basically dr strange netflix u want refresh,False
hela snot dead right,True
essentially culmination odin greatest mistake film really highlight shitty father king think lie secret great job loki nearly singlehandedly destroying asgard weakens odin point death causing hela released hela introduction command heimdall take back adgard one place hela draw power revive sutur eternal flame mean stopping hela causing asgard ultimate destruction thing enjoyed really stuck may get mentioned film totally going top mcu movie list got see weekend,True
loved sherlock reference harpsichord address two chair perfect,True
entire movie like 80 metal album cover art come life,False
thought address gave sherlock apparently really dr stranges address author address irl unless different sherlock moment missed,False
huge fan marvel type superhero movie one looked funny brother worked part cg went check funny movie usual marvel stuff end day dig marvel movie probably really like come looking grit,True
said generator really care waited even five min,False
think imagination,False
surprised stephen strange offer thor plate busgetti,False
torn think could also homage odin get eye patch actually thought odin going hand eye patch thor ragnarok,False
thing hated movie easily warrior three got taken,True
movie may outgross justice league domestically really great quality fun,True
agree pop much think going,False
suit,False
last joke miek might hardest laughed marvel movie,False
must missed scene,False
link wanted let know right term podcasts,False
thor losing eye vastly significant set following path odin far asgardian mythology concerned mcu film lighter thematic departure previous serious thor movie,False
seen man steel would love man steel,False
much want see character time hope dead asgard got destroyed nothing gigantic sword body exploding planet enough kill,False
bruce banner every white guy want cool black friend,False
thor movie long unsung hero mcu basis much never getting recognition work however think movie going enjoy lot appreciation increadibly funny colorful great action set design catchy score criticism pacing little fast act one later moment needed bit breathing room particularly scene thor loki odin felt little bit rushed still great time watching,True
guess elf make good villain,False
whole movie kept thinking please please market best reviewed marvel movie easily best movie year laughed hard many time theatre since watching hunt wilderpeople even ride home movie kept smiling remembering funny scene thank much youtaikawaitititi making happy chaos,True
smallville fight pretty epic,False
would also accepted kashmir,False
hulk one punch manned one work fucker fenris beast great notoreity norse mythology fenris curb stomp,False
movie whole good movie well directed acted love art direction however really starting get sick marvel constantly going humor route really hope ruin thanos like ultron every movie funny guardian one sometimes want something bit gritty earth like ironman three best part reason love movie tony stark vulnerable flawed protagonist movie,True
anyone else hoping loki speeding towards palace ship would start saying must go faster must go faster,True
dressed,False
since hulk blood made fenrir mouth something,False
hey strategy work use,False
see ship take palace attached bigger ship end probably got back tesseract flew,False
link trailer,False
sure fun movie long time moment awe cinematography next stitch laughing sure best thor movie fun marvel movie year,True
jack kirby design everywhere sakaar awesome,True
loved first scene he praising valkyrie best true whenever talk say tell call start b trash wha waiting whole time call trash even start b,False
wrong asshole,False
considering infinity war trailer showed would say likely,False
teleports thor,True
introducing rastafarian idris elba,True
anyone else think ship cut post credit going guardian galaxy feel like would weird thanos capture asgardians get earth make sense guardian captured chitauri ship accompany earth,True
oh wow never caught thanks,False
could right felt drawn like family guy gag nervous first five minute,False
damn banner faceplant looked like hurt,True
taika really knew utilize character ability hilarious way,False
gt hemsworth seemed like way fun role one four appearance really felt like pulling lot silly thordarryl skit,False
missed minute beginning got right odin told thor hela sister miss,True
also kind jerk,False
