comment,parent
really messing movie much hulk thor fan thought humor pretty childish would cool one thousand and thirteen year old mid 20 self slapstick pretty good though banter hulk thor basically consisted behaving like little boy audience supposed laugh rather larger life men hulk would say something like hulk doo doo head thor doo doo head thor would reply unheard stinky head doo doo supposed cry tear mostly gave blank face o_o villainsantagonists bland hell watched first thor forgive ignorance hela seemed last minute villain introduced briefly dying odin like oh way sister goddess death ok bye pop speaks heavy exposition like hela true heir throne blah blah blah lazy writing hela literally asking skurge motivation even egregious example lol spoiler grandmaster played goldblum bleh something flamboyant dictator enslaved oppressed people seemed wrong behavior carried make believe commoner would fear lost good opportunity build rebellion led thor hulk overthrow oppressive dictator going second thought maybe grandmaster flamboyant playful demeanor would bother much antagonist hela display demeanor well time big flame guy destined destroy asgard gravity stake movie much levity find worrying plight save asgard treated joke thor hulk showdown impressive would probably watch scene mood rest action ok guess mostly cgi figure mauling horde cgi figure otherwise lightning spinning slashing interesting idea battle bridge one air one water last act connect well lotr something similar term minibattles going hoping something like,True
comic mcu replacing death goddess death,False
first spoiler preview cgi spoil,False
current comic arc hela,False
gt seriously understand funny people laughing man rag dolling ground reality pretty horrific sight funny even though knew joke coming subverting hero landing way deadpool mocked high jump cut ground foot stomp hard one knee slowly drift camera hero stand foot looking stoic ninety time including character avenger one turn towards flying robot seamlessly transforms hulk sort throwback subverted expectation based comedic tone movie people probably guessed punchline comic hence laughter slamming harmlessly onto bridge,False
think avoid spoiler ragnarok notice trailer well thor still eye scene wounding mean entire injured eye cg never actually applied hem,False
stronger thor like odin stronger thor kingqueen source power hence odinforce thor becomes king thorforce,False
hela norse goddess death lady death one thanos love actual personification death universe entitity lady death immortal entity beginning universe end universe hela another strong long lived alien,False
think probably marvel including missing eye trailer thor ragnorok trailer would infinity war trailer revealed,False
comic yes mcu subbing death goddess death,False
jeez joke chill joke ruined movie idk watching marvel movie first place,False
real complaint hulkplanet skaar sp effect ragnarok remove movie play end,False
hey man korg best,True
wait sufficiently far away deadly shooting america release movie never release movie,False
source seen mentioned anywhere else either way see happens infinity war,False
notice nebula face building well would cool hear background stint arena like,False
interrupt wait need melt stick interrupting capital crime geez fuckin loved part,False
avoided first two thor movie long time looked uninteresting finally got around watching summer suspicion confirmed caught ragnorak opening day blown away compared first two ragnorak lot fun watch set entertain,True
whistle old spice jingle,False
oh cool know would done seems weird thanos would pining hela though character death feel much mysterious cosmic powerful,False
gt first thor movie would give pas already two movie establishing tone feel character joke thor pratfall everyone losing shakespearean diction character liked showed influence earth first thor movie fish water first avenger still shakespearean getting used stuff one sided second avenger settled hang people joke around mjolnir etc time get ragnarok influenced earth friend year point unreasonable think would lot chilled selfie people street example,False
thor power include observation,False
watched today god korg gift mcu,False
skurge served absolutely purpose except hela deliver exposition honestly replaced undead movie visually entertaining man many quip even dramatic scene,False
man burnt super hero stuff seems like stomach outlier term theme tone darkma stuff comedy driven one absolutely enjoyed movie want see lol,True
felt way released friend benefit string attached near fwb showcased chemistry mila kunis jt whereas ashton kutcher natalie portman zero chemistry romantic plot tend really flat even though good actress think even need mention worst romantic pairing,False
thought sharlto copely lol,False
duh seen jeez need day,False
taika rhys darby imitation use rhys darbys voice,False
damn people youbukdiah explains pretty well like movie quit downvoting different opinion,False
anyone catch reference castle valkyrie selling thor rachel house say tell dreamin waititi surely fan classic comedy,True
sort point fact feel jibe work issue,False
quip lot quip,False
anyone high re version,False
typical,False
enough time say magic word,False
one early clipsteasers showing hulk running forest wonder happened scene,True
pretty standard kiwi thing maybe lil jonah summer height high,False
agree served purpose agree overkill marvel tried jam story element way many source,False
supposed care struggle find life purpose honestly could care le final scene bridge magical near infinite ammo m16s yeah felt like extra storyline jammed,False
marvel trailer creator dude put away tinfoil first movie work feige running mcu team know exactly interconnected phase iw trailer delayed withheld pretty much wait civil war teaser cc never released publicly first trailer iw trailer likely drop week star war december release appear trailer sw,False
wife walked theater guess one enjoy rest audience laughing head joke thought forced corny ill watch end hit hbo disappointed hope try turn black panther comedy well,True
fair enough,False
think said anywhere possibility sure think ever suggested two,False
agree everything posted,False
hand best marvel movie seen surprised much enjoyed,True
agree feel tacked executioner fairly prominent character thor comic similar redemption defending asgard w machine gun seems like producer wanted put iconic moment previous thor film realized never never would fine,False
completely expected still brutal even die,False
lol thanks cool people like movie marvel produced many good popcorn flick people take kid hang fun others overlook thing see flaw still enjoy whole fine humor also subjective,False
best part story absolutely sound like kind rambling mundaneyetabsurd story fill lot norse mythology kind reminds story freyja chariot cat imagine mcu thor would explain something like taking nap long day fishing sleep cat keep cry go tell knock find tom cat two kitten like keep like know hard single father like chase gave two kitten freyja us pull chariot,False
well may remember one hundred said loki said planet two week even though left warp tunnel second thor goldblum line said actually million year old thanks planet look like smiled reveal old looked,False
would matter serious,False
aye change heart huge wtf ok moment texas weapon came handy though eh lol thor comic recommend read marvel long never thor guy begin think jane foster held mantle,False
negative review seeing annoyed comedic nature thor three whether wanted epic action comedy interesting thor two interesting feature loki,False
settle francis,False
two tesseract,True
find interesting sorry different opinion acting like walked theater shocked movie actioncomedy clear knew took issue comedy undercutting tension drama completely different story mention original post yet getting downvoted sharing completely different opinion enjoyed cool,False
well whatever okay enjoy movie,False
really saying opinion invalid like fourteen thousand people thread wanted serious movie got comedic one cool like saying ranking worst time marvel movie thor three second worst thor two absolutely worst,False
never said like observation obvious hole character said mean enjoy,False
okay plenty nitpicks available walked worthy buying unless walked ninety movie ever made,False
think hole hela dying form thor powerful attack yet sign stronger able withstand thor attack thor able withstand hela attack,False
wow must enjoy many movie mean walk come,False
plot point blood give hulk like mutation assuming,False
never big thor reader reading comic 90 walt simonson thor run regarded best modern stuff,False
forty-one laughed as goldblum awesome say tha hela bit underwhelming seemed move,False
177a bleecker street usual spot sanctum sanctorum comic sometimes think baker street see,False
yah heli hurt thor lost eye thor losing badly decided end world getting as kicked please heli equal footing start ragnarok equal valkyrie loki heimdall hulk side run equal could wiped as let along distracted let people escape way watch movie get final scene heli kicking thor as,False
really depends type comic book read dc marvel comic book serious time lighthearted really dislike people use excuse comic book people complain tone movie,False
oh right well problem thor hela equal odin say think anybody reacted hela way shit pant even odin,False
enjoyed every marvel movie think one feel like tried mix deadpool guardian galaxy like,False
thankfully five movie night area otherwise would stayed whole thing cringe worthy u,False
two week favorite grandmaster assume loki would noticed,False
yes shit pant massive bad as none explains simple question odin said hela get power asgard thor thor beating hela cut power also asgard place people fact eighty died mean thor weaker idea thor would sacrifice power save people damn good story ending problem explained well happened,False
one weapon thor one beginning smaller tesseract,False
yeah okay agree well explained especially since trying explain apparently place case hela stronger thor twenty power nothing really change come two fighting introducing ragnarok surtur equation distracts hela get away remaining asgardians allocate power either unconsciously maybe end giving thor power hela obviously would able help continue fearing hela,False
ahh ok haha,False
goldblum felt like ornate costume lol,False
really wanted like movie honestly felt like kid movie couple swear word thrown marvel film laid slapstickgag humour little thick lately going still enjoyable would consider mustrewatch action scene pretty good movie little nuance perfectly fine personally wanted,True
understanding well could see simplifying sake movie also cate blanchett pretty amazing,False
would mind would love see however would make movie worse going destroying whole god damn civilization stop sister even destroyed end anyway,False
godness established devo,False
starting ever seen euro trip,False
let cut hair turned pretty good thor,False
wonder deadpool show,False
wonder much alcohol drank millenia old bender big would planet made,False
yeah mislead many level thought thor going say scared snake thought snake going bite could stop laughing entire joke,False
fair time first thor came easily best thor appear screen speaking tone chris hemsworth nobody hollywood thor came bunch australian credit brief appearance star trek two thousand and nine list dude yet look early appearance late night pretty stiff funny confident star people see,False
right seems like every actor missing stuff blindspot least thing care,False
funny moment pretty bored overall enjoyed exploring jeff goldblum planet every time something happened asgard freaking care seemed filmmaker felt way idris elba super cool though always would killed actually film scene odin real place green screen obvious ruined scene,True
thor loses asgard pal sister attack asgard thankfully made new pal new asgard,True
real captain america teaser brushing ice windshield plane say something effect man waiting long time,False
mean agree whispering issue time dude chill fuck kill dog get butthurt,False
true clearly jadabub going haha,False
star war fault heck would argue one better romantic plot,False
good one funniest marvel movie second gotg2 valkyrie bae definitely best thor movie liked character hulk funny still think cool getting big universe marvel wait bp also thought scourge going dallas cowboy joke named gun dez bryant troy aikman especially since got texas one question comic reader thor really care loki much movie,True
wow legit thought actor playing loki corey feldman,True
actually captain america movie beginning line get line colonel care time one waited long enough,False
closest thing get planet hulk overall loved many great thing film put word sum absolute fun best thor movie felt almost like guardian movie recommend highly,True
would like safe passage anus,False
least favorite part thor ragnarok little mockumentary longer considered part canon,False
yeah dumb,False
revengers kicked as,True
feel like people laugh scene also would laugh two magician front page day one try trick audience show trick done ending fight,False
well said specifically draw strength asgard may diminish thano fascination wanted frame way thanos might offer power join,False
asgard people draw strength still accomplish much right,False
theater erupted laughter hear last part thanks clearing,False
gt tesseract definitely stare,False
reminded painting renaissance holy war esque feel,False
giant wolf fenris exact,False
yeah wish avoided trailer would pleasant surprise although something would expected poster,False
groot korg something together infinity war,False
thor magical scifi begin,False
one hope would awesome,False
midwest anyways would never leave middle movie even cheap night payed might well finish,False
yeah think might cut rewatch back civil war,False
completely disposable popcorn movie scene promising went right back something high school kid watch friday night completely forget saturday marvel played safe,True
tried really hard accentuate cameo heavy closeup matt damon loki ground along luke hemsworth cry thor recognized damon bit started loling could put finger 3rd hemsworth brother till movie looked,False
mean speculation point would mad reused cate blanchett death thanos obsession,False
pretty cool reading technology first time used film invented friend director,False
show lady death introduce concept infinity stone gotg,False
think two people seen marvel movie regardless country fact lot even seen movie majority north american,False
yes man definitely best spot thor thor movie scene nail view,False
still get involve natalie portman movie like even small cameo,True
jason aaron thor god thunder starting two thousand and twelve story jane foster thor one favorite comic read,False
hope infinity war interaction guardian calling asgarians galaxy,False
de troy joke old one place together destroy nothing cowboy,False
probably third favourite marvel movie date iron man one guardian one superseding feel like movie executed story lot better otherwise thought movie great fun witty well put together pretty fantastically written movie good like marvel marvel composer mark mothersbaugh finally reusing musical theme mean know patrick doyle thor one theme brian tyler thor two theme top head notice credited credit good notice mothersbaugh brought back harpsicord dr strange showed appreciated overall music movie pretty good really evocative eighty synth pop kind stuff comedic timing super point marvel movie typically token joke enough keep movie dark anyway movie straight science fiction comedy loved aspect went full hog comedy route nailed korg best character actor gave great performance visually might best marvel movie would think watching movie much wow awesome think would able say marvel movie sequence valkyrie attack hela bloody awesome would frame wall bad maybe thought fight ranged mediocre bad one aspect really make feel way every fight fight something thorhulk fight lokivalkyrie fight one hallway think exception looked great thing like opening fight hell looked cged hell rapid camera movement made even apparent continued nearly every fight scene aspect look fake kind bugged think saved immigrant song final battle think playing first fight movie mistake overall well made technically competent movie soundtrack rock lazy read version aka made video version,True
yo talk lord ring reference movie little list cate blanchett karl urban balrog looking villain henchman climbing pillar like goblin stone gate like gate moria innocent civilian hiding cave escaping back mountain green ghost warrior taika watiti new zealand grew lord ring even art director let know noticed anything else,True
unites hulk valkyrie thor,False
yes little goblin scurrying pillarsthe balrog worried one seeing,False
sadly think correct saying closest get true planet hulk luckily least get quality animated movie story,False
beta ray bill,False
notice guy playing thor film played thor bunch marvel movie actually guy whole time crazy right,False
pretty great best marvel movie seen,True
thor pretty good substitute silver sulfer wish rumor disney buying fox would panned would paid much money see stand alone drdoom origin movie done right,False
right would loved see banter loki thought film initially would include strange along side thor hulk setting introduction avenger,False
big uncomfortable laugh callback end great however,False
god elite couple hope threw martini face idiot commoner enjoying movie made way theater,False
yeah said got thought going cowboy joke,False
wait see iw integrated avenger well really made feel dr strange get involved shit serious,False
saw crowd cracked major awkward silence,False
heard film trailer lowered expectation significant role,False
world secret like impossible keep still great job making appearance impactful,False
cosmic cube space gem,False
loved ragnarok comedy movie seems controversial part understand time thought thor noticeably comedic personality seem right think comedy swing miss people comment suggesting either anyway critique movie would like share really think adding flashback odin hela crusade nine realm showing defeating kingdomsspecieswhatever would helped hela character loved hela villain seems like would benefited another scene two backstory one commenter explained earlier hela introduction kind lame whole dying oh btw sister goddess death conquer asgard thing nonetheless rap major complaint movie still loved lot thing thor v hulk hela valkyrie loki heimdall korg etc,True
thor loki worked issue,False
obviously best thor movie two thor movie bottom tier fantastically fun movie needed since guardian two hit spot biggest complaint three villain hela jefff goldblum ragnarokbringer guy none developed well hela needed lot screentime set devilish jeff always felt like missing sentence whenever speaks like could saying something ragnarokbringer guy awesome realized destroyed destroying asgard really show cool,True
hmm yeah mention old crew got offed really quick sad get screen time,False
flew away sokovia stealth mode could track flew flew crashed,False
new spiderman movie safely say criticism heard marvel getting silly true marvel newfound silliness best thing ever happened movie lifetime seriously loved movie dumb little joke awkward moment thor constant failure typical movie badass hulk champion fucking jeff goldblum could go guy see movie see different marvel movie deserve support rare go movie pure comedy grinning whole way yeah ragnarok managed oh go lover norse mythology promise research disappoint,True
bifrost loki used heimdehl first thor pulled thin air loki going summon big fire dude knew asgard go shit,False
laughing throughout movie great people seem want batman thor,False
trickster used tricksterforce,False
pretty sure ship escape end bill ship wonder battle pit planet part revolution hope love dude,False
everyone idk pop type,True
mean worked gorgeous scarlett johanssons charm right,False
sherlock 221b baker street,False
chill said said might realise ridiculous sound,False
tough going punch glass eat shard,False
sound ridiculous though ninety-nine situation completely justified telling someone said talked movie one sound ridiculous freaking telling like mate fucking internet make fucking mad go god damn drug clearly missing something life,False
rude though make mad chill,False
turnabout fair play take advice well,False
wait actual thing comic odinforce like speedforce,False
yes well established,False
oh boy thanks explanation,False
appears two blue cubesstones asgard vault first larger one tesseract smaller one mind stone,True
noticed brief scene child fleeing wood chased undead warrior edited exact way one multiple chase scene fellowship nazgul edited lord ring theater hard flashback lord ring scene might edited callback one scene around battle amon hen quite sure specific lotr scene,False
got back watching second time still laughed joke even though knew coming grand master announcing thor hulk escaped said mission choose accept catch first time made look around see anyone else noticed haha even though film felt like comedy superhero movie felt true thor first two film really,True
heard song hundred time hearing movie take immersion mostly pure imagination also used frightening tunnel scene willy wonka immigrant song sound amazing lyric relate plot,True
referenced one appreciated sci fi coming age giant robot animated feature film like,False
get favorite joke thor say struck hela largest lightning bolt history lightning history lightning,False
haha fucking love summary cast list right,False
obligatory,False
really anything big meant nod mission impossible even planet grand master somehow seen movie favorite joke mean one got play matt damon luke hemsworth sam neill genuinely tear first time saw,False
gt get mission choose accept mission impossible line,False
holy shit thought one,False
yah hoodies sunglass would best disguise,False
critical role fan chance,False
anyone think might nod box art doom skurge leap ship onto pile zombie got twin gun karl urban doom guy two thousand and five movie,True
like anyone posted around three time,False
really really loved movie thing took movie hulk voice sounded digitized like auto tuned sound deeper fantastic,True
enslved guy pretty nice trusting,False
know cuz never watch trailer anticipation killer dougs sudden hulk shat brick sure great surprise,False
wildest hang onto seat ride film,False
nice d reference,False
naked westworld,False
telling,False
korgs brother,False
think small one tesseract big one ice giant casket thingie first thor movie,False
least hogun time speak little fandral volstagg died immediately also happened sif,False
nothing,False
like eight,False
silly thing iw,False
even recognize matt,False
rfuckchuck,False
feel like different character saw previous movie would mad either way around plenty funny people last eighty-nine earth year people change always wise cracking character even thor one go back watch,False
honest goldblum never played anything goldblum movie great one care,False
eternal flame,False
saying anyone could take eternal flame use resurrect dead,False
natalie want gathered hesitant thor dark world lost director patty jenkins went onto make wonder woman fulfilled contract one opted appearing one,False
yes comic book movie,False
reader comic favor chuckling thinking villain name hella,True
hela villain speech reminded lot galadriel dark queen speech delivery word,False
said puck sir,False
hope really argument,False
well hella fine,False
correct,False
casket ancient winter even orange,False
think silly moment guardian galaxy deeply mistaken sir,False
wow thanks spoiling bright smith,False
two tesseract,False
think trolling,False
nope,False
idk definitely thought korg played rhys darby started talking taika waititi great job character,True
thor say oh god melting stick scene,True
sure load picked notice thor raiden special attack mortal kombat two think probably become god thunder blasted hel,True
fell hour,False
queen blade aesthetic unlimited spine hydralisk,False
time fly,False
raiden spin bison psycho crusher street fighter holy fuck nerd,False
best scene movie happy birthday spoiler,True
seems marvel pattern midcredits scene sequel hook postcredits scene joke,False
could believe hammer pulled joke,False
right always thought span freaky battle cry,False
like amount ammo seemed like fired six seven clip worth running,False
two blue glowing square different size figured second real tesseract first fake something else someone said need rewatch thor one,False
destroy hela created greater stronger enemy surtur make sense,True
went knowing movie going great still astounded much loved everyone element hilarity wildness feel top bad way make two trump joke hela think moment yell faaake sad,True
first one hela called weak casket ancient winter,False
infinity gauntlet plot hole,False
promise really surprised gotten many downvotes mean sound pompous totally blown different movie expecting comic book nerd read thor comic ever remember bro also huge hulk fan felt dialogue thor little childish maybe one many anus joke taste,False
actually called valkyrie scrapper one hundred and forty-two thought weird like calling soldier soldier,False
destroyed mjollnir indestructible make sense sound space odin god died make,False
play odin running thor came back asgard actor thor talk monologue,False
legend sih,False
first talk new crush tessa tompson valkyrie,True
like walking emoji movie expecting serious drama movie serious drama,False
