comment,parent
gt could argue iron man thor namedrops indicate live fight lt,False
transcript attempt peter parker pick passport please peter parker topickupa papsport please peter parter topickupapapport please peer par topickupapaart please peerpakrheretopickupapappertplease,False
good,False
get possible someone defemd snd shout dceu v marvel box office number said batman movie role highly respected honor,False
keep mind actor want return infinity war would played actor,False
wax hoping would give demand gentleman debut trailer hallway disappointed sony,True
get one film series film would love batman though maybe pull reverse keaton spiderman villain first bruce wayne,False
peter met dr strange actual wizard lead initially believe mysterio wizard exist later notice mysterio fake wait magic work like,False
fuck,False
case since mysterio actually power like trailer,False
wrote right woke late night smoking super well written,False
preposterous next thing say lazyass prince adam great hero heman,False
anyone else theory spiderverse may dated doc oc spoiler,False
peter parker pick passport pepper,True
teaser trailer,False
trailer two opening shot going tony funeral shit lmao,False
trailer dumb three second intro trailer telling watch trailer already intentionally clicked link watch trailer,True
admit annoys probably knew movie coming know snap somehow reversed still seeing trailer alive well spiderman endgame even released seems lame spiderman even come july could waited endgame drop also worse nick fury trailer knew spiderman coming back fury guaranteed,False
gt incredibles first last villain something bad make look good example,False
since begin thought mysterio odd choice villain find dated mean hypnosis special effect really fortunately mcu helping look awesome,False
marvel writer reading thread oh shit boy someone leaked script,False
turn bad feeling good feeling,False
forget jon favreau jon favreau,False
mysterio see kid love cinnamon toast crunch,False
hey mysterion,True
insanely likely correct coincidence mysterio effect resemble magic peter seen,False
spiderman fury else,False
love mystyndrome,False
mean trailer sony channel one thing mention marketing make sense since actually still character might wrong point though think also make money solo spidey film,False
theory illusion though obvious trying evoke strange thing,False
dr goboom,False
careful pa go say something going regret rest life,False
legit question teaser trailer seems like pretty full trailer point anything tell entire story teaser,True
curious afraid use time vortex fan theory time vortex something literally pulled last minute postcredit scene postiw movie barely mentioned new character would like solution problem something significant something come know ten year movie going back time would rather see use time stone,False
mysterio look like jake gyllenhaal,False
soooo timeline last saw peter disappearing presnap post,True
wait aunt may figure,True
another one take place infinity war,True
retired,False
kraven kraven last hunt met spiderman mcu yet still could come jealous spider sure could better job story could play mostly even using vermin sadly sony feel kraven better used solo movie without spiderman like poor venom,False
anyone else issue wanting fulfill role spiderman want holiday sort fly face message civil war power anything something bad happens rough paraphrasing seems odd willing turn back fury drag back assuming lot trailer shenanigan going,True
peter parker pick passport please say five time fast,True
know sure taking place infinity war iron spider suit figured,False
known relationship spiderman though weird,False
never paid web fluid,False
mysterio get wear helmet trailer vid blocked job,True
biggest grin face right happy getting fucking rad spiderman series finally completely corny hamfisted,True
gone record take place minute end endgame,False
smartest student like dumb jock trope kid science bowl team good enough get schoolsponsored trip dc europe,False
could lazy could say snap changed worldview suddenly radicalized depth obviously,False
maybe got ahold mandarin ring,False
hodor,False
reminds hulk reveal ragnorak freaking theater would erupted kept wrap movie,False
hand mrtom holland,False
guess still know spideysense exists since peter realize nick fury room,False
internet love affair samuel jackass people love sam jackson,False
would avenger cast show spiderman film feel like stretching little bit could totally possibly correct,False
lot question one guess spoil fact whatever thanos world avenger infinity war going reversed endgame two expecting see jake gyllenhaal thought blockbuster superhero flick day turned batman role iirc three apparently villain elementals obscure group villain old 1970s horror comic idea marvel choose reach deep pull instead dozen major actual spiderman villain yet see big screen beyond see marvel little experimental spiderman flick homecoming high school drama smaller stake villain one foreign setting supernatural element must strategy counter audience fatigue traditional spiderman film formula,True
nightcrawler turned zodiac saw remember anything think saw two trying open minded let heard cast,False
well vid either illusion likely see sandman moten man hydroman,False
never paid drug,False
know sure taking place infinity war iron spider suit figured,False
spoiler,False
helmet confirmed,False
would surprised route want take casual moviegoer already confused enough think movie remain mainstream keep easier understand layman,False
mmm paul big fat cunt,False
feige confirmed,False
reef initially going older batman changed mid 20 one,False
would tear end watch,False
feel like going similar ant man wasp take place infinity war,False
love much love comic,False
well stand corrected apology,False
hype thankfully cloud judgement mj definitely find going help relationship parker flourish,False
end watch,False
waiting since first spiderman movie,False
spiderman stealth suit resembles certain hardboiled detective penchant egg cream confirmed creator meant look like noir suit sweet spoiler,True
wow understand,False
another confused person,False
mean hulk buster suit hulk present bodied thanos,False
think kind want,False
stand corrected thanks info realize reality,False
know guy missing point villain marvel move ensure part marvel franchise almost every single villain oneoff,False
man suction cup like iphone ninety thing could anything worked surface environment could carry load fucking badass got action man figure something suction cup could barely hold freshly cleaned window mom would rightfully freak formerly clean window,False
bingo thor spidey movie stay popular last iteration well antman dr strange endgame really care character watched movie understand origin contribute avenger endgame unless make stake high doubt movie successful predecessor gotg need pick shit without gunn little interest,False
norman osborndr doom set phase forty-five hate venom well maybe eventually marvel talk sony letting use symbiotes retcon venom want see sinister six v black suit spidey bad like,False
illusion man mysterio super human,False
water giant thought hydro man swear saw sandman trailer,False
nanites courtesy ray palmer,False
ok considered teaser trailer make teaser normal trailer,True
mean even english movie dubbed,False
probably busy trying die peter ran hid see,False
ever meet via hologram,False
pretty sure saw spiderman die last avenger movie,True
see one hundred sony camp character spiderman universe like claim different universe go title interacted comic,False
like eighty sure going case movie take place infinity war,False
maybe endgame spoiler maybe former avenger tower seen construction remodeling behind ny central station,False
yeah enough subtle foreshadowing come across contrived twist sake gotcha moment well executed,False
gt yes would create illusion make look like hero steal side rip spoiler,False
died,True
great anything worth watching,False
trailer spoil endgame,True
know sure movie come put trailer either way super pumped movie,False
confirmation,False
cool spider verse two,True
love spiderman enjoy homecoming one bit hope one good,True
knew treat introductory scene mile room sketching little comicbook reactionsound animation like knew going watching everybody raving animation art realize much care attentiontodetail make animated movie still comicbook going witness blown away quirkiness color effort essentially make whole thing printed source material come life toed line going overthetop cartoony delightfully realfeeling feel like universe peter porker came unrealistic hijinx also gave character scenario room people happened represented comic book character loved watching movie put eye animation art design aspect movie deserved enjoyed alongside story character afterthought oscar le prestigious category reward,False
happy finally getting origin movie,True
know,False
happymay relationship confirms tony make end game plus sign iron man anywhere spoiler,False
gt anticlimax well read beat comic lol honestly hero actually time travel fuckery antman capt marvel still around realm possibility plus iirc report filming scene resemble scene avenger one bet wibblywobblytimeywimey shit thanks antman capt marvel go back new york shove tesseract loki as,False
gt starting next one start minute avenger four wrap story amy pascal,False
wait spiderman dead dust lame excuse going use coming back one prequel,True
great always story good feel like give way much room show acting habilities focus plot,False
nailed,True
guess using see magic shitty cgi literally anything plot need,False
bet matt reef batman movie turn much better jon watt directed spiderman movie,False
suffering erectile dysfunction year gave boner,True
oh yeah spider man ps1 game stage fake ufo invasion got swing ufo statue liberty,False
people get defensive would say discussing role least consider character held upwhat mean people need people get random pissing match marvel dc company past supported iirc occasion marvel struggled dc even helped competition thing need chill bit playful rivalry cool people take seriously,False
arguably best villain completely personal reason limit far go set boundary stick family first guy best complete idiot able put two two together,False
hold clark kent wear glass superman would superman see,False
literally levitating flying around shooting magical beam elementals mysterio supposed superpower,False
give anything away endgame,True
red mist,False
hope try explain whether magic technology make difference audience need know x,False
feige also said avenger four titled endgame point knowing badly want keep next movie wrap take everything anyone say anything grain salt,False
clicked play button yet sony spoiled whole movie homecoming trailer afraid one might spoil endgame anyone already seen ut spoil much,True
seem remember room brief moment might misremembering haha,False
first thought weird much younger arrowyer hawkeye got korean war though,False
look cool wish spiderman movie avenger junior actually loved dynamic peter fury ultimate line look like going capture conflicting feeling distrust respect,True
kingpin never sinister six also scorpion molten man hydroman typically associated either number incarnation group classic line doc ock electro vulture sandman kraven mysterio,False
big spiderman fan loved homecoming look okay still hate whole new mj thing,True
die end civil war still chance,False
mother forking shirt ball ya basic snap,False
like iron man thor people definitely know avenger,False
iteration gotg2 going wiped dceu slow moving retcon,False
dead,True
like said impossible timebased fuckery make much sense scarlet witch poofing everyone back lol overpowered one stone subverted result,False
spiderman nancy hard watch,True
want put money,False
allowed say legally,False
peter parker picked piece pickled passport,False
incredibles two decent hold candle first one tbh good,False
yes black suit one given shield peter europe original ny,False
gt really sure happymay would indicate anything tony lt,False
gt mom would rightfully freak formerly clean window mostly way get suction cup work put little spit little spit circle window sorry mom told would clean minute,False
work high schoolers perception dealing bully fuck feel bad kid,False
wonder get stealth suit le recognised,False
except since pretty easy move country would refer collective weird,False
even close really,False
adding another canon sinister six,False
yeah saw last week seeing several top ten two thousand and eighteen list really loved seems lot people opinion serious enough western conversely funny enough comedy loved perfectly balanced two work comedy western paced really well lingering long enough important bit quickly skipping stuff needed bad completely flopped need movie like instead venom two tbf havet seen venom sure enjoyable enough probably good example mediocre movie make money side note really looking forward velvet buzzsaw starring gyllenhaal directed dan gilroy nightcrawler released netflix february,False
got nice boob villain want one thing taking spiderman disgusting,False
cool yeah cool,False
ben kingsley bad,False
want think,False
vulture stuff pretty clearly jerry rigged adapted alien tech like human tech wrapped around existing alien otherwise stolen damage control technology got feeling technician guy know stuff work know make thing,False
ugh,True
expecting today question answer right,True
p sorry p,False
nail head,False
watch international trailer mod pinned top comment brings suit,False
mistaken three year event civil war infinity war could happen infinity war like ant man amp wasp would explain suit change though know,False
red skull typically one intimidating enemy avenger comic know talking,False
gt obviously entitled opinion think ultimate spiderman cast one best run brand period killed peter good get really hoped would take better direction six hundred and sixteen especially ultimate six others finally see badass spiderman almost like superior storyline actually becomes successful scientistentrepreneur guy even like mile made sense become successor pete gt mcu spidey movie get much right core character going get tied knot fact mj bombshell supermodel redhead way peter league look going see movie opening weekend fucking love marvel movie however loyal comic book fan love nitpick shit forever,False
rsquaredcircle leaking,False
actually ben famin parker got wrong pronunciation,False
look like lot fun teaser become trailer stopped nick fury reveal show seven hundred and ten second action cut web slinging title would tease,True
correct,False
ned leeds probably spider man perfect cover,False
normally would bite franchise unpredictable,False
sandman molten man hydro man never part elementals though wikipedia say elementals show ffh independent confirmation useredited source,False
need blanket le blanket,False
right also like people saying barry allen flash,False
fuck man manipulated,False
know trying say fork fork right,False
love,True
look awesome mysterio villain,True
jake gyllenhall favourite actor said still see playing bad guy comic book movie fit role still going crush tho know,True
remindme eight hour,True
like wrong kid died,False
science standard pretty high marvel universe professional would need able raise dead cure disease also know everything genetic engineering time travel reason,False
keep changing motherfucker,True
ready sex,False
aparently peter feeling better,True
call quarter pounder france,False
gt shocker pro wrestling,False
look bad first one,True
pretty much made want see,False
mj know name,False
bad lol awful knowing anything matter like geography math proper eating etiquette nice event,False
sandman,True
homecoming great whatever still going see spidey number one marvel character,False
used think spot goofy character storyline daredevil truly horrifying thing power,False
spiderman,True
got boyfriend bet kiss ya,False
think crime stealing cool guy think dude might bad guy,False
good point felt like tony showed interest previous movie forget pepper still tony trailer,False
vulture scorpion mysterio kicking around mcu starting believe going make s6 postthanos threat avenger five,True
feel bad people empowered defend instead spending life getting shit cool,False
reason thought good idea drop infinity war two,True
idk maybe maybe could still visual efx guy one us magic instead fancy tech,False
mysterio syndrome incredibles confirmed,True
probably favorite part,False
school go way many class trip,False
literal translation american would cock sucker hard time taking knob gobbler seriously would called cock sucker,False
like leftover,False
mysterio natural evolution actor played bubble boy,False
clearly whoever trailer dead,False
mandarin v2,False
really like trailer spoiled entire plot two minute hyped nonetheless,True
end first one,False
many procent people watching movie think even heard term sinister six,False
ah confirmed,False
possibly hydro,False
never turned batman auditioned begin nolan turned reef want much younger batman movie,False
teaser feel pretty long involved teaser used short glimpse get flavor character movie keep guessing,True
whole film excuse jon favreau flirt pretty lady,True
overjoyed mostly feige gave bob ultimatum ike would retire,False
omg jake marvel wagon point thinking collecting actor jake amazing actor btw,True
many spiderman movie going make,True
anyone else hear rock guy voice,False
might change right bad guy elementals,False
seems fine kind mad know everyone spiderman series survived infinity war look like tony stark probably dead fury taking place,True
point anyway,False
favorite part ultimate universe many peter class mate knew spiderman mention many people knew like every villain movie always taken ultimate approach would surprised class figure except flash never able grasp,False
yeah movie look great,False
need bring back flash first spider man movie dude probably like fifty chill,False
sony hide doc oc,False
need hear boy big screen,False
take place event infinity war,True
unless soulstone,False
mysterio insane illusion technology like comic,False
see feeling better,True
mean fact spiderman well alive,False
enough super hero movie yet,True
made spiderverse priming everyone duplicate spider character,False
definitely thinking maunaloa maunakea dense naples mean saw destruction last year imagine super populated like europe,False
fan saying pretending good guy actually responsible huge monster thingies la syndrome incredibles apparently character done omics,False
lmao,False
thought hollywood think younger demographic like wokeness,False
name youpickleindabutt never heard stirring feces euphemism putting pickle someone butt believe,False
else saw csgo wingman map rialto one,True
batman matt reef movie gt gt gt gt gt gt gt b list spiderman man villain jon watt movie,False
starting next one start minute avenger four wrap story next one far home,False
could see would make sense scorpion,False
cool though real fan spider man know mysterio marvel movie fan never read comic treat store,False
webbing dissolve,False
like empathy teenager emotional problem,False
feel dumb gasping first elemental creature showed like wtf sandman,True
good nightstalker villain portray take trailer mysterio using hologram fight hydroman sandman etc really,False
deathstroke,False
gt batman parent may well killed family heading home watching space jam pick movie go would,False
beat dead horse fact marissa tomei alltime smokeshow get eye seems purpose mcu much offer,True
assumed taking place last avenger movie,False
appearance iron man tony stark although happy seemed peter handler homecoming maybe fury showing portends bad ending tony,False
jake gyllenhaal bet wearing helmet couple scene,False
rip every sink wall,False
well currently playing deathstroke dceu,False
dr boom,False
well also fury alive,False
mandarin goofyass one sadistic villain marvel universe mandarin story life first annual matt fraction iron man run amazing basically nightmare situation protagonist story mandarin continues great villain throughout rest run doom magneto hell even red skull relatively stable villain mandarin villain slowly start realize completely unhinged becomes fucking terrifying,False
sup dickwad flash thompson tony revolori terrific jackass amazing trailer happy hogan aunt bae scene hella good hyped,True
oh one hundred lmao,False
mean somebody figuring sure,False
gt lame excuse going use coming back one understand comic book work right sorta fundamental basis entire universe,False
actually spiderman two game ps2,False
pro tip never watch trailer two,False
read voice,False
someone care much know character named eugene flash nickname,False
except incredible nowhere near first kind plot,False
one favorite thing homecoming toomes figured especially didng even investigate supervillian coincidence civilian life put puzzle piece front put two two together,False
want wilson fisk sinister six,False
john favreau able swing shit chef expect,False
saw filming prague last year get,True
totally know already,False
character entirely based around actual power think keeping trailer people familiar character look like mysterio copying style dr strange,False
imagining spiderman foe called knobgoblin,False
method madness presumably seeing culmination happens postendgame maybe rewatch put piece together coherent place,False
work tony stark strike one many people book,False
going guess take place alternate timeline get away something,False
guy said would drink piss dropped today,True
second thought hawaii think anywhere densely populated naples relation water make sense ton people base volcano comparison looking,False
one else heard sound like tony stark voice could imagining thing sounded like rdj,True
need trailer tell going live,False
chameleon techically cast movie fan casting brad pitt electro would fun fuck,False
omg confused mysterio good guy,True
mcu delivers wondered would make vulture cool sony never another marvel movie without marvel studio bad,False
power arises need,False
okay parker sense nick fury room,True
kind alien thing could blamed innocent fellow man,False
already,False
know amazing joker,False
eh think big part spidey charm downonhisluck relatable globetrotting billionaire like spiderman get acknowledgement deserves fact moment rare make special,False
would anyone describe spoilery want watch,True
f,False
hate actually overall like toby sperformance,False
could see elementals like rhino asm quick setpiece main attraction besides notice mysterio,False
happy one immediately thought dewey cox,False
could thought movement magicy look coincidental maybe tech mimic magic,False
case see reply answer yes,False
apropos nothing read hulk ward really confused,False
came aggressively meant sorry,False
way around syndrome basically mysterio host villain,False
protects neighborhood dope suit really respect see peter sup dickwad got laughing,True
also first time thought cgi animated movie measured surpassed 2d animation crazy well blended multiple style character great character design one favorite detail villain attack would brief flash music would strike loudly background behind would turn one color block bit hard describe film unbelievably detailed cool,False
forgot snobby rmovies reason never post,False
think missing something,False
agree announced marvel phase four week endgame come keep everyone wondering,False
fishbowl helmet,False
show trailer twist revealed doc ock mile universe,False
want part shit,True
cheese particular villain defining trait least comic want see go fullon meteor man movie,False
excited see mind would never blown ended bad guy along,False
would bring much needed depth film,False
marvel confirmed take place endgame,False
marvel trailer recipe use old pop song two main character talk timeawkward silence awkward marvel humor change light darker mood appearance another character change music serious tone end catchphrase,False
think single casting choice outside iron fist got dude martial art experience charisma marvel failed mcu,False
know right first thing thought,False
leave ben parker alone business,False
gemma arterton plus,False
comic nerd know cannon seen depiction popeye shaggy taking know,False
fury get drop spidey spidey sens told,True
good dude moment coulda left big guy end,False
problem packaging far home first met tom holland fucking germany saw go fucking outer space already taking nyc gimmick anymore stop trying market way,False
would spiderverse matter people still wanted mcu spiderman raimi film mcu venom hardy one mcu xmen fox film mile different,False
also plainly say official trailer start,False
dart hit right side nick sitting left,True
advertising character,False
find source would love read green goblinnorman always one spidey villian excited see feige planned,False
fair sandman problem,False
would say character based ingenuity cunning course hatred spiderman get may little different see huge problem knowing magic may us technology give appearance magic,False
obligatory glass whole personality video,False
think hydroman,False
know considered missing endgame timeskip,False
recently reminiscing nascent day mcu remember marvel using description fit thor grounded take thing eventually got doctor strange like yeah fuck got magic whatever,False
yea unfortunately nowadays studio focus getting theater actual experience watching movie twist big moment unless skip trailer barricade forum also suck,False
sound expensive,False
would undercover agent going mall,False
