comment,parent
really people tend forget spiderman homecoming four villain vulture tinkerer two shocker really organic way,False
school rn watch take place infinity war,True
wow great insult,False
director say mj mary jane certainly strong mary jane impression peter already two strong love interest invent third,True
also notice iron man show phase one avenger,False
probably new york,False
yeah probably keep making movie,False
idk everyone want version kingpin would last second spider man hero mcu,False
nobody talking kickass wingsuit,True
yeah figured,False
yeah obviously,False
considering mysterio back story special effect artist seems almost obvious,False
many goddamn sequel make,True
graveyard smash,False
nope using specialeffects,False
love people bitch complain original movie also bitch complain movie exactly like source material one,False
say unfair question said spiderman movie make sense movie spiderman rest crew,False
ok buddy,False
nick fury tell he alone mean avenger come back snap he alone europe,True
insulting,False
yep smaller scale stake mean higher probability villain winning,False
assuming outcome endgame one big reversal,False
introduced dumb nanosuits anything possible,False
enough,False
guy address,False
ridiculous,False
theory fraud causing destruction save day,False
mysterio look bad friend try hard funny one note mj wierd aunt may shit writing like really dickwad wtf almost managed top penis parker appeal demographic movie,True
wait kilgrave spiderverse,False
brass section glissando,False
everyone thread seem forget tony engaged,False
watch enter spiderverse wrong spiderman died day,False
big true,False
surprised marvel gave u trailer early another avenger endgame one,True
thatsthejokejpg,False
bet movie take place snap infinity war first see peter riding bus across bridge classmate bet returning home event movie infinity war pick,False
wanting pay massive salary,False
thank tom holland cool,True
know snap get reversed since fury think really cheapens beautiful end infinity war immediately start making plan known future movie dead character really reason see endgame,True
spiderman one marvel hero secret identity ultimate comic running gag people keep finding identity,False
mandarin,False
many,False
thing always bugged incredibles even though love film piece buddy pine superpower supersmart comparison stephen hawking crazy smart buddysmart would running around iron manstyle suit instead sitting motorized wheelchair,False
budget one note mj nothing compared real mj sam raimi,False
mean trailer,False
one forcing go watch movie,False
really doubt would show reacting tony death movie even come marvel stupid,False
username check,False
mysterio one make wolverine kill x men,False
oh ok bad lol,False
ironman dy,True
bet movie take place snap infinity war first see peter riding bus across bridge classmate bet returning home event movie infinity war pick,False
hydroman,False
undusted hmmm,True
gt like game throne spoiled finale nothing coming got finale comparison would make sense zero movie coming endgame obviously know case,False
glovers acting homecoming abysmal,False
bet movie take place snap infinity war first see peter riding bus across bridge classmate bet returning home event movie infinity war pick,False
bet movie take place snap infinity war first see peter riding bus across bridge classmate bet returning home event movie infinity war pick,False
bet movie take place snap infinity war first see peter riding bus across bridge classmate bet returning home event movie infinity war pick,False
believe,False
bet movie take place snap infinity war first see peter riding bus across bridge classmate bet returning home event movie infinity war pick,False
dead probably,False
big fuckin peter,False
like iron man thor put together,False
explains iron man thor rolled one mixed dr strange particle effect,False
exactly love able take five crappy xmen movie small fan service piece smiled ear ear saw wolverine weapon x apocalypse get one good one,False
yeah working goblin vulture tech,False
know responsible concern completely made plot point rather based comic,False
really think spiderman death permanent,False
watch,False
spiderman appeared nyc high school field trip narrow list people could spiderman single class list,True
definetely going happen course,False
bet movie take place snap infinity war first see peter riding bus across bridge classmate bet returning home event movie infinity war pick,False
done fucked,False
freak know,False
bet movie take place snap infinity war first see peter riding bus across bridge classmate bet returning home event movie infinity war pick,False
bet movie take place snap infinity war first see peter riding bus across bridge classmate bet returning home event movie infinity war pick,False
true,False
even lazier given tech break oscorp get doused chemical slowly drive violent instead thief time accidentally bringing back spider bite mile get paranoid new spiderman responsible life staying go bad go another villain realises spiderman mile sacrifice save drum villain,False
groovy,False
bet movie take place snap infinity war first see peter riding bus across bridge classmate bet returning home event movie infinity war pick,False
great movie love everything villeneuve done,False
probably meant kingpin,False
introducing mile prowler subplot sinister six film could work worked peter civil war,False
jake villanhall comin u summer two thousand and nineteen,False
saying bruce would take randy fight think saying,False
spiderman,False
joy hearing orchestra version every time,False
yep much like favreau character become obnoxiously annoying,False
one playing theater still remain show bad,False
looking forward film honestly spiderverse worried going underwhelmed,True
kevin feige said,False
like dead along,False
maybe tell aware case would put money taking place anyways think would clear ambiguous would nothing spoil regard point potential spoiler op question,False
mean real consequence mcu,False
honestly one thing always bothered thanos never died version scenario despite fifty chance died end infinity war sat alone smiling turned dust would equally good different ending character going really mesh best world,False
set like enders game,True
youtubers get money people sign bell,False
theory really hold simply spidermans feel good want,False
think better suited introduction spiderman anyway peter le experienced hero even someone like kraven would want choose experienced mature hero first hunt spiderman would suffice would cool see go hero later,False
except name none character trait feature mary jane watson bad thing anyone let character,False
yeah deadpool two fight scene xforce,False
flash thompson even little otherwise dope actor,False
shuri disappear watched twice thought offscreen whole time,False
like good prince persia adaptation fine movie best video game movie ever saw,False
oooo nick fury went europe capn murica winter soldier graveyard scene end,True
look lot better latino washed homecoming,True
hopefully get revealed early film complexity twist overall would shame main plot movie,False
thing could think said,False
people call punk rock,False
know really thought sure heard brought either interesting proposition,False
tony cry cry cry,True
asking address death without giving away anything endgame possible,False
stop arguing funny hell read,False
damnit feige liked intrigue guessing like dc zero idea movie even made let alone set,False
narwhal,False
prince jinghim,True
going sad watching marvel movie imagine like netflix show face show poster newspaper background something,False
cousin cracked part peter parker spidey tell mile morale spidey kid got great news need drop monitor stealing doc oct computer maybe comic detail thought funny detail true monitor display device need trying steal criminal data hard drive computer,False
marvel make villain smarter threatening movie shocker joke comic movie dumb almost killed spiderman spiderman would match smart hydroman,False
keep arguing hilarious read amp x200b call retard something,False
keep thinking everyone got putting piece together spiderman appears outside new york specific group student specific high school take field trip amp x200b probably nick fury found,False
used different take part beginning ned dart mj peter theater noticeably,False
yeah think probably partly clark kent thing glass also kidding dweeb last person would guess super hero,False
frothing vagina jesus h need read,False
insert gif word joke flying word,False
know aunt may madame web,False
name,False
think want,False
biggest crush tom holland omg cute,True
character mj unneeded cringeworthy,False
one give fuck,True
sealed mint hydroman asm cartoon show still shelf chameleon one favorite believe mysterio hydroman either,False
yeah mix syndrome gilderoy lockhart fraud,False
another spider man movie,True
wiki description claim postendgame short search based show confirmed timeline except old source old two thousand and seventeen interview amy pascalkevin feige apparently confirmed movie set avenger four endgame seems like current marketing strategy currently using say silent personally find doubtful preinfinity war,False
consequence ramification mcu endgame time travel bullshit stone coming back point watching going reason engame shit trailer show absolutely nothing,False
interesting see cgi point expect improved time released hope,True
actually turned gag part fighting style smash still shard hand brandished like someone smash bottle counter bar fight,False
aunt bae,False
endgame trailer listed among missingpresumed dead nothing happened screen afaik,False
defiantly seems setting sinister six considering already three mcu,False
pinned comment video say music far home trailer,False
hey whatever happened scorpion necktattoo dude end homecoming love mysterio scorpion show randomly dream,True
dynamic mysterio could also provide pretty great core film climax tony stark absent peter find new mentorhero revealed villain let bit retread spiderman two ps4 game doctor octopus still could turn quite compelling,False
also possible look way purpose illusion,False
fantastic four guess,False
similarity spiderverse would received well,False
infinity stone universe,True
looked good till jake gyllenhaal marvel running actor,True
shit meant fisk always get name mixed reason,False
yea u version look like sped convo peter mj theater make seem awkward int version normal speed convo le awkward,False
next avenger movie done puppet dark crystal would awesome practical effect,False
done geeked real good son,False
cgi look terrible,True
supposed get back spiderman four day,False
maybe speculate two thousand and twelve though gt sony still owns spiderman going spiderverse spiderman movie morale andrew garfield unlikely want two franchise morale spiderman time mcu spiderman soontobe five film almost many garfield maguire spiderverse version combined tell sony receives revenue standalone mcu spidey film probably one hundred and seventy-six billion ffh spiderverse wonderful made 302m believehope give mile peter parker treatment obviously say sure,False
going say mysterio superhero super power hope something funny like atleast spiderman immediately suspicious guy lot audience member fooled slightest,False
shoulda spent time playing catch ya instead training body mind kill ya,False
another trailer spiderman far home,True
people predictable,False
od,False
end homecoming sort write vulture villain role,False
maybe understand happening could thought dying,False
fair saying batman bruce wayne like saying kim kardashian wonder woman absolutely ridiculous billionaire playboy would selfless,False
idea everyone loved scene much depth behind lasted like two second say anything particularly unique obviously going stay dead barely movie,False
mean everyone dusted alive,False
feel like obvious going something else subvert expectation,False
going stan lee cameo,True
tom came,True
surprise sure,False
gt spiderman respect hyphen,False
look even shittier god awful homecoming embarrassingly bad,False
feel like seen trailer lt insert number mcu movie gt time without even watching,True
adding curse mysterio dialogue curious,False
would bp bore death,False
let u see work magic horrible netflix horror movie come,False
venom done pretty successfully though financially term character perfect tragedy movie spiderman,False
uhhhh disturbingly big bulge must one illusion right right,False
bahaha many fucking super hero movie,True
oh man got mysterio wait shocker remembers shocker minor henchman villain last movie aw man,True
hype real devil advocate moment kind undermine significance endgame mean clearly knew last year character died coming back le still make entire infinity war saga feel le significant important,True
probably twist comic four baddie called saying make sure people getting hope villain,False
geek card issued revoked exact time forgot hyphen spiderman,False
suit though far home red black suit infinity war see using red blue suit tony gave,False
hope actually good swinging scene one,True
never end,False
lol aggressive worry,False
fury danger,False
copying pasting everyone confirmed fege far home take place endgame,False
would felt anything actually everyone else dying around,False
wait trailer one giant spoiler thought avenger infinity war spiderman know trailer kind prof thanos big deal,True
yeah mine,False
nice name holden,False
feeling mysterio playing syndrome incredibles movie,True
actually reading wiki wanted avoid trope used previous movie gave new character play around,False
fege,False
exact actor,False
spiderman easily best hand toby course,True
think think fury would bring someone unproven,False
big fucking penis,False
reddits,False
pretty monotone actor,False
assumed mysterio creating illusionscreatures make look like hero see soon enough,False
twenty actor portraying high schoolers,True
thing already one right going germany,False
fishbowl mysterio plus jake gyllenhaal movie going sickkkk,True
know want hangover get hangover,False
glad least asian sidekick movie since spiderman pretty much white kid look forward movie asian male lead character hollywood,True
yuck look awful,True
would marvel stark tower one landmark mcu oscorp mostly tied spiderman sony property,False
teaser,True
spider pig simpson,False
formulaic pretty safely predict rest seen,False
school trip friend taking holiday europe,False
look pretty therefore value fuck,True
prequel spiderman nick fury died infinity war aware comic based way undo,True
sound expensive,False
oh thought year need go look passport lol,False
stealing tight,False
little bit clayface thrown well,False
kevin feige explains spiderman far home prequel infinity war amp avenger four,False
give hangover,False
fight hydro man many elementals know,True
comic book character stay dead unless see head get cut know rule marvel universe anyone come back injury without parallel universesalternate timeline mumbojumbo long beheaded name ben,False
god comic book movie fucking joke anyone like shit die immediately,True
hydroman right would illusion soak peter send tumbling back,True
nightcrawler xmen dummy,False
music mr gabriel tambourine,True
significant denial friend,False
made new account say,False
let people like like,False
understand point homecoming went washington also others movie even tho spidey movie outside new york,False
kevin feige explains spiderman far home prequel infinity war amp avenger four,False
real possibility also think case,False
oh look next iteration rest cinematic universe point think people get excited movie simple moron,True
believe filmed bunch passed,False
teaser,False
know said kidding right,False
three reference one comment nice,False
doc ock got reed rest fantastic four reed hmm,False
awesome thank thought sarcasm heavy enough try harder next time,True
wonder many time tom holland flubbed peter parker pick passport please,True
yes need aspap,False
another alternative universe thanos snap,True
would think spiderman could sense room guess nick really bad as,False
aka birdman,False
sorry actually feige president marvel studio,False
talk avenger initiative twenty,True
anybody else see boat forty-nine say asm212 quick google search could relate amazing spiderman two hundred and twelve hydro man far home amp x200b,True
black widow hawkeye hang avenger,False
ok,True
could would dumb mention,False
yeah know kevin feige,False
mean daredevil movie michael clarke duncan,False
yeah triggered boycotting movie release reee know joke seems poor taste would nice go back time compliment underlying meaning make seem like harrassment,False
think one stretch,False
zing nice black panther joke man original creative dae think black panther overrated eleven,False
first look dope second label want teaser trailer regular trailer,True
also every single classmate peter survived seems highly unlikely,False
something strange visual effect power,False
swoopy thing hair,False
would surprised ended illusion made mysterio,False
peter parker pick passport say three time fast challenge,True
peter parker pick passport say three time fast challenge,True
make new account ask copying pasting,False
name check,False
feature boi go,False
maybe judge,False
love mcu trailer much speculation seeing necessarily final product russos know,False
bawled like fuckin baby like jesus twenty-eight game made cry one thousand and ten glorious bastard,False
good point one seemed really traumatized fact half died came back ago wondering mean time travel shenanigan,False
prediction think tony dead look aunt may talking happy think probably right,True
let u talk want start,False
kevin feige explains spiderman far home prequel infinity war amp avenger four,False
cgi look pretty bad tbh sure improved watch,True
bloody yank coming super power buggering london bridge,True
talking,False
maybe think pushing die snap guess technically possible might make death series meaningless time stone away thinking stone appear destroyed snap undone process,False
want tom hardy instead,False
hell let cw sub,False
gt thor fucking p bifrost demand axe beat six infinity stone fucking p,False
exactly,True
bit lacking whole access advanced resource department though knowing equipment actually make two different thing tony expensive hightech garage rather important part ability make mark ii iii iron man suit,False
never heard mean anything dickhead idiot amp x200b ignore everything one link google find slag dictionary definetion general insult ireland dickwad semen gone hard,False
anyone know timeline movie,True
endgame,True
love marvel letting nut hang putting fish bowl mysterio imagine lot coke involved,True
yes exactly picture entire shield scenario spiderman future,False
anyone recommendation comic might read get general idea expect,True
wait thought spider man turned dust end last avenger movie,True
seem like fun person around kind feel sorry people situation interact,False
pointed first,False
odd wikipedia calling elementals cover water golem hydron rock golem magnum guess make much difference guess established posse seems smoother,False
exactly poor taste,False
miss movie vanish space,True
really dislike new mj,True
seem like pleasant person around feel sorry people situation absolutely interact,False
first trailer look awesome pumped second noticed mysterio apparently trying save day warning spiderman unsafe medium see hero theory act hydro man villain staging event public see mysterio hero guess moral story criticise mysterio showman tendency tiein thing defines spidey hero put costume attention adulation expecting kind reward great power come great responsibility,True
let people enjoy want enjoy,False
last ten second sold already sold,True
real hype right,False
trailer need long,True
peter class take many trip would lot le trouble,False
fuck clark kent,False
think happen destroying stone undoes done far reaching consequence across entire timeline mcu something think also already established time stone reverse death vision really anyone fair game especially good guy get whole gauntlet,False
bullet felled parker,False
knobgobbler homophobic cocksucker,False
end film see victorious peter parker return new york traveling bus classmate exhausted peter rest suddenly spider sense tingle peter whip head see donut shaped space ship lower city,True
rip,False
gt want ego spilling keyboard,False
cool died got really show u anything,False
spider sense told nick room,True
want waste time valuable got make account point right,False
mr stark feeling good,True
anyone notice pepper potts name check rather tony,True
amazing job mysterio look amazing,True
sound right,False
peter spideysense start going haywire nick duty shot ned,True
dude aquaman grossed one bil think use intelligence plotting comic book film dumber successful apparently,False
blind find part,False
thought exactly definitely minority,False
velvet buzzsaw film going lit,False
parker take coat,False
wait heel turn,False
someone eli5 spidarman going movie last saw feeling good prequel,True
tbf think jarhead generally good movie overall,False
mean assuming case ever since first iw trailer came think main reason split two movie could emotional impact death without reversing immediately dr strange action make clear time fuckery happen,False
first homecoming far home next home alone,True
exactly classic mcu stuff literal apocalyptic event nobody seems care fact hilarious dedicated making everything inconsequential,False
look like one hundred and one hotel de matteis probably reference j dematteis writer spiderman comic,True
time movie large enough believable enough,False
even set pic samuel jackson holland lol,False
every spiderman movie different actor,True
wow thanks info know,False
believe everything time dr strange control time stone see single way defeat thanos give stone perceived stonepiece stone ant man quantum zone snap survives contrary new character time warpzone quantum zone supposed avoid endgame teaser animates coming together similar piece people turned metaphor piecing back together iron man alone ship ship could nebula help get home,False
coming back endgame along everyone else got snapped,False
also look like one hundred and one hotel de matteis probably reference j dematteis writer spiderman comic,False
nah take place minute a4,False
mysterio actually power simply special affect wizard water guy tangible super advanced technology latter case,True
nah european spiderman totally different dude,False
feel like stepped since black panther strong soundtrack likewise spiderman spiderverse killer memorable soundtrack important rounding movie glad finally picking,False
kind hoping would make spinoff dark knight series acknowledged gyllenhal character name robin maybe like red hood flick maybe nightwing,False
also show nick furry survives,False
think considered early punk general bucko,False
spiderman dead though,True
f4nt4stic four confirmed,False
totally agreed,False
well really seen spidey sens new film really remember hair standing bus infinity war guessing still developing full power since younger spidey,False
lame,False
yeah saw like backhanded compliment still trying get point across,False
know true bruce chainsaw hand boomstick,False
would great peter parker raimi movie,False
love trailer start corny family vacation movie vibe take one hundred and eighty get real fuck hype captain marvel,True
zing nice response man definitely talking comment seriously dae think marvel untouchable godstudio simple criticism eleven,False
think get mj personality perfect wit always teasing parker may traditional redhead comic snark teasing spot,False
felt way thinking probably unbelievable anyone know closely fuckin spiderman like nerdy friend high school even though coincidence line might even think way kid know high school famous damn superhero,False
brit watching loser version duck,False
gt dae think marvel untouchable godstudio simple criticism eleven yes,False
ok well one obvious clue girl constantly getting kidnapped super villain bf first name basis villain,False
bullshit think made new suit guaranteed tony taking backseat,False
better looking captain marvel,True
nevermind brutality people get head slammed car door burst like watermelon mcu,False
run,False
reed richards,False
believe never got actual wolverine costume,False
fuck fantastic four get evicted filthy rich sure context behind find funny,False
aquaman damn good time despite dialogue character problem perfect movie bit fun seemed click people glad got see black manta ocean master movie even though probably could trimmed black manta,False
comic vulture suit look awful comic,False
need bring joseph gordon levitt board doc ock green goblin care,False
nooooooooooo,False
get addicted something,False
boy mysterio finally time shine,True
well easy answer plot armor also scarjo hot,False
proper xmen movie let u face fox stuff plain xmen,False
point trying make movie take place snap movie could take place snap well like ant man wasp,False
taking place iweg,True
id like see anyways ned good character portrayed good actor highlight first film,False
casey affleck,False
okay many field trip peter per year exactly field trip eventful like,True
shield probably made,False
happened spidey sense peter know fury room gun shoot ned fury skrull maybe peter sense danger,True
like red head comic peter either thing different ok way,False
mean 24x7 stalker know pretty white girl happens stalking bother investigating social group,False
