comment,parent
calling somebody dickwad really bullying definitely something buddy would call,False
damn shame one favorite spiderman villain,False
except know nick fury peter never interact,False
actually like ps4 spiderman theme,False
last saw peter parker dusted titan yet see captain marvel appearance resolve avenger endgame movie feel right thing considered either deceptive design super premature hard tell right,True
mcu character die one movie get trailer next movie explained still alive one even question,True
simmons one best bit raimi spider man trilogy bruce campbell,False
he playing rey mysterio sr famous rey mysterio jr,False
mean also globetrotting confined one neighborhood think quote insinuating,False
fuck afraid flash issue bullying may verbal harassment still done someone fight dude arguably skinnier peter fine violent still skinny kid math team lame,False
even fucking know saw trailer dude nut,False
pretty sure joke,False
loved sitting lair cup tea waiting mile took long,False
canon,False
marvel trailer formula start joke sequence introduce plot lot voice random action scene reveal sneak peak villain right end credit post credit comedic scene really stuff science,True
sound awesome,False
yep,False
five minute endgame seems specific,False
pretty neat,False
syndrome literally making fun ofpaying homage trope villain including mysterio,False
oh boy spoiler haha,True
r2meirl4meirl,False
said prince persia movie close enough lol,False
steady amp x200b,False
make blue crystal,False
great another spiderman film comic book movie end,True
need actor experience playing airborne animalthemed superheroes andor villain better choice michael fucking keaton,False
would watch remake assassin creed play desmond instead entering machine badass instead every player run around room reading email lucy computer staring wall trying jump onto ledge seem like good place hide puzzle,False
mysterio hype one time favorite finally movie,True
man zendaya character say cringe teen angst bullshit unbearable,True
got tell kid okay call friend dickwad school,False
especially since superman clearly come back life end bvs,False
sometimes randomly think scene peter vulture first meet costume get fullbody shudder got watching movie soooo suspenseful,False
would say ending civil war ragnarok infinity war anything predictable,False
mysteeeerion,False
think saying batman role would one film chose spiderman,False
might changed movie tbf,False
one know obvious retrospect probably better avoid possible spoiler marvel usually good giving much away,False
oh sure probably going make spidey look like bad guy making look like hero,False
hey spiderman korg rock monster outer space know mate thor,False
thought going take place infinity war,False
leg injury three hundred and ten one thousand and ten rice,False
take digitally removed year passport thirty-seven could possibly take place spiderman homecoming infinity war amp x200b,True
probably,False
arc warden,True
thinking well likely guy actually major role movie legit representation comic book counterpart probably stunt created mysterio,False
agree rock sea monster mysterio illusion fight guy ultimate run could become whatever matter touched,True
spoiler alert jeeeeeez,False
pic jake wearing fishbowl,True
well might realize spiderman even since bring suit maybe wear black suit stay public eye whole time,False
never explicitly say take place,False
yea picturing ending peter opening scene bus infinity war,False
spiderman one two especially two absolutely brilliant film two best super hero movie going three pretty shit,False
gt time jump theory besides set photo true probably undone lt,False
counterpoint bryan cranston would second choice,False
yea pretty much think time predictable,False
look good hope spend much time boring relationship stuff mj,True
velvet buzzsaw yeah,False
look like magic strange us floating symbol shape appearing hand,False
never explicitly say take place could easily take place infinity war,False
eh know buff shave head age bit lt dan leg think would okay,False
yea elemental people really look like sandman hydroman molten man yea mysterio doin callin,True
think le turning good owes parker much dude seems like man understands debt,False
kind sick fact nobody know marisa tomei anymore tbh,False
going meme,False
know mystery die endgame seems like pretty big spoiler,False
think tony going die spidey got get new suit somehow,False
basically noir suit,False
spoiler nowadays bitch everyone figure parker fury survived snap good know course production chatter new movie anyway,False
offense fan boyiish way putting comic book movie role high honored tradition look kilmer clooney affleck role make actor actor make role ledger performance joker iconic ledger brough role stark rdj one sane rdj performance personality given stark,False
illusion spiderman,True
yeah moma museum modern art got listen next time,False
universe actual magic power primarily special effect artist turned villainous illusionist,False
money nick fury actually chameleon,False
sony plan wait,False
could good point,False
bet added f died pay respect,False
may dumb question watched lot marvel movie could movie event happened avenger infinity war,False
dumb peter classmate like better suspect one friend fucking spiderman since keep showing wherever like live new york big place washington london whatever uh starting get bit fishy someone say fishy guy wearing fishbowl,True
albaqoykey,False
always samuel l jackson anything spidey really need another mentor fight crime initiative really hope fury point right direction babysit,True
green shit look really dr strangey maybe marvel decided something look like holographic frisbee magic,False
assumed meant brokeback mountain zing,False
honest seen every movie google zemo reading comment kind forgettable,False
unsnapping neck well one hundred time travelling alter past result loki survival,False
people thinking make le powerful old man logan comic line xmen dead mysterio made logan think everyone mansion villain killed everyone link panel,False
look like spidey thing sistas,True
love comment without real spoiler hidden hahaha,False
surprised one mentioned spiderman noir definitely trailer,True
apparently version zlist comic villians elementals,False
love peter totally channel tony happened,False
came say mysterio creating fake monster showing save day,False
get logic paying attention detail,False
yeah even going far advertise budy cop movie spidey mysterio unite take bad guy love holland gyllenhaal badly act interview pretending good guy although know know jake,False
imdb,False
trailer existing completely spoil ending avenger endgame killneutralize thanos reverse snap ezpeezy people fucking worship russo brother,True
ben fucking parker,False
would also add far home trope,False
sup dickwad,True
hype tom holland best spiderman,True
seeing gyllenhaal finally comic character really satisfying,True
basically beginning ultimate spiderman year since read,False
soooooo spiderman clearly come back lol,True
think know man smelled sarchasm,False
old enough grandma,False
yeah soon saw mysterio hero kind gave away,False
anyone else thinking giant elementals actually absorbing man perhaps mysterio absorbing man working together rob bank absorbing man create beloved hero mysterio seen much agent shield know status could nick fury involved,True
stood movie look entertaining fun genuinely enjoyed trailer seen peter interact others forgot villain main plot seems mysterio wanting act part hero undercover thief clash spidey maybe mysterio try make spidey villain,True
suitcase one say ben fucking parker,False
wow stirring feces anal reference spent decade infantry soldier thoroughly impressed never heard kudos,False
volcano really bright magnesium,False
sure set endgame possible post homecoming pre iw,True
mean fair manage make pretty much every phase one two villain le cool comic make dude electric whip lame kind impressive,False
gt snapped people coming back never snapped begin money still time travel fuckery,False
wow wait marvel seriously revamped love spiderman especially mysterio coming reminds old spiderman game like spiderman friend foe boy great,True
end last avenger movie work know dead shock factor false sense stake depth marvel movie,True
going big part endgame,False
agent coulson,False
nightcrawler two,False
well also know fury meet spiderman endgame,False
would actually speculate iron man thor live given talked present tense trailer,False
ded,True
said came field trip way field trip besides russo brother lied title endgame actually inferred could endgame maybe lying,False
look little taller,False
technically,False
still get chill hearing opening homecoming happy giacchino back,False
said take outside,False
ever huge avenger,False
yougamingtatertot got big window say,False
nick fury dart ned want deal fanboy way know ned already speed peter identity,True
guess two kind crawler,False
raimi able make spider man three way wanted would great executive pressure put venom,False
halfassed retcon appease fan real mandarin going show effectively speaking mcu mandarin aldrich killian,False
gt might excuse sign dcfu likely reason talking as playing one clist villain likely killed never heard thing playing one popular character fiction oscar receivingnominated movie back catalogue three movie reason joaquin phoenix although joaquin phoenix far better actor jake gylenhaal care many downvotes get turned role lex luthor playing joker one movie,False
sure rule link little googling find plenty official confirmation posted,False
really hoping take place infinity war,True
fact europe spiderman saving day make think unable bring everyone back plenty hero europe could take mysterio,False
mean nothing keeping movie taking place,False
ok know already knew would another spiderman movie infinity war even came still feel super weird watching spidey trailer character pile ash could wait endgame release,True
think zendaya cool though character annoying sometimes think would go well romantic lead though call mj personality nothing like,False
oh great another red head character getting replaced sake diversity skip one,True
sony fucking dumb shit,True
hope massive silver screen hydroman,False
guess vulture one salvaging alien tech,False
spiderman sackerfice big bad booty daddy hookup,False
occurred jk simmons great job original movie neither reboot even tried include character despite pretty big presence spiderman universe,False
would fear really think hero going stay dead,False
look alright nice see boy jake gyllenhaal big budget movie long first joaquin phoenix jake two current best actor hollywood acting blockbuster could excited,True
one quick shot two hundred and eleven,False
would lie case,False
actually origin story comic iirc,False
tap forehead,False
lizard mysterio one top three villain show spiderman movie beautiful see action really hope gyllenhaal give character dramatic flair really make memorable expect see hobgoblin,False
man wait see velvet buzzsaw,False
embarrassing lmao,False
boat named asm212 feature hydro man villain amazing spider man issue two hundred and twelve,False
guess spidey sense tingle co fury threat always thought awesome advantage spidey never ambushed cept maybe venom,True
fucking kidding manas dead obvious business ausratschte,True
hot aunt may best aunt may,False
snoke real mysterio,False
erfucker look around oh good taxi,False
think movie take place infinity war remember say tony field trip might hunch,False
hydro man doorway many plotlines would consider unnatural say water clone mary jane,False
mysterio villain wtf expect,False
okay getting spiderman fatigue,True
widowed tony heroic sacrifice pepper becomes disillusioned modern science failed save fiancee life stark industry dissolve pepper establishes alternative wellbeing company goop,False
sup dickwad,True
spider verse,False
know anything liked used ramones,True
even though mary jane watson still establish mj forget actual name character boring people mention mj supposed new mj dumb idea could made new character connection another character share nothing common love interest parker,False
lincoln_dd omg omg omg tingling,True
must fun party,False
leak line lot trailer said gt he using last thing tony stark made lt create effect,False
would never say face wonderful person gifted artist would say face,False
almost kind suck knowing wonder subvert expectation somehow,False
imdb edited lot people always right,False
stark staying home america letting peter peter kid school trip fury like nah need,False
method similar motive different,False
nope long confirmed endgame first glimpse mcu afterwards,False
bet mysterio working norman osborn twist villain pawn larger game,False
seems like way infinity war single endgame spoiler,False
seen hail heisenberg,False
gt know anything sure endgame peter back mean end iw saw spiderman nick fury turn dust trailer honestly think pretty shitty take place iw kept everything wrap event iwendgame sorted also trailer started thought oh going introduce british superhero interesting nope big reveal jake gyllenhaal,False
world really need nathan lane fabulous j jonah jameson,False
think rocksand giant fire giant water giant must coming source presumably mysterio,False
mean possibility talking as even got say like fucker,False
every movie well thought tour de force nobody go marvel movie wanting see perfectionism fun enjoyable superhero movie sure piss much,False
kind look like making illusion something based sandman molten man hydroman bet giving mysterio dr strange type magic shit dabbled comic let u create mimic fight,False
stealth suit inbound,True
whole trailer trailer shit need stop,True
toon squad defeat thanos game basketball forced hand infinity gauntlet movie,False
martha,False
well guess may know peter spidey,True
say,False
know somewhat chemist,False
guess survives next avenger film eh look awesome,True
going meh dawg,True
except fact different suit could explained another one fury brought europe sure infinity war genuine question,False
oh shit,False
acting like totally guessed know damn well already mentioned thousand place already,False
gt way yeah never wasted talented actor mediocre villain,False
peter suit case look like bag amazing spiderman peter get dad,True
feige confirmed long ago first postengame movie mcu,False
notice family lot wealthy many classmate,False
correct wrong interpretation beck empowered coulda sworn one illusion ability suit energy projection something,False
fact movie exists spoiler avenger one minor spoiler level fact overall think fine watch,False
waaait thought mysterio bad guy,True
idk man willem top gobby probably one favorite spiderman villain,False
like feeling better,True
trailer answered one question relate avenger infinity war parallel universe,True
easter egg,True
fake open hand slap matter,False
hopefully long time,False
really spiderman fan thought died,True
watch different trailer look like anything special looked kind generic uninteresting,True
cgi still awful look fun,True
yawn lack organic dramatic storytelling mcu staggering damn phony manufactured oh spidey got dusted iw sad dark brave marvel oh fine daisy europe nonsnapped friend please continue believe infinity war meant anything give u money know,True
uncle happy,True
fishbowl keep seeing referenced idea mysterio lore would helpful spoiler welcomed,False
please cotinue using spidey theme every time perfect would way,True
fuck next phase going dope,False
entire point terrorist mostly smokescreen created real villain american using threat terrorism enrich empower going terrorism angle namely terrorism real threat,False
interesting using iron spider suit sure make,True
buddy,False
could technically infinity war,False
watch trailer clearly wearing new dress,False
aaaah must,False
know going alive somehow kind ruin everything right everyone happy like nothing happened,False
sure going great going giving amazing spiderman two vibe going real big term plot scope way save world deal mystical monster rather save neighbourhood stuff spidey usually deal feel like worked last time small scale focus peter relationship character sure like headed big press x doubt,True
assuming using attack steal shit ala die hard vengeance,False
dumb friend figured yet go dc peter spiderman save go europe peter spiderman save spiderman obviously someone know queen,True
class trip back infinity war class trip europe would mean time travel involved infinity war never happened tony stark alive happy still job,False
vulture mysterio check dock ock gt use dimensional weirdness make alfred molina version raimi film new sandman electro please sub kraven idk nearly villain spot maybe lol,False
mysterio origin story,False
feeling fury going shoot straight tell one potential powerful being known exist really put purpose perspective new front line event endgame,True
cringed therefore value bit man jake g make hell yeah,True
enjoy new trailer pretty pissed sony new cash cow decided ruin endgame,True
necessarily teaser reveal whether movie take place endgame,False
mysterio made hydroman,False
one dumbest best clitches ever love superman,False
oh fuck yeah,False
additionally slew fantastic villain since going either remained true comic counterpart altered positively serve plot,False
like cooler version prince persia guy,False
welcome comic book,False
armpit web,True
want people talking like as polite type initially,False
wanted piss tested would pm sunshine,False
paycheck two comma would even excited part trump administration,False
regardless mental gymnastics trip moma manhattan,False
nothing spoil endgame win lmao hopefully pack full action plot armor strong,False
would four fundamental interaction four force idea expect element term four element referring water earth air fire multiple millennium old,False
almost dropped soylent saw supernatural character know various source,True
rmovie detail,False
said sup dickwad mess,False
like passport year,True
maybe reed richards,False
like weird tom sawyer spinoff,False
finally way excited mcu movie,True
get dewey want part many squee moment trailer,True
love spiderman theme interspersed trailer,True
ozys plan give world something unite everyone would die dr manhattan crazy psychic squid brain,False
supposed wear shirt torso,False
really good sister brother last year everyone really good movie unfortunate thirty-four people went see theater,False
first appears spiderman punch shit like ah ha professional stuntman immune punch,False
excited dropped phone face tried quickly play trailer seems amazing,True
knew spider man black panther dr strange would brought back sequel development trailer add remove anything else knowledge,False
need get hyped waste like every villain,False
people basic understanding one important villain one popular superheroes,False
make look incredibly good,False
could probably get suit nick fury think getting black stealth suit,False
vulture uncle ben,False
good villain,False
shoutout rsquaredcircle,False
field trip moma manhattan europe,False
make anything fact giant check signed pepper potts pepper stark happy saying alone,True
calling mysterio first heist actually one sanctum infinity war nobody around protect use illusion skill trick guardian steal magic gizmo allow actually manipulate reality control mystic art monster shit still one hundred something conjuring bet actually real maybe following dnd style illusion magic spell illusion long believe real effect,False
spiderman knowledge almost exclusively ninety cartoon linked,False
looked like showed sandman hydroman trailer would bet illusion mysterio prevent looking amazing,False
mean two movie missing pipeline advertise movie mcu organic storytelling compared franchise nice bait,False
conflict interest wanted good superhero movie,False
tobby maguire,True
glimpse trailer,False
thought trend action sequel taking character london dead,True
believe going effort trick people expecting spiderman come back next avenger movie,True
get pissed first showed without,False
tell one saw distinct eye agammoto sigil mysterio blocking water attack illuminati eye yes green color program think direction amp x200b real sorcerer one amp x200b bad as suit mysterio amp x200b oh yeah spidey,True
maybe think flash amp x200b,False
think mean fear character even remember time rewound thanos stopped nobody perhaps maybe even actually remember never happened,False
say talking said salty,False
avenger endgame would need lot work making people interested mcu ahead phase three exciting since people anticipating something amazing infinity war mostly seeing everyone together come nailed completely also mcu achieves certain depth linking one another make every film piece puzzle need put together understand big picture marvel need see needed stop milking cow least feeling without big reveal road feel le depth pretty low stake like happened antman wasp serviceable nothing add big puzzle picture,False
sure mysterio illusion cool seeing hydroman sandman,True
hope bring kraven point,False
zordon jj jameson jim gordon lucifer santa really,False
make new movie,True
thannos kill half population like right first spiderman movie,False
ben fatality parker,False
thought thought would set something movie next one bring green goblin guess,False
yea probably right,False
oh shit gyllenhaal mysterio,True
snap split fifty people one universe fifty movie take place snapped universe,False
tell coworker go suck bag dick,False
alright snowflake,False
shit,True
get gyllenhaal franchise stretch two movie optimum presence weird feeling find mysterio bad end set next movie,True
think character remembering likely sacrifice older avenger happened better story memory wiping entire thing,False
wait see mysterio finally boy getting action hahaha,True
true apartment window yuge,False
rwoooosh,False
also michael keaton fucking rule,False
maroon,False
gt passport notice year edited preinfinity war,False
mj seemed suspicious homecoming probably figure ffh,False
stop shoving spiderman movie throat literally one still theater right granted one theater pretty good zero desire see one ffs,True
yeah think fact shield advanced tech,False
heck yes,True
watched first time today first one would worst feel like,False
walk hard good movie,False
glad everyone got half being dying thing quickly spidey survived,False
sony made trailer lol,False
one,False
five day get harry osborn revealpostcredit scene,False
look superior,False
twitch chat like say pog,True
hydroman sandman bet us special effect illusion trick recruit maybe,False
well yeah take place avenger four,False
sony owns spiderman,False
even villain guardian galaxy example changing lot service film many people consider best one bunch,False
marvel even pretending getting better let u act like moron new trailer featuring mostly people currently exist,True
comment replying start mean fucking annoying trend reddit,False
sound like syndrome incredibles,False
pretend much want cast black lad captain america called shaun rachers bascially thing michelle jones clearly reference mary jane unless introduce mary jane eat word race swapped mary jane,False
iw homecoming suit get new iron spider suit new suit fall timeline,False
bruce campbell playing mysterio never ever pain still hurt,False
really want see spiderman outside new york seems like integral part character oh well sure fun anyway,True
okay bite fishbowl get stuck head,False
god damn marvel version eidolon,False
always forget shocker til feel,False
truly,False
gt starting next one start minute avenger four wrap story amy pascal,False
oh,False
going guy actually took long enough,False
hate spidey three way worse two loved tobey peter though heck loved whole raimiverse,False
reason remind madame web,False
noir shieldundercover variant,False
neat way get fantastical spiderman villain movie though,False
hope le whinny time tom holland american accent tad unbearable,True
theory elementals villain sandman hydroman working withbeing controlled mysterio make mysterio look like hero,True
wow already watched movie reason still watching trailer,False
could explained spider man following villain appears turn bad luck making way europe time school trip,False
announce day dr strange two well,False
one hundred million,False
yea made vulture use alien tech worked great seem recall wanting new alien tech sort around new spidey movie beyond vulture vulture beginning,False
hey magician guy spidy related dr strange look cool though,True
disintegrate nothing avenger three suddenly alive let mortality get way good franchise,True
problem mandarin twist real mandarin kind lame entire problem twist mandarin ring fu manchu change made regard mandarin made sense part worked,False
let u fuck score actually use amped classic theme stinger piece time please thanks michael,True
oh cool,False
marvel movie better eighty garbage hollywood produce day mad popular,False
holy shit another spiderman movie give culture smh,True
sandman movie cuz look like sandman movie,True
remember similar plot point villain chameleon,False
brave,False
believe set,False
would say superior one,False
leather jacket fur collar make look like og neck feather sheer brilliance never brought mentioned wear time favorite jacket guess look think oh vulture love,False
flash thompson,False
fishbowl mother fuckahs,True
take place event avenger four,False
okay,False
