comment,parent
matter died see people get stuck fact,False
take place avenger four confirmed multiple time,False
shite,False
thinking take place infinity war shortly homecoming took place two thousand and sixteen,False
bully thirdperson singular simple present indicative form bully,False
would kill donofrios kingpin mcu,False
teaser wait fifteen min long trailer,True
look know showed jake gyllenhaal trailer really got wonder trailer would better without mysterio thing attacking planet spidey might made le spoilery trailer,True
think hope get see,False
popular opinion look fucking amazing,True
turn good interested helping villain fight spiderman,False
damn hope found way make people forget world seems damn fine moment half humanity died resurrected,False
fact j jonah jameson,False
dormamu come karaoke,False
jake going tell sipderman go suck fuck,False
dead right moma sure anyone would confused preclude could take place infinity war confirm take place,False
homer already ruined stop spiderpigging whenever hear spidey song,False
yeah really like sold movie,False
figured seen movie last saturday burned memory yet,False
syndrome mysterio,False
dewey cox reference,False
cool,True
well certainly make interesting peter prospective comic flash bully fight back peter get spiderpowers fight back would blow cover would right movie version flash verbally bully peter fight back peter shown much smarter quick witted basically peer instead peter getting ability fight back choosing peter always ability chooses interesting angle,False
absorbing man maybe,False
every criticism even minor buried already oh except negative comment zendaya always love insult woman marvel proud mindless sheeple downvote give counter argument listing moment trailer refute point guess right painfully generic unfunny every way bbbut amazing cgi card even pulled since par either funny watch far reach praise garbage hey let u enjoy together since going stop saying feel prop friend anyone else going speak truth feel great,False
actually think announced nephew actually mile,False
took long enough,False
know say big fish bowl,False
batman kid growing zero knowledge mysterio knew looked like picture action figure knew literally nothing else wish come comment section lol knowing kind ruined second assumed gyllenhall really good guy going new interesting dynamic marvel movie,False
okay people griping tying infinity war peter snapped yes possible take place infinity war highly doubt come marvel know stupid knew end infinity war people dusted already movie work knew people dusted thanos contract movie like rdj chris evans know one dusted going come back one left standing one likely risk die discussing online friend work almost year marvel know know know talking treating u like idiot knew last year spiderman dead good,True
syndrome,False
maybe go jerk closet somewhere rest u watch busy hating fun,False
reason excited division movie,False
confirm camera guy shot cobie set hand delivered footage editor signed contract tell hold someone door,False
like away new york,True
like reveals nothing captain marvel endgame already know far home black panther two dr strange two etc etc set release endgame preview movie way survivalresurrection character caused literally anything time shift act god kamidogus,True
ayy kayfabe,False
saw opening night audience one big giant gasp fucking way,False
wow cool another marvel movie exactly plot every marvel movie,True
basically step tony stark bigger ego,False
raimi film always wondered people suspicious mary jane always hostage super villain scenario like maybe investigate social group spiderman sure know,False
could confirm time travel happening many people back alive everybody acting never happened happy mention alone one stark anymore busy know yet like day future past like go back time one avenger went back time would know happened unless explicitly explained happened,False
peter parker pick passport please many take,True
birb,False
real talk though ps4 game spiderman theme fucking amazing,False
three suit one classic bluered stealth suit swinging around europe day suit look black red,True
drive coolest car,False
dunno guy make look interesting,True
bullying anymore half time type kid would gotten bullied decade ago heather reboot last year great job showing,False
got serious goosebump theme came,False
iw,True
also fact iron spider suit,False
thought spidey dead,True
quite yet,False
alright love spiderman thought homecoming great look really underwhelming first fuck even putting trailer endgame anyways seems like peter thing sake story want bring spiderman suit feel like something spiderman would ever nick fury come brings anyway unless predictable plot wanting spiderman mysterio one upped spiderman mysterio obviously villain behind everything point wanting bring suit dunno seems forced pointless,True
dewey cox reference two thread hahahahahaha,False
long start making bad one,False
wait endless crap superhero movie go trend,True
stark dy avenger four fuck,False
literally part trailer liked,False
hot lady anything realistic everyone would hitting marisa tomei walked room lol,False
everybody smart vulture,False
love fandom unbelievably spoilerphobic mcu flat spoil film come everybody make excuse,True
maybe think different spiderman entirely like one london,False
talking movie filmed location italy set actually rather set atlanta,False
change thanos like ton think comic book thanos illusion right thing crazy deluded seems crazy goofy as smile face two hundred and forty-seven could wrong though lol thanos purist want chime,False
think dropped trailer mean knew peter lived infinity war end game trailer kind ruin suspense happen end game know live,True
damn super hoping trailer would even show peter wanted show mysterio maybe even push another spider adjacent hero maybe jessica drew even mile entire trailer peter missing leaving everyone shock potential peter actually make week endgame show trailer peter around,True
nick fury immune spidey sense,True
seen twice might go see tonight able experience mile leap faith way theater gave goosebump time awesome,False
one el feel weird watching even tho peter got dusted know movie announced prior snap feel like setting endgame fail,True
benjamin fitzgerald parker,False
jake gyllenhal suck spider man enough spiderman movie really demand two fucking new one every fucking year,True
fire one trailer whilst hoping sandman hydroman good chance mysterio illusion trickery,False
shot ned neck,True
shoot friend work wife hulk hogan,False
think trailer spoil anything sony charge marketing marvel studio sony finance market product m merchandising right make movie thus perceived m control sony chooses release trailer,False
also nick fury alive well duh,False
loved twist thought perfect,False
lol downvotes ironic call snowflake downvote like snowflake would pc culture blow people wo constantly complain also blow opinion,False
mysterio first appeared without fish bowl thought sentry,True
b g c h n g,False
sorry know movie came endgame guess sony wait,False
even high school ninety physical bullying much thing mostly pointing mocking teasing fighting happened usually two bully bully kid got picked tbh always assumed always case whole jock beat nerd school fictional hollywood archetype,False
actually pretty fair representation rich popular smarta bully dumb brute everyone hate something done plenty time iteration flash bit true life,False
hope going incredible reskin,True
day age dude prolly got lung cancer badly done fucked whole shit,False
gary oldman john malkovich james caan paul giammatti ben kingsley tom hank sean penn ed norton kevin spacey soon,False
troll troll get mom basement neck beard,False
wrestling marvel name better duo,False
yeah trailer also posted marvel official channel,False
wildlife good phenomenal mostly always,False
already disappointed mysterio good guy villians elementals really essentially hydroman already fuck disney,True
spoiled infinitywar ending everyone dead going alive due time stone,True
th say damn got big head,False
actor even every dceu film rotten tomato score sub twenty would rather play superman batman literal cinematic pop culture icon even one movie touch anything marvel movie offer,False
feel bone,False
would like think know comic lore even think general audience people would sooner expect venom green goblin one spidey villain mysterio great even really know much motivation great excited see adapted scrap knowledge,False
honestly idea happy going peter weary handler weary stepuncle make lot sense,False
got sort excited really hoping adam warlock obviously yey mystero,True
seen,True
legitimate question sandman limit amount sand controlbe figured could become world,False
yeah open message brower pee message monitor record chemical piss produce attachment send sample worry monitor sparking normal part process,False
incredibles ripoff,False
yup,False
probably going kill typical mcu fashion,False
fighting water another villian,False
fan proper service changing story oh stupid fan service apply,False
well fair adrian toomes really frail made old man vulture resemble old men bald head bent neck vulture major arch villian spiderman early comic,False
movie lot different spidermen would never work,False
tbh think spidey making suit point think going want stop relying tony,False
thought died,True
photo fury set,False
really enjoyed sister brother saw review pretty split surprised one favorite last year,False
really liked doc ock spiderverse also alfred molina great,False
storyline next avenger set release april twenty-six bring back select hero disintegrated good movie well,False
still real,False
cgi problem bad cgi spidey look like stretch armstrong,False
mysterio closest thing zet arc warden look movie screen lol,True
mysterio wizard,True
read comic watch cartoon mysterio always one favorite hoping villain finally finally moment relishing needed fishbowl though,False
confused timeline,True
yes nearly every teenager going see movie brunt audience tf reddit thinking unique understanding comic book,False
agree black stealth suit look cool,False
fucking wish,False
guy fool respect even movie guy one best actor period,False
actually seen yet soon meaning,False
gt alright mysterio going monster thing beat amp x200b classic villain invention go haywire villain gain conscious team hero stop said invention,False
girl peter parker interested vulture daughter nice know trailer,False
mysterio syndrome confirmed,False
comic book thanos get laid death right,False
infinity gauntlet concerned balancing anything snap half life think impress death,False
proof universe split two snap maybe og avenger even able reverse snap endgame next phase mcu continue universe,False
busy watching mouth instead hand,False
bigger badder much mr spiderman,False
problem begin least personally know always choose marketing storytelling letting people know movie infinity war like really give f uck creating even fake temporary suspense least pretend care story much care money machine know,False
apparently take place event avenger endgame,False
since teaser almost three minute long,True
wait plot sound absolutely incredibles,False
aunt may taking spiderman mantle back new york,False
since phase three opinion,False
actually really liked garfield film,False
one spider man strongest baddie legit op actually know answer,False
theme always brings childhood glee nothing bad happen spiderman theme play,False
following trend last year excited standalone avenger film feelgood bug movie end year,True
booyaka booyaka six hundred and nineteen booyaka booyaka wrong mysterio uh,True
fanboys blindly twist pretzel defend disney overlord,False
suspected illusion look like hero,False
nah create problem make look hero trickedscared u ussr world peace,False
look specifically want ruined endgame lot spoiler info coming co sound real logical often multiple picture confirming roleoutfit etc thread always huge suspect legitimate well 4ch leak decent track record,False
mysterio look badass fish bowl head,True
remember deleted scene mj say suspicion spiderman maybe,False
damn thought sandman,True
well nick fury alive well got snapped,False
shocker maybe better doc ock though already spoiled two great doc last year hope keep going,False
holy shit musical score really digging new take classic glad see lot comment digging musical composition,True
tease like vincent onofrio kingpin big screen would absolutely fucking amazing recover since boy matt beat shit though dd cameo ugh,False
thought water monster sandman first,False
god one quote need retired get spouted retard even slightest chance might relevant,False
mindless product spiderverse great recent example much potential superhero film great meaningful,False
bad actually really liked feel like would fit somehow always got impression electro megalomaniac way portrayed as2 power sake power obsession turned dangerous,False
true,False
idk iron monger darren cross red skull loki bucky either equal better,False
mysterio probably playing good guy master plan,False
look like jock anybody bully asshole,False
last year wondered would market movie without ruining avenger four endgame guess kind disappointed something trailer acknowledge even something voiceover like thought dead huh movie look great though,True
barker farker parker,False
bar pretty low though like ton memorable villain movie,False
spiderman die infinity war watching,True
got look point view black people oppressed century every single country world scapegoat since dawn slavery invaded forcefully taken enslaved understand little revenge driving factor crazy come want flip oppress oppressor instead,False
particularly bad case cut half,False
roomie got hit dart thought going kraven hyped,True
anyone else take light heartedness iron man thor reference mean survive event endgame,True
chief,False
people mad set new interesting angle iron man villain made punchline smokescreen exact iron man villain previous two film corporate rival want dethrone tony stark,False
sure mysterio without fishbowl,False
seem like sandman,False
yes,False
two thousand and nineteen gon lit,True
kind wish hade nt shown mysterio would made movie better popped,True
dickwad,True
take place five minute endgame,False
mean stark iw suit basically magic point mysterio could smart come something,False
lol terrible,True
really dumb drop trailer like endgame everyone know fakeout,False
wonder would even tiny thing background like radio talking,False
fact generic as elemental monster dead giveaway unless mephisto something,False
ah old syndrome routine,False
villain nobody going mistake hero like comment suggests,False
really dumb chump like game throne spoiled finale people fine,False
whew said stirring feces thought meant brokeback,False
hear voice,False
like much better everyone else must pretty cool bet life awesome,False
hot take enjoy prince persia,False
mysterio menace could see,False
though took place endgame,False
good catch possibly explain one,False
fanboi incoming lmao,False
like mj character annoying,True
til mysterio power thought like david blaine something,True
anyone else notice one single character know dusted iw trailer cap iron man thor nick fury,True
mads mikkelsen doctor strange completely wasted opinion maybe thought otherwise,False
exactly said friend set photo trailer part still think rumor,False
yes danger,False
man nearly bonkers saying something like dunno clark kent guy superman,False
agree really seem globe trotting look entirely venice,False
played supporting character case would get noncompetition clause role like,False
indubitably,False
big guy seemingly made sand close enough,False
lt thought date issue new passport might help place movie occurs make mention year date issue date birth sure significant maybe intentionally hiding take place maybe year meaning gt,False
bro fuck pea,False
peter passport month day year date,True
movie set happy peter seem depressed,False
knew get go know fan hyped,False
yeah especially mary jane fake tied hydroman really looking forward seeing spot spiderman three,False
lie constantly rare moment truth important declare,False
yep balance shit killing pursuit skeleton sex,False
yawn,True
fiege said take place five minute endgame,False
holy sequel maybe number three turd flamming bag,False
agreed fair could said spiderman movie besides amazing spiderman two look good begin,False
fiege said take place five minute endgame,False
spiderverse different superhero movie animation read script formula character arc action sequence nothing original unique aspect,False
heard secretly endgame show see spiderman july thought say endgame may real endgame,False
well suit also disappeared snap happened see tony make new one endgame,False
big fight marvel sony withhold sony sony anyways,False
thinking case seeing couple time bummer,False
good murderer actually feel bad guy though special move someone dude ended brain aneurysm something ruin day,False
might confirm time go back event homecmoing iron spider suit clearly upgrade first suit given stark,False
cast,False
spidey,False
amateur really mean paid,False
fury right miss another character,False
barely gotten incarnation spiderman new york come think civil war airport germany homecoming spend lot time field trip dc suburb infinity war space iron man dr strange new one going venice,False
someone anti marvel think may time hop bandwagon joke end sold,True
aunt may know,True
mean going assume least day peter leaving earth thanos snapping,False
one going talk music,True
yep everyone seen heard movie far either confirmed snapped fury hill spidey confirmation either way may mj etc saying resolved universe definitely could half snap seeing,False
well yeah obvious though,False
thought shuri confirmed dusted endgame trailer face missing screen next think antman peter antman show later trailer,False
yes,False
ahhhhhhhh,True
really,False
spoiler alert good guy win,False
join fishbowl rule city spidaaaman,True
gt well another character want spoil non obvious returnee,False
fully erect,True
going honest really stand hopefully movie feel fresh,True
hysterical laughter,False
ok know nick fury actually dead infinity war,True
know survived endgame,True
sick trailer spidey sense trigger fury room,True
curious stan lee cameo,True
guess theory could happen summer infinity war since see peter school bus could fall semester also seems pretty summery infinity war,False
lucifer play,False
theory saw honestly hope case see working otherwise though would open another hole iw happens right peter class get back ny would make people wonder suit take europe,False
sue,False
waiting live action mysterio century,False
catch end homecoming,False
personally completely fine mandarin made villain interesting instead though,False
agree really stupid part,False
speak english doc scientist,False
reminiscent peter may relationship spiderman ps4 game helping homeless shelter,False
nobody remember hydroman,False
real know support refreshing,False
one going talk superiorlike suit awesome look damn good,True
hmm maybe new suit loan nick fury,False
considering tony already stole pepper happy think happy need win pepper happy married multiple time adopted child comic,False
old seventy spiderman actor still alive would wild old jaded spiderman,False
teaser think saw whole movie,True
one hundred sure know,False
huh mysterio good guy,True
yea shot film last week great dude,False
older meme sir check,False
would surprised many people think pretty much every announced movie take place infinity war everyone dy one seems able comprehend obvious plot point maybe maybe endgame going end everyone coming back snap,False
yet see spiderverse unfortunately list,False
rewind time markwezz ahh hot,False
sup dick wad,False
another spiderman reboot many reboots,True
would even release trailer soon though,False
ever since old man logan book mad respect mysterio,False
assuming know went thanos fight even remembers way beat thanos involves time travel maybe people remember anything happening,False
one know jake two marisa tomei age like wine,True
refreshing usually music mcu infamously forgettable watched every movie multiple time really theme hum theme avenger one,False
spiderverse movie mcu would cool tobey maguire andrew garfield tom holland one movie,False
chance set infinity war like second antman confirmed take place event movie,True
know feel release trailer film much different feel setting expecting kind spoiled limited expecting next avenger,True
exactly built hype around end game suddenly seeing spiderman flying fit get die end infinity war spearheading next phase mcu could waited release endgame relase trailer whatever upto,False
well yeah assume mysterios illusion nod character,False
threat peter,False
second actual face appearing already hella board perfect casting,False
would spoiler take place importantly far end game movie happens,False
never party somebody praising spiderman homecoming realistic tough say,False
spiderman died,True
mean least topic,False
baby mouse,False
entering mcu change character uncommon make safer role given state dceu would understand would hesitant take batman risk fucking batman even hand look done affleck image even core played good brucebatman combo,False
say next summer summer,True
he got netflix film hitting next month called velvet buzzsaw would watch trailer he reunited nightcrawler people look fucked,False
could serve way set type movie sinister six something mysterio already know vulture buying tech past vulture selling tech year could reason several villain exist like shocker,False
could get mary jane one lol,False
sandman main villian closed harry arc setting venom four could,False
could take place endgame make sense,False
shuri got dusted infinity war according endgame trailer,False
vulture basically pg13 version birdman haha,False
read great review talked got exactly right 60 spiderman first big young hero sidekick since represented youth give decrepit old man villain film hand made vulture thematically old instead physically different era peter blue collar fuck got mine attitude bitter much world changing,False
kind shit big trope lot old show youth hope played,False
far know absorbing man grow size maybe wrong,False
look like rock,False
mysterio bit batman type villain really spidey type guy crazy vfx skill seem like could keep spiderman,False
stranger thing happened,False
good old spiderman,False
mean talking guy successfully convinced wolverine kill every single xman albeit nowerased universe,False
thought shitpost coz look like casey nestiat,True
basement flooded,True
illegal peter parker caucasian friend,True
got disagree yeah lot teenager could probably recognise mysterio marvel villain would say would much deep knowledge also large chunk teenage audience tom holland fangirls kind doubt die hard spiderman fan would know intricacy spiderman villain would say yes good amount audience vague idea mysterio definitely would say every teenager know,False
dilusional think mysterio well known character especially among kid born 2000ish,False
oh sorry know make wish kid got see early screening movie trailer history ever try entice viewer story line emotion would rather know movie,False
look stupid okay downvote,True
waiting sta uh oh,False
oh missed link,False
feel like way obvious though would surprised actually went route,False
real bad luck ok give break,False
perfect casting,False
sure ip right character absolute nightmare long series running netflix like still marvel studio lot licensing deal right revert x year producing anything happens right situation becomes much simpler point sony deal spiderman renegotiation venom performed well sony going push hard get spidey back house,False
came,False
would title studying abroad,True
mean gather trailer take place pretty much straight homecoming,False
well already uncle aaron aka prowler homecoming even call mile deleted scene probably definitely getting mile line,False
big chungus killed thanos,False
ridiculous clark kent wear glass superman,False
came forty year mysterio created,False
yeah mean endgame even though already knew got sequel coming dustex character kind suck blatant end result endgame,False
either play high school peter spiderman,False
right kid born around time superheroes never popular would know,False
old fun sell fish bowl everyone heroic everyone fish bowl everyone fish bowl one,False
guy watch disney movie gross,True
built hype around end game suddenly seeing spiderman flying around fit get die end infinity war spearheading next phase mcu could waited release endgame relase trailer whatever upto,True
fury everything could set endgame right infinity war cleverly set know fall timeline could see finishing trip bus ride home airport infinity war happens,False
mention nephew name homecoming glover could prowler,False
ok give one vulture killmonger thanos zemo pretty good,False
appearance nightcrawler,True
goofy fishbowl shaped helmet spidey regularly mock,False
twist oh right,False
sony distribution marvel film production,False
title sextape,False
ugh got try hard make mj woke cringe,True
additionally og sinister six doc oc electro kraven mysterio sandman vulture ton different iteration team right term established rogue gallery spidey mcu vulture scorpion shocker tinkerer prowler although would really count mysterio possibly hydroman whatever embodying seemingly elemental based being trailer could form sinister six would bet money least mysterio scorpion vulture team,False
