comment,parent
jungle book mowgli think different disney one least point view mood director made choice atmosphere ultimately super great,False
true robin williams genie improv mostall line holy shit,False
trying shame binarykin,False
think getting voted saying movie perfect,False
stepbro,False
curious movie include iago redemption aladdin two go lamp jafar,True
lamp also seemed like def setting aladdin two going,False
aladdin one favorite animated film thought marketing new one looked bad surprised film movie ton fun main cast great chemistry music humor great movie new material also pretty good movie good original would definitely suggests fan watch found good take animated classic would also say probably favorite live action disney film far eight hundred and ten,True
honestly get live action film fun twice,False
done reprise arabian night end credit,False
also fast forwarded place bit jarring,False
basically became memeclickbait stuff medium social medium,False
yeah actually going lie rolling eye heard genie heard playing turned great really great actually started lot fun came screen far modern adaption go genie certainly hit mark,False
oh god,False
downvote people preemptively complain downvotes,False
fence seeing turned away,False
lot people agree actually think anyone underwhelmed smith crazy best part movie far,False
bought iago seeing diamond rough thing felt like cave kind master degree psychology tell heart would tempted steal anything cave saw beginning movie scene telling u aladdin thief wholesome give food away poor people steal kid setting u later also say tie jasmine attraction soulless prince symbollically iago saw aladdan streetrat palace diamond rough safely assume cave got good vibe also beginning movie someone pas cave assessment got crushed mouth tbh really hard understand damn cave saying,False
admit killed hype movie lol favorite part original,False
get impression,False
depending view lion king remake dropping soon james earl jones second,False
remaking aladdin already animated movie watch yeah well another one,False
maybe repeated line ill neeeeever forget street rat blah blah plus easy money maker,False
need big star genie going one know alan tudyk,False
infuriating baz yet direct one,False
really open idea remake feel like lot opportunity movie feel like high school project need passionate people behind project see love crew behind detective pikachu pokemon far letdown,False
amazing moana though gave stupid chicken much personality,False
jasmine girl one replace thor heart,False
usually avoid popular movie franchise like going movie get lot smaller indie flick around gave shot keep mind sort movie super fresh memory animated version loved regarding set small felt like lent sort intimacy importance character fine chase scene song felt place learned later new addition kind made sense aladdin singing best somewhat agree review said sang like high school musical production like way sings dare close eye nasally overemoted kind silly smith amazing fact difficult thing adapt well actually best part movie testament outstanding performance jafar interesting thought decently done mean nuanced get remember enough animation say different seemed gave due motivation within context kid movie honestly good time strong suspicion critic got wrong one could help compare intensively animated counterpart left movie thinking disney actually pulled seems like bad idea expected rt score eighty-five ninety percent surprised panned last two movie saw theater endgame jw3 definitely better experience endgame good humor dumbed character propped teetering pile time travel trope made fun make easier swallow yet expected get score rt least managed wrap everything leaving jw3 enjoyed first two honestly expected fifty rt guess absolutely represent opposite people term actually enjoyable best large budget film seen theater mean really apparently worse detective pikachu,True
long buy blue ray disney win cycle continues,False
bop dope,False
lack range play anyone smith,False
thought pretty decent entertaining would give six hundred and ten amp x200b good amp x200b smith solid job genie charm funny moment certainly level robin williams made character pretty entertained whenever screen friend like good smith totally added flavor allowed rapping comedic talent shine visually fun place like original naomi scott convincing jasmine impressed wonderful singer felt captured original jasmine personality perfectly nasim pedrad dalia funny charming perfect addition film billy magnussen nice addition well screen time limited add silliness buffoonery film wadi rum stellar filming location desert shot spectacular amp x200b bad amp x200b jafar everything jafar failure opinion marwan kenzari seemed bored uninterested film though writer director deserve much blame giving actor much work either one memorable fun character original film jafar complete utter disaster thing got right jafar costume staff sultan boring hell fun character original give sort personality one iago get enough line great character orginal totally wasted alan tudyk talent barely using arabian night anyone thought smith sing song understand smith singer sounded awful prince ali visuals impressive parade seemed small static lacked chaos original music sucked tempo song slowed smith rapped whole thing rather singing much speechless song fine naomi sounded fantastic fit movie musically different rest song film took film sound like belongs frozen genie cgi yea blue genie never looked quite right already knew trailer amp x200b mediocre amp x200b mena massoud aladdin look part certainly mischievous boyish charm original acting fell flat lot time time felt like reading line rather acting bad performance though think pretty decent job chase scene marketplace one jump ahead could lot better pretty much everything else,True
sultan turban removed anyone else think michael stuhlbarg second,True
like disney movie anymore maybe hahahah,False
yuh mah pruncess,False
belle worse well went quirky bookworm snob laughing peasant unenlightened like,False
original audio cave wonder frank welker rerecord,True
dj khaleed screamed immediately final shot though,False
movie bad marketing bad first aladdin favorite animated movie sucker musical released soundtrack spotify noticed take slightly different r amp bhiphop vibe could resist glad caught dolby overall thought fresh take stand fan service wink original worked time though afraid would another beauty beast instead rehash original version felt like adaptation broadway musical even intro feel like play get main character presented glimpse arc accompanied version arabian night pay homage movie visually musically naomi scott jasmine far best character best improvement original time thought hearing lea salonga though shade brad kane massoud smith worked great iteration genie though worked way better screen still reason prince ali worked despite disney releasing one minute pay justice happening low point movie jafar think miscast rather intent play well theater going character look insignificant want interesting take parallel aladdin story borderline went typical marvel villain dark reflection protagonist end thought parallel worked got nothing jonathan freeman version though pretty disappointed saw jasmine stealing supposed best scene kept waiting snap actually terrifying villain animation happen jafar felt menacing iago alan tudyk good fit role far nitpicks go start affect much enjoyment movie halfsecond thought stuff thought credit rolled going disney avoiding villain transformation instead relying mascot without giant cobra jafar fall felt pretty rushed despite padded screentime iago also thought jafar needed song deleted song original movie would fit version proposed story time fan slowmo quick fast fwd used work specially one jump ahead aladdin jasmine take wooden cart moving slowmo singing slowmo one jump ahead reprise set also felt pretty weird hakim might well said yo prince ahmed supposed make feel bad feel bad okay whereas animated al humiliated people laughing hakim whisper part original dialog reprise felt ironically happy sad second reprise way better though proud boy cmon disney even broadway show arc peabo bryson gt zayn,True
disney hack working overtime,True
arabian night good feel like smith singing voice powerful enough carry really liked prince ali though sad reprise,False
begin disney live action trend removing villain song believe getting prepared lion king remake,False
appreciate reprise used narratively shame removed disney villain song legendary,False
would hell twist,False
like disney account helping ruin film industry fun watch endgame fun,False
kind original worked howard ashman died middle writing song movie fewer musical number towards middle also robin williams dominated second half,False
great movie cast fit role nicely liked version adaption jafar movie total remake cartoon definitely brought nostalgic feel loved guy ritchie et al superb job added culture without appropriation adventure comedy love adorable flick,True
loved wish people would decide one genie jasmine standouts soundtrack awesome saw dolby audiocolors great fun price ali reprisejafar snake form disappointing unexplainable dealbreaker detective pikachu get pas messy plot get hate aladdin much charm going,True
alabamah,False
ali got jammed park rec,False
ending song went williams never friend like,False
would leave,False
giant hourglass look horse two ass,False
look ops edit,False
kind felt place tbh bust solo silenced convince general help make much sense,False
genie child magical power,True
whole point make distance williams performance though,False
girlfriend argued joke dirty mind thank vindicating internet stranger,False
nothing think funny aladdin ended last night gushed girl great instead getting straight reddit guess people like thing,False
film lot like venom great potential accumulation badstupid thing really brought understand people love though hell part fun perfectly watchable even touch original would pay full price blu ray sale like eight black friday would probably pick,True
thought rip robin williams thing upvote bait mean like situation appreciate current movie liked awkward humor especially dalia liked stupid recurring jam joke liked smith singer like way took genie obviously fair compare williams going get better williams fun sitting seat thinking two paragraph going post reddit going good time going,False
question someone hast seen movie yet true stay original smith butcher genie bad trailer portrayed genie justice,True
really autotuned hell,False
worth smith good job going,False
audience laughing quite bit cleaning cat joke least dozen people side oh person said line dalia nasim pedrad comedian even way say clearly joke little surprising disney slid ton dirty joke disney moviesshows meant keep parent interested going child head,False
nah solid 2nd hellfire take crown going much emotion complexity speaks u human level even today,False
find prepared musically satisfying agree hellfire better emotional piece,False
decent understand different actor bring different personality character felt like genie low energy character smith film commit entirely however could preference make seem real attempt keep cgi budget check overall would recommend waiting renting,False
legit question honestly fathom certainly financially necessary maybe cementgild position alist director adding disney resume suppose reason enough want strengthen pedigree relish opportunity willing throw maybe,False
said bop automatically disagree taste sorry generation slang,False
always enjoyed place joke original always thought eluded genie magic timelessness pulled remake random substitution like yes genie know people beat box jasmine making people disappear screaming song want sultan cool thought differentgood way wrap thing understand empowering girl thing right cool thought part clunky made since soundedlooked much like belonged frozen,False
loved much probably see week maybe next weekend,False
originally sought singer could act switched casting actor sing aladdin two song mena naomi nailed,False
indian biased naomi scott mena massoud excellent singing acting charisma dancing white guy bollywood mama proud modest costume inspired little lovely silk brocade material blend story indiaarabiaegypt believable casting positive representation hakim also rocked jasmine getting agency,True
lot friend loved movie kind soso one going talk part jafar already sultan jasmine brought away speechless song like wtf whole time call hakim jafar object hakim wave hand jafar finish jafar sits back like seriously jafar motivation film second one yet let u hakim silence let u forget already frickin sultan lamp yeaaaaah,True
follows original pretty closely change expanding jasmine role bit almost original song albeit remixed smith actually best part mena massoud aladdin going,False
heavy hitter lion king circle life wait king hakuna matata feel love tonight incredibly iconic tough cut agree commenter hellfire best villain song poor unfortunate soul favorite musically think,False
liked thought would time felt like one tv musical 1990s rodger hammerstein cinderella brandi whitney houston especially thought mena massoud pretty much perfect aladdin although change give jasmine role give smith time smith took emphasis away thought kind unfortunate aladdin one disney animated male protagonist felt almost like secondary character movie smith surprisingly decent,True
got instant visual titus cackling rise giant ursula end film pitiful insignificant fool god never wanted anything,False
mena nailed dancing definitely highlight complimented naomi think would cute funny jam scene cringy nailed awkwardness,False
movie jazmine ending sultan interesting guess going order merchant give food free since seems concept money even thought read lot book therefore deserves role new song wtf moment get triggered jafar go thanos guard wtf trying way hard emulate elsa failed miserably,True
really bad jafar supposed amazing terrifying nope one,False
mena like erol flynn gene kelly type hope get big naomi become alist movie star happen,False
think dorkier aladdin work somebody feel like prince absolutely depthelement forte element swashbuckler true character love jasmine feistier full vigor,False
really great excited see go next part whole new world hit really took aback powerful,False
also sounded like original singer mena brad kane voice interchangeable naomi jasmine always loved mena dancing friend like amazing naomi singing speechless nail,False
make sense wondering list three rule would removed prohibition killing,False
mena sound exactly like brad kane voice identical mena old school mgm musical movie actor naomi alister,False
brother said look like oscar isaac way kind cracked movie jafar say something familiar man brother leaned said voice look like poe dameron,False
love jasmine sultan aladdin queen consort love dynamic,False
yeah sultan hakim jafar upset could hire naveen andrew reprise role,False
love idea jason mantzoukas damn bring back naveen andrew,False
loved dance number,True
mena gorgeous better actor singer dancer superior noah,False
cgi jafar transformation end horrid,False
mena super talented take back glad aladdin stand assessment jafar awful,False
bette midler woman nail ursula,False
disappointed song missing aladdin really need villain song anything hoping would expand toned jafar felt bit toothless time,False
nope voice make incredible great dancing impeccable going great throwback actor,False
confused jasmine shocked find prince ali jafar told everybody aladdin jasmine aladdin talk really magic carpet ride,True
credit lol,False
naomi gorgeous queen sarah michelle could get glory movie star naomi even smile dent nose,False
noticed also staying credit nice like original end people movie singing whole new world great job,False
saw saw magic carpet one collapsed giggle,False
fun movie,False
cringe humor everything hate modern movie,True
thought aladdin first impression fuck worked well whole point idea flubbing everything yeah hard recover jasmine see trying know rather actually dick,False
dodge saying prince cosplaying street rat,False
hakim razoul anyway hakim scrawny one original,False
assume jafar zapping back aladdin complete wardrobe change original line say word prince implying prince longer prince,False
jafar scary enough easily weak point movie,False
think understood happened,False
bad part gilbert gottfried iago,True
gt saw dolby audiocolors great bass drop prince ali number maybe effective nonlive bass drop experienced least theater,False
rewatched genie claimed powerful universe,False
feel like live world pikachu say hell live world guy ritchie could let aladdin actually say look abu everyday see horse two ass deserve dammit ala still disney grave injustice absolutely loved movie tone perfect lead fantastic much fun want see,True
announced genie actually thing least worried movie totally board casting people need realize playing robin williams genie playing version,False
follow youtube channel kid target audience review kid film really trust people target demographic tell u good movie,True
oh yea loll b,False
skeptical new aladdin bad beauty beast remake awesome definitely go see,True
actually thought referenced cutting hand jasmine took bread shopkeep holding jasmine wrist aladdin came took hold saying want shopkeep replied yes put twist aladdin take bracelet,False
think none cut original movie hour half keep song still half hour pad want still find prepared much interesting song lion king instrumentation chorus used effectively especially build end melody crescendo king undisputed respected saluted give chill every time one accomplished composition disney movie,False
movie definitely fun watch favorite live action remake great job one smith best could genie making pleased smith smith trying remaster robin williams personally feel aladdin experience movie aladdin playshow disneyland always favorite rendition aladdin aladdin king thief personal favorite story hope live action continues far would say five hundred and ten,True
agreed sounded cool would love see effect used movie,False
also shot night understand faithful original would lot breathtaking could see everything clearly,False
guy fell wellhole thing,False
horse two ass great sure exchange good setup one jump ahead reprise guy said born street rat line really reason say,False
jfc song play end credit,False
wife said looked lot like eva longoria,False
way leave lyric rest u,False
saw movie real good bad review talking smith great job playing genie idea getting much hate flaw saw movie also pointing finger original movie well like wish prince really anything either movie also like last wish handled get turned genie wish original movie wish turned difference powerful genie mean genie like,True
damn thought dead,False
smith far best part movie let u honest great job filling epic role,False
eight year old daughter hated left early said kid asking thier parent leave idea true,True
like sped,False
enjoyed movie smith fantastic job genie liked made genie different animated version hearing friend like prince ali made want download soundtrack highly recommend seeing,True
jafar please shut jasmin reeeeeeeeeeeeeeeee,False
someone tell dog movie trailer making many screen blacked trailer almost get see movie,True
wait remake era disney sometimes milking nostalgia little bit much remaking reaallly old disney movie snow white jungle book 90 disney movie still fresh collective memory iconic fairly remade without copied may walt inspire someone disney board soon get trend,False
nobody left theater adult like ten people,False
gt sometimes milking nostalgia little bit much yep straight cashins make even awkward obvious play nostalgia shot shot remake really work entertain nostalgic audience boring create new story new generation please instead mediocre onetime cash movie younger generation honestly never remember,False
career dead,False
oh agree working premise understood live action remake cutting one song specifically prepared,False
quite thought please put mena massoud everything forever dude charisma charm scene meet sultan fucking dying give man shit ton work naomi scott already knew talented killed gave jasmine much version nailed original song gave great pleasantly surprised smith version genie took small direction robin williams version felt like prefer williams smith great job though still eh blue human version way pleasant wish gave little screen time dalia going frame movie care version prince ali visually great musically weirdly flat unfortunate sore thumb rest great friend like much lived original jafar okay absurdly camp original outright bad think issue he clear motivation original jafar put upon advisor simple sultan yeah machination rule kingdom kind get manipulate one seems pretty beloved competent maybe take time show motivation wanting rule overall remotely eh rt meter seems imply far away better beauty beast step cinderella wish let guy richie go little crazier direction loved moment visual flair best work since man uncle strong seven hundred and ten hope build strength remake,True
make man song need,False
really weird moment really cool visual really good original song wish added song broadway show cut song original well,False
dog movie trailer every single film lately give away entire plot well,False
new lyric prince ali interesting go talking animal menagerie convincing bunch religious probably married woman adjust veil grovel yummy physique also like barge palace instead invited wait asked smith enthusiasm slays especially towards end sound shocked number animal brought,True
see think may actually hotter buffy smg crazy know,False
seen comment may big deal audience however anyone else feel like singing whole new world carpeting around whole world like animation rather around hood,True
oddly enough kind feel like tyduk hei hei iago,False
dj khaled hit noped theatre like need messing disney staple either,False
article make seem like nothing getting cut finger crossed,False
seen comment may big deal audience however anyone else feel like singing whole new world carpeting around whole world like animation rather around hood,False
yeah agree really sure replied comment though haha guess wanted seem bit realistic trip around globe probably would taken week month,False
went skeptical came honestly loving people going compare away original part pale somewhat compared predecessor lago jafar come mind brings wonderful spin original story think people fence really need give chance smith genie easily favorite part brought nice mix robin williams style well work wonderfully especially cartoony scene character really shine grinning ear ear friend like,True
think might died actually dunno well supposed water bottom theoretically could gotten help,False
genie made gray area comment jafar needed specific else genie decide fulfill wish orginal genie know going happen 3rd wish version genie,False
nothing worse two bad thing aquaman dialogue song fix one remove best movie two thousand and eighteen,False
oh geez copy pasted without looking hah yes kind reminded u oh yeah smith song lol welcome miami flashed,False
live action abu,False
tried bring realism ground purpose live action,False
wanted power get revenge rule everybody pushing war sultanate,False
must missed something getting revenge kingdom something use bathroom really quick think missed something,False
watching movie get cast teeth jafar cartoon gnarly crooked teeth kind bared snarled dude nailed part character thought,False
awesome make tinkerbell effect right see thing,False
original specifically said wanted powerful genie world,False
wonder happened,False
yes genie think repercussion enslaved lantern version knew,False
want hercules remake maybe tarzan,False
funny thought couple different line movie like aladdin wish genie freedom delivery good original,False
saw yesterday literally first thing movie end pretty jarring unnecessary,False
bop head,False
wth bop,False
prisoner several year,False
ohhhhh totally missed bit okay bit clear,False
better thought still bland cast good really missed jafar much screen needed something better,True
tsunami made joke,False
dear evan hansen aladdin story,True
yikes,False
mena gorgeous infectious personality,False
think cast valiant job movie lack emotional depth original remember miss genie scene end original cried watched first time kid still get teary eyed even adult many year compare new one match even take robin williams equation wish hurry much making one maybe made mulan tarzan first taking chance aladdin,True
genie make prince look like one also genie sultan listen,True
apparently cuz captain guy flip flop,False
part jafar summons staff made think going full star war,False
ironically took movie disney movie known creating magic scene hour two believe everything say show matter outlandish realism last thing wanted aladdin movie,False
ironically took movie disney movie known creating magic scene hour two believe everything say show matter outlandish realism last thing wanted aladdin movie,False
man uncle,False
speechless one well camera work sneaky good time movie horribly bland others though lol,False
friend went expecting trainwreck came pretty entertained smith definitely butcher genie good job pretty true original difference obviously animated movie mean bit charm lost solid seven hundred and ten movie fun watching want play snes aladdin game,False
ben kingsley jafar would perfect,True
