comment,parent
objective failure everyone would need agree point laid many people making opinion subjective objective ninety-four audience score clearly lot people disagree rewatched animated kid sorry liked live action different people different opinion saw heart passion enthusiasm liked smith genie liked genie addressed whole ego trip aladdin go oh man cartoon ego trip way worse thought nervousunsure gift presentation hilarious even liked much love story realistic one fall love like three day,False
hate right haha,False
market going want bland white male protagonist sell ticket,False
"really dense care manga whatever heck going talking movie disney movie two disney movie titled aladdin original one thousand, nine hundred and ninety-two remake two thousand and nineteen hard understand stay topic leave",False
naomi scott hot,True
like bringing princess bride great example live action movie full whimsy feel like disney sucked silly fun took seriously aladdin picture,False
"nononono nuh uh aladdin disney aladdin based story like jungle book element original story cartoon adaptation totally valid remake one thousand, nine hundred and ninety-two movie yes exist vacuum influence original source material adaptation oh fucking make leave little piece shit",False
"gt element original story cartoon adaptation totally valid stop right wrong original post comparing two movie nothing else lunatic keep talking book talking disney production original disney movie nothing china greece russia save magic carpet scene aladdin fly jasmine egypt et al one thousand, nine hundred and ninety-two movie set middle east end story wiggle room",False
wow thought better original,False
gt honestly found enjoying much deviated original wished done lot everything essentially shotforshot original fell flat new part much interesting kind wish adaptation remake would take liberty rarely match let alone eclipse original may well aim spirit first literal translation,False
see interesting find auto tune bad obviously two thousand and nineteen comparison emma watson beauty beast may well live musical first bit cringy agree found stride got cave part worried turned best part smith thought killed ill honest die hard fan animated disney movie still watch regular basis twenty-nine thanks begrudgingly watched live action version see far best adaptation far,False
jafar looked really young moment got hand lamp smile looked stupid,False
shadowlands endless night good example lion king expanded musical motif original score well,False
felt jafar le villainous maybe lack expression compared smith genie okay part perfectly twelve way old animated genie twelve smith many year sister apart feel like giant age gap,False
damn commie tell,False
mean like dragonball evolution like last airbender,False
meant taking liberty done right neither two,False
loved casting except nasim pedrad dalia face look fake actually distracting know lot cast different mixed descent worked together nasims face americanizedlooking lip filler face filler botox obvious bad nose job looked place setting ancient agraba mention much stood next natural beauty bone structure naomi scott jasmine,True
really liked handmaid nasim pedrad dalia disagree distracted face full plastic surgery filler completely ruined,False
"movie pulling one thousand, nine hundred and ninety-two version element original story make relevant conversation",False
agreed count,False
captivated whole new world melody throughout movie love song also captivated naomi scott cleavage showing well love song sung either beautiful voice find smith genie cringy either fun movie surprised low score,True
ben kingsley,False
arab caucasian kept problem original kind agree face look bit weird though,False
yes great example surprised learn alan menken fact write jasmine new song normally good thing disney probably wanted next let go though right choreography anyone else notice,False
actually liked nasim lot thought mi cast jafar good final third rest film seemed corny believable intimidating figure like original lead perfect,False
know exactly talking,False
jam scene hardest laughed movie long time,False
ahhh still good,False
excuse arab,False
serious question anybody else think really give jasmine good reason marry aladdin end version original expressed desire marry love one mostly want sultan really seem seeking marriage original aladdin generally goodlikable dude made big mistake involving lying identity one even pretend prince take jasmine hair jewelry say meet get back dick move see reason would marry end version wanted sultan aladdin kind jerk jerk original animated version anyway,True
really wanted say perhaps would like see snakelike turn giant snake,False
give shit lamp rubbed everything exactly cartoon make new exciting,False
hell yeah brother respect opinion good look thing different angle adaption loved aladdin,False
never really put together idea four major character unhappy lot life robin williams fun entire time kid really pay attention life might bad awesome power suppose smith pessimism beginning really brought robin williams least way resonated better really brought slavery theme movie bettermore subtle way compared overthetop female empowerment jasmine genie would completely agree aladdin jasmine sense ennui beginning jafar dissatisfied well seen success making life doubt success continue ultimately lead becoming sultan,True
issue aladdin jasmine avoiding guard start movie scene good left bummed rest movie turned around found footing,True
hmmmno,False
must respectfully disagree hormone,False
okay would love link thumbnail header discussion,True
sixteen anymore using experience,False
seeing woman hot naomi scott point seems plain power,False
perplexed guy ritchie direct really wish sanjay leela bhansali direct epic like many shot tight many close ups thought smith pretty good liked comedic part wingman role reminded character hitched movie enjoyed much preferred never friend like song animation rather prince ali whole new world magic carpet ride much,True
go friend,False
arab caucasian indian,False
"plainly obvious even read post original point one thousand, nine hundred and ninety-two movie remake set middle east nutter keep bringing adaption set country like bearing disney produced aladdin movie go get fresh air clearly brain getting enough oxygen",False
movie okay overall first thirty minute rushed acting terrible flow bad got closer smith genie got worried worse going get boy wrong smith carried movie hard idk back feeling okay thought going cherry top shit mountain turned reedeming quality movie meme month ago reason see shit show,True
oh agrabah right exist take influence different culture specifically different culture influenced source material,False
anything last airbender took liberty term plot bad movie way little changed going,False
gt shackle realized fetish started,False
yeah awesome also want know double,False
woman hurt,False
metropolis gotham amp central city exist yet located america sokovia eastern europe gorilla city wakanda africa agrabah middle east rocket science,False
aladdin came going high school disney made many shitty movie 1980s beauty beast aladdin revolutionary many way plus christian kid allowed see anything pg sang score choir sang whole new world graduation song anyways loved movie love musical love smith love costume high production value love oldschool 1940s full musical cinematic experience love good cgi well especially animal great honestly past fantastic see liveaction also took two nephew seven nine dancing seat music bottle sugar soda movie either hiding face seat kissed scary part want look told ok laugh joke got good time enjoying movie like kid full immersion involvement story best part genie according seven year old think smith good job hate many people trash talking preview saying movie would suck good fun sang really well know sing quite hit swagger bwabwa oldschool broadway affectation robin williams knew well recreate awesomely good fun glad shared nephew,True
smith made quite happy role live long time multiple actor playing role mean many batman superman mention macbeth hamlet singing great reflected style fun showed everything really remember animated version well emotion subtlety would say half adult experienced movie child teen adult slightlygrownup joke robin williams adlibbed sad subtext apparent big kid smith presumably script add grown joke adult awesome anyway line really drawn robin robin adlibbed joke gag,False
cartoon jafar somewhat evil caricature drawn evil people immediately assumed looking snake staff live action jafar human evil beard evil eyeliner long pointy face hate say actor hot take hat stare camera like damn,False
good enough gilbert godfrey would odd hear voice also comforting,False
forget dungeon dragon movie best storytelling franchise ever 1000 book awesome character go original script time,False
call crazy casting white kid maincharacter nonwhite role first step toward madness outside zuko kid actor somewhat dull lacked richness sparkle animated version katara aang otherwise hard cram complexity layering happened last airbender season let creator write script consult every casting decision,False
gt jafar way young like creep sinister agree pretty creepy said going punish sultan taking thing love ie daughter,False
bit funny smith genie thing concerned going movie turned best part rest felt kind rushed part though liked others disappointed near complete lack traditionalarabian style music brought amazing color costume detail music source material western style sad,False
gt audience score mean rotton tomato actually read quick faceless account audience member single one time post giving five star generic praise go ahead click review see empty really throw word objective say rt audience score objective standard use honestly music alone listen soundtrack tell high standard broadway quality would say casting quality broadway play course fair number performance standard actor posse obvious attribute creative team looking obviously needing aladdin lead able parkour freestyle dance stop realistic buzzword meaningless time,False
comment improvement original laughable heartbreaking,True
yeah persian aladdin goddam arabian movie hollywood know difference indian middle eastern culture frustrating even seeing lot color clothing indian persian,False
aladdin actor looked bored,False
yeah jafar never actually supposed scary person extremely arrogant proud point comedy iago work talking parrot parrot mock movie generic villain,False
rebel soldier leia death star plan leia dun wan,False
"agree genie touched slavery theme well somewhat similar one thousand, nine hundred and ninety-two movie female empowerment thing absolutely terrible artificial sounded introduced movie make political subtle new speechless song seems made empower jasmine nothing story song way better",False
mean actually listened read lyric whole new world open eye take wonder wonder sideways magic carpet ride,False
least got carpet moving aladdin mach fifty oh wait offscreen,False
ah okay see difference noticed disliked objective fact difference noticed disliked meaningless great way conversation differing opinion,False
titus drag would amazing would faithful hell source material,False
ok permission enjoy,False
looking thank,False
bruh sonic boom would alert guard,False
thinking movie right really handmaid dalia another matter watching blacklist would sworn lotte verbeek play katarina look similar though,False
best review agree every point,False
thank middle eastern kept thinking look like rich arab housewife stop botox distracting,False
smith probably best thing actor movie cautious put really fun show without becoming wacky caricature could tell took role seriously pretty good script work scenic design beautiful loved sweeping shot agrabah groundlevel shot city merchant beginning fire dance scene aladdin jasmine looking cool think directorcinematographer really uglydistracting shot time multiple scene thinking keep camera still stop moving around much really disappointed music coming musical theatre background really disliked mixing voice sound right environment sounded like actually actor sound booth rather character singing fantasy world huge fan alan menken like believe super involved decision past composition silenced song reprise called pretty damn bad pop vocal style jasmine riffing sucked lyric sooo bland pask paul overrated despite good la la land work production would better putting beyond palace wall musical adding another handmaiden story edits fine nothing offensive nothing amazing sure loved messed exposition guess drag everything two hour day overall decent movie worth watch fan aladdin want see beautiful representation agrabah see smith pretty good job genie five hundred and ten,True
slapped make sense anyone,False
really comparing amateur adam jacob james monroe igelhart come singing going bad time lol tried put thought away ended pretty good time,False
jonathan freeman jafar voice acting stage acting good character,False
godfried godfrey lmao,False
pask paul overrated librettist idk,False
law updated thousand year one week event change playing devil advocate,False
song reprise song yes definitely cookiecutter shoehorned,False
could disagree,False
gt let u remake movie beat beat charm inspiration completely different concept set satisfying reveal end revealed intro actually genie new life handmaiden dislike even hint beatbybeat ridiculous assertion,False
yeah movie man,False
agree,False
literally gave example using information movie eg rule ok fwiw give shit sultan fictional world statement could anything even directly contradictory previously set rule information would care weird,False
yeah point thinking smith better choice,False
playful movie general often disregard rule,False
yes caucasian umbrella category european middle easterner north african south asian fall caucasian necessarily mean white generally physical feature save skin tone hair color put nasim pedrad group white woman would stand,False
absolutely satisfying reveal everybody saw knew immediately kid wife surprised must really critical eye come plot saw coming mile away satisfying genie become human end add nothing character handled much better original making genie obsessed handmaiden tell u anything character forced love interest mostly used comedic purpose inconsequential change besides adding speechless rest movie beat beat remake opinion soulless remake,False
evil beard,False
someone love aladdin liked annoyance song slowed lot emotion sucked delivery lyric except jasmine great job retaining emotion original,True
reminded mad max fury road get lol,False
must admit black man saw reply sat back said going good let hilarity ensue,False
holy fuck actually good wife nagged watch came knowing disappointed co unimpressive trailer good review damn good smith killed one else could pulled never friend prince ali well executed,True
also camp enjoying oriiginal watched original hundred time really really liked version song better original smith surprisingly killed genie someone else said explained genie want free much better original movie wait watch,True
broadway musical disappointed magic charisma animated movie thought talent bit weak fair see original cast like others aladdin alltime favorite disney movie plan see live action remake soon people saying mixed thing planning go low expectation hoping pleasantly surprised,False
yep saying buy course mean even slip tongue,False
arguing beatbybeat comment charmless one liked treated say however provide glaring example adaptation dissimilar original exposition even linked original ffs one merchant alone night trying swindle audience worthless shit introducing lamp one mariner kid introducing story beatbybeat soulless sure think exact nearexact remake opening scene wtf,False
wish explained limitation jafar sorcerer made genie powerful going seem like anything sorcerer could controlling weather genie power hand really lot smoke mirror aladdin really prince dress like one,True
oh man remember early day internet tried read disney secret like hahah rebel,False
tell fan original decade really break heart watched new movie last week sorry far good original even say made bad change,False
whoa originally planned babkak omar lad cut seems like lot take let u write music movie stage production obviously using expert terminology,False
would watch making extra feature big fan interesting,False
feel like shlock get away scene supposed discombobulate bit,False
see original cast blown away performance,False
gt robby haynes raz al ghoul think franchise bit mixed p robby haynes character named razoul ra al ghul villain batman,True
speaking believability major problem costume mean look nice people live desert people walked laundromat ready join costume party clean polished,False
gt godfried gottfried going correct people least correct,False
well shit really excited watch ever since saw trailer thought looked fantastic moment saw deeply disappointed watch,False
need pedantic clearly portrayed premodern culture,False
worked sync line never good idea play movie like 15x speed act like nothing changed,False
oh god forgot voiced bird could got anyone,False
super generic parrot still somehow able think enough riff going yet nothing free could easily solved showed even implied jarfar turned say friend servant parrot,False
googled naveen andrew alladdin lost fan think would far better jafar,False
aladdin lucky jasmine jafar really bad prosopagnosia,True
jafar upon time upon wonderland,False
marilyn monroe like hot level distracting,False
neck hairy would surprised commenting thread,False
oh,False
would still played fantastic almost crafty jafar creepy uncle jafar fire would genuine,False
stunned people complaining chemistry lead thought bursting screen half expecting fuck right got aladdin place first scene watch interview together would think boning irl,True
think jafar movie got terrible motivation seemed come nothing power character make sense,False
character way written foil mirror image aladdin great actor could deliver damn build end prince ali reprise turning snake pun see toy captor funny biting serious one note,False
proud boy unfortunate connotation,False
yeah believed genie hand maiden lol let u kid get kid movie forced,False
smith best part movie thought would good genie damn really pulled,True
thought iago jafar abu sultan cave boring fuck compared original random dance scene annoying settled fairly quick bad expected absolutely nowhere near quality original still completely pointless,True
disappointed jafar sing aladdin theme really one part waiting,True
disappointed,False
thank said put better write,False
prejudice saw trailer much famous hollybollywood sauceflavour amp x200b start negative missed supercool jasmine next rooftop aladdin streetcred missing thought helpless new movie despite futile attempt give woman empowering moment hated new song much political feeling almost look like tried strengthen female arab speak something spirit mind political statement film disney movie much combination prementioned helpless side jasmine amp x200b aladdin made puke first shot omg typical superhandsome guy fall forbelieve also look pure handsome guess real ppl like sultan really good cast rajah carpet iago also really cool amp x200b jafar total miss old creepy purely evil beautiful cartoon hard watch missed snake transformation old guy deceives aladdin cave wonder totally hated move spoke open two beetle half looked like anyone could walked missed evilness guy dutch like half could respect performance totally different feel hard watch downed rating movie least half point sorry cave wonder preexisting friendship genie carpet missed fundamental detail made love carpet ruby laying hand scary statue abu tried put back important eye cave roar touched forbidden treasure lamp feel like magical legendary cave amp x200b smith acquired taste opinion cgi could better though loved see magic ala like style general sure genie part good energy cartoon genie missed mostly absolutely adored robin williams think noone jim carrey similair actor could pulled must admit guy pretty neat nice different interpretation part love counterpart awesome chick make movie better loved daliah well casted good actress nice addition story mind love story though must say way smooth ruin first conversation hah sultan good liked fact jasmine wanted sultan noo menn go liked dancing stuff art department deserves big plume beautifully dressed room scenery could go detail think said lot already ah well glad saw movie would mind watching couch home come netflix instead going theatre movie get seven translated six critic kind generous shit thanks patiently reading shit also reading ppls opinion happy see different perspective,True
haha sometimes wonder expectation color experience movie moment like feel like went lower hell expectation still managed give think fairly unbiased assessment miserable watching like movie like wrinkle time walked like ten minute made incredibly poorly painful watch sure sequel made based jafar saying back shit end wish guy ritchie went back making wholly original movie grounded reality version least rocknrolla sequel,False
agreed empowerment shit totally miss seems helpless movie cartoon play along stealing scene outshines rooftop movement old one jasmine saw latest movie futile attempt strengthen weird cultural difficulty utterly unsubtle way contradictional way,False
wrote massive review sum three sentence love,False
cleaned clothes back even opening animated aladdin lady washing clothes also people homeless still looked dirty think clothes clean much reason like movie,False
love random redditor,False
ruined illusion looked like people soundstage burbank vancouver know washed clothes back come perfect parallelism thinking old john wayne clean shirt western opposed sergio leone believable dusty poncho matter hard wash live dust going dusty look lawrence arabia,False
really sad get baby rajah snake jafar,True
one start house attacked two submarine interrupt fish people politics three hiding sunken boat get attacked four arthur mera discover secret map black manta attack,False
damn gave song leg already leg like arachnosong,False
looking comment like totally agree,False
glad toned joke stand one reference current time supposed long time ago aladdin musical horrible movie thing noticed modern instrument reference disney world map least want talking constantly,False
enjoyed movie lot thought would,True
idk guy ritchie lot movie seem weird chase beginning dancing like sped ever slightly look natural like understand stylistic choice people,False
"much better thought would think deserved six thousand, five hundred and seventy rotten tomato certainly fifty-six plus smith shockingly great genie",True
enjoyed movie lot perfect movie see start summer never saw original cartoon version liked smith genie get many internet made like would awful genie matter would taken role would blue fun top kind character supposed smith pulled well,True
left theater thought well,False
speechless fucking bop one convince otherwise almost wanted cheer song finished,True
neva ave,False
least skeevy facial hair,False
take away jafar infamous cackle,False
biggest complaint man iago became aboveaverage bird repeat line spy,True
flat far good,False
smith comparison best part movie made abu iago forgettable jafar casting terrible aladdin goofy smile movie costume bright felt like bollywood movie speechless song felt place,True
shame ben kingsley would made great jafar going,False
much mouse dick need suck make happen,False
never seen original cartoon version child,False
wonder budget went big set piece bland cave wonder one room movie blue,False
gt costume bright felt like bollywood movie part really hoped would lean heavily letting aladdin become true bollywood movie disney budget could amazing,False
filmmaker perspective also changed directing style moment came across like playing music video disney channel commercial hamfisted marketing ploy,False
speed choreography fifteen time ninety dancing mix hip hop bollywoodinspired dancing kind neat everyone looked like robot moving unnaturally fast actually really liked smith genie music good except speechless would necessarily bad separate version movie fit musically released pop version credit also throw complete music video center film boy took,True
scenerybackground real live action,False
saying washing cat one context someone would say mean anything washing feline cat pussy synonym mean replace pussy cat work dirty joke ffs people easily amused,False
khaled arab fit theme,False
oh absolutely would would expensive sadly disney spared every expense,False
would love see side side photo looking see,False
one hundred agree noticed choreography sped randomly made look cartoonish bad way otherwise enjoy movie smith genie pretty good good amount charisma without going overboard though realize thinking smith rather genie whole time least favorite part jafar evil looking instead generic middle eastern ish bad guy four hundred and sixty-three voice really sell whole deceptive smooth talker original speechless song like said would terrible original one early reprise end almost groaned felt hamfisted could easily done whole jasmine sultan thing without heavyhanded felt place unnecessary way,False
