comment,parent
agreed everything said smith autotune noticeable song aladdin ranged flat mediocre jafar lame lacked presence way animated one whole new world dazzling visuals stripped away although admit movie version really good,False
gt plus looked like ate stack pancake put suit universe fat absolute unit,False
really liked movie one minor thing really bugged movie us song musical motif character whole new world aladdin jasmine romance arabian night jafar friend like genie jafar wish made sultan friend like play genie power happens wish sorcerer arabian night wish powerful universe granted first two wish victory jafar third genie piece switched anyways good time,True
sad get super close face camera people running guy ritchie tends signature shot movie definitely lacking chavs though,False
interesting insight noticed friend like arabian night,False
nah get married three,False
thought could tell actor bad writing,False
standard caveat apply unnecessary good original disney corporate greed would lying said enjoy mean aladdin twist thrown cook triedandtrue recipe hard screw mostly naomi scott clear standout talent megastar deserves get alist role jasmine wanting become new sultan good change well gave stronger goal add depth character also big pasek amp paul fan speechless fantastic song sang hell mena massoud good actor refreshing innocence charm today hero tend snarky jokester stoic badasses guy like something 50 keep working craft play long game smith genie solid great see loose funny lot joke fell flat actually would liked see lot hiphop flavor song making human instead free change loved gave dramatic weight jafar actually mind take highlight problem either made le cartoonish liveaction liked used street rat like aladdin lacked much personality actually depth guy ritchie competent enough definitely right choice movie number better others friend like gt prince ali make sequel would prefer different director come onboard fact given bad return jafar liveaction sequel would lot welcome eye opportunity actually improve original version,True
low expectation came enjoying parade introduction prince ali probably best scene really made fun spectacle lot issue genie even aladdin without comparing thought fun movie well made like new song jasmine really good voice rated six hundred and ten overall,True
never questioned seeing original animated film aladdin wished prince would need change law requires prince marry princess unless genie wish aladdin appeared prince real one genie power make real prince right,True
split new jafar one hand liked new characterization cool path somewhat similar aladdin sort made foil protagonist hint sort path aladdin could gone pure heart diamond rough decision make jafar apparently much younger really help reinforce similarity path aladdin said felt like got comparatively little screentime due iago really character recall really memorable fun moment got see scheming maybe misremembering thing actually got much screentime og jafar certainly feel like got much time limelight though think would make sense cut screen time considering added whole new character dalia thought kenzari great early part movie acting match script call really deliver third act needed buy kenzari performance conniving schemer machiavellian bastard working behind scene undermine sultan point film climax stop subtle morphs powerful terrifying whose lust power become insatiable get baited aladdin trapping think kenzari acting bad felt like almost stage presence way example smith need overthetop cartoonishly evil character say wanted frightening intimidating powerful sorcerer lacked certain kind stage presence made og jafar truly terrifying villain felt like range hit final note third act called performance fine stab back kind villain loud booming strike furious anger kind villain think also bit problem movie new version jafar hungry power warmonger merely want crown sultan want invade neighboring land certainly buy kenzari performance selfish conniving sure buy evil warmonger like wanted supreme ruler could wished land rule get impression intentionally wished control agrabah process sending army conquer neighboring territory would part fun want control jasmine homeland want crush really evil bombastic performance would bad thing ideally would want someone range either subtle grandiose depending scene call one feel like intense moment story call jafar loud bombastic,False
honest opinion coming movie steaming pile garbage except every scene smith absolutely stole show made movie worthwhile able capture abu magic carpet character however seemed actor struggling keep definitely watch,True
really loved acting choreography dance sequence really amazing job making feel like genie controlling aladdin broke immersion impressed genuine dancing ability,True
know expecting movie iago turned giant raptor greatest sorcerer world outlandish deal breaking turn magical world incredible feat routine every hour something heard song somewhere jafar horrible played great villain bought repressed impotent rage consumed coveting power think much three minute entire two hour movie filled dialogue let alone plagued awkward silence uncanny valley part agree specifically abu changed jafar moment take mind suspension disbelief way caused consider lowering rating absolutely loved everyone watched family friendly disney movie fun watching foggiest idea experience honesty feel sorry wife enjoyed little felt need ask trolling heard opinion differed,False
weird question seen orignal multiple time seen jungle book remake since came streaming platform never watching aladdin movie answer question,False
issue context wrecking disney classic promote personal brand breaking lyrical flow stupid regard making good cover shouting name music generally viewed endearingly goofymemetic complaint,False
well seen original aladdin ten time,False
pretty bad guy especially beginning dialogue felt forced trust line fell completely flat aladdin actor terrible actor also bothered tried make movie everyone indian aladdin middleeastern surprised disney let movie like beauty beast well done shame probably favorite disney classic,True
believe one skipped,False
gt mena massoud great aladdin wtf smoking,False
agree well nobody live robin williams aladdin worst part aladdin fucking terrible actor,False
really genuinely enjoyed movie thought beginning little clunky arabian night weakest song smith came little flat one really enjoyed rest especially loved twist jasmine politically minded wanting rule people rather allowed marry whoever wanted liked jafar top mincing old gay guy quality everyone gave cartoon villain back day thought guy great job keeping face placid still giving impression rage bitterness underneath complaint honestly wish would kept gilbert godfried iago felt absence keenly,False
good movie guess visuals great genie great damn really ruined made movie another feminist woman power agenda movie jasmine aladdin beginning good genie good everything else blowed especially feminist agenda,True
disagree balance people seeing aladdin know expect aladdin movie also character lean entirely new actor merit toe line think maybe bit much direct pulling old film overall let nice,False
whole damn movie tried indian made sense character setting supposed middleeastern know jasmine wearing indian clothing trying bollywood,False
lol knew would people getting bent shape feminist song people like clockwork trigger,False
actually liked movie,False
feminist song pretty annoying really add movie though,False
feminist song pretty annoying really add movie though,False
one would assume genie made jafar sultan,False
thought prince ali really well done far favorite part movie,False
lot better expected even smith genie way better expected one favorite part movie going told going make comparison animated one think helped enjoy,True
movie great significantly better thought would based marketing definitely enjoyable least smith really good job genie putting spin role skeptical going probably best part movie naomi scott great jasmine thought mena massoud fine aladdin standout mean bought aladdin think performance detracted movie think miscasted jafar andor writing good find compelling intimidating villain,True
better original saw original day saw one movie visuals weaker overall cgi laughably bad place way better character work really get clear sense aladdin jasmine jafar want absent original film notice go back watch,True
skeptical one going especially recent trainwreck dumbo ended enjoying fun watch smith great job jam scene husband laughing,True
definitely got mix moroccanindianpersian feel definitely amalgamation culture,False
technically speaking original aladdin story took place china agra city india movie blended inspiration several culture,False
like robin williams rip could always smith gave movie substance otherwise another frozencaptain marvel solo scene jasminereboot rip disney thought said going stop nonsense solo,True
become genie end iago get turned giant scary version chase jasmine jafar,False
beat beat live action remake every beat slightly stilted shittier none film justified existence yet lion king last hope,True
saw someone else mention forgot song comment bummer indeed,False
catch little saying remembered animated film put one like whole new world kiss fall carpet say yes thing like caught,False
caught three disney reference one obvious one map saying adventureland fantasyland also saw magic carpet building castle sand end building think palace fun thing threw handtassel inside sand made tinkerbell going castle like intro effect finally whole new world think saw pride rock least tree look like lion king bother anyone else jasmine jump pole like original wimped original aladdin putting something cross swing without help one gave disney ilm amazing animating animal figured exactly look real blown away recently far gotten jungle book mainly animal anyway lion king going look amazing even like dumbo animal one still lifelike,True
idea trying say jasminereboot line issue movie jasmine play larger role original sort developed character original,False
agreeing spend rest life someone might well lay expectation,False
slang exploded past week hate,False
think everything worked better two thousand and nineteen version exception genie song routine original animated version vocal visual range two thousand and nineteen able capture understandable reason smith probably good job could expected trying recapture magic role always going uphill battle initially thought vizier lowkey actually towards end probably actually worked movie favour,False
felt like benny hill video chasing sped,False
spot turandokht observation much aligned wife thought jaguar affected villain trend early cartoon nice way framing cataloging,False
think movie needed exist though far complete remake part remade generally worse original part like dance extended backstory larger world scottish prince better,False
blurted loud wth laughed still like music smith collab nice liked song actually,False
line movie genie magic really illusion stripped away character show,False
hard claim add movie spoke central core jasmine character arc actually led scene able demonstrate father quality necessary lead never evident original seriously subtract movie song scene arc basically got little hang ending aladdin get girl even would sultan willing let marry thief exactly wrong woman power agenda anyway detract aladdin still form core part movie master ultimately villain defeated get everything ever wanted end jasmine character arc ruin movie fault feminist agenda,False
better spaceballs,False
way watched musical thought jafar spot wonder,False
gt wrote reply another message similar vein reuse gt gt hard claim add movie spoke central core jasmine character arc actually led scene able demonstrate father quality necessary lead never evident original gt gt seriously subtract movie song scene arc basically got little hang ending aladdin get girl even would sultan willing let marry thief gt gt song nice leadin conversation leader guard,False
remember spaceballs 3d,False
fan whole female power thing disney trying need political message sprinkled onto disney movie jasmine voice good could care le lyric would rather fun song something serious especially even original movie,True
oh ya singing definitely better original one new cast singing talent seemed naomi scott honestly like speechless much song despite important moment played pacing characterization alone make film blow original water,False
gt saw original day saw one amp x200b well go never seen aladdin two thousand and nineteen version came unless grew childhood amp x200b remake could possibly better original disney movie,False
liked song,False
totally agree downhill battle especially reddit mean look next comment youekibekistanstan saying got bent shape bent shape saying honest opinion,False
thought talking rewind joke general specifically jumping movie bit,False
3x,False
disney remake looking forward became unenthused saw trailer wife forced go say reason thought going like ended bad good colorful movie lot hoping see aladdin live action music always likeable mostly smith trying hard funny actually likeable despite worry work bad shot shot except one additional song talk second could seen watching original one added nothing substance think remake would work better added different element like malefecent sort know story go actually went type element people may like say please read whole thing blasting extra added song sung jazmine awful first completely different sound rest song sounded like generic pop music america abruptly take movie furthermore message hitting head message agree really feel like disney cashing current movement real world furthermore message already made clearly le top wanting become sultan becoming sultan end anybody say message made loud clear country woman voice etc etc country going require scene taken andor altered movie going allowed play country anyways great message make hit u head song straight fit rest music lastly smith fine would say could replace one aladdinjasmine would care terrible meh,True
glad remade aladdin remake great put smile face smith fantastic one thousand and ten performance hope sequel definitely going try watch imax 3d tomorrow,False
agreed upvoted alone film great entertaining agree,False
true genie may simply known existence god also would genie make powerful god anyway paradox,False
two new song,False
think song sung different time thinking time jasmine sung,False
aladdin still form core part core part movie called aladdin nothing wrong feminist agenda add every single create whole new movie woman power slip every movie remake,False
might hairspray sort though since disney may something risky,False
oh yeah meant way looked like seat front 3d,False
thought okay great bad liked musical number chemistry jasmine aladdin,True
ya know person movie made people always decry disney remake long make someone happy one obviously think relished happy loved ill probably see soon,False
gt really liked white prince first come court jasmine guy fucking killed maniac perfect series still recommend,False
anyone else think mena massoud look like egyptian noah centineo,True
critic suck amp x200b two word exotic jam,True
think mena reminded gene kelly great singerdancer good actor wrote aladdin way way showed showcase acting yet effortlessly romantic effortlessly adorable far cuter print made,False
think song fan message think played well musically felt heavyhanded standing guard advocating helping poor could evidence enough convince father especially since song soliloquy hear character also feel vein original music maybe nostalgia care,False
holy crap jafar casting ton evil feeling naomi scott pretty good movie pretty good soundtrack,True
ok litertally got done watching movie writing sitting seat enjoy lot oeiginal coming ome grew original full stop one replace robin williams rip excellent job take character could feel essence character ever feel like ever trying copy robin good thing add lot think needed think ppl would unfairly say like original overall song great much better character development original jafar probably gripe remake original could feel intimidating evil one could notbut overall say go see worth onee sit,True
yea great genie blew away seen new live action aladdin know good smith genie musical epitome bringing unique style different robin williams,False
huge fan jasmin handmaid thought hilarious stole every scene also like changed arrangement song arabian night felt especially fresh part big fan new song felt different older one seemed stick little however thought editing second time sung awesome think actually favorite live action remake far one thousand and ten movie ended theater actually applauded seen happen,True
absolutely true mark looking something mad never cold independent believable top,False
loved joke genie continuing forget aladdin name friend like,True
favorite part jasmine singing going get driver license,True
considering work man uncle expecting lot action scene whole cave scene prince ali song brilliant though,False
oh gotcha,False
felt like actually good one minor plot hole jasmine could rubbed lamp instead sequence trying get alladin,True
heard khaled fled theatre,False
realized anyone else think song speechless could pas bond song sound like something could part bond title great song,True
pro smith far surpassed expectation genie provided seventy-five energy humor movie dalia also awesome genie relationship cute colorful beautiful look hilarious dance scene con absolutely awful new song sung jasmine questionable accent everyone agrabah quasi middle eastern accent jasmine aladdin jafar whiny insecure psycho instead intimidating villain jasmine aladdin chemistry ehh,True
agree opinion affleck batman bright spot bvs batman saw jl totally different batman bvs plus plenty wrong dceu movie batman would argue enchantress leto joker steppenwolf poor cgiwriting jl poor writing bvs martha anyone eisenberg lex worse batman,False
alluding,False
yeah bugging first seemed like character really desire treasure touching order break rule like aladdin necklace ruby,False
new song place like someone realized needed transition guard changing side could wrap film instead putting thought sensical transition hit u nowhere pop ballad girl power guard decide see error way return sultan message great even thought song catchy maybe bonus track soundtrack hit shelf plot point sloppy execution place compared tone scene,True
thank underrated gem deserves due one best original superhero movie ever made,False
god made universe exists outside bound time constraint universe made hence infinite eternal declares heaven throne earth footstool name jesus christ douknowhim coming soon much time left woe worth day see ezekiel three thousand and thirteen john three hundred and sixteen amp x200b amen,False
decide second finish movie,False
least five time felt like six even three still many time lame cliche happen,False
wow aladdin lowkey huge release recall thought coming much later,True
credit movie lol,False
really high hope chiwetel ejiofor scar feel like great job,False
asking sequel live action remake actually bad idea much like taking idea king thief flesh aladdin character appreciated jasmine necessary character change made aladdin one sidelined title character,False
movie needed hakim,True
overall thought good enjoyed aladdin alltime favorite classic disney movie next lion king beauty amp beast little worried first worked end first minute weakest think arabian night fine whereas like one jump ahead also like made jasmine afraid jump guess trying get become outspoken whatnot original think already pretty defiant made sad changed thought smith amazing job making genie thought movie improved moment character introduced fine jafar dhalia little plot cute well upset get jafar reprisal prince ali really waiting thought speechless little place song appeared movie loved actual song also thought great made genie human though guess mean sequel getting liveaction treatment completely fine good movie though glad went go see,True
liked prince ali feel like whole new world hold magic cartoon original wide shot carpet starlittered sky backdrop least expecting jasmine skim water hand flew water felt like let u go back forth closeup actor clearly gimble front green screen broll landscape night,False
sequence gladly accept shotforshot remake,False
right thought missed something setting exception,False
exactly wanted one great box office greatly rewatchable heard read one think way finger crossed,False
remember ago casting announced big rumor hugh jackman would scar one hundred,False
guy ritchie production popped screen idea completely floored,False
loved jasmine alladin perfectly cast loved chemistry whole new world throughout enjoyed two thousand and nineteen update jasmine character totally sultan,True
heihei moana,False
oh man kind imagining australian scar know feel yet,False
yes,False
buy reddit account ya know marketing firm approached account offered two hundred,False
first ten minute dire idk heck happened editing pacing pick smith good naomi scott good job song really shoehorned place unfortunately made story jafar action make little sense original genie first song prince ali arrival song really well done thought,True
every actor autotuned,False
think easter egg though mean caught reference nicholas brother,False
well decent dj khalid,True
got theater late walked tail end arabian night miss anything beginning,True
frank welker cave wonder abu rajah think first animated reprise voice acting original,False
audience score rt high ninety-one iirc feel like go movie ready pick apart enjoy different take animated disney classic like critic definitely feel disappointed unsatisfied,False
list 5x,False
honestly iago pretty scary,False
wrong,False
saw touring cast jafar previously played scar well fun little disney villain connection,False
youtube rewind better knowing thing,False
one actually fell pretty flat people theater seemed bored thought prince ali captured spirit original pretty well though probably agree one jump ahead awful,False
conclusion disney better sequel one jafar,False
actually thought might go mentioned mother second,False
judge movie trailer especially cgi one,False
well would necessarily need australian accent think hugh singing voice really amp sadistic yet showman aspect scar,False
yes sweeping jasmine hair gesture think,False
everything seen great rogue one firefly dodgeball wreck ralph one amp two zootopia moana etc also fantastic dollhouse another show cancelled time godamn great dollhouse,False
"gt jasmine solo number tried picturing one thousand, nine hundred and ninety-two animated form could much like beast solo song live action batb reminded actually really liked song shoehorned pretty awkwardly",False
link disneyvevo youtube playlist anyone want go back 90 2000s smith use rap end movie dj khalad two thousand and nineteen loved need release another album,False
seem like actually fly around world whole new world,True
wish filmed stretch fall carpet aladdin first kiss movie actually made really appreciate good acting animation really liked movie although mena could sing naomi especially naomi superb naomi scott going big star life going change overnight acting tremendous great adaptation hat guy ritchie,True
guy ritchie filmed big snake scene king arthur sure want,False
yes momentarily turn mummy saying bringing people back dead,False
notice prince genie created background color similar fresh prince beliare pink green,False
quick question rajah tiger remain dead end movie,True
right curious whether still rule kill anyone,False
along ending short dance sequence credit,False
overall liked movie however three thing like one iago brought back gilbert gottfried two opening scene used agrabah palace middle desert instead middle ocean three think wayne brady would better genie smith think smith would better jafar,True
sherlock one amp two snatch king arthur legend sword man uncle give shot though exactly quality loved every one entertaining like style nice change pace loved scene sherlock two game shadow,False
overall really sweet fun movie good ninety-three version course thing really worked one naomi scott beautiful killed jasmine speechless song fit massoud also quite charming ali new girl aka nasim pedrad hilarious two smith mostly good awkward moment def felt confusion direction friend like prince ali absolute banger made comedic moment really work especially jam speech three tone film whimsical nice take live action jungle book beauty beast felt serious time bollywoody cartoony overall played strength four costume set design also really fantastic script direction mostly good weirdly paced moment jafer bad advertised finale also felt bit lackluster much better expecting said make want watch ninety-three version,True
smith never disappointed film seen looked great trailer tone aladdin recognizing excited lived exceed expectation bring sequel remake,False
first trailer occasionally final render time thing still rendered day release example like comparison gotg one ape cyborg necessarily mean final cgi great better likely long video trailer v final film thor ragnarok spiderman homecoming jurassic world fallen kingdom justice league black panther,False
notice colour fresh prince colour title logo fresh prince belair smith made fresh prince,False
jafar said powerful universe something like little grey area specific enough genie theoretically one powerful being universe soooo,False
