comment,parent
plus sure mena could rocked like adam jacob song special also kind glad attempt one,False
gt fun watch endgame lol,False
goddamn turned jafar grima wormtongue,False
one trailer original audio compared new trailer original animated scene side side exact sound file,False
say bad purchasing good movie good original disney would win situation,False
exact thought enough ritchie expecting snatchaladdin mashup lol,False
smith great genie role cringey favorite songdances friend like prince ali vibrant color choreographycinematography top notch naomi scott also really great jasmine man gorgeous,True
rdouchebaggenie,False
one thousand prepping aladdin two,False
whatever make feel better,False
mistaking billy magnussen making joke,False
maybe wrong know feel like making genie human jasmine marrying aladdin kind closed story,False
played voice iago,False
purchasing movie think good would make feel better guess seeing identifying side based purchase make feel better antidisney,False
yeah pretty much voice iago,False
antidisney really antipeople like disagreeing people time backfire end day feel slimy suicidal,False
entirely opposed live action remake artistic vision whatsoever,False
even remember slow mo fast forward cut sound like classic guy ritchie overendulgence forget snatch lock stock scene one rotates camera around yaxis absolutely reason,False
gt way better beauty beast live adaptation reeeeeally low bar,False
said enjoyed make sense would buy movie enjoyed right,False
hand maid dalia nasim pedrad iranian descent,False
totally make much sense,False
hearing conflicting report prepared ill pissed,False
actually really enjoyed movie set amazing mena massoud naomi scott even sultan became pretty charismatic character movie went manage screw marketing bad still bit skeptical jafar understand going different version bad guy feel like whiny kid sometimes overall might favourite life action disney movie yet definitely liked batb,True
one hundred agreed plus music sounded like theme park show karaoke version thin cheap sounded like kid made bedroom shocking amp x200b heart illusion one,False
completely agree smith really stole show put personality passion role might compare legendary robin williams would really aim surpass respect smith touch role instead trying replicate williams also thank end genuine actually made feel quote moved final get jam voice style great,False
yeah check,False
director def made choice bad choice amp x200b like absolutely cringeworthy terrible 3rd act choice,False
genie shackle metatexual commentary disney contract,False
personally really liked intro arabian night felt powerful panned agrabah,False
changed chord underneath whole new world world would change something beloved fan insane,False
explained perfectly song felt place honestly felt like let go jammed,False
laugh honest reaction endgame felt stupid mean aladdin felt stupid kid movie guess endgame lowbrow adult humor,False
plastic disney plastic like made new technology animates action figure heart real love illusion selling nostalgiainacan empty,False
difference singing skill jasmine turn sing whole new world jarring chuckle,False
okay marketing smith disservice pretty good way match robin took path mostly worked liked friend like arabian nightsprince ali yeesh moment singing mena solid enough naomi scott favorite part movie chemistry mena okay best voice fantastic although meh speechless good song bad fit felt like watching greatest showman kind threw decent pop song movie went different direction jafar would preferred showier schemer animated movie guess marwan kenzari alright given lot weird direction choice really like one jump prince ali least favorite musical number movie going get geniedalia thing entirely sure many issue beauty beast watch lindsay elli video think aladdin good jungle book cinderella recent disney remake worth watch smithnaomi scott capture magic animation solid six hundred and ten,True
song adaptation really play smith strength turned great,False
actress iranian iranian tend fair skinned,False
gt fan slowmo quick fast fwd used gt work specially one jump ahead aladdin jasmine take wooden cart moving slowmo singing slowmo going get movie guy ritchie directs inevitable death tax guy ritchie speed ramp,False
w f n eight hundred and ten,False
agreed storytelling horrible put entire intro jafar finding cave wonder first time montage jasmine new song right tone aladdin universe lighting absolutely amateurish moment answer dp unbelievably unexperienced 1st unit dp choose aladdin look rather natural charm actingsinging ability real humor film awkward humor forcing aladdin genie awkward talking woman many cut action scene know fact full take music sound like sixteen year old made bedroom think adding smithisms genie character song good idea something would immediately ridiculed laughed cgi genie incredibly bad high profile big budget film set look like set costume look like costume jafar scary even little bit hire guy ritchie known stylishly successful ultimately heartless emotionless film direct aladdin think loved aladdin,False
enjoying thing grrr,False
show contrast good music trash music,False
naomi scott naomi scott like almost naomi scott scale one naomi scott,False
genie deliberately fucked using grey area excuse,False
probably aquaman kind movie five six time two character talking something behind explodes action scene start,False
guy also said wanted make kid movie child lot director tend given opportunity,False
well interesting take,False
tell princess bleed,False
view agrabah great feel singing lent good time think biggest issue film come isolation v package isolation song set feel right immersed world everything work well opening quite yet one jump enjoying everything,False
yeah mind going fast dance number work like combo slowmo work,False
changed chord first freakin line one jump ahead reason make better,False
jafar kingdom heart game well,False
oh really also responsible ninety-one approval rating verified account rt,False
read wrong first thought said one belting whole new world mad alone get,False
fun fact robin williams may best genie second best actually guy,True
fun fact robin williams may best genie second best actually guy,True
verified ticket purchase right would argue anyone rushing see aladdin early probably also part target audience hence higher score say deserve take thing like consideration well,False
pleading watch movie saying going watch movie go already hating smith performance think good one sure got smith personally money,False
people could also disagree,False
alright disney hack got score eighty-one audience really matter way look guy idiot,False
yeah still believe conspiracy angle could touch ridiculous saying could still drop,False
wtf good mean,False
director claimed timethey gave key point hit got way let riff,False
seeing glimpse oversized iago trailer knew would climax instead cobra jafar really bum,False
yup added drum whole new world,False
kid bop anymore bang eachother meth,False
ugh shame,False
original end aladdin two three,False
wow naomi scott really acted circle around mena massoud kind charisma vacuum,True
went expecting hate first hour average time better expected amp x200b came whole new world amp x200b fuck disney win love,True
funny thought arabian night really good friend like prince ali let down compared original,False
genie made jafar genie got feel try return jafar jafar would retaliate either making genie genie aladdin vengeance tricking sequel involved human genie jasmine going whirlwind find free genie aladdin would fun hell,False
came across tweet said sultan looked like joaquin phoenix gluedon beard know really,True
wrote full review gist movie look amazing excepting blue genie sometimes smith work genie let work strength instead emulating robin williams naomi scott jasmine probably best part film,True
liked naomi scott power ranger,False
parrot coming lol iago got dragged lamp happen cartoon version since watched,True
holy shit joaquin,False
oh damn depressing,False
people theater lost sloooow part prince ali bollywood dancing scene also pretty badass,True
expected alright wow factor guess generation may seen original might pas enjoyable magic thing original part genie specifically written williams mind rather cast fact think original love right faverite time list know word word think scene williams riffing adlibbing fun animation drawn around rather drawn first scripted smith element fun contrived guess would matter played part would hard follow williams creation least attempt point even making film apart cold hard cash course hard watch live action remake original classic close people heart ok nowhere near bad dumbo film actually offensive memory original better beauty beast high benchmark mean,True
ohhhhh yeah waste he way talented relegated personalityless bird,False
gt song okay one jump ahead issue voice getting drowned saw wife last night verge leaving agree audio hard hear song time like background noise drowned smith also vocal range power carry arabian night either jafar threatening slightest either,False
yes get dragged lamp cartoon,False
jesus christ massive hate boner movie,False
fantastic,False
one thought jaafar great first scene badass lot development people complain avout snake missed oldman disguise jaafar tour rewaaaaard also yago reduction,True
saw february two thousand and eighteen grinning like idiot every time stage,False
ruined overwatch league grand final last year man need stay fandom belong,False
gt arabian night gave chill listened google play day god,False
yup filmed place city fun,False
side go hard love,False
would personally way smith genie,False
nah thought jafar easily worst part film nearly intimidating imposing could take seriously villain,False
live action dbz frieza stay form one whole story please,False
feel like lot people keep saying one actually know sure lol ever even confirmed internet eat another rumor,False
mean time leave anyway lol,False
question everybody mind amp x200b smith well robin williams,True
jasmine wished infinity gauntlet snapped everyone away silenced song,True
enjoyed hoping would gone full bollywood musical number pretty fun movie smith pretty great aladdinjasmine well played downside music wise one jump ahead felt really clunky like enough music shame one underrated 90 disney song,True
ooohhhh thas hot,False
alright,False
scene beginning aladdin discombobulates people underground boxing ring,False
look like pretty grain great time pretty much enjoyed entire thing aladdin dancing scene jasmine sing especially great honest really remember specific plot point original weighing aladdin memory game either way great time recommend pretty much anyone,True
friend watched 10minute preview offered hollywood studio disney world noticed sped slowed everyone looked attributed potentially early cut saw movie looked equally awful,False
definitely felt like mix bolly hollywood little bit really enjoyed,False
trying,False
holy shit actually name drop movie,False
fun movie pretty surprising seeing hate,False
congrats daddy sigh dun wan,False
honestly loved movie jafar weak point,False
loved really thought mena naomi great chemistry loved genie moment gt rewound movie go back see abu hide lamp lt great first meeting prince ali jasmine awkward funny,True
wrong,False
thank come another one,True
mean slapped,False
grey area genie powerful full stop,False
would glue beard,False
jasmine holding back subtle nod film commitment female identity refusing warmth lover hand prefers stand alone belting independence icy uncaring void,False
gt look like pretty grain grain thread least,False
literally walking screening back screen behind heard another one burst laughing,False
damm girl sing,False
happy live world see package deal unserstand mindset remake ruining original ruin movie already made two movie nothing wrong,False
eh one best agree good yes nowhere near best,False
scene aladdin present salton jasmine uncomfortable scene sat xd big cringe put hood eye,True
aladdin dy,False
thought incredibly bad robin williams like people seem attached grew dubbed version writing movie absolutely appalling rely lot tell show instead way around fail develop every character jasmine properly many scene iconic made develop character like aladdin abu feeding child saving princess getting arm chopped talking freedom etc rushed dumbed reduced blinkandyou willmissit moment cringed lot dialogue consisted hey mother dead parent dead friend monkey see alike fact character development movie botched one point aladdin make deal obviously evil undisguised jafar later act like total jackass consumed power caring power sure really pure kindhearted diamondintherough character original like writer focused much jasmine forgot character arc aladdin arc overcoming insecurity streetrat unworthy marrying jasmine none really given time explored speaking jasmine really going strong empowered woman thing mean zero problem strong female role model movie much next guy think mulan favorite disney princess actually tell show tell lot jasmine get entire song poor stayinthekitchen silenced woman many people seem praise song hate one say find cringeworthy yes need strong female role model way blatant political message shoved face comparing mulan great character arc development revolve around booby want show worthy one show strong female role model simply one motivation rooted desire protect everyone love desire want rule city woman oppressed silenced raise voice worthy voice filthy men show tell anyway biggest gripe movie biggest genie nothing smith robin williams genie character shamelessly completely utterly shattered adaptation beautiful thing original aladdin opinion great dynamic aladdin genie watching original movie loved seeing budding relationship real heartfelt started cry horror genie said nobody asked like genuinely felt touched started considering aladdin true friend even end movie really took genie relationship aladdin home original much matter many thousand time watch scene start cry like baby beautifully written touching new one producer seemed think meh want see aladdin genie become great friend guy gay lol much better improved version genie explicitly aladdin friend tell much face also help aladdin unless something going worry replace entire dynamic love interest genie fuck disney real progressive making whole movie woman strong exist find price step back make female character solely purpose generic love interest word describe much insult think movie original work bad,True
trouble adding detail lot time feel like added placate people internet want write twenty biggest disney plot hole listicle also add problem give like townspeople paid praise gaston add story take away charisma gaston character make good villain also make sense everyone willing follow battle castle think actually hero great man eager listen,False
really cartoon realises developing feeling bella want give present spending time cue library scene live action like book like stupid kind show library,False
true specifically created character mind get agree role showed clip animated genie robin stand,False
never get away,False
would give solid seven hundred and ten main actor fit role quite perfectly especially naomi jasmine song pretty catchy love new rendition whole new world overall pretty enjoyable although part might feel dragged critique jafar villainy enough soso cgi one place scene jasmine suddenly break singing detained way everyone shitting beauty beast lol bad dumbo way way worse,True
gt guy play jaffar look exactly like brett flight conchords like uncanny kept expecting say something funny totally devoid humor ah knew looked super familiar,False
genie blue,False
reason easily could,False
gt iago barely talk boy alan tudyk disney goto voice actor day king candy k2so shifty weasel zootopia big hero six apparently,False
hey washing cat subtle vagina joke child would miss,True
yeah businessman villain wanted kill big hero six bummed alan tudyks iago line love alan tudyk,False
thought thing thought wow would thought joaquin phoenix except would remembered seeing name cast list,False
think singing really flat like going hoping see fresh prince energy song barely sounded like cared,False
gt felt like watching greatest showman kind threw decent pop song movie movie lyricist team dear evan hansen starred son film producer think song pretty subpar usually one song one actually work every project,False
thanks,False
actually found jasmine character refreshing part movie see statement anything acted reminder actually come far last thirty year,False
play lot original song,True
actor play amahl farouk legion barely tell,False
music one child grew loving song really want original remake please disney,False
animation better storytelling better huge team people wheedling animated script year time liveaction film one two screenwriter coming script short amount time,False
leaf wind squawk,False
sorting best response saw either lukewarm stupid joke negative opinion sorting new commenting see quite people enjoyed movie,False
mean yeah jasmine felt far like fleshed complete character movie wished made say le stuff stuff good thing really worth anything stole lamp really great moment still think original rendition jasmine better even unsultan glory jasmine character would silenced whenever discussed forcing marry either sent personal tiger suitor told piss go jump balcony ran away threatened execute whoever felt something awful proclaimed loudly look discussing future prize even jafar take hold lamp still taking bullshit refuse bow enslaved throw wine might demigod could destroy father strong woman definitely silenced singing loudly giving heartfelt speech everyone voice silenced thing prove people take crap definitely like jasmine earns title sultan end new movie new addition put spin original story feel would much better earn since really much except talk deserves title first female ruler something nothing else,False
disagree jasmine original actually say anything literally nothing even song,False
fuck wtf stand,False
think jasmine character moment biggest one ask,False
loved smith friend like prince ali new world great naomi scott new song good feel like fit could listening twenty year like rest,False
original new one,False
agree disagree find original jasmine great character right even proactive aladdin,False
agreed,False
though three day left marry resisting ok would forced law say must married prince next birthday worst case scenario jafar would married hypnotising sultan aladdin genie burst prince ali fabulous parade ran away know even apple cost money got rescued boy hand cut subsequently captured taken back palace fell love prince would married next birthday except got discovered fraud went save day caused sultan change law would done whole saga men played part give voice far see,False
yes,False
believe two new song add,False
gt worse pitbull singing africa actually happen,False
naomi scott belting shit whole new world new favourite thing,True
enjoyed smith genie certainly level robin williams made genie fun entertained whenever screen mena massoud alright aladdin best actor charm fitting aladdin naomi scott jasmine perfect good actress good singer incredibly beautiful never seen anything looking forward seeing stuff future loved new character dalia nasim pedrad killed role stole every scene also enjoyed billy magnussen character screen time limited silliness buffoonery nice addition film biggest disappointment jafar clearly miscast role think writer director actor favor either omitting prince ali reprise sorcerer jafar turning giant snake unforgivable jafar complete utter disaster also quite disappointed iago totally wasted alan tudyk giving iago line would give six hundred and ten far good original glad watched fun seeing live action pretty entertained start finish said think movie would watch point,True
said way contradicts said clements musker eric goldberg said improvised riffed everything recorded sixteen hour improv picked wanted goldberg called script roadmap giving important plot point williams needed hit,False
id give seventy-five ten like parkour antarctica fast motion first musical sequence worried smith thought really damn good amp mena naomi nasim great role also come 4k blu ray hdr movie pop screen color film gorgeous,True
actually thing resist would never met aladdin married first jackass father gave hypnotizing sultan desperate measure jafar said would obviously marry anyone even law said jafar around would father considering sultan decapitate tell movie mostly trying find prince marry taken care law say yes sexist say take care jasmine yes mostly helpless jafar aladdin first scene show perfectly jasmine jump high aladdin final fight show perfectly jasmine aladdin incredibly utterly helpless aladdin win end fool jafar making dumb wish big difference aladdin sheer luck finding genie carpet otherwise would dead movie focused male protagonist jasmine opinion never generic love interest exists marry protagonist save problem technically thing either,False
think ruin first shot shot remake movie existed fail see point,False
smith actually pretty great vocal range song pretty disappointed opening song,True
thank god left,False
prepared thing super vague rumour later contested lose hope,False
"right let preface saying officially second willenium smith stole show despite online hate meme surrounding initial look portrayal famed blue genie version friend like prince ali instantly memorable also staying true paying tribute classic version performed robin williams one thousand, nine hundred and ninety-two animated version two thousand and nineteen version aladdin quite hit high original come close song movie stellar arabian night prince ali giving chill scene main cast also great naomi scott jasmine amp mena massoud aladdin solid chemistry scott turn great performance entire character jasmine much characterization animated film major plus massoud hand show serious comedic chop chemistry smith main source comedy throughout production design film also absolutely breathtaking vast set feel absolutely lived costume give sense realism one area film fall completely flat treatment jafar marwen kenzari amp iago alan tudyk arguably two best aspect original mean cut prince ali reprise god sake like jafar big moment shine place bland evil villain speech much love tudyk think could ever topped gilbert godfrieds performance iago ninety-two version overall aladdin really fun ride definitely worth seeing big screen musical number guy ritchie please read make man youncle two money make please thank sir",True
gt hypnotizing sultan desperate measure jasmine resisting jafar said anything desparate measure bird brain idea married would become sultan crown would even passed sultan daughter would go whoever married,False
notice dance sequence almost seemed juttery could tell like directorial choice theater fps issue,False
maybe get prince ali reprise jafar could sing,False
genie like martini,True
damn reaading review made little excited definitely see theater,False
one question doe jafar turn giant cobra end,True
skeptical hope come huge proponent thing disney actually really fun time definitely best movie still good original also straight remake change made narrative hope enjoy though,False
still point jasmine would marry anyone thing control jafar took enslaved yes society life extremely sexist ancient arabia jasmine much fighting see unfair try much new one appreciate would much better message explicit like woman woman rule go back kitchen jasmine stay cool end,False
forty-five year old male target audience enjoyed film nephew mother,False
awesome weird idea people seem think movie made million people world wanted live action remake aladdin mean affront life,False
absolutely loved movie,True
say name,False
definitely director choice mouth moving regular speed scene sped little,False
anybody else feel first half felt like watching broadway musical genie came story felt like actual film,True
umm specifically mention incredibly well read proud library,False
could used white washing tbh,True
without intervention genie aladdin would forced marry law standard country would tried resist law would prevailed,False
lol said perfect liked,False
think character moment worked developed properly shoved like understand wanted sultan going go speechless going need change fact even understand money start,False
actually liked change made jafar seem smart wish genie moment nice foreshadowed aladdin wished prince,False
unless father last minute decided new version course jafar would manipulated sultan try force marry end movie still refuse without intervention would dead,False
prince ali longer slave soundtrack grown faster expected,True
original felt like musical changed stand routine every time comedian genie appeared one changed blockbuster every time movie star genie appeared,False
true irrelevant og genie one hundred uncut unfiltered robin williams energy,False
probably would scary intense kiddy day,False
doubt would remove song far added song,False
hey hey disney would never esteemed actor like alan tudyk went juilliard,False
ah damn minus one star,False
yeah hell deal sped action first song almost like dicked speed post match music felt amateurish,False
jafar turn giant snake scene play,False
bucock,False
spirit lifted know chiwetel pipe kill since good kinky boot,False
alladin two three good,False
aladdin jasmine abu take lamp flee magic carpet jafar turn iago giant iago giant iago chase agrabah get lamp back admittedly cool scene cool giant snake jafar,False
