comment,parent
delightful really expecting reaction like could take leave disney princess movie really get everyone fascination frozen even though pretty good one feel like able focus fun cute surprised emotional still landed music liked right away even though let go still slap think liked song song last menzel powerhouse voice unknown show instantly better lost wood perfect ninety r amp bpiano man music video needed honestly probably favorite part movie tie found next right thing really poignant song depression losing someone important think love fragile could one best thing heard kid movie teach kid love long time really tune get classic disneyprincess fan rock thought really fucking cool watching elsa tame elemental familiar throughout movie like gale pretty chill first btw gale force wind get thanks bob burger fire newt super cute cool scene thought taming water horse scene really well done also unintelligent comedy relief character walk fine line really like olaf character meta knowledge also currently struggling existential issue like idea luiz antman disney princess universe explain old movie put disney finally holy shit talk water animation shot dam flood thought might real animation altogether point magic look great scene focused water incredible anyways perfect certainly liked first one tight one hundred and four minute nice plot felt succinct really care twist least one involve someone present movie feel like guessing game right would say strong seven hundred and ten,True
brendan urie fucking sing,True
man whole time kept thinking beautiful movie far come silly honestly loved frozen one recap olaf 80 rock music video kristoff reindeer cracked shit,True
next right thing hit like bus man tear wife one,True
saw enjoyed first one animation fantastic,True
anna climbing cave part thought leaving one earth monster buttholes,True
show absolute showstopper expecting 80 power ballad incredible,True
jonathan groff music number lost wood reminds something eighty ninety see peter carera sung song westlife covered,True
good,True
take moment appreciate man krisoff straight elton john eighty power ballad god damn cheesy top right way,True
got home really loved beyond impressed animation plus tear laughing couple point really glad made sequel unknown even best song lick sure stuck head,True
listened soundtrack movie kept thinking lost wood sounded like foreigner song glad disappoint show great song animation somehow even better,True
yeah idina menzel vocal amazing kind wished pushed song instead unknown understand,False
trying figure feel movie think good lacked uniqueness first film frozen special sort challenged norm traditional animated movie one really although still definitely good visuals beautiful also weirdly satisfied elsa finally let hair always thought would look even prettier totally,True
music elton video boy ii men fucking beautiful,False
disney really said god woman huh,True
youtube lied spiderman,True
holy shit samantha joke land weird sitting nobody laughed literally nobody olaf,True
olaf starve give know disney like put joke adult damn dark hahaha also olaf great never big fan might favorite character time around,True
appreciate took mature decision movie like finally learn reason parent journey wanted learn elsa power tough see dealt thought fairly dark disney movie also felt anna kristoff subplot kind afterthought wished could incorporate better,True
mediocre first time kid theater laughed shouted samantha hole opened chuckle,False
loved magic ever since first trailed dropped february would hoping would see happy love story ancient magic feeling merely hinted first film really came one elsa fifth spirit bridge world mankind magic nice touch loved thing would searching whole life turned think important message discovering knowing important growing understanding world around,False
theater went nut,False
hoping sequel good better original time let go,True
hand joke got many laugh theater,False
enjoyed movie first song better animation story plot hole,True
made much better imagining jonathan groff performing groff style humor,False
worst four disney sequel come last two year,True
holy crap got dark towards end woman next practically sobbing sync anna,True
kristen bell rule arandelle good place,True
mean anna elsa first biracial disney princess,True
anna song crushing darkness feeling like go might one darkest song ever seen disney film really appreciated enjoyed included,False
anna kristoff subplot funny leading proposal felt like actually got proposal shoved ending really quick like even get scene emotionally overshadowed anna finding elsa alive,False
disney hold back dark theme beautiful see character navigate mature emotion though think movie good job portraying family friendly way keep next right thing,True
yeah still totally sure feel yet rewatched first one day ago one far cohesive plotwise main plot nation felt really underdeveloped whole five spirit thing felt really pointless mother thing felt kind tacked etc elsa always steal show thought anna olaf pretty good kristophe kind unnecessary song pretty funny probably least favorite bunch fine though music show pretty damn good unknown great verse actual chorus still weird enjoyed movie good bit though,False
agree felt rushed end,False
loved movie callback elsa finding hip swinging walk first movie pretty funny,True
valid complaint movie elsa get horse even though anna family horsegirl energy,True
came left field worked,False
believe thanos managed snap olaf frozen ii solid nine hundred and ten little fast paced thing wish explained good job disney made hella good sequel,True
terrible missed anna dork like first movie aside misunderstanding kristoff ugly cry later seemed much composed general lost wood amazing though kristoff man,True
unknown best one think anything memorable first one especially since pretty specific situation,False
fun movie anyone else get annihilation vibe first walk enchanted forest half expecting screaming bear sneak also scene towards beginning carriage anna check see olaf elsa asleep suggestively asks kristoff want got lot reaction adult theater someone near quietly said fuck,True
olaf asking existential question kristen bell really made want see would good place,True
plot hole loose thread contrivance,False
would best friend jeremy bearimy,False
getting serious ragnarok vibe decided knock dam arendelle people place,True
really torn movie animation astounding music par first plot much potential story could get level original new character handful line forgotten troll bigger part explaining forest also help feel sister swapped place end elsa regal ready political queen imagine living nomadic sami village ordered castle arendelle anna way carefree open would blast moving around seeing new place considering kristoff raised wood troll would right home forest anna elsa meant bridge magic normal like ambassador normal sister go magic land magic sister stay normal land quick correction credit scene description say,True
signature song disappointing,True
ok movie big problem adventure movie little adventure character place almost immediately needed sense going pace like hopping next zone step away another one feel like emotionally flipflop easily except sequence like example anna knew elsa froze death even look like devastated looked devastated losing olaf also seem emotionally dry scenario like ending scene cut anna getting queen automatically fine elsa away first movie first part movie talking feeling togetherness basically could feel like cut chunk exposition somewhere big missing lot story beat rhythm maybe fit running time two hour know believe kid able tell adult everything fastpaced would think solved whole situation two day added screentime king queen kid make audience feel impact happened past still ok film something disney made look like adventure film frozen one adventurous note frozen two lastly miffed pushing unknown song movie clearly show sequence amazing reason think pushing show spoilery sequence like final leg movie,True
olaf absolute charactrler,False
loved tone movie felt mature olaf provides comedic relief needed overall really enjoyed,True
yeah death talk seemed really noticeable elsa flat saying blame parent dying tough olaf temporary death way staying dead actually wondered filmmaker going bring back changed design something bit easier turn toy animate future,False
agree specificity thing think first time forever want build snowman worked pretty well lyric pretty clear still super catchy tied plot stuff really,False
elsa charging ocean immigrant song play would great,False
olaf reenacting event frozen amazing hilarious,True
big let go unknown definitely signature song,False
think lost wood going hang around long time male power ballad mix sincere tongueincheek energy,False
would surprised resolution third moviebecause one hundo trilogysees sister swap place,False
actually like three song show lost wood gt gt gt gt next right thing lost wood funny hell 80s90s nostalgia trip,False
segue show elsa ride nokk slow motion dark sea stunning entire sequence breathtaking show far disney come quality animation,True
show like let go unknown,False
worthy successor original first couple song weak going hit stride water memory bit totally telegraphed still hit feel,True
olaf reenactment original kristoff solo beyond funny favorite moment,True
damn disney sure love character dusting away,True
movie last jedi disney animated film much wasted potential bad even five year old thought terrible loved first one sad sad day,True
one tangled two zootopia three wreckit ralph four moana five big hero six six winnie pooh seven frozen eight ralph break internet nine frozen two,True
hi hello woman next,False
diehard frozen fan extremely average expected sequel still loved hope kid enjoyed,True
love message final line song something like everything changed forever choose listen voice next right thing great,False
favorite song definitely kristoff 80 themed song also olaf frozen two reenactment pretty good well,True
put frozen one top moana basically ranking,False
getting strong peter cetera vibe,False
thankfully always parent parent dead,False
like pretty obvious chopped lot thing reason felt like everything conveniently placed whatever needed arm reach character immediately place needed advance story instant next scene starting adventure movie adventure happening behind scene get see start end point,False
called controlling thing control surprisingly adult idea also hilarious moment,False
anyone notice couple scene first trailer third missing,True
really good made cry point,True
pumpkin pete scarecrow given life like olaf left rot ground anna sing,True
oh filled brim,False
everyone always talk wanting luis recap mcu movie olaf reenacting every disney movie,True
kristoff song really stood rest music kind ran together,True
show think best spoilery,False
okay example include,False
city saved anna started cry magical snowflake crossed face thought cry memory olaf lmao occur still thought sister dead point,True
need signature song,False
also thought northuldra matias little line,False
best part hand,False
movie really boring wish plot better elsa anna together andventure,True
tbh holding laugh olaf death could see saying anna feel good,False
pushing spoilerish,False
based complaint five year old gt elsa make ice ship instead trying run across ocean could carefully dissassemble dam order safely release water breaking damn saved elsa hundred mile away rock guy break damn thirty year ago forest knew problem barrier north side forest ect ect lt,False
anna plea mattias help destroy dam say anna gave life truth shared face mattias holding back tear anna literally risk life enthusiasm prepared die follow right really moving,True
needed extra half hour tbh,False
movie crazy gorgeous shot water creates ice step sweep shot ridiculous,False
stay credit scene,False
think part theme though kristoff wanted perfect moment full extravagance really needed get speak heart simply clearly glad kind joke proposal,False
frozen one tightlywoven plot sequencing feel jarring frozen two felt like watching animated slideshows plot get mean,False
yeah writing definitely uneven like conceptidea could feel jerk pacing think bit game throne issue incredible scene idea convey struggled actually connect dot,False
story incredibly predictable music largely ok loved bit happier ending anticipating really liked much maturely handled character movie,True
movie explain elsa power miss something like 5th spirit center element ice kind wish detail lore,True
doubt internet deliver,False
needed time explain childhood parent sister needed time character actually move certain place time trying quell spirit yeah right needed least half hour,False
ambitious plot beauty lot scene feel like good idea various momentsscenes struggled actually link together smooth way game throne really issue except x1000,False
yeah show agnar iduna playing wind spirit,False
really wish got see elsa tame earth giant resolution could truly avatar master element,True
sixteen year old boy going go watch theater surrounded little girl wondering music hold new let go watched,True
yeah felt like watching movie bstorylines storyline nothing ever felt important,False
movie really resonated kid towards end love stuff really getting pushed three u holding hand pretty cool,True
unknown really good track,False
sure say fact credit scene,True
think trying really hard one personally leave knowing lyric single one,False
enjoyed movie spectacle see issue reciting water memory though olaf spouting bunch random trivia spout debunked homeopathic theory water memory find kind reckless studio include plot point narratively work film going lot kid watching falling pseudoscience get old enough take care also found interesting made elsa center native tribe religion clearly tapestry clearly supposed central figure however felt would fitting elsa mother itsfunneh africanamerican film also married african american woman kingdom like disney want deal interracial couple real time retroactively fit one story began elsas parent kid movie maybe deal deep implication issue coopt story culture profit take certain responsibility put world,True
pushing unknown new let go show much emotional unfortunately spoiler,False
lol priority right seriously though sister left confirmation gone olaf arm went away blame thinking,False
one disappointing dislike year try really hard recapture magic stake higher tone mature worldbuilding richer kind lost magical simplicity first film hell lot le fun sven kristophe forgotten like forty minute song seem le memorable film forgets musical also might theater large swathe elsa second song washed instrumentals look love instrumental music menzel voice best thing arsenal flaunt also modern day allusion boy ii men style music video perhaps wrongly assume allusion border wall dispute seem bit place also tone really weird like boy ii men video olaf joke tearjerking revelation olaf joke character death olaf joke another character death kind flipflops place think prevents scene reaching maximum impact still animation gorgeous voice acting singing splendid joke miss really hit shame quite live potential least admire swung fence hit single bunting direct video tier sequel generic rehash,True
lost shit elsa grey blue changed elsa white,True
kristoff plotline done better bernard rescuer money,False
least mention plot point like lest consider random troll maybe like troll song desert scene like,False
based purely complaint five year old gt elsa make ice ship instead trying run across ocean could carefully dissassemble dam order safely release water breaking damn saved elsa hundred mile away rock guy break damn thirty year ago forest knew problem barrier north side forest reindeer singing song tone deaf lt,False
olaf summary frozen two sort format earlier movie,False
far favorite part film absolutely perfect summary hahaha,False
kristoff olafs song fucking dying lol,True
shipwreck establishes ship make turbulent water mossy rock troll foreshadows elsa always enough power reason doubt accomplish whatever want get unknowable detail magic know anna know elsa trouble make sense absent knowledge whether matter time sensitive anna would treat time sensitive nothing universe first second movie suggests distance way related strength magic song river ultimately foreshadows describes elsa journey track nature spirit curse responsible barrier would also responsible elsa near death limit fast move magic water horse embodies spirit element water normal horse follow normal horse rule nature spirit care barrier reason,False
yeah disney definitely depict mother look like tribe people except snow depiction thought funny made sure black guy black gf would made sense one norse people yet interracial couple one get see together already picture sure lowkey slick fit way deal,False
ice castle one,False
consistently glow haha,False
lol well worthy complaint think ice ship since make canoe even new one native,False
loved movie personally liked better first one honest josh gad stoke show olaf existential crisis killed,True
movie end bdsm joke kristoph get like one hour anna kiss okay prefer leather olaf believe could last whole hour,True
snow weenie biggest disappointment lack icy scenery like first maybe fault researching otherwise fun movie olaf actually quality lame comic relief elsa charging rogue wave badass,True
topic tiger dad train zootopia could get,False
five year old said mother snowman human crisis ice could certainly give folklore exist would ice,False
gt parent dead,False
believe nobody mentioned elsa basically avatar master four element link human world spirit world complaint movie avatar disguise,True
also put canoe first place sending ice path expect need boat,False
think biggest disappointment exciting new character ready elsa kindred spirit counterpart siren voice mirror disappointing conflict needed something one trying stop made everything feel benign olaf dying could moving like elsa died saw flashback tense meaningful also saving arendale copout,True
oof bad,False
last fifteen minute felt rushed like keep certain amount time realized running also incredibly obvious someone made change ending city destroyed else would go way say everyone safely away flooding matter,True
reminded,False
already know much sister love yeah nice see sisterly support screen waiting big new character bounce plot point never came four spirit oh 5th know ice totally water spirit fine felt kind hollow,False
really hoped would destroy city would inversion first film,False
kristoff song reminded little danson man peter cetera,True
eight nine movie never watch regret even watching,False
brought element beginning first thought ah avatar life enchanted forest,False
got annihilation vibe anna olaf went dark tunnel thought looked like alien cave end movie,False
joke definitely threw loop luckily many kid around,False
next movie going ball shining light,False
sobbing thirty minute film stop sorry,False
mean disney movie though disagree entirely 1h42m animated film,False
princess anna feel good,True
halfway kristoff song like okay clearly joke going fun throwaway song like shiny time pee,False
laughed little loud part caught guard,False
elsa master four element could stop world needed froze,True
eh really disappointed stick around,False
beginning little elsa making ice sculpture make baymax one,True
meta commentary bad guy hilarious,False
thought funny moment think song good enough overthetop enough kristoff one moment movie got kind delegated totally going propose end wait,False
yeah think first joke would landed better seen trailer something,False
setup along song beginning flag always fly made think movie would go idea thor ragnarok kingdom people place,False
think song memorable word saying kind shocked dark,False
anna elsa relationship one wholesome awesome thing disney done long going need see couple handful issue still endearing music great importantly seeing progress animation year blessing mindblowingly beautiful movie,True
part song convinced cover famous 80 power ballad tip tongue driving crazy anybody got suggestion song sound like,False
master three,False
found film outstanding laughing cry right place music gorgeous funny side character annoy death would write much honestly still emotional whole film loved far first film one blew away,True
anna feel good,True
agreed fully think movie missing new character bounce plot idea already know sister love really able develop character would nice another character throw wrench thing fun predictable make feel anything yeah like made olaf meta commentary random line gave biggest laugh whole movie,False
talk good kristoff elton johnboys ii men power ballad,True
going fucking ignore line anna end enjoying kristoff leather,True
absolutely could much better flying along get next song,False
love made meta joker film definitely funniest line one,False
feel consequence could made movie powerful averted end including unfreezing elsa stop flood,False
inspiration chicago first bar similar,False
pretty much anything foreigner real,False
moana 1h53m even ralph two 1h56m even ten minute could improved pacing movie lot honestly frozen biggest animated film latest decade could spare least go one thousand and fifteen minute missing chunk lot thing showed okay could marvelous,False
loved mattias,False
youmi16evil post credit scene,True
basically everything feeling,False
going mad olaf stayed thanos snapped,True
go frozenlittle mermaid theory people like believe,True
olaf recapping story like ember island player episode lol,False
correct wrong horse trying fucking kill moment getting tamed right like sudden riding friendly horse second ago pushing depth sea pretty jarring,False
liked kristoff actually got song time jonathan groff one singing unknown credit maybe everyone know thought adam lambert first lol,False
whole story feel pointless nothing meaningful happened aside final scene,False
going hang bunch kid scribble shit,False
hi woman man right tear,False
great time minor complaint though fact two village member spoke elsa kristoff really get lot time screen expectation admittedly may inappropriately placed given actual name properly introduced impact going would bit larger also earth giant element get one representation seemed weird much element causing problem would single one three running amok earth get giant stumble around asshole honestly thing matter terribly like bring like try see getting better catching thing bother movie typically ridiculously easy please great time see saturday maybe something change timespan,True
song everywhere soon needed let people see movie make viral,False
weird much talk impending doom every consequence averted,False
thing fire wind spirit though nowhere,False
saw coming mile away still fucking slayed delivery could better,False
show hand googled turtle could breathe buttholes showing,True
saw could ready kingdom heart four whatever next haha think movie ready well story element ready take earth giant anywho positively say would liked better 1st problem pacing transitioning story song bad everytime getting 1st one damn song would start felt like song suffocating story 1st one say problem present 2nd go around think could done without maybe two song least otherwise problem elsa song amazing story able breathe play one last thing want say oh damn elsa hair brideish dress left breathless definitely jump spot disney princess list haha,True
saw loved movie thought well animated story nice albeit predictable hilarious moment throughout wish chance see last six minute theatre got lit literally cinema caught fire evacuate still great movie though,True
yes thank vague bit song stuck head could remember actual lyric google lmao,False
oh god believe thanos killed olaf,True
beautiful film really liked uneven better worse element first awesome nonetheless,True
hilarious,False
best scene far 80 style music video featuring kristoff,True
"first thought movie finished easily could used another one thousand, five hundred and twenty minute",False
probably purpose glacierice river place north water memory ice make memory visible communicate four spirit balance fifth spirit bridge awoken time imbalance ice probably power spirit gave knew power would needed bridge fix thing explicitly stated film quick reasoning,False
"thought good let go still reign supreme song film decent especially show sequence couple gripe end needed additional one thousand, five hundred and twenty minute flesh end clearly capped one hundred min prevent child turning jelly would film justice also really understand need elsa separated end dam destroyed spirit free content frozen island context film seemed like thirty minute journey top physically still tangible sure sh fifth spirit nature comfort zone come stake high execute separation like toy story four oh part arendelle get saved end exec agenda written film aimed kid huge ip arendelle destroyed elsa turned super natural form disney wanted play card properly",True
fucking bdsm joke,True
thought fine felt like half movie really enjoyed first frozen trailer excellent see shot anna wielding sword make feel like lot movie got chopped screwed briefer running time pacing awful genuinely thought movie halfway ending came none revelation parent elsa power satisfying feel wellexplained either think could great another twenty even thirty minute story stand bit mess none music memorable although lost wood performance lot fun song felt situational result think leg let go want build snowman overall disappointing personally still enjoyable felt mixed movie quite long time,True
