comment,parent
thought olaf song really dangerous message sometimes important child question bad thing done idea keep quiet make sense older terrible whilst bad thing happening olaf ask help nearby ally instead allowing behaviour continue saying fine make sense older time must ask help question something make feel uncomfortable know child film quite core disney film include ethic moral lesson child bad situation talking really abuse could watch think keep quiet confusing uncomfortable thing happening may make sense later bullshit line kind reasoning groomers use one many issue olaf film handy know phrase crucial later water memory magic forest transformational know,True
think could explain bringing olaf back,False
sterling k brown amazing,False
funniest thing read day,False
fun movie got see one thousand and twenty-five cinemark xd absolutely stunning kristoff power ballad going top spotify soon,True
problem fixing mistake ancestor made real consequence descendant european settler still need easy kissing making,False
whyhow elsa turn ice,True
grown as adult presumably tradesman merchant could possibly run city got put troll charge,False
lost wood panic disco unknown,False
kristoff nothing movie think also missing good portion suddenly showed end wish issue proposing resolved screen,True
elsa saving felt like rewrite handed higher ups imagine someone wrote first thirty-four movie would understand elsa save city underminded story theme,False
come back life end kind negates risk,False
descendant settler one need wear hair shirt flog atonement sin ancestor process fixing damage caused ancestor consequence take respect friendship better ending movie would seen arrendelle destroyed people arendelle working together build new city help people northuldra would symbolic sin washed clean baptism etc,False
show made cry powerful hit really strong know connected much beautifully done absolutely loved,False
gt unknown ahh yeah bad see,False
mean clear grandfather wrong interaction coded european indigenous people,False
worry saw another site credit jonathan groff kristoff unknown cover,False
hilarious fit rest movie hilarious,False
safe word let go,False
awesome,False
major kenny loggins flashback great,False
anyone else get reminded annihilation went mist,True
saw movie two day ago liked cringed wood especially multiple svens popped started looking like bad music video,True
actually dante leaf hell end inferno find good website explains go satan fur reach genitalia go butt hole reach earth surface,False
artist want frozen two art idk red leafed tree called film anyone know actual name red leafed tree seen frozen two sure actual name tree would love find look reference illustration thanks lot frozen love,True
someone also covered kid eye,False
four friend cry absolutely cry laughter thirty-seven,False
expert area think northuldra supposed represent reallife laplandsami people northern scandinavia north american colonization metaphor exists would perfect one would rule since american made movie indigenous seem people white european rest cast want read topic since creates couple different issue head think first movie implied kristoff going sami inspired character due style outfit first introduced due association reindeer helped define outdoorsman outsider southern city elsa anna belong movie sort flip head elsa anna northerner family kristoff get along ryder fairly well wear new southern outfit make reference heritage could non northuldra sami might guy wore sami clothes none really plothole anything interesting direction going end sami queen king arendelle disney trying retcon kristoff backstory relationship frozen one expert could wrong kristoff outfit curious bigger plan point handle thing differently found kristoff character inconvenient story wanted tell round,False
everything better first except song forgettable forced lazily written nothing stuck animation gorgeous,True
sure rewrite would saved plot getting run everything else movie contain sure increasing running time complexity narrative would helped neither thing would appropriate movie supposed engage young audience personally wish movie told story le epic since much rushed abbreviated felt like tease instead single movie pair ya novel would absolutely buy daughter probably go read,False
couple sitting next also late 20searly 30 losing,False
mean kind fun part even hit home song look scene typical eighty power ballad reindeer part hommage famous bohemian rhapsody music video audience scene hillarious one highlight movie,False
martias reaction going funny,False
know kind think imbued first movie take elsa troll lead troll asks born power cursed make think regular people given power whether curse reward whatever,False
every time hit high note died went heaven glorious,False
loved 90 boy band video clip parody also thinking kid get reference,True
agreed loved comedy animation left theater song could remember one kristoff even could begin recite unlike 1st frozen moana leaving theater singing song way,False
mom sings song make go sleep anna whisper elsa asking want make snowman later assume night go big room build olaf first time continuity ftw,True
definitely targeted dad take kid,False
honestly think elsahoneymaren scene intended acknowledgementoffering giveelsaagirlfriend audience really much suggest anything friendship considering cultural meta context seems purposeful especially disney definitely aware lesbian reading elsa,False
get rebellious shitty life dialogue felt pretty cringey especially yell fuck multiple time succubus fighting disappointed personality change given,False
would print money disney hope go route,False
came back thread see anyone else felt way cracking also loving,False
theatre laughed as disappointed twenty minute coco short interrupting opening scene miguel coming screen saying let finish,False
opinion pretty much first one ok movie music really best part plot seemed tad convoluted point,True
honestly liked river song either bad quite opposite heard north wind meet sea instantly captured,False
got pay troll toll,False
forget beyonce song spirit lion king,False
dude scene dam break water pours canyon tree looked sooooo realistic blown away,False
think red maple tree,False
except bawling outside entirety show spoke level expect disney movie,False
pretty forgettable though entire film,False
thought going happen glad glad got hug elsa seriously emotional child movie reason prepared hug,False
think needed longer wanted fantasy epic also wanted runtime two hr,False
seems disney theme year since toy story four,False
way sang cold empty numb sang note got powerful song kept tear coming,False
wait sure supposed innocent kiss considering movie kid,False
everything becomes clearer realize written directed hideo kojima,True
bruce willis thought fifth element sequel,True
yeah sentiment pretty much sum movie,False
see ents broke dam,True
native also quirk talking reindeer,False
honestly found river song song reason love show much others like already loving song found section showed kicked whole song another level rest duet perfect,False
wait pc call baldfaced deny,False
voice singing four note elsa ahahahah four note beginning chorus around riverbend pocahontas aah ah ah ahh look thanks call actiondiscovery similar theme coincidence discus,True
detected chicago vibe well,False
tbf olaf fair number good line first movie distract run guess wrong guess kristoff love enough leave behind kneeslappers,False
anna us talk jutsu captain guard,False
wikinovelizationsome article call sixteen voice actor sixteen movie released seems like fair enough interpretation,False
also death motif think straight quarter note,False
somebody know music tell transposed around riverbend c unknown e flat equal move c b c gb f natural gb eb,False
anyone age twenty literally looked like backstreet boy video,False
update staying even longer googling sheet music found idina sings straight c b c halfway voice around bar sixty-five note ok go sleep,False
excellent point could figure olaf song supposed make sense older say yeah abuser say also parent bothered explain something case positive attitude two comedy number since framed kristoff song comedy movie need two comedy song could left olaf song,False
show lot better right gravity fall good mostly music want watch whole show check soundtrack ha ha,False
elsa goal basically find purpose life followed voice felt would lead truth voice theme water memory think mother voice calling elsa power admit bit kind ambiguous movie though,False
one challenging realised could actually fight focused energy taking called enough feel magic realize one,False
olaf recap amp guard reaction really funny lol elsa entire sequence glacier best part movie,True
literally taken month get movie head thanks,False
thinking fight feeling reo speedwagon,False
remember watching mv like thirteen experiencing first breakup girl cruel,False
sextant,False
original ending find hard believe disney ever killed main protagonist movie,False
elsa say done olaf asked kind event would common thing,False
save martha forest,False
inb4 kristoff get broken piece carrot stuck butt anna venter unknown save as,False
like way anna treated christof pushed box understanding boyfriend spoke would let finish basically went left without saying anything bed time well need like pick reindeer first thing asks take later apologizes say love fragile like okay express feeling song feel like film trying explain child still need make repriations aboriginalspeople affected colonialism grandpa something wrong well going best make right instead distancing saying past past also emphasized aboriginal people like christof reindeer wrangler anna young woman liked olaf recap died,True
fafa,False
zero day song form,False
seen film agree anna favourite feel charming relatable missed,False
anna boot got twenty-three upclose glamourshots still enough,False
herd anyway reason movie ending tonally consent basically director complete creative control want mature original screening either bob eger alen horren hated ending demand change,False
one hundred one else laughing loosing,False
literally,False
loved olaf said ok kristoff go talk rock childhood well rest one liner olaf hilarious time around,True
olaf recap indeed hilarious way mimicked elsa playing charade,False
cringed part,False
part killed,False
proposal attempt miraculous save,False
goosebump managed bust amazing effect,False
probably team crab song moana,False
thought,False
appropriately appear crimson frost birch tree based birch tree trunk red leaf gt crimson frost birch often chosen landscape use due deep red leaf summer attractive bark redleaf birch available,False
olaf dissolving anna arm reminded infinity war princess anna feel good,True
many lord ring reference water horse canoe waterfall scene lonely mountain hymn etc,False
felt way reo speedwagon yeah great,False
nobody convince atleast think letting line would kind ruined mood understand bet considered,False
omniscient see reason would trilogy movie continues rack money,False
scroll far thread movie peaked right surpass moment,False
many ballroom ball,False
twenty-six thought oh right guess jacket usually wear made leather never really realized,False
explained guard elsa sacrificed find truth started war believed olaf disappeared elsa gone also like think olaf manifestation elsa repressed emotion happy friendly love warm hug everything elsa afraid life still could never present like olaf least find joy letting people share magic snowman,False
loved frozen two way frozen one plot much mature song way better,True
recognize air supply reference hear one know tel,False
loved still confused appearance anna elsa mom show like really feel like elsa would say mom mom memory tf talking elsa singing unison loved movie part confused,True
friend oh god elsa fifth element function love,True
yeah nobody ever child film like hiccup dad train dragon weak excuse,False
also way explaining ice sculpture thing happened past,False
arc really came left field suppose meant link whole watching thing change accepting theme really like,False
think reference either nod theory upcoming remake theory true,False
kid might misheard guess,False
sounded like chicago got fight feeling anymore vibe,False
yeah figured target demographic sit still two hour hinder pacing nice slow journey first half second half started ticking box straight climaxresolution damn looking forward anna actually using sword like preview kind waved ice sword around,False
never thought would relate olaf character going bit existential crisis lately scared change got almost real impressive considering frozen way movie amazing movie feel real even ice queen talking snowman fire salamander walking rock giant reindeer companion,True
knew would one get got reference,False
well pixar owned disney,False
gt told arendelle granted magical queen reward iduna selfless act spirit wanted reward iduna grant power magical ice power really would come handy killed shipwreck probably wanted bridge magic human curious act selflessness enemy appeased spirit gifted two daughter instead one attuned magic attuned humanity spirit also tied blueorange morality trope really put logic force nature follow weird set rule mortal comprehend,False
well put agree everything said,False
really elsa viewing memory show memory mother saving father via kulning thing calling elsa via magic atahollan magic atahollan calling elsa elsa could hear magic come atahollan basically magic calling missing piece home particularly stated implied elsa hearing mother sings actually magic atahollan magic allows view ice memory past,False
gt lot song frozen ii story song felt describing something happening frozen franchise deeply impacted broadway way stage musical constructed story narrative song also discus character feelingstransformation commonplace broadway musical expected necessary move plot forward particularly opening number example see song like room happens hamilton cry argentina evita chant ii hadestown crowd thousand anastasia musical prefer stick frozen take look changed opening song stage musical vuelielet sun shine added elsa song dangerous dream evident pretty much every aspect movie voice actorssingers current former broadway star plot construction costuming actual song geared towards broadway sensibility easier translation creation stage musical adaptation u broadway fan room extremely fun see disney movie fully lean thin line movie musical stage musical drew parallel wicked pretty much immediately came movie particularly difficult given idina menzel former role elphaba unknown wizard movie show defying gravity know jennifer lee lopezes purpose know idina range elsa story draw parallel elphaba virtue parallel narrative woman power understand isolated everyone around,False
liked lost wood lullaby found fan folktype music,False
took three soon four year old enjoyed dark darkadult humor fly head,False
samantha,False
told animator feel free take 80 video kind place full backstory vanity fair,False
feel like strange choice get really asking,False
think musical fantasy story left lot third installment,False
said fire water wind earth anyone else yell fucking magnet work,True
got honestly thought kind dull entire middle movie kind pointless meandering saw article saying reason movie existed money completely see kristoff example character really reason movie kind said movie bad good humor song decent animation absolutely stunning think movie watchable think spectacular like first one better,True
completely agree kristoff great moment basically one hundred useless movie,False
sometimes good leave something alone,False
excited going still exceeded expectation heavy theme one least reconciling modern day society colonial past olaf said arendell stand actually resonated lol like north america pride adherence justice rule law necessarily extend group wronged past expecting dwell thing like disney movie animation amazing writing razor sharp music much better overall though think one song top let go movie lot heart need exist feel like lazy cash grab clearly lot effort went making movie,True
angsty phase,False
four,False
thinking avatar,False
strong song animation great voice work magical first film appreciated felt different like bigger sequel time felt could benefited stronger backbone around great idea theme wrapping waiting shoe drop feel like definite structural issue script little self aware time taste including weird let go wink like touch like change identity even though feel like better first time around dunno despite feeling like tie loose story thread cool way something missing sequel need sit remember first playing better repeat viewing,True
sex tent,False
oh enjoyed whole thing happens let creative team full 80 baby please lol,False
satire eighty music video far highlight whole movie,False
great line reading kristen bell,False
gt kristoff example character really reason movie obligatory romantic interest trope,False
olaf frozen two almost like nerd coping existential crisis,False
gt spoke would let finish everyone think,False
thinking captain planet,False
make sense older,False
exceeded expectation like damn really dark part showing kid issue let arendell get destroyed henceforth side coming together build kingdom equally could benefit maybe would princess mononoke theme apparent entire movie also elsa riding water horse save day anna entire as kicking well fucking awesome let pas first movie family romance theme breaking cliche fairytale incredible feat one empowering even full grown adult going get selfcare elsa went authentic self giving happily ever,True
reddit already scrolled past comment someone said elsa hot movie creepy way know,False
like idea crossing thing small world,False
loved movie reason think plot without confused felt like lot element throw time process character good first film hell better liked littler conflict film hell even gave something fucking snowman kristoff trying propose anna subplot predictable voice actor able add lot sincerity annoying animation stunning show sequence might top let go ending kind conflicted part feel like contradicts message first film happened new trend animated sequel another part feel perfectly logical development character done better wreck ralph sequel think good movie certainly mile better disney sequel including toy story sequel think would need rewatch get firm stance feel despite issue joy watching movie six year fell love first one made feel like kid would regret movie existence slightest,True
honestly totally amazed last five hundred and ten minute amp x200b every risk consequence stake movie spent setting got thrown window everything amazing nothing bad ever happens ever know disney movie still would liked least consequence happen,True
felt kind 80ish,False
yeah found scene comical definitely parody see joke completely missed depending audience demographic,False
going first one much stronger story pretty good plot twist felt frozen two magic eye candy overall plot direction somewhat mess,False
absurd maybe temporary death like first movie would silly marketing decision kill disney princess well killing olaf character would destroy sale,False
elsa totally could frozen ocean walked glacier,True
said exact thing annihilation partner,False
action consequence,True
really keen marketing movie imagine unknown kind flagship song next let go upbeat full positivity honestly stand candle next right thing message alone right thing face despair hit hard thought message everyone deserves hear best damn song movie,True
strongly remember first movie really taken became huge pop culture moment knew soundtrack would wildly successful first viewing could recall four five song know go song wanted painful sit plot appreciate went larger scale action packed bored mind major chunk thing kept going olaf stunning animation seeing quite comment saying better first really get think amount success first escaping let go etc put people remember first came refreshing felt pacing song comedy character perfect really loved scene one flow really especially end destroying damn elsa coming back saving arendelle kristoff proposing olaf coming back life etc happened instant went taking time building thing okay let u wrap real quick pretty bow,True
amazing loved amp catch new frozen part two cinema hall near along friend amp family venture adventure unknown well worth money,True
well person coping existential crisis,False
sometimes plot seemed leap felt like necessary detail hand felt like movie successfully tackled lot relevant heavy theme tactful way also found olaf funny funny first time,True
jarring see photograph end know match timeline come left field,True
know lullaby opening flashback instantly brought tear eye within two line,True
know either may easy cry,False
tried wave strong hand wind could carried,False
clapped saw,False
think first film regular relatable human exception elsa 2nd film full magic spiritual creature structural issue felt want tie five element together end forgetting wind fire totally unrelated,False
even anna thought totally left behind without telling pointless,False
everyone seen fifth element would see coming,False
mean nothing super relatable still mom good relationship barely remember anything age scene hit specific memory feeling beautiful lol,False
water earth fire air long ago four spirit lived together harmony everything changed arendelle attacked,True
went fifth element,False
yeah spirit wanted hard way like dumbledore,False
right adult guy without kid loved movie,False
thinking leeloo dallas multipass,False
thought 80 power ballad,False
think resolved issue song see anna,False
yeah story got much interesting,False
live far elsa still come friday game night,False
believe killed kristoff like,True
mode score film ten lord reddit easy impress,True
hard way find water horse carry still super easy barely inconvenience,False
hidden meaning really dark comment delivered really lighthearted manner,False
feel like twilight zone reading praise watch movie plot garbage pacing worse disney movie needle exposition movie completely random exposition character randomly revealed plot without basis knowing first place best represented scene ice sculpture anna grandpa attacking native spontaneously appeared presumably elsa used magical gps build statue front anna last split second got han solo anna look say dam ruse tear logical conclusion looking random as statue like entire movie whole thing mess,True
post deleted people really mad black dude frozen ii,False
would like see olaf derrick together,False
said anna somber song soupsed death yes creative perspective respect think tragedy kid movie edit know think kind dumb idea rumor true much like child medium talk death bridge terabithia charlotte web frozen two still hope one day disney ball somthing like,False
could sing like probably smug,False
olaf got snapped,True
convenient maybe given elsa power level really nothing deus ex machina,False
happened letting easter egg easter egg donald mickey goofy seen little mermaid scar rug aladdin something disney movie need create convoluted crossover narrative explain thing,False
tour world band probably living dream,False
loved ten thousand first thing first one catchier show stopping tune story much better amp entertaining,True
lost found literally wrote song guarantee higher ups decision,False
doubt elsa could odd single wall prevented city destroyed dam released whole lot water also fact made back time knew immediately make whole lot sense,False
horse goddamn kelpie like fire elemental salamander,False
malificent show shadow show fairy godmother wand _interesting_,False
olaf frozen adventure def twenty-three minute side mission,False
water horse old scottish legend sure nordic country similar legend,False
died power dying could stay alive elsa diedlost power magicked,False
saying related,False
comment replied deleted dying know song sound like happen remember song commented,False
walldam blocked magic would agree think happened,False
anna queen arendelle elsa queen north incredible,True
thor ragnarok train dragon three fully expecting pull arendelle place people everyone evacuate even moreso dam let loose flood water,True
heh trilogy astronomical success frozen merch see making end time,False
need make dude twice age save world,False
okay need might romantic line disney movie ever movie ups good lord perfect,True
feel like many thing writer focus elsa romance need come play,False
rumor original ending darker probably happened exec told change even set catch song promise flag arendelle always fly,False
yeah disney movie almost expected,False
setup exactly made think oh yeah kingdom getting destroyed,False
wait half indigenous mom clearly white tribe member like everyone indigenous honestly think implying,False
uhm anna elsa mom member tribe,False
agree whole reparation feel anna else half indigenous like surprise liked inclusion culture feel bit cheap liked mood feel film frozen one,False
game throne season seven level fast travel elsa horse,True
olaf eleven ratio savingkilling fish movie saved one thing never change sequence presumable killed one caught mouth went canoe waterfall,True
glad elsa living two thousand and nineteen adding rgb crystal changed dress show sequence,True
shang mulan would super jealous horse far swifter coursing river go atohallan arendelle quickly,True
said believe story came success take time pass screenplay wait,False
could lived plot carried first movie song probably hired best writer could song came thought horrible,False
