comment,parent
wait meme olaf background horrible shit happens character emotional moment goofy concerned snow man behind like anna cry elsa go together across sea ice boat scene olaf would perfect background famous awful moment throughout history,False
ton older movie cartoon going back thing like power puff girl older fairly odd parent even animaniacs joke subtle actually funny kid older folk find funny different level beyond obvious sign good joke multiple tmdifferent generation interpret meaning still laugh,False
heard screening film march bob iger step change ending probably wondering could happened iger stepped going gt spoiler lt kill elsa real gt spoiler lt think true book released film end end second act say anything conclusion,False
lowkey super hoping gay stuff rpopheads would explode way would play well overseas though,False
loved elsa stepped queen let sister step spot light promotes anna queen sister queen elsa damaged youth live life recovery spotlight going lie scene mom sang along show whole row least adult tearing outright cry,False
disney push show massive spoiler movie push prior film kind ruin experience since scene apng make film,False
olaf anna feel good,False
reminded earth song michael jackson,False
fun fact singing aria deus erie ancient hymn death podcast cover great detail,False
hot like icy alien corpse,False
snow ice rendering fantastic always give respect song writer need credit managing use fractal song cool word,False
gt also originally thought would emotional olaf elsa stayed dead hoping would keep olaf dead avid reader comic hate dead character keep coming back life,False
feel suffering depression entire life song unknown hit hard lyric spoke one way another,False
logic pretty sound though olaf made permanent elsa magic start thanos say think elsa alright pretty good sign elsa seriously hurt dead,False
also technically disney princess,False
feel make sense mean get turned solid ice begin whole journey cave kind iffy explained foreshadowed based everything taking place see altering definitely moment changed affected rest story,False
right problem movie spirit take form trying harm suddenly help giant felt like literally nothing movie explained,False
disney got beat one year animated film oscar category said never dropped movie,False
new disney show idea,False
olaf quickly recapping movie,False
waiting someone put next right thing good place,False
frozen black panther wtf,False
person theater dying laughing thought finally together bohemian rhapsody thing happened lost,False
half expected olaf say anna feel good,False
water earth fire air long ago northundra lived together harmony everything changed arendelle attacked 5th spirit bridge spirit could stop forest needed vanished thirtyfour year passed snowman discovered new bridge snow queen named elsa although ice magic skill great lot learn ready save anyone believe elsa save forest,True
community race important showing race together,False
keep keepin friend strong hope keep fighting,False
mother,False
feel like maybe right frame mind saw love first one one fell flat reading comment seems like people liked lot check disney,True
first frozen seven song frozen two six,False
scary perfectly written,False
anna feel good thing think scene,True
m anna feel good thing think scene,True
gt huge fan first one noticing people liked first one like one vice versa hated first one watched yesterday remembered go nowhere let go loved one like song liked olaf actually gave elsa something,False
honestly think iger made right call narrative dying might worked parent child would livid,False
said major gandalf vibe,False
deleted scene switching character well scene elephant icecream shop something entirely different fully animatedvoiced etc alternate judyparents scene also scrapped,False
agree felt choppy unsatisfying,False
lol literally thought gale also reminded birdbox,False
never wanted whole drama save people first spirit wanted dam gone would washed entire kingdom away,False
well kind mother firmly dead everything else see cave memory like memory mother,False
ghostwriter,False
oh yeah lul,False
frozen ii surprisingly great sequel could one thousand and ten went full force uncanny valley go one colonization aspect mad get political hate politics could perfect thanksgiving movie like mother whitewash blend granddaddy still attacked weapon two fully kill olaf endgame three talk elsa isolating bad thing whole first movie know meet friday night 4the new character get le screentime would think five avatar last airbender good movie six kristoff character arc completely screen wtf,True
gt liking kpop version patd disgusting,False
forest seemed lot like maleficient forest coincidence,False
going kill elsa olaf real director ball steel,False
theatre lost shit,False
frozen two best sequel animation since toy story three fact discussing crazy,False
could stop cry point,False
absolutely awful song either outright bad literally took tune first one added new clunky lyric half movie member good frozen stuffed full many plotholes even five year old complaining,False
think awful,False
show get fucking lizard also hear reason,False
damn fucking straight ralphed,False
show easily favorite scene movie even though fully understand mom,False
maybe odd man loved first one might like one even,False
seems difference opinion directly tied intelligence viewer,False
mother singing memory flashback,False
opening sound lot like fight feeling reo speedwagon,False
fucking kidding damn year dissapointing,False
nope dead whole thing ultimately big plothole since freakin lizard able hear well one elsa memory,False
reasonably pretty sequel watch time see terrible actually half movie member good frozen song generally bad outside unknown ok best movie definition polished turd look great mess start digging,False
gt also song told character feeling instead showing literally sad dark done onthenose like every song first movie also like every musical ever character singing feeling,False
literally member first one storyline weak made zero damned sense angle like collection interesting scene coherent way put together,False
seven hundred and ten generous fuck really four hundred and ten,False
frozen two maleficient two template course would get result,False
think anna deciding alone destroy home property citizen save everyone,False
member let go,False
coco fiasco,False
seriously ripped tune original movie glued awful clunky lyric half song,False
memory rmother water lizard hear well spirit fire elsa spirit ice rock gaint spirit earth,False
like would cool liked girl think important mature female character love interest,False
cept place mother never went memory manifest elsa made,False
said repeatedly film water memory ice water island memory,False
serious ptsd like watching tom holland fade enough,False
yeah thing water come contact would memory suddenly calling elsa first place elementals also travel following voice,False
like first one thought grossly overrated found one major improvement perfect seemed like squashed lot good idea hour half movie series enjoyed original,False
even find single scene interesting outside aesthetic appeal fuckin bored right jump,False
like two point thing looked like might finally get interesting nope,False
seems like echo idun original call spirit child water remembers remembered voice used lure elsa,False
han made cameo,True
really knew low quality cash grab fire spirit turned little cute critter disney toy manufacturing machine move kid going want another olaf toy christmas,False
even got ride shadowfax,False
yeah flashback speaking role,False
cept nothing intelligence behind reason call sudden thirty year later reason direct anywhere,False
explain interpreted call wait thirty year later know,False
neither writer,False
frozen obviously intended stand alone story sequel made yeah good thing writer movie,False
movie princess magic snowman concerned race man chill,False
zelda lullaby maybe,False
million two way could made good sequel nope direct video quality,False
epona song zelda,False
new lyric painfully bad though gt cold gt empty gt numb gt life knew old lyric gt power flurry air ground soul spiraling frozen fractal around one thought crystallizes like icy blast never going back past past,False
disney made error putting twenty minute christm er holiday themed frozen short film front coco resulting backlash bad short removed future showing week,False
movie decent feel like everyone harping villain think necessarily need one,True
dy irae,False
festival music king,False
weird dude,False
lol oh damn bad huh,False
pretty sure kristoff usual outfit made leather olaf could last minute wearing clothes mentioned finding clothes restrictive earlier,False
short even bad better suited abc holiday special,False
voice watched twice still get thought maybe literally voice island idk also aurora looking snowflake sky elsa fifth spirit snow looking spirit creeping like,True
boring,True
end sven olaf kristoff dressed conversation went something like kristoph get like one hour anna okay prefer leather olaf believe could last whole hour,False
gotcha plus twenty minute short really long movie type thing long enough question even right movie,False
throw little queen shot four reindeer harmonizing got fat homage right,False
know go see movie day dead always expect twenty minute josh gad singing meaning insert holiday choice first traditional case,False
daughter agitated imax prescreen warmup thing problem movie scared lot stuff fine,False
would say dtb quality time better pacing,False
imply otherwise anna literally talking kristoff usual jacket funny make think could said meaning something else,False
visuals great writing absolutely awful,False
get ten minute,False
mom mufasa moment sort though,False
little blip wrote getting home frozen two surprisingly ambitious thematic goal throughout runtime selfidentity permanent change making decision greater good exploring unknown prejudice wonder magic hardship sacrifice along adventure grief revelation pain come along idea chose present concept character feel far le cohesive imagine scope creator vision intended though perhaps film rest disney umbrella never wanted quite stick landing hard teased concept make sense character growth seem hint vibrant story cut away screen time otherwise wasted moment nothing add vibrancy straight take emotional investment looking kristoff power ballad lead story arc feel disjointed rushed unsure want lead coming together ending feel hollow missing emotional punch like tug war happening storyteller brand disney would want preserve realized audience first film older obviously wanted tell tale reflected growth change instead compromise far could take said far impressed film two thousand and thirteen frozen animation incredible song found older show next right thing stuck far original soundtrack olaf presence longer cheese grater brain glimpse interestingemotional story enough keep invested everything would unfold shame ambition allowed go far could five hundred and ten,True
really elsa go ice cerebro manifest,False
movie emotional reminded sloth died month ago,False
expecting something ala sausage party going disappointed,False
get watch next month cat,False
elsa mom see memory come togethor one unconscious dad elsa mom call side,False
gave elsa girlfriend kristoff boyfriend end two seemed dating,False
really happened elsa dad got hurt elsa mom used ah ha ah ha chant call spirit come heal stuck wrong side mist hid trailer dad went arendell grew befriending falling love dad told northuldra decided tell anyone else taboo elsa heard ah ha ah ha chant coming magic river keep secret past calling would go discover fact king arendell one strike first northuldra could right wrong free forest mist mom first told place,True
think mean first meet group trapped forest fog whole time,False
mean first movie rewritten,False
yea little confusing also,False
love movie one would made love even already grandfather actually still alive could worked somehow still twist spirit going wild die dam destruction,False
joke point supposed funny imply taboo,False
fact one hundred clear ton people wondering voice bad storytelling disney part,False
yes joke come fact truth talking usual jacket sound like could something else,False
sound like kulning,False
yea get saying like voice call wait long think would made sense movie showed something happening set event frozen two elsa hearing voice elsa singing voice bam spirit mad,False
cried many time esp thinking little sister wow love much fact kept talking changing growing perfect movie,False
really liked separate first movie first movie kind revolutionary sense used kind modernage dialect like wait want stuff chocolate face one oh color stood ton love unknown idina menzel harmonizing reminded elphaba singing ohwhoaoaa end defying gravity,True
first movie entirely different plot elsa villain army snow men etc different song wrote song let go felt mesh well story initially conceptualized wanted use think chief animator one chinchilla name forgotten said best song ever heard written film changed dynamic focus relationship make elsa evil snow queen original story based someone going turmoil gt assignment come badass villain song elsa end result let go however power ballad curious effect first lopezs felt bit conflicted writing song approached slightly different perspective later described approach thinking emo kind place rather straightforward villain saw elsa conflicted person always hide snow power able embrace higherups heard song thrilled great song also saw new take elsa personality would require alter film jennifer lee would ultimately promoted codirector film told new york time minute heard song first time knew rewrite whole movie,False
theory tarzan,False
elsa anna parent survived washed coast africa tarzan,False
none kid would get think way anyways nonissue,False
many first one bit troll song honest good,False
sound right,False
fantasy trope earn place amongst primal force accept,False
best part said parent dead laughed as,False
part killed,False
enjoyed film thought would anyone else think editing insane,True
pulling pretty solid disney family flick,False
friend exact thing could stop laughing,False
thought aang going show midway sequelitis usual water horse fight cool got olaf fix though,True
exact reaction could believe eye best part movie hand going,False
going help put asunder bad weather put arendelle,False
exactly thought would actually liked movie little teeth actual consequence,False
kalelsa pretty cool guess,True
dammit thought idea,False
yeah enjoyed bit first one mainly lot true snow queen story based,False
sequence shot really tight marvel type movie format scene supposed carry grief emotion done purpose without holding back part elsa tames wind spirit ice power quick tight sequence sister find parent wrecked ship hold back grief facial animation dick around else visualizes parent final moment via water next right thing depressing song purposeful scene kid singing car lol scene water come fjord look feel like impending destruction especially dolby,False
beautiful animation forgettable song probably two hour long dealbreaker kid movie passed time olaf recap definitely highlight,True
action sequence movie tone muddled though constant switch ridiculous gagssongs promise dark think,False
song generally worse story much better loved first film,True
happened first movie elsa make sense queen mary arendelle since based anderson snow queen,False
really really disappointed movie entire plot disposable ending made sense every tearjerking moment land never believable olaf good quip kristoff solo fantastic really laughing everything else bleh,True
delved greedily deep,False
raise thor explaining infinity stone,False
guard speaking line also arrested development chicken dance,False
yes thought one one else know even see annihilation say oh screaming bear look understanding,False
seen original countless time enjoy one probably see necessary none song grabbed,True
link lazier,False
idea movie beautiful mess,True
enjoyed movie alot animation water beautiful little spyro adorable,True
gt moana like sixteen disney movie pretty normal age get married,False
part enjoyed,False
heard sterling k brown going movie wondered would maybe love interest elsa ended playing older guy guarding bridge saw character older knew would love interest looked elsa going maybe boyfriend movie article people thinking elsa might get girlfriend trailer show girl elsa mom younger guess people thought might love interest elsa thought girl might elsa mom since talking past trailer looked little like anna girl trailer ended elsa anna mom younger never heard tarzan theory clever though,False
seriously go everytime thought try spot voice back mind never,False
want peg snowman,False
make forty minute,False
starting back first teaser came caught attention nod marketing team disney sure really came u mysterious trailer got asking question last week super duper excited watch film disney fan ton bias sooo yeah lol aside movie beautiful disney obviously still got deliver visuals spectacularly song choreographed tuned elsa scene showing power unquestionably incredible felt like eye ball soul opening understand beauty universe could die happy ever seeing grand canyon lol,True
took word right mouth add reason spirit angry arandelle also one like yeah see action full reasoning character movie really villain per sae simple reason character give monstrous thing hit term cold real like villain since frollo hesitate say realistic one find motivation people similar position even nowadays definitively adult,False
seems trend lately disney wreckit ralph two vanellope leaf game live online game toy story four woody leaving bonnie live street bo peep elsa leaving kingdom live wood message disney trying convey,False
loved lot going emotional intriguing adventurous air mystery never clearly resolvedexplained something miss lot modern fantasy tale story theme change inevitable choice furthering original movie coming figuring want often easy thing take sacrifice suffering doubt think elsa made right decision hand throne anna start new true self life north know ever really interested ruling anyone took throne duty really enjoyed song kristoff could bigger role loved heartsick ballad always primarily anna elsa story anyway loved scene practicing proposal sven horrified mother shielding child eye,True
look picture gone naw playin right back great throughout film great little incidental throwaway dialogue made character feel like real people,False
follow fire run fire,True
aaaaaaaaaaaaaaaaaaaaaaaaaa,True
playing charade friend sexy walk boyfriend immediately shout girlfriend sister name legit thought anna manifest fire power people predicting,False
holy shit movie sucked legit worst movie since pre tangled dark day animation something disney getting away let u make great story getting let u make something look cool,True
one thing kind annoyed would opinion perfectly fixed kristoff role end would liked anna propose resolve conflict wondering good enough fitting moment personality really funny moment subvert expectation,False
called money,False
one guy broke thing call note related dy irae used lot dark song,False
elephant playing sure dumbo,False
gale deliver letter bridge conversation see reason doubt magic water horse flaming salamander army giant golem beck call end movie anna queen dangerous one,False
convinced bit baby reindeer surprising young woman meet forest originally woops rested hand moment,False
mixed race mean lived like walking distance arendelle took mean warring neighbor,False
samantha,False
feel huge jump see kristoph proposing anna lot chemistry feel seeing moment together would helped,True
ya motivation making quality product tank brand end game money,False
postcredits scene,False
movie dark,False
exact opposite reaction theater lol good,False
said heard audible gasp parent sitting behind laughing line moreso reaction parent lol,False
considered would perfect,False
would pay watch sibling get motivated pull smokin sexy stylish combo,False
movie really weird feel like soon started picking suddenly ended,True
darkness parent,False
well ice premium includes dressmaking 3d printing creating life,False
unpopular opinion think frozen two better first one really love everything elsa movie ana go full annoying like aurora maleficent job eight hundred and ten kind want man elsa lol,True
wind calmed frozen tornado,False
took bit thor ragnarok,False
think contrasting idea going stop loving something felt important,False
let arendelle go would bee better ending could even added arendelle place people,False
good movie first one damn deeper darker expecting like ultimately end story long shadow colonialism invoking classical element greek norse mythology wherever hell water memory thing come oh kill two main character albeit temporarily leaf another one basically singing utter depression hopelessness damn dark,True
gt feel seeing moment together would helped first movie filled lot kristanna moment probably watched first watching frozen ii,False
true also elsa pretty much spell audience reason anna born power two represent bridge connecting northuldra arendelle one connected element elsa one connected arendelle people anna,False
really guessing much experience disney going tell,False
frozen two basically legend korra minus asami,False
half expected fire nation attack king telling girl story,True
unpopular opinion movie good feel like focused elsaanna relationship little much point anna seemed kind obsessive elsa weird definitely felt romantic vibe stirring sister especially end put face really close together hand anna completely dissed kristoff preoccupied elsa blew kristoff entire movie definitely place get engaged one thing irked song average guess expecting since first movie fire soundtrack made entire movie broadwayesque character bursting song random moment help move story along said movie pretty much carried olaf quip one thousand and ten kristoff love ballad also hilarious thought animation beautiful overall five hundred and ten would watch,True
lmao samantha cry laughing thought olaf annoying first movie got wayyy funnier also fact family portrait castle hahahaha,False
everything eighty even videography someone really eighty music loved much,False
stick stone may break bone whip chain excite,False
familiar source material han christian anderson make lot sense viewed context original story,False
thought going happen whole film,False
inuit native norway,False
glad one loosing type song fit playlist perfectly,False
relsanna mad,False
yeah happy ending coming together fast gave whiplash especially understand elsa would give throne apart one line unknown movie never indicated hated ruling,False
correct answer,False
right lol else going pg someone death though guess either fall cliff see brutal battle beginning,False
exactly thought introduced like elsa going avatar guess,False
best thing going absolutely gorgeous separated ften incredible moment great shot loved else kelpielike waterhorse surprisingly well handled darker moment olaf getting thanosed anna depression really unfocused narrative storytelling cringey character development story felt first draft get people general area need go fill story detail later never elsa mom became fifth element death part culture elementals see film gayle kelpie buythetoysalamander rock giant force closed forest something bigger gave elsa power could momleelo mom alive power came related culture would conversation parent would instead asking troll getting bad advice going board still issue first let u talk mom heritage maybe really bothered reveal anna elsa half indigenous opposed everyone getting along thought came oh 32nd cherokee okay see people could handled lot better especially elsa give throne live apparently new leader coming outside fix problem look forward see dialog aspect turn curious explore maybe reading wrong song fine enjoyable moment forgettable movie characternarrative forward line dialog coudl first film great job making song nessessary character plot came distinct memory went tell style nothing despite complaint enjoy disney know completely work,True
help think arendale plan went north rounding success went betrayed everybody treachery rewarded trapping enemy permanent fog,True
people north set continued conflict take odd choice integral backstory present resolution,False
really surprise seen anyone mention short sighted immoral anna decision destroy arandelle fjord film portrays morally grey choice brainer destroying dam right thing shocked disbelief rest film especially way one question anna decision,True
haha ya going say song frozen sequel place darker hellfire lmao would surprised greatly,False
doe blamed one bad yt boi everything else fine,False
stay long enough see scene credit reenactment frozen two event surprise frozen one character hilarious,False
comment referring plainly outlined similarity spirit connection plot thematically conveyed within frozen korra namely focus nature sentient force pseudo religious allegory obvs unique korra w said specific trope found within lot modern series within last twenty year absolute proof derivative korra asinine say possible simply bring conversationally gasp platform discussion,False
