comment,parent
still like first movie better think song memorable first movie however loved song anna elsa mother sang unknown song remeber kristen belle someone else said song frozen two rival betterthan let go assuming song elsa sang went across sea looking past memory bad song even remeber thrilled elsa going live wood see anna kristoff going live cabin among villiagers elsa least elsa come charade night etc far away villager free visit town want glad elsa happy time anna loses freedom would nice see anna kristoff wedding maybe short wedding frozen three,False
fine decent enough sequel story first lot impact also thought music lot better first kristoff song pretty cringe olaf song super kiddy fine guess kid loved theater visuals great saw dolby seven hundred and ten,True
elo,False
kind groaned started singing think need really enjoyed still good reindeer better people still fun,False
haha even catch thought trying figure craft nice one,False
rooting rapunzelelsaanna cousin theory,False
thought really good bit better thought would,True
kristoff song homage 80 power ballad like glory love karate kid ii ilk got big kick,False
anyone else agree missed chance give anna magic fire power saw mother magic thought sure anna going develop innate power ginger little fire lizard mother magical would made perfect sense,True
people familiar 80 loved song visuals movie accompanying,False
got elo vibe elton,False
emotional yes certainly part immediate rush emotion mainly relationship anna elsa many touching moment two really highlighted sisterly love,False
exactly song thought heard loved,False
thought maybe going reveiled kristoff related villiage guy talking acted similar thought maybe long lost brother something kristoff raised stone troll people remember ifnthey said happened kristoffs parent thought maybe older lady would turn grandmother never went anywhere,False
know experience much olaf bad thing,False
seen walt disney animation studio movie know really like film pacing seemed sequel seemed unnecessary song probably best part film everything else seems jumbled together,True
actually edit post think song funny pretty enjoyable kristoff story lead song really feel like drifting apart much land maybe song supposed dramatic,False
end day relationship elsa anna love series got movie seeing elsa kristoff getting along also great addition seen since first movie elsa one hell awkward introvert accept happy living wood visiting family every would hate grow apart suspect might inevitably happen long show either frozen three short elsa anna still able reconnect happy,False
talked like 5th element,False
super beautiful amazing soundtrack nice emotional moment olaf got wonderfully dark joke maybe needed little longer introduce new character get chance much extra ten minute middle would helped biggest complaint movie wanted job definitely good time,True
well rumor true glad decide keep dead would traumatic kid sure bit traumatic kid watch sad anna got frozen first movie thought elsa frozen guess really died,False
horse mane amazing,False
olaf recap everything,True
wife felt maybe extra twenty minute let scene breathe bit pace super fast especially felt directly parent boat totally agreed fantastic movie,False
know mean think wanted reinforce point need power help people,False
sort agree little disappointed arendelle destroyed although glad elsa badassery able save ridiculously powerful wish could see even capable always prefer going right edge even story sure disney feel comfortable one hand nice know disney movie sad ending fox hound looking suppose staple animated film always thought would cool see mature animated version story get away little darkness doom liveaction remake maybe make liveaction frozen see,False
saw today definitely enjoyed feel like movie absolutely needed go watch probably would give seven hundred and ten animation beautiful storyline enjoyable overall music mesh time unfortunately bad sure feel like real classic song would want listen repeat overall liked would really go way go watch,True
heard numerous people movie dark exactly movie dark,False
"map say mdcccxl one thousand, eight hundred and forty think hit nail head",False
love scene olaf summarizes anna elsa story villiagers reminded jon snow come dinner skit seth meyer kit harrington seen great skit,False
new evil,False
need know movie talking though realize list film character hold breath unrealistically long time probably huuuuuuge,False
technically get luis recap mcu comiccon see,False
feel like olaf jason mendoza would best bud,False
frozen ragnarok dope anyone else notice baymax snow doll opening scene,True
anyone else thinking rescuer every time kristoff tried propose something got way,True
gt olaf reenacting every disney movie since miramax film buena vista subsidiary pulp fiction technically disney flick one olaf recount pulp fiction please,False
agree one disney film could used extra fifteen minute watching kept thinking must quite bit left cutting room floor somehow seen two movie elsa star yet still feel like really know,False
honestly idea clearly remember movie stopped caring good dinosaur good definitely action flick,False
han kind forgot plot armor disney princess kristoff forget waiting han flop anna come running,False
thought terrible story predictable consequence like knew olaf coming back ffs fantastic view though,True
anyone else notice voice calling elsa singing exact four note heard stairway heaven guitar solo six hundred and thirty mark kept expecting robert plant belt wind roaaaad,True
make sense anna queen arendelle still feel like movie great job explaining elsa went forest plan happily staying maybe saving story part three,False
overall kristoff actually critical relevance movie smiled line liked singing feel like mostly movie could get rid major frozen character disappears much last thirteen movie story character arc feel lacking compared elsa anna let alone arc first frozen,False
seriously olaf would pulled bing bong would something,False
yes like know shown made whole plot feel thin,False
holy shit,False
yes show clearly let go followup going,False
undersells metaphor historic injustice group hug needed perfectly okay disney movie staying safe ending dumb bring difficult subject matter act ending simple,False
would predictable going anna fire power circling among fan theory since first movie came,False
also sound like dy irae featured lot movie,False
thinking back explain plot movie whatsoever,False
harder sell toy arendelle,False
could build fuckin ice castle like day,False
watched movie could tell exactly plot,False
kept talking dam six year old go keep saying bad word,True
frozen three please elsa magical stuff forest pretty snow dress riding water horse,True
god thought dreadfully bad like car two bad none original charm first movie tired trope kristoff trying failing propose painful watch even get started eighty nightmare music video hated also kid confused,True
wonder king runeard ever found cranberry cd many iconic actor actress film,True
found somerhings never change unkown seems like simar pacing first get frozen heart want build snowman first time forever love open door quickly general movie songheavy beginning first movie let go happens around twenty-four minute mark really three song remainder film four include reindeer song,False
technically princesseselsa seeminly renunciated anna queen,False
gt tragically misinterpreting well yeah whole town evacuated mention specifically people safe risk flooding town discussed kristoff anna anna guard,False
guess assumed spirit gt fellow spirit since one lt using mother voice call really mentioned guess maybe idea power growing made possible finally hear great distance,False
would make make sense elsa stayed frozen became actual spirit appeared anna like force ghost said longer part human world undisneylike,False
arc arch,False
must absolute zero,False
movie seemed way adult like expecting know disney go dark god damn song w anna saying ready succumb also seems like lot joke aimed parent kid eg olaf make sense older running gag kristoff 80 power ballad lot kid cinema almost falling asleep end lol pls tell think big change,True
disappointed film think first frozen greatest anything still thought good elsa anna character development movie set could led anna elsa good character arc never followed anna overbearing protective elsa could led argument sister drama move story better provided better excuse elsa awaken spirit go later moment pushed away olaf anna anna development letting older sister independent time look like elsa confidence problem stop overworrying end elsa going live magical people important end arc anna acceptance elsa independence instead nothing elsa meanwhile selfish awakening spirit caused unwarranted destruction arendelle repeatedly put friend sister harm way try discover source voice origin scene make cave pivotal arc perhaps given decision choose see mother briefly find origin power risk arendelle destroyed completely elsa glimse anna cry cave olaf fading away kingdom people struggling makeshift camp realizes importance people friend family leading rush freeze deluge anna break dam whole also lack urgency since idea people camp lack defined villain help either well least movie pretty elsa look great hair also liked unknown remember much song walked kristoff number bathroom break feel like missed single thing,True
acting chop musical talent theatre discipline exception course goddamn amazing entertainer,False
past couple month much shitshow job used say one step time song hit close,False
right going missed opportunity,False
anna plan,False
arendelle get destroyed elsa made pact spirit sound stupid going whole movie stunning though would watch dark sea sequence,True
thanks,False
weezer cover point apt covered,False
gt also cool shot teaser anna swinging sword kristoff riding hill flanked reindeer appeared young mother twirling wind leaf think saw find trailer talking although remember seeing sword swinging grabbed frozen sword early forest reindeer maybe fire end fog lifted young mother leaf pretitle father telling happened,False
thank honestly forgot evacuated town beginning pretty tired saw haha,False
damnit left theater checked thread thought said totally missed credit scene,False
think six year old seeing ice princess elsa magic water horse pet fire lizard goat,False
watched one thing girlfriend got noticing dialogue really point two instance really resonated one elsa anna talking bed room anna told something along line wish saw see two another one elsa say something like following fire anna responds want following fire run fire personally really felt emotion behind line,True
kristoff song giant melodramatic 70s80s soft rock music video reindeer absolutely hilarious made longing anna seem ridiculous still charming missed fun one,False
one else theater laughing thought absolutely hilarious could tell went way kid head,False
kind believe like pointing ground sorta flat hand lifted leg ice skate,False
know anyone else seen deluxe version soundtrack feature song used movie seem relying different plot point movie actually play example song kristoff sings anna called get right trying propose end anna proposed really fun cute song sure point movie song would come extra song mixed everyone general concern confusing plot pacing make think film went several several draft rewrite actually production obviously disney product lot cook kitchen one felt obvious others,True
yeah would even say aimed kid overall anna song olaf death would expect disney movie,False
dead,False
seemed like intended elsa stay frozen even expected reveal anna hugged elsa fact force projecting frozen throne would much disney,False
gt mature cheesy original feel like targeted good way parent kid loved last one,False
ed ward,False
three four outtake even sung cast rather songwriter previous frozen outtake song writer wonder mean major shift late production,False
honestly frozen ii story completely garbage think art thing saved song never good let go asked one thousand people song best let go would probably vote song frozen ii combined expecting decent story story never came watched film theory prediction frozen ii mat plot would much better excuse movie sure good going man save woman woman love man man get married route time much disney could done story suppose another cash grab ruined everything suppose good excuse eat popcorn,True
"anyone like kristoff song get period half movie wink nod three thousand, five hundred and forty-five year old parent coming age mother father play sound track frozen playing background",False
absolutely aimed adult grownass man loved every minute people missing frozen huge part many parent life disney know go frozen live show disney world big laugh parent frozen ii designed hold kid aged,False
seen wife said pretty much polar opposite said different stroke guess,False
every adult theater cracking new way determine like person think kristoff song frozen ii dumb ok bye,False
wow rude little shit,False
almost dude whole movie comedy,False
entertaining flawed two four year old fucking loved like whipped wand cast stupify lol make bank forced listen music sane person forced anything solid forty-five know audience,True
olaf death grieving knew elsa died olaf died,False
going save forest believe,False
thought moana much younger sixteen,False
watched happen,False
funny movie incredibly divisive seems people feel ok people either loving hating much better expected even thought could might even go far say preferred first 80 power ballad living,False
guess expected much one first movie everything frozen two better like said thing better animation watch get talking might agree understand coming even kid liked first one bored one something expect well like said different stroke,False
shame downvoted said true writing movie garbage heap legit understand much whole ahtohallan thing came read people comment explaining,False
want know wife liked genuinely curious aside beautiful artwork decent song memorable quote struggle understand anyone aside kid wanted see elsa anna like anything else movie honestly felt like something essential missing movie plot,False
sterling k brown comedy well,False
seen frozen one understand movie lol,True
yeah read comment fully understand ahtohallan either guessing going idea water contains memory since ice basically extremely cold water memory best thing elsa could see added much idea really go example anna elsa drama completely forgotten kristoff joke olaf change drama much watch matpat film theory video frozen explains true villain frozen prediction second movie found plot much exciting actual movie,False
really best watch frozen one first edit scratch first movie play huge part pretty much mustsee,False
feel way movie look amazing voice acting great story deliver felt tone odd well moment darker went back funny comedic emotional dark much enjoyed kristoff 80 montage felt completely place could focused relationship arandelle sami people completely brushed introduction sami people culture parent relationship flashback end would nice felt interesting portion movie,False
see raging religious strawman thread frozen two think saying something clever biting people heard dismissed countless time fact goto burn asking believe giant man beard sky show done little actual thinking subject believe hinduism go around saying har har worship cow ha eating god least spend time understanding people actually believe engaging discussion think belief incorrect,False
give shit god believe literally matter made whether believe two hundred one discussion burden proof believe powerful zero evidence existence someone patted head little boy sang song believe believe one le god go logic science,False
know late 80searly ninety music video kristoff something behold,False
thought would made thought provoking movie,False
living disney female empowerment song speechless show teared theater year,False
mean dumb also best part movie,False
listened multiple child cry watching oolaf elsa die pretty much back back think went enough movie mature child movie opinion,False
oh fer sher mean flippin cartoon people critiquing like latest flawed tarantino movie,False
fair elsa anna ugly cry different point movie animation movie great could see pain made cry right along,False
considering bringing name table baby pregnant funny,False
sure movie saw saw giant wall ice,False
gt give shit god believe impression giving fact come across caring great deal truly care would suggest modifying way react people mention theological topic gt someone patted head little boy sang song believe see people care react would oh believe x cool whatever get butthurt start insulting people throwing wild assumption hardcore atheist antitheist decade get impulse attacked religion religious believer care cared lot thought answer freeing harmful delusion toward truth course cared learned belief people believed stop worst example turn get past kindergartner understanding religion atheist polemic focus combating plenty well developed logical evidencebased reason believing various religion much stronger others none completely conclusive certainly enough make one understand people choose believe enough quite arrogant confronted people believe,False
idina concert gay bar invite stage footage headbanging let go pretty great,False
supposed holiday special put coco instead scared coco would nearly well,False
disney flexing studio water physic even going mention accolade hair physic,False
know enough story directly comment watch many movie theater usually let wife take kid kid movie went saw neighbor weekend made happier movie seen long time,False
fairly tale old story old norm deal,False
gt know deep meant beginning film voice calling go elsewhere leave home say film never touch arguably main plot thread beginning gt every day little harder feel power grow troll mention power growing feared might enough gt parent ship left unanswered question exactly happened parent water memory elsa used look moment death died ship father cradling mother water overtaking ship made clear however parent lied purpose journey going southern sea risked dangerous water get information might help elsa feel guilty death parent image elsa conjures father cradling mother right death mirror image see time mother cradling saving father younger gt make wonder might frozen three focusing parent prequel kid know much ground explore know happened adult drown first film showed u gt seem totally fine going living completely different city end living two different city shown communicating via gale getting together play charade stay regular contact elsa tell anna two side bridge bring two people together side longer live total seclusion rather talk trade comingle,False
know really unclear,False
yeah got theatre started listening deluxe ost realized pacing story seem place think alot either rewritten left chopping block feel like writer pulled back kept family friendly happy end hope see scene song suppose go special bluray release something,False
nothing like sentient snowman check love life staring waiting,False
hoping ana got fire power could cross avenger movie,False
whole seating area stop laughing whole song adult kid theatre though,False
mutant witch,False
disney already wreck ralph two proof concept,False
video damned adorable dax couple goal sure,False
lead singer band panic disco writes sings stuff also massive vocal range,False
everything said complete garbage plenty well developed logical evidence based reason believing various religion talking as name go ahead name evidence based reason idc believe could believe santa give shit going tell fucking idiot say thing like evidence based reason believing nothing answer although love picture paint high mighty joke fact scientific evidence back claim religion none zero fact argue matter faith believing reason human need answer hard question like idea die done want believe something religion exists bullshit,False
go obedient fuck like good little boy girl since know obedience one christianity important value lol course without people would question nonsensical bullshit told every sunday like mary virgin guy turned salt blew away guy multiplied fish bread thin air dude walk top water keep going going give little fuck opinion end go obey hear get cookie,False
thought funny engaging enjoyed story much crazy people opinion,False
wife cracking kristoff song felt like old meatloaf poison power ballad probably funniest part movie,False
lol wut understanding see screen ana made sacrifice destroy arendelle right wrong grandfather elsa put wall ice blocking water spirit allowed city spared sacrifice ana made,False
thought intentional kid little frozen new six year older think darker mature subject matter nod think trying create story would appeal older kid new grown story still appealing younger viewer adult still capturing timeless disney magic honestly sound like tough line walk imperfect think pulled well could,False
also know sleeping beauty actual name,False
would killed one already evacuated safety flood,False
yea kind surprised dark anna song particularly character youthful bright think taking character limit intentional though olaf mentioned forest place transformation thought interesting transformation character turned something scene towards end gt elsa anna see elsa look transcendent new white gown ethereal glow radiance becoming comfortable aware power used hide feel anna dressed black grieved loss friend sister virtually childhood home kingdowm dark spot make reunion powerful lt wife puddle tear theatre moment even honest get tired schmaltz get troweled onto movie found scene moving surprised comment kid getting bored two five year old absolutely loved movie thought animation stunning song definitely memorable sure better right really liked headline song unknown intro song blended together show felt like music certainly planned way liked effect honestly confused story whatever elsa anna kid cared,False
oh planning seeing alright guess ill go see,False
confirm five year old wanted elsa water horse oh marriage noted technically get married big plot hole,False
lmao crazy person see complete lunatic see anything disney logo good,False
liked movie like lunatic,False
mean called people share opinion crazy clapping back upset give receive hate hate lmao get hated back,False
also dying laughing haha,False
definitely watch first frozen watching one,False
elsa becomes dark knight queen,False
win argument fourteen year old probably even know saying say something make sense know respond since expect talk someone equally dumb let tell something movie plot well movie lacked substance needed slightly average movie term plot since frozen expected make frozen ii plot decent let art song carry become toptier movie plot climax also underwhelming even friend barely learned creative writing right could think something better many people working one movie high budget would least think decent plot since song artwork guaranteed make movie global phenomenon like first movie like said guess one crazy people think frozen ii good another disney movie one best female empowerment character history disney wish loved since many way frozen could good know actually devloping theme casually inserted instead forgetting problem solved,False
said crazy people opinion two year old,False
spewing opinion fact hate tell center universe opinion end time grow calling fourteen year old even tho mental breakdown fucking read sentence said crazy people different opinion fragile soft,False
lmao word stop cutting corner especially misunderstood like look sentence see easily misread,False
maybe fragile little pussy mental breakdown word crazy crazy right,False
lmao sound like mental breakdown chill kid opinion mean anything look like rather quite mental breakdown relax take large breath look sentence weird much comma change thing wow free grammar lesson must happy gave free satact answer maybe break four hundred and fifty scoring english section,False
want get rattle wub nub soft little boy,False
anyways quite sad misunderstood yes lead argument mistake alone apologize however crazy many think horrible movie many comment alone stating plot bland regardless already said thing five time already,False
way reply continues prove point tween thinking insult actually effective goodness sad,False
much enjoyed stark contrast live action song show much better actual fuckin singer lmao underestimated shite live action bc released animated long immediately noticed astoundingly better vocal lol think song would worked without good vocal tbh would worked worse singer despite technically easier song movie,False
ninety-three percent audience score seems indicate otherwise perhaps maybe reddit accurate judge people liking liking something weird work,False
could wrong afaik voice actually done quite bit earlier process animation would think help va might perform line way match storyboarding see work feel slow edit thing without whole chunk fully animated shit ton money wasted also timing first thing relevant seems like movie went quite heavy rewrite song sung actor would help gauging work process would surprise early story rewrite song got cut opposed late production,False
weird rotten tomato basically ten audience member well suppose look imdb review might see otherwise look top rotten tomato review also state plot rushed well furthermore know whether people liked liked song animation seen many review seventy-eight star simply animation song funny say reddit work meanwhile also give site equally many flaw,False
calling elsa think need reaffirmation,True
