comment,parent
dan castellaneta genie spot,False
k,False
soundtrack song aladdin huge part though popular song people going watch film nostalgia hit audience one hundred expecting song disappointed cut,False
like actress cast jasmine worried film,False
prince aaaaaaali fabulous ali ohbobwahhhhh,True
get downvoted hilarious,False
madonna one,False
"one thousand, nine hundred and ninety-nine",False
get hollywood trailer teaser trailer yet release three min trailer pretty much show entire story call teaser,True
heard rumour iago speak he smart parrot know true though,False
seen hair,False
ever seen one minute fresh prince bel air would know hell perfect genie,False
tiger literally unwatchable,False
mix,False
know perfect guy job,False
italian wash hair anything day becomes naturally silkysmooth idea happens lot italian,False
beauty beast great job showing depth beast lefou unnecessary b belle mom ruined amp x200b emma watson nerdy pull sortof otherworldly beauty would felt better another harry potter actress evanna lynch could,False
people worried movie right watch original stop giving moneygrubbing fuck money,True
enjoy remake,False
agree look like dogshit fuck disney given classic signature animated style gritty 3d reboot horseshit far far beyond must sell well china,False
well far everything look great,True
look like iago talking film va showing imdb page,True
guess milked,False
mean nothing new gerard butler phantom opera similar,False
like think would done instead animated film anyways budget technology year ago make believable animated cheaper produce,False
maybe completed effect something,False
whole new world movie popular song think also think hard right tricky thing genie song robin williams performance core part original movie based casting smith seems like decided take genie different direction rather someone else try recreate robin performance think right move make song tricky hard imagine smith able robin williams song original also feel song missing dramatically changed,False
yes movie really hated liked jungle book,False
encapsulates villain well friend side facilier princess frog,False
jafar song abysmal aladdin two matter fact like good thing movie hold candle aladdin one song still neat hear jafar smack genie around,False
abbaabba,False
genie movie sinbad,False
soo excited movie aladdin absolute favorite disney movie look heavily cg thought watching crappy fanmade trailer aladdin looked dolled fake like finished dancing disneyland parade getting little worried,True
cruella one hundred and one dalmations usually disney fan compare aristocats film since plot bit similr,False
he definitely blue,False
yet cave wonder entrance rock boring really loved moved well except kingdom heart made annoyingly difficult defeat heartless,False
remember jafar still looked like old beggar went cave,False
thought wasted much money cgi stuff carpet ginnie monkey magical stuff ninety location though rest movie still look bad ill kind pissed cave wonder great disney flipping bill old money bag,False
gt lion king remake feature scar song prepared well disappointing one best song movie one best disney villain song general,False
loved movie,False
holy shit voice lol never made connection,False
maybe angle lighting looked much older aladdin,False
beauty beast practically shot shot remake original extra song extra scene minor change,False
well yeah know exactly song everyone pissed included,False
lol damn mad never put two two together,False
genie played robin williams,False
thumbnail kind hoping would live action version first version arabian night start aladdin movie going musical,True
oh giving last airbender vibe,True
pursuit happyness smith odd choice compare certainly going dramatic role would used one comedyaction role like men black think special effect department one make break role matter great voice actingmotion capture cgi genie look horrible cheesy weird average voice acting amazing genie special effect make people look like avatar first came,False
cast guy thick glass snatch brick top rub lamp fuck think sweetheart,False
considered teaser trailer,True
sameee huge fan movie love see adapted different way get hate watch lol,False
lol yeah man mind blowing also considering watched like crazy,False
wow came far way lemonade mouth,False
sequel oz great powerful confirmed,False
fuck voice work shitty,True
va listed imdb cast listing look like disney want little talking animal iago mushu bet flounder sebastian make little mermaid remake,False
everytime teaser come sub like show seriously think like strip tease getting titty right away,False
woah obsessed movie kid definitely going look forward one kind want rewatch original many year total nostalgia,True
sure still belly button,False
probably thanks modern time metoo disney show midriff musical stage red outfit,False
lot people mad wanted see teaser trailer lol,False
agree think ruin anything wish still musical least found better way get song,False
good teenager take clothes,False
let u see monkey,False
john oliver already cast zazu lion king damn perfect casting right,False
gilbert gottfrieds name nowhere cast list really,False
make sense cave sand dune live action,False
seven month away probably ready show much cgi since film heavily cgi little show right would think would least close ups main cast though,False
box scrap,False
genie appear beyond halfway point,False
aged urine,False
make sad seeing knowing robin williams genie,True
know true would surprise entire reason smith hired genie know one could good robin williams whenif movie flop comparison turn around say people like movie smith black make criticism film racist bullshit exactly like tlj,False
kind like idea like enchanted petra,False
agree got chill trailer,False
titled official trailer though,False
abu sorta talked sound translated weird squeaking,False
based upon brief viewing sequel kid think even animator came back sequel,False
remember time long ago movie allowed use color blue orange,True
stop projecting others,False
please tell character othello,False
scan entirely much thread looking exact comment,False
twin peak,False
holy shit joke thought going joke reddit sometimes wish time,False
would swept away,False
jungle book pretty good though,False
announced hoping would seek james monroe igglehart role nice job genie broadway honestly better rendition friend like thing worried smith,False
blame walt disney canada official link walt disney studio youtube call teaser,False
going guess put line back arabian night cut ear like face,True
two option try mimic robin williams go different route try mimic robin perfect awful go different route much room error,False
cartoon would work well live action setting,False
shut fuck return jafar king thief masterpiece,False
nope,True
think appears blue first meeting twice throughout movie part look like smith,False
twenty-six aladdin came ninety-two twenty-seven time come,False
jazz music stop,False
yeah getting beauty flashback let u hope take page ha jungle book actually get bit creative,False
music cue though hnnng,True
literally sounded like used audio clip original movie,False
sure want rewatch aladin go blind,True
disney,True
guy warlizard gaming forum,False
going lie pretty disappointed titling expecting full fledged trailer see run time started watching,False
robin williams still u would still great,True
wtf kevin hart lt mom,False
shazaam,False
king arthur good fun least,False
sound exactly like original movie,False
sand effect snap thanks thanos,True
seventy-eight much water,False
seem recall genie broadway show black guy freestyle may mistaken,False
record skip,False
want three wish,False
yea weird official one harder find either way expect full trailer genie jasmine jafar next month two,False
thare,False
teaser like wanting titty right away strip tease get eventually full trailer,False
aladdin hustling son think,False
shorter version actually made excited,False
said twitter wait till see blue,False
hard pas,True
mean emma watson baad singer major autotune going,False
made power ranger movie last year super campy think sequel planned sell merch as,False
least confidence smith voice,True
going huge mark word one disney biggest rake far animated collection go,True
f,False
surprised shot jordan instead namibia largest sand dune world,False
blue say literally human magical shit bust,False
compare robin williams though smith work cut hope done good job,False
ya would even get genie lamp supposed accept magic call bullshit,False
jasmine dad played jeffrey demunn riot,False
music sound good everything look good except aladdin look way clean well dressed supposed homeless starving half time right,True
given smith actor possible go broadway version genie often black actor incorporates hip hop music,False
aladeen news aladeen news,False
miss robin williams wonder going voice genie,True
iago intensifies,False
first time,False
loved king arthur people hated thought damn good hopefully aladdin similar,False
understand way either beauty beast meh take core story go different way instead copypasting liveaction mostly music usually done worse first time around,False
look forward jafar sexually assaulting sake plot,False
yeah jasmine might saving grace genie suck disney going make jasmine supposed sixteen year old like original really push beauty much without getting creepy jafar slave costume going bit harder explain parent,False
nope,True
perhaps shrimp popeye could cheer oh,False
doooood would forgotten show,False
aladdin could way hotter,True
pretty sure already changed subsequent recording video release,False
pocket sand,False
going like beaut beast essential carbon copy animation almost word word oh dear wanted watching beauty beast put animated version watch something actually enjoyable going similar experience think bother aladdin one time favorite film got feeling one going shit good way,True
silky fluffy beard tho lt three,False
well sure going make kid nightmare let u honest disney made people like thirty,True
barely remember still hold,False
beauty beast terrible look like going worse,True
went paul mitchell school hair silky smooth,False
guy ritchie foot chase scene like nobody else pump least,False
hotter hot,False
least especially thief,False
yup everyone excited new disney live action movie like one hundred hit rate recently surprised live action little mermaid movie hot,False
dude character sixteen chill,False
immortan joe property,True
hope delivers,False
good dan robin seems like disney choice distance portrayal probably wiser sensitive audience love robin genie,False
although want mulan liveaction carbon copy yet movie crew changing everything,False
sub hate remake apparently would read much,False
al adin,True
smith,False
dude seen people mad mulan changed please people lol,False
need hire actor play doctor stranger cape fine,False
kill exec,False
genie us exact audio track robin williams line new animation would happy,True
pouring salt wound even hot fucking chest visible idiot see original movie like actually mad,False
cast simbad fuck reddit shazaam mystery,False
slow clap,False
one thousand and ten would show world,False
would rather look aladeen look like allen,False
wtf guy ritche,True
buy thaat,False
usually actor live action part remake may well go full cgi movie character stylised look cartoony,True
token anybody expect differently sceneforscene remake disney kid cartoon whole thing meant larger life fantastical ride rather historical drama,False
calm,False
eeeewwwwwwwwww,False
fucking disney,True
jasmine dad blue,False
true suppose fault strategy movie making damn much money find derivative boring beauty beast awful going,False
okay move life,False
genie smith checked imdb,False
eh think know died spoiler mate,False
siamese please siamese please,False
omg pls,False
strong ten regular men,False
yeah noticed recent rewatch aristocats like worse version dalmatian lady tramp combined,False
still get could still get thing get something new industry run engine nostalgia even sequel old movie done exactly feel like going crazy,False
going genie voice though,True
thanos font,True
hello,False
uphill way,False
yeah riot,False
yo yo yo give three wish wish love none bitch,False
yeah would rather new genie poor robin williams impersonation hell even good one would meh,False
smith,False
sebastian major character would bizarre hell,False
tho like lock disney vault guy new combination died something got remake classic make money like disney blue ray seriously easy,True
real people smoking want say true original story argue guy look like thirty day aladdin cartoon never grew five clock shadow,False
got realize cogsworth big eye goofy smile would look stupider live action movie,False
could made wear pasty christ sake,False
upvote,False
danny devito confirmed jasmine dad,False
know intend movie blue genie ancient city exist flying carpet without cgi,False
trailer,False
actually genetic think due certain gene people mediterranean meant deal absorption vitamin k deal high amount sunlight excess oil someone produce wash hair actually partially absorbed scalp creating natural defence sunlight actually made probably pasta shit lol,False
disagree teaser pull tickle nostalgia full trailer get take world imagine might see,False
seem made focus graphic instead story telling definitely betting movie director learn storytelling make movie great,True
dude charismatic hell,False
based true story,True
could worse thinking aladdin might cast famous white actor business portraying right speak trailer,False
far movie already released like twenty-five year ago sure spoiler possible scenario,False
picture danny devito perfect jasmine father,False
song prince ali hoping good hinge genie basically,False
actually feel like revolver lot energy,False
smith aladdin jasmin jafar abu,False
shut fuck guy pulverized horse proper joke,False
agree entirely main thing tough think song especially area concerned smith could see take genie working hard live robin williams expect awful could maybe see friend like way kind work although would expect nearly good original lot trouble imagining smith version prince ali awful maybe cut completely rewrite song maybe pleasantly surprised hoping latter course see,False
guy ritchie get book disney think chance movie world,False
literally going two identical version old disney animated movie think many new story could investment went apparently people ok even trying anymore,False
hate exactly like cartoon know big eye big smile would look stupider way lot people fail realize thing cartoon look good live action film,False
sorry tony stark,False
haha woooooooooooooooooo,False
cave wonder cave wonder,False
ok egger,False
going honest thought robin daughter zelda williams played dictator kuvira legend korra imagined super deadpan female genie sick everybody shit loved idea maybe macabre,False
thanks hate little see look pretty uninspired aladdin look shiny wut,True
better gottfried,True
lady tramp ask way le offensive cat aristocats,False
unrated genie dr manhattan,False
got mother eye,False
going lie cracked smile,True
jaden song something,False
fuck robin williams still upset,True
original story aladdin basically spoiled little brat think face suit personality perfectly,True
miss robin williams know totally would done genie role,True
one thoroughly enjoyed beauty best,False
cave sand dune make sense live action movie,False
beauty beast cinderella awful jungle book good though,False
kind secret sexual reference expect,True
tom cruise movie ruined,False
bullshit indiana jones chased giant bowling ball entrance cave wonder giant tiger head made sand,False
fuck supposed,False
derelicte ball,False
man always forget bad animation directtovhs sequel,False
yeah ok thanks tryin see jasmine real tease,True
like found thing week saw poster trailer somehow missed buzz flick confused thought mulan next live action working,True
know dr claw disney,True
aladeen good,True
disney movie bluray,False
miss robin williams,True
sure complete cast know lad,True
one one,False
genie shoulda sinbad,False
world,False
holy ball go back trailer wide shot cave show abis mal entering closeup aladdin would missed remind original scene,False
may summer neat,True
id bolly wood wait,False
mine sort italian,False
would think would see poor boy siree,False
tell,False
"missed great chance tell mankind undertaker hell cell one thousand, nine hundred and ninety-six",False
play,False
maybe bug life reboot extensive experience playing mantis,False
unzips,False
guy sultan,False
people used call aladdin younger shit come birthday lol ironic,True
happy cake day,False
say something bad trailer might overreaction teaser trailer could different movie mouth cave move talk,False
compare force awakens teaserstrailers first teaser show millenium falcon end lamp trailer show han solo chewbacca genie,False
yeah get going kind first force awakens trailer probably taking lead one huge payoff killer action shot forgive forty second static desert shot get thrilling moment make want leap chair aladdin one feel kind dull,False
relevant,False
move tho see close right cut,False
aladdin sequel,False
omeone plea e tell remaking thi movie wa already made perfectly fir time,True
friend like remix,False
genie freestyling,False
danny devito joe pesci originally asked gilbert turned would fun one,False
aladdin grant genie freedom end,False
disney sort lot another example indiana jones ride disneyland agreed principle harrison ford voice indy long part marketing however someone either fucked care sent ford commercial script along ride script thus got voice actor playing indiana jones instead harrison ford,False
know say,False
aladdin seem like say take clothes jasmine flip,False
ugh,False
would see poor boy sirree much hair,False
toxic love always favorite,False
thought aladdin supposed handsome,True
supposed make sense maaagic,False
expecting jumper cable,False
john oliver,False
sure alone liveaction remake original aladdin fantastic watch instead paying see story worked better animated film original animation divine robin williams gave outstanding performance really matched,True
disney fucking money world yet arsed actually build set hire production house make real prop entire teaser looked cgi max,False
seems like used exact voice clip cave wonder original,True
retarded,False
score alan menken,True
thought cgi trailer assassin creed origin eagle flew,True
forget quantization shitty timing hire ghost musician like good old day,False
aladdin broadway musical genie quite different robin genie still sing song make work smith need make interpretation much like different batman joker different,False
giant ound boulder found right real life terrible comparison,False
dare want world robin still voice genie,False
dude chill joke,False
motion capturing sitting stool flapping arm around,False
make feel like spidersand,False
love reddit,False
gt freestyle smith kid actually think smart choice profound likeability actually making effort,False
wow dude really thanks telling u something could found wikipedia,False
got say zero faith movie trailer completely sold,True
like mortal engine alita battle angel want orginal big budget flick actually look good,False
lt hope live action hercules dress know moment much wanted ruined,False
get reason tired complaint watch kind reminds people bitched superhero movie wonder stopped guessing mcu happened,False
friend liberty prime would like word,False
think everyone ween washing often little scrubby scrubby water often good go,False
yea think voice think changed voice much role,False
wait three,False
cave wonder clapped,False
girl fight,False
aristocats,False
terry crew would acceptable replacement cgi bird terry crew,False
also mark going mountainhill look like lion rather panther,False
derelicte ball thank much,False
actor probably even nipple nerve,False
zohan best make anyone silky smooth,False
tired uninspired orchestral cover,True
"ign seven thousand, eight hundred and ten monkey",False
movie,False
gt magic carpet perfect little balltickler tassel say fuck fuck even tickle ball thanks,False
gt yea think half indian half white iranian,False
excuse male pattern baldness,False
may 24th still spring,True
felt actor cast upon time deniz akdeniz perfect also video comment gt let u take moment admire hot aladdin,False
batb amazing film going cried internet film critic hobbyist like hate trendy,False
aladdin place ever heard arabian swing good style anybody know diablo swing orchestra balrog boogie basically friend like operametal version,False
gilbert gottfried pileoftrashlooking new movie see opening night swear batman,False
thing though aladdin ride strength musical number particularly genie never done well robin williams,False
still nothing top feeling sitting theater long time ago galaxy far away came screen,False
thought distinctly remember chasing scarab desert specific area put piece together remember random spot,False
tiger native africa lion would guess,False
nah need phil ever hercules,False
gt giant round boulder found right real life ah yes like flying magic carpet wisecracking 4th wallbreaking blue genie living lamp,False
feel like danny devito would make great iago,False
sure genie gettin jiggy wit soon,False
okay sure going robin williams think type role smith could pull keep hope,False
used happened,False
um pretty sure summer next summer,True
guy ritchie shite,True
see argument lot magic world anything possible work though forgive every lack thought magic exists movie play rule like star war space fantasy ship fly space like atmosphere sometimes sometimes hear sound space break sci fi convention need consistent word concept element movie stay true world created relatively realistic know explaining well enough hope get,False
easy money disney,False
act like going happen,False
disney hit goldmine live action remake incredible formula take huge hit movie twenty year ago remake liveaction look expensive shiny everybody feel nostalgia go see make least triple original must feel good knowing remake frozen twenty year make ten billion dollar cash cow,False
get ready aladdin two thousand and twenty-four jungle book two thousand and thirty sleeping beauty two thousand and thirty-five beauty beast two thousand and forty-one lion king two thousand and forty-five staring one dude one thing masterful score whatever maker meh producer bleh come bleeeeeeeeeeergh huaaaaagh hack hack hhhhhhccckkk,True
think style trailer perfect want know detail give cinematic sweeping shot glimpse soundtrack happy want movie spoilt trailer,True
ritchie bling menken keep real,True
might anyone else get annoyed trailer include original tunesong twist epic sound,True
perfect,False
least broken arm,False
office,False
lmao fuck thank want blue thanos aladdin tbh,False
jasmine,False
asking point movie studio,False
want excited remember genie robin motherfuckin williams help think need movie money passion,True
actor rapper since teenager,False
rip robin williams better genie way,False
eye find clean every dog hair return,False
become official trailer scenery cgi title crazy pumped,True
stop putting harmful industrial chemical hair evil company use poison keep enslaved beauty product use pure water body eventually clean need shampoo oil make,False
every transformer movie mean good,False
dialogue spoken cave copypasted original movie know hired guy listen original new one side side compare seems like exact clip enhanced louder,True
miss show,False
guy ritchie interesting,True
imagine aladdin genie breakdance fight jafar iago,False
best got think actually showing ab would public health amp safety concern nonstraight male audience,False
agree nice see someone else positive comment might remake would call cash grab far expensive artistically done great care source material people seem mostly complain either enough like original different feel like enjoy story told different lens forget dot line original,False
wrinkle time one risk memed hell back,False
sooo changing initial story jafar disguised old man look like he normal getup aladdin enters cave lion tiny reason,True
seems harry potteresque,True
remember producer aladdin saying based design tom cruise specifically designed would make sense people would believe prince,False
well really sensitive ok ever,False
jasmine dad danny devito watching,False
id rather see walkoff,False
new ign review three different review part movie setting seventy-eight cgi seventy-six story sixty get time actually finish watching movie feel enough story told u get general idea,False
look clean,True
know wish mean righteous fulfilment desire manifested appropriate agent represented case orrible cunt,False
family walk talent agency,False
hear danny devito saying many line concerning jasmine tell truuuuth,False
would say still think rather tasty,False
confused cave literally collapse aladdin pile sand trailer people complaining hole wall suddenly trailer give impression hole wall gave impression giant magical sandtiger like animated movie,False
amazing fifteen minute could make put monty python want yell get,False
put robe wizard hat,False
captured feel original one well,True
singing beauty amp beast bad emma watson sounded like hatsune miku,False
could tell lowered budget return jafar since get robin williams back,False
hell redo except money original perfect leave alone,True
want fuckable 2d qt314 much ask,False
pepperidge farm remembers,False
