comment,parent
like person said pretend think singing amazing like film thought pretty good singing voice definitely low point nowhere good professional singer voice level cast member,False
gt wish disney would make live action remake maybe try hand new fairy tale live action animated amp x200b frozen even moana coco though amp x200b,False
disney okay hey jeff going reprising robin williams role genie aladdin jeff shitttttttttt,True
could cg genie used hundred hour certainly still robin williams riffing studio,False
wan theme 3d rerelease original aladdin like lion king,True
going suck,True
almost like hitch he public following aladdin around giving tip land jasmine,False
kid ate shit old enough eat shit also introduce kid likely seen andor billion time care kid watch gd episode umi zoomi one hundred time seeing remake like watching new movie bet,False
right iago swoop cave wonder jafar silhouette left cave,False
nothing sacred anymore,True
year ago,False
dmn month twenty-four,True
feel smith absolutely wrong genie almost actor would better,False
jasmine need hot able get peepee,False
spoiler,False
reddit went fucking crazy banned half people subreddit josh brolin snapped camera commemorate event,False
people start liking smith,False
long trip could use snack,False
little creativity hollywood started cinderella realized oh shit every animated movie made people throw money u fond childhood memory tied movie take little effort take successful animated movie exact thing liveaction coupled massive cgi scenery script already place animated movie wildly successful came disney print money particularly care,False
u society nigeria would different story,False
smith willing genie bold think ever compare robin,True
break robin williams point,False
iago aaannd singing show tune aaarabian night neath arabiaan mooons,True
think review movie aladeen,True
voice wow sound ridiculous,True
changed cave tiger lion,True
sing song annie get gun,False
look like mclovin,True
electro swing version could listen day super enjoyable,False
coming month avenger four going another solo going good movie nobody going see,True
never friend like,True
probably going go guy played broadway,False
love tiger corner,False
smith,False
never stopped,False
look wack,True
movie something wanted since live action b amp b unlike loved movie feel like smith lot live robin williams never replaced also want see jafar costume jafar favorite disney villain want represented best high hope movie better disappointed,True
difference adapting story photo copying,False
smith genie,True
mean spiderman moved one released eighteen year ago much younger one first big superhero movie ever bringing whole game movie amp x200b people never account situation emotion around watching movie rewatched spiderman god bad amp x200b p taking away enjoy movie objectively sure better,False
brought sand everywhere get used miss robin williams,False
entirely valid point,False
turn magical talking cave something realistic,False
without robin williams,True
talking movie pg13,False
definitely surprising movie year friend guy ritchie fan dragged looking forward loathing whole thing holy shit fun movie sure never going win oscar blast watch highly entertaining opinion undeserving extremely negative critical reception coming somebody becoming pretentious movie snob day day,False
yeah made 12bn still good film maybe quite good animated version still well,False
biiiiiiit frosting throat take medication,False
long term running well dry depleted fucked taking risk drilling well afford fucked know right way cultivate truly groundbreaking heartfelt lucrative long lasting family film know struck new chord moana seemed pretty good dis frozen think long lasting oomf aladdin beauty beast seems like trying live action retread thing,False
wait really entirely shortcircuiting brain right,False
idk mean look heath ledger version joker killed role say someone genie better think happen going completely opposite smith wrong going,False
made billion dollar good enough,False
going give chance aladdin one favorite animated disney movie cave wonder moving like actually speaking really bummed something trailer tv movie quality hope good excited,True
expecting dr manhattan,False
oh yeah dosnt look like street rat look like persian guy hit girlfriend,False
genie better big blue cgi dude kind look like smith also comical funny actual animated series,False
every time someone post trailer titled teaser every time someone post teaser titled trailer got get straight,True
hi bakery nice seeing,False
old aladdin supposed one really look like teenager hair arm recently clean shaven,True
without robin williams playing genie,True
said may two thousand and nineteen coming summer summer two thousand and nineteen next summer two thousand and twenty,False
agree,False
gilbert peace,True
matter say common knowledge,False
shove butt,False
actually looked meaning posted shame used right maybe analogy hit home clarify agree definition race fluid arbitrary biological construct race however ie geologically isolated breeding population share certain characteristic higher frequency member specie real,False
thank validating opinion matter,False
get french baguette,False
danny devito jasmine dad id watch,False
better fucking hat,False
like make moana next five year rock able,False
actor play dr strange cloak playing carpet speak tassel though,False
except kind lamp iconic djinn story within context tale supposed unassuming everyday item lamp damn fancy major plot point baring witness wealth grandeur treasure room aladdin presented gungy dull piece junk think buffing make writing legible free genie revealing true worth one main theme aladdin judge something worth based appearance version based teaser seems forget,False
many people slowly said agra ba showed city,True
course,False
last word song mushu back think,False
risk look wall street banker risk though real disney taken risk lately panned tommorowland idea wrinkle time movie mar even recall movie kaching need look smaller production company beholden share holder disney buy continue circle life haaaaaaaaaseweneaaaaaaaaaa,False
done holiday release like november december,False
inner atmosphere battle cool drifting,False
subject shot iago flying city artificial dead look beauty beast pretty much killed interest movie look like made plastic,False
removed theatrical release,False
even room suicide squad joker still fucked,False
hole mine,False
yeah right always mix castellaneta azaria bad,False
thought still pretty menacing actually like mixture feeling,False
joke already getting lady tramp single doubt mind aristocats least table,False
honestly think pocahontas movie reason always soft spot interracial relationship story,False
seriously gritty stuff worked jungle book assume would,False
look like ape look like aladdin aladdin messy hair ffs,False
movie ruined second genie show screen _,True
bring people back dead pretty picture,False
looked good showed aladdin expecting kovie corny hell,True
worst case cast danny devito,False
love,False
believe fucking believe look fucking ticked moulting,False
personally voting ray romano,False
tell watched,False
amp x200b asked delivered,False
mess zohan,False
great propaganda company sold founder need tolerant bullshit fuck disney,True
apparently china hated mushu could well gone,False
real talk earth keep giant city like fed watered middle appears sahara desert,True
shot wad supposed dry run,False
happens alot ppl generally shampoo hair strip oil,False
live action aladdin even look muslim pas,False
look like teaser trailer,True
reminds tv show black sail pirate first season everyone still teeth looked like showered regularly,False
hope flop hard,True
go,False
need get lamp chaley like crevice next level,False
tape episode show french reason one disney thing french alongside aristocats,False
rip robin williams,True
wahahah nono,False
could gotten actor could pull proper costume,False
man spider,False
real,False
counterpoint beauty beast made twelve billion worldwide another countpoint disney much fucking money able afford long time also also bought fox another revenue stream want take risk let u pretend like garuntee,False
another shitty live action nobody asked hate hollywood way use nostalgia fuck thing nowadays,True
ftfy teaser,True
saying genie really represented hollywood act like could cast real genie,False
give scene terrifying way possible butt seat opening night,False
going suck beauty beast live absolutely horrible predict much work better cartoon plus improve upon robin williams genie,True
islamist sing dance disney selling founder moral getting u comfortable religion peace realize people fooled libtards unless show muslim really murdering stoning racist terrorist watching piece shit,False
reason thought still preproduction shoe touch also mean lion king trailer coming soon,True
juice,False
would call approximate even,False
yeah making riamgoingtohell kind joke new guy look anything like cartoon version,False
yes need donny osmond,False
go watch taxi take care always louie depalma,False
ooohhhhhhhh say got nipple,False
wow expecting live action end twist,True
need danny devito play sultan let get real weeeiiird,True
sand everywhere get used genie aladdin king thief,False
saying trying make movie china appreciate,False
calling sultan danny devito,False
post getjaydenajobatallcosts smith impressed much though liked focus sure turn,False
someone told replaced robin williams smith genie may burn sucker,False
got pay troll toll get jasmineshome,False
teaser trailer,True
track record completely bad jungle book good hate batb,False
try watch chinese mulan movie disney pretty dope deal subtitle,False
anakin would hate,True
probably right gave cease desist sequel sure qualifies genie related material bet steer clear iceberg wanted create movie said wholeheartedly agree take original voice recording recreate genie knowing robin williams probably additional four hour voice recording movie otherwise never would see light day like need genie look like robin williams either use voice probably mannerism went animation honestly would bring people tear hear posthumously reprise role genie,False
hell asked,True
man nice montage desert,True
really optimistic beauty beast quite enjoyed jungle book made enough departure original movie feel interesting ended hating beauty beast practically shot shot remake original music everything added stuff yes felt weird watch movie felt like complete rehash original getting vibe aladdin trailer hope singing hope make deviation original story one thing optimistic guy ritchie style extremely unique entertaining disney neuter corporate risk aversion could end lot fun b amp b,False
buddy mine saw cave wonder take shirt shower said cave wonder eightpack cave wonder shredded,False
whelming suppose,True
absolutely perfect teaser trailer show absolutely nothing fill much anticipation hype wish movie trailer like,True
someone never really watched original animated film music seems cool panning shot seem cool cool guess,True
hexadecimal reboot,False
feel officially teased,False
actually yes shit,False
wow bisexual unique tried shoehorning unrelated conversation attention yet,False
easily racist disney renaissance film really curious stay true animated version without resorting stereotype portrayed film,False
john oliver ok,False
ran blue paint prematurely shot wad supposed dry run got bit mess hand,False
animated aladdin look like oscar isaac,True
genie,True
wop wonder reconciled since considering disney star war movie would really campy kind princess bride like talk han solo ben solo kid told bedtime story dad solo movie kind think would really sweet eye role inducing sure sweet kind poetic ben ever tell story became smuggler,False
gunna pirate fuck outta he,False
time favorite disney movie video game ever beaten sorry gamer apprehensive excited,True
well show genie lamp parrot iago shadow flying desert cave wonder plus firstlook unknown actor mena moussard playing alddain bad teaster going,False
mia khalifa would hotter sayin,False
holy shit every comment read make angrier,False
sinbad genie know definitely iteration universe incorrect somehow,False
hearing mythic version mulan myth legend podcast make really hope someone movie folklore foot soldier officer end commanding army fight decade,False
play genie,True
pissed happens better make genie bullshit black stereotype character either,False
huge crush aladdin,False
pissed smith fucking hate smith,True
since change thing anyone care anyway wonder take sexism racism,True
comment made article lol trying find voice iago,False
include arabic actor smith good actor complaint,True
crushing since power ranger,False
make miss robin williams hope smith,True
shazam,False
score also song guy la la land,False
loved watch sure,True
right malicefent good new story empathizes villain know disney good remake,False
assume iago still talking bird right,True
let u honest toy bombed fun movie ahead time really also really fucking weird lot people,False
think depends perspective remember people seeing louie everything portrayal frank absolutely exploded definitely rare someone sixty,False
completely agree thought cinderella perfect balance classic story something new enough nod original,False
video sharing site profitable thankful youtube let u people upload whatever want free,False
kind arabian night,True
sure hope use actual middle eastern actor scarjo brownface,True
yeah read swear copy song written turn original soundtrack cd,False
aaaand arrived remake without robin williams blow,False
changed entrace lion mean jasmine pet longer tiger either,True
official teaser official trailer,True
yes making actual cave btw likely talk see close mouth trailer,False
wish terry crew,False
cave wonder born raised magic lamp spent day chillin maxing relaxin cool casting magic outside school little street rat good started making trouble neighborhood monkey touched treasure cave got scared said moving monkey street rat belair whistled carpet came near stitching said wish dice mirror anything could say carpet rare thought nah forget yo holmes belair pulled palace seven eight yelled carpet yo holmes smell ya later looked kingdom finally sit throne genie belair,True
first many disappointment sure,False
damn fuck sand,False
shorter version way worse,False
swear god bring back gilbert gottfried protesting disney,True
pretty much,False
point stop considered live action movie trailer looked ninety-five cgi,True
almost two thousand and nineteen still pixely trailer,True
like everything everything soft smooth touch shoulder implying body referred lunge awkward kiss,False
summer summer two thousand and eighteen already happened two thousand and nineteen yet next summer,False
unnecessary remake,True
honestly shit emma watson bad choice love movie sing okay wanted looked like belle unknown brunette amazing pipe would million time better tone deaf sound horrible go emma watson constantly altered computer sounding voice would immediately take movie gaston sounding amazing really made emma crappy voice even noticeable still love emma watson though,False
yet see newer scene matched peter unmasked subway willem dafoes sheer menace villain j jonah unbelievable charisma greedy douchebag dr ock losing wife childhood rush seeing build newfound power etc etc three easily lowpoint entire trilogy go without saying fan old movie case cry loud secondmost recent redo jamie fox character literally played itsy bitsy spider zapping bunch generator lightning whatever fucking corny get long story short saying first one amazing stretch saying simply best,False
well apparently psychic everyone idea great visuals movie going look like bet trailer come spoil best part,False
street rat know diamond,False
wanted see pop fucking thing,True
gilbert godfrey part say way movie suck already,True
hoping producing directing goddamnit going skip one sure lol,False
pure robin williams brand comedy though probably even ad libbed make smith may seem forced,False
guy different genie done go check clip aladdin broadway see adapted genie impossible,False
rtheydidthemath,False
goootcha people kept telling watch one even though thought kid,False
robin williams,True
say thinking jasmine judging jasmine jafar red outfit,False
well would watch fuck,False
born ninety-three mean twenty-five,False
got priority straight eh xd,False
people keep telling play thing ps4 exclusive though right,False
must like eating pear,False
completely took movie every time sang cringed never watched movie beauty beast show girl animated one remake severely hate terrible voice period,False
nail geniealladin interaction movie fall apart honestly 1b alladinjasmine chemistry see movie go well,True
add sort weird character trait accessory joke character ancient fairy tale still ancient fairy tale,False
remember disney would write brand new story new generation,True
least music sound amazing gave goose bump,True
strangely enough toy one favorite movie watch came loved robin would automatically watch anything nine year old kid think movie understood,False
got high got whole ten pack biscuit halfway throat goddamn dry buttery tasty,False
smith,False
oh right sure right comparison make sense kind implying quality smith movie varies lot think poh peak cuz movie really amazing get mib caliber smith would also happy see cgi higher chance break movie like said though genie cartoonish character every aspect movement basic appearance interedting see adapt,False
yeah ps4 amassed quite extensive list exclusive also happen gaming masterpiece,False
course talk talking trailer curious make think cave exist desert though obviously location bunch sandstone middle dune,False
one jump,False
dude movie gave many nightmare kid,False
god damn amp x200b,True
excited fact hire someone middle eastern south asian jasmin real shame disney princess could relate growing becuz actress naomi scott look brown hired problem beautiful actress quite good hire people look certain ethnicity actually else supposed bring forward middle easternsouth asian actress hollywood represented priyanka chopra long amazing love many talent smh,True
unfortunately feeling movie turn profitable disney fan inexplicably supported much worse,False
damn time start saving guess,False
could resist smile,False
hah happy,False
hm neat,False
seems nice,True
betray mr williams watching movie one genie,True
believe actor egyptian better could tale actually persian arabian halfpersian take get think two persian film prince persia,False
need lion king trailer god dammit,True
appreciate polishedness mann performance technically wonderful feel clean part charm movie though step away glossy performance quite fit depth emotional rawness performance looking anne hathaway eye sobbing singing point sure singing screaming agony one moving scene raw genuine help feel misery even musically perfect could range pitch power terrance mann add touch imperfect rawness think would incredible,False
meteor hit,False
exprince ali,False
dare like half white washing joking think people sensitive play race like scarlett johanson played major ghost whole point japanese girl transferred robotic body happened white mean white washed original girl still played role get,False
next springsummer going lit disney movie lion king toy story4 come,True
animated movie formed sand dune middle desert,False
wonder jasmine dad say praise allah version,True
hun purpose getting business,False
much love emma watson reason suck reason period voice terrible forced autotuned,False
thought departing animated movie make realistic,False
luck,False
wondering smith step curly slipper much original performance adlibbed,False
stg one jump reprise movie fkin riot,False
gt hard live robin williams say impossible trying recreate style reason people like genie sequel robin williams,False
yes would animated disney movie loved genie doubt aladdin awesome story,False
gt 2d qt314 like,False
thought people complaining like animated film,False
think teaser supposed tease get excited movie rehashing original two hour get boring,False
disturbance force thousand woman cried disappointment upon seeing trailer,False
yah know people keep falling cash grab bullshit shit movie big star meaningful change original expect people eat unfortunately people pay nostalgia hell drug,False
personally think changed much beauty beast ruined whole core message story lindsay elli great video essay agree complaint hated live action beauty beast,False
well problem casting emma watson sing charisma,False
robin williams genie epic really hope justice,False
barely understand lion saying,True
perfect world would gotten guy genie,True
china made different version mulan already west disney actual story mulan theatrical definitely tend add stuff embellish,False
appreciate dr claw hired provide voice cave wonder dude seen work age,True
played eugene levy care miscast,False
ok idea somehow,False
well happy alan would complaining la la land guy,False
say like mark ruffalo hulk last six year,False
genie smith mimicking robin williams genie terrible go way broadway show hopefully good finger crossed,False
always thought steve kirk cameron case,False
yeah issue rumor witch villain seems lame chinese actress mulan apparently great actress picked look english skill popularity china,False
god hate trailer give away whole movie,True
uhhhh sorry guy ritchie,True
okay though,True
sad robin williams play genie smith excellent second choice,True
phenomenal waste time money potential fuck something badly technically financially impossible better lazy shitty creative decision confuse boring realistic,False
tell le risk established ip,False
try,False
live action movie primarily cgi,True
general kenobi,False
"saw cinderella remake care trying drag opinion please take way felt bored maybe many live action cinderella remake wanted like love animated one though cinderella remake really love low budget one called rodgers hammerstein cinderella one thousand, nine hundred and sixty-four mom showed kid one loved growing seen love cinderella story check",False
thom yorke suck,False
christopher walken hearing sing song fantastic instant fifty-seven,False
rtheydidthemonstermath,False
make money risk predict accurately possible lose,False
worst trailer seen lately sand building wtf,True
full length trailer batb tit,False
okay trailer show anything essence simply hey check exists look exactly like knew would expect look like disney live action movie covered mouse house greed practically feel focus group statistic etc,True
make lot money fact today world sorry,False
vista,False
always thought computer animated version would make bajillion dollar,False
referencing thing know,False
super disappointed enough sand,False
beauty beast something book gaston wanting rape belle,False
wait see sexy red outfit jafar make wear,False
asking realism movie genie magical sultan flying carpet,False
oh god please make happen somebody,False
sultan eugene levy,False
everybody want cat,False
pretending anything liked singing film whole,False
radamel falcao,True
know crossover episode existed probably going watch later,False
wait,False
yeah seen guy play jafar movie,False
sure go different direction way went completely different direction king louie jungle book,False
robin williams voice genie tv show remember,False
fuck hope justice incredible,True
generic cgi mess zapped vision like live action disney movie got,True
wait mulan without song someone want watch,False
like singing actually really impressed ability hit difficult note,False
cast member aladdin clean looking need street rat,True
flattering angle actor playing pretty attractive imho,False
low risk low reward almost absolutely high risk much higher reward high risk mean could mean much lower reward accurately account risk low risk mean consistent accounting sorry trouble understanding something basic high risk high reward yet still felt confident enough downvote claim correct hint,False
think much like r amp h version adore incarnation branaghs took time delve ella adversity remains way prove strength also love time took build relationship prince also robb stark mean hello something different original feel place also think making musical excellent choice still payed homage song original really think strongest script strongest vision really kenneth branagh incredible creative talent jungle book good script felt unsure really threw adding want like plot device song song like whole movie bare necessity montage plot device feel weird wanted flow better beauty beast intent shotforshot remake addition rewrite felt forced unnatural feel way broadway version well still better film however also emma watson theoretically great belle bc belle hermione similar could picked broadway talent better result cinderella score front vision script design casting mean cate blanchett queen really hope get like,False
pretty gross someone middle eastern decent playing jasmine said got darkish skin good enough cast role,True
personally loved live action beauty beast thought emma watson perfect liked stuck original,False
strooooking inner wall clitooooris,False
calm iago,False
original story boring though reveals girl say time war woman need fight everyone say oh ok make sense,False
tell jealous invited anyones aladdin 27th anniversary party,False
smith genie right see screwing honest,False
oh shit sultan hypnotised wed jafar jasmine cool thanks prince ali nice meet elephant let door hit way,False
almost lot better chain,False
