comment,parent
feeling go something like fictional city agrabah jafar grand vizier sultan parrot iago seek lamp hidden within cave wonder told diamond rough may enter jafar identifies street urchin jasmine refuse marry suitor temporarily leaf palace meet aladdin pet monkey abu aladdin jasmine become friend eventually fall love palace guard capture aladdin jafar order jasmine confronts jafar demand aladdin release jafar lie aladdin executed disguised old man jafar free aladdin abu prison sends cave ordering retrieve lamp aladdin find magic carpet obtains lamp unaware touch nothing lamp abu grab red jewel cave collapse aladdin hand lamp jafar throw aladdin abu back cave though abu manages steal lamp back trapped aladdin rub lamp meet genie trapped inside genie tell aladdin grant three wish aladdin trick genie freeing cave without using wish us first become prince ali ababwa order woo jasmine iago suggestion jafar plot become sultan marrying jasmine aladdin greets jafar sultan palace jasmine becomes upset refusing genie advising tell jasmine truth aladdin take jasmine flight magic carpet deduces identity convinces dress peasant escape stress royal life sending jasmine home aladdin tied gagged thrown sea jafar rescued drowning genie second wish jafar try hypnotize sultan agreeing marriage jasmine aladdin intervenes exposing evil plot process however jafar spot lamp thus discovers aladdin true identity flees lair order iago retrieve lamp aladdin fearing lose jasmine truth revealed aladdin refuse free genie order maintain charade iago steal lamp jafar becomes genie new master us first two wish usurp sultan become world powerful sorcerer exposing aladdin identity exiling abu carpet frozen wasteland however escape return palace jafar try use final wish make jasmine fall love genie grant wish beyond power upon noticing aladdin jasmine pretend interested distract jafar aladdin try retrieve lamp jafar catch plan stop aladdin trap jasmine inside hourglass overpowers aladdin friend magic aladdin rescue jasmine hourglass trick jafar using last wish become allpowerful genie bound new lamp jafar end trapped inside taking iago palace kingdom returned normal genie sends jafar lamp far away cave wonder suggests aladdin use third wish regain royal title law allow stay jasmine realizing aladdin decides keep promise free genie realizing aladdin jasmine love sultan change law allow jasmine marry chooses genie leaf explore world aladdin jasmine plan marriage,True
murder trailer dude lion cave mouth surprising disney,True
anyone else hate youtube put channel logo right top full screen button mobile,True
well everyone already expected lol knew,False
jason statham better involved,False
never watched live action one even worth besides enjoying emma watson,False
kind aladdin,False
probably aladdin australian accent would sound weirder,False
ever wonder every kid saying open sesame time late 90,False
dude get cold desert night cave would question realism live action movie would warrant cover bit scene,False
oil,False
want pikies caravan,False
tiger look anywhere near cool cartoon,True
actual guess wash hair remove natural oil result dull bad looking hair oil overproduced compensate making look greasy shower hair return natural oil level might look bad many optimum hair state rnopoo participate fear smelling bad people fine right product want go without shampoo use good conditioner heat protectant drying hair,False
cave deep voice compared original literally voice,False
yeah would done people would moan changed much,False
always thought kirk cameron,False
small correction dan castellaneta homer voiced genie return jafar tv series hank azaria moe apu chief wiggum thirty character,False
williams originally agreed role stipulated whilst would voice character want voice used order sell thing ie genie voice commercial advert promotional material disney related product like burger king toyshappy meal offer etc wanted part animated world wanted create something child gave voice role within film want voice used pr publicity story go disney exec agreed voice later featured advertising material anyway disney claimed nothing wrong appearance genieswilliams voice run via williams wife however send picasso painting worth 1mil time apologise williams appeared reconcile disney appointed new studio head publicly acknowledged disney needed apologise williams also acknowledged done assert dispute money williams took much lower fee voice genie comparison usual rate voice actor time paid anywhere near onscreen actor williams maintained never money principal williams came back studio time third aladdin film much chagrin doubt actor already recorded line genie genie role movie rewritten fit williams style source,False
jordan lot attract foreign filming part tourism outreach portfolio including stuff like star war martian work know disney netflix medium outfit north america familiarization trip run help attract business,False
look like prince persia two aladdin,False
lols good one game,False
think pointing hank azaria also voiced genie,False
sand,False
called mine,False
one teaser two really live action ninety-eight trailer cgi,True
feel like remind great robin williams longer u,True
already made justgamedevthings post morning unless one upvote needa get remedy complaining,False
make lot money shit,True
series,False
well made nz physic teacher wife part costume design team going watch,False
"hear went saw stage musical got honest applause get lion king great stage musical one felt flat like would see went highschool musical better production value aladdin amazing film came one thousand, one hundred and twelve year old made huge impact genie steal entire film justice live stage show much made cool magical quality usually brought constant visual transformation voice change absolutely perfect delivery robin williams made untouchable character film could called genie pal aladdin williams sadly potential replicate part magic original done onstage smith whilst far ideal choice role could really fun job friend like fails",False
proper cock tease trailer,True
yeah part maltese mine thing look nicer couple day washing immediately washing,False
lili stitch show level first movie stand,False
problem movie try take something really improved try improve let,False
monkey movie smith sorry bout one could resist low blow joke respect guy rock legit curious genie performance hope make proper sarcastic prick,False
leave much hope jasmine,False
ever better live action version cinderella story,False
remindme eight month,False
confused talking aladdin genie genie played smith fresh prince ali hence prince ali,False
interesting whatever reason made wonder star war thirteen would better robin williams voicing jar jar,False
reciting lyric prince ali song original aladdin movie btw excited new aladdin movie,False
happy smith genie,True
really hope movie feeling aster,False
plot twist genie played jared leto,True
make sense since western part china province arab empire,False
disney hq guy need make new movie idea make new one hey look fifty cartoon bring live action give man rise,True
think smith going best imagine like genie broadway musical seen absolutely fantastic lot people going write immediately going try one,False
shining jewel lut gholein,True
actor look anything like aladdin,True
going fresh,False
2am hyped,True
welcome forty thief,False
opinion rewatched summer first movie beautifully crafter art piece broken family second bunch dumb gag stupidmakeyousad plot child always thought second one sadest bunch child liked sad movie someone tell say grew found original far sader second one unoriginal unecessary,False
big lamp huh alright well see ya later,False
alan menken back music going lie exciting thing,True
yeah kind finally understand curiositynostalgia hit movie provide must awesome introduce kid something loved age,False
voiced smith totally missed memo looked saw name end credit,False
know stsrts star war trailet,True
screw want mixup gottfried voice genie,False
smith mentioned wait people see blue may joking may look lot like broadway genie,False
genie played smith blue,False
ill take bobcat goldthwait solid second choice,False
holding grotesque flea bitten abu,False
good white actor playing aladdin,True
oh okay thanks,False
sausage call sausage,False
good luck replace robin williams genie,True
well mentioned reply someone said homer simpson genie return jafar person replied complemented hank azaria voiced genie tv series long ran dan castellaneta homer assume person mistook dan hank voice way character simpson,False
definitely,False
mulan real king arthur meaning best composite multiple real people mostly fictional like king arthur ending change depending story time period traditional story retire peace turning official post ruling dynasty much later story commit suicide,False
ooh right loved shirtless sleevless vest moment cute balloon short guess disney real life actor six pack much kid,False
pretty sure issue people rate movie want watch guy ritchie movie petty criminal dumb thing cleverly also medieval england magic kind really good time want watch king arthur movie probably unhappy,False
guy ritchie movie always fun happen good side effect may occur,False
genie smith hmm see go robin williams made character,False
hate notion kid care internet phone tablet nowadays yes may like thing also enjoy movie magic something world look look frozen successful think kid watching stream make tutorial parent went movie watch frozen huge disney shill look marvel every kid love want superhero disconnected want sound like boring family member would barely see whenever saw game boy would go good health eh read book guess man true true,False
frozen one biggest movie ever kid still love princess movie never change,False
would want see disney butcher another animated classic live action b,False
agrabah street rat fightingtraininggrowing montage ft hundred eye,False
billy zane throwing shade,False
glad everyone else share rage free nip,False
teaser,True
grease,False
type shampoo think aladdin us,True
aladdin tv show good shit kid also hercules cartoon one crossover episode oh man good stuff,False
wait got goosebump,True
link,False
gt perfect lol,False
ah bad read differently assumed azaria voiced show whereas castellenata voiced movie apologise,False
material girl,False
cave wonder head looked really dumb,True
meanwhile france,True
whole trailer much cgi maybe hair test poorly go add messy effect post,False
know,False
good see new original ip oh wait,True
yeah bloody sound track make want run around house,False
close avenger,True
hiv aladeen,False
grease bro dirty irish hair bad practice hygiene wise,False
idk ask scarlett johansson,False
toy really cool quirky movie right think often get forgotten,False
know grade coarse,False
wanted live action remake,True
smith aladdin song wonder mib quality wild west quality,True
really motherfucking smith god going suck hard,False
bad guy thundercats voice fuck disney,True
singing voice though dude named brad kane lea salonga jasmine singing voice also voice mulan singing voice pretty amazing,False
damn got nasim perfect person play jasmine,False
pathetic as looking lion cave childhood stand,True
favorite disney movie really hope justice though without robin williams sure possible,True
thought exacty tell first second opening scene going exact beatforbeat recreation definitely banking nostalgia,False
really want henry cavill plastic upper lip aladdin pecs,False
sound like got frank welker return,True
need apologize glad able clarify thanks polite,False
hint like bwam bwam bwam bwam bwam,False
see issue far pandering first making _good movie_ first making selfreferential second live action cinderella ok changed little adding backstory adding character prince actually building relationship little fleshing evil stepmother motif maleficent great movie interesting direction take wish would explore space little villain twisted perspective thing fun concept mostly mentioning speaking aladdin twisted untold story royal vizier starkid absolutely fantastic play similar concept youtube watch five say better live action movie end live action beauty beast absolutely dreadful kept story added nothing useful _while also making already worse_ lindsay elli good video essay review short added context minimal irrelevant boring andor stupid beast character building original gone reason making as whole time song nearly straight lifted worse also spend much time trying fix stupid problem nobody actually cared original tl dr people like either adding nothing new add change make way worse need focus actually improving character adding usefulinteresting context showing new point view rather,False
expect tribute robin williams somewhere,True
everyone want see genie want see abu,True
pretty sure explicitly said,False
already smith cast genie would preasantly surprised theybhad used robin williams original recording plus unused material,True
generic as looking aladdin guess making sure character unique juice went smith genie,True
mexican aladdin,True
smith posted teaser insta account caption wait see blue,False
wrong trailer one official george lucas version,False
movie going disappointing solely due robin williams playing genie,True
wife liked came saw theater watched animated one live action one last week seeing side side hate new one p think enough reference original remind much liked side side realize close,False
wait see fold half waist collapse,False
reddit need concinve disney make first nc17 movie make christopher nolan director,True
remake _not_ going change anything,False
teaser trailer,True
theme song literally arabian night,False
liked idea behind maleficent keeping relevant aladdin check play youtube called twisted,False
thanos,True
one deserved like movie adaptation book one involved read book thirty year going memory,False
alladin raggedy would racist robin dead gilbert mia jasmin thick obnoxious social commentary somewhere,True
music holy,True
spit drink drank drink,False
remake something new improve something new heck make b amp b added nothing new nothing new worse original also like johnny depp charlie amp chocolate factory unable get original shadow failed,False
almost like somebody make new joke rely shitty constantly repeated one _ _,False
feel itching around junk goddamn 4d movie,False
mustache team justice league standby,False
huh weird keyboard flipped hellfire prepared never seen one,False
even thought somehow sort make complete nonstarter,False
bd wong busy terrible jurassic park movie,False
wardrobe acting singing better le wooden emma watson acting singing seriously actress audra mcdonald multiple tony award singing,False
ca show world,True
aladdin,False
avenger defeat thanos send back time custom prison stark built retains full gauntlet power bound tothe bidding anyone release prison guy release know wished erase half life universe could snap finger insane want prince wished kill half universe random good chance would survive use remaining wish bend survivor would prince make prince skip genocide yes technically dread run destiny still arrives nothing know like lose,False
give tassel,False
hate fact movie animated really cool location actually exist,True
danny devito,False
like elephant abu kick door open foot,False
ten thousand year give crick neck,False
honestly went almost zero expectation came grinning like madman super fun movie loved,False
saw parrot thought gilbert gottfried disney,False
even remember revolver,False
give hunchback notre dam remake,True
jungle book liked right,False
know iraq british capital,False
naomi scott playing jasmine think great,False
come disney could go real desert cgi look bad,True
song mulan iirc,False
slip ross marquand one notice,False
street rat born street rat die street rat yep could see,False
gt jafar song abysmal aladdin two actually line song aladdin clearly based never friend like super fitting guess beating good guy twisting theme song back kind thing,False
disney making u pay double remake movie movie free everyone,True
aaaand look shit,True
frozen new original remake something old relies heavily nostalgia never said kid like disney movie certainly say like superhero movie stand saying without benefit nostalgia remake least one come far bad boring movie kid going like matter much want nostalgic also never said stuff kid day bad health way bad worse stuff liked different taste youth change generation usually reject stuff parent like opt something new create culture bet natural time pass trying fight,False
got really excited saw lamp sad robin williams,True
look much better beauty beast watching one guy ritchie hope make story morally grey area bland rehash,True
would crime,False
wish remade diablo two instead aladdin,False
wooo,False
everyone official disney approved version smith genie quite revealing pick look tree bon,False
except genie slave,False
hank azaria never voiced genie dan castellaneta voiced return jafar animated series,False
frozen new original though cookiecutter remake movie older ipod kid super excited moviesmusicculture parent grew prefer newer stuff maybe parent fully understand people latter,False
small,False
pff looking aladdin probably cast steve buscemi jasmine,False
know anything project look credit end smith guy ritchie two name least expected involved,True
dumbo looking like core story made change sure disney comfortable tim burton helm,False
sent live uncle beard,False
got guy voiced gravemind halo,True
thank roger jessica rabbit success movie existence,False
sweet saved fifteen thanks,False
anyone basar fucked hoor princess,False
logic dictate cautious live action remake beloved childhood classic inner like fuuuuck hype,True
tradition,False
went grabbed loaf bread hopped balcony onto second floor bonked couple palace guard found quick hiding spot wait blow,False
gt got sauce gt fool aaaall got sauce,True
ah cuz short round mean,False
yeaaaahhhh,True
time save world,False
rcommonredditfacts,False
toy u,False
one lamest trailer ever seen trailer purpose entice person see film trailer boring shit took least interesting scrap scenery slapped together called day filthy trailer bitch said director,False
smell bad still shower wet hair shampoo pillow probably need wash day though hair stop super oily,False
got maintain copyright,False
nostalgia hell drug,False
saw aladdin trailer smith definitely,False
seriously though writing song spectacular,False
girlfriend worked film art department prop said one day everyone excited would heard smith due rap today turn finishing filming wrap give everyone gift posed picture though really nice guy apparently,True
iago spirit animal,True
felt beauty beast teaser trailer go see likely see,False
man people really care making something good people enjoy want make something safe turn profit sell toy merchandise matter bland beauty beast bad hobbit bad last jedi hot garbage made bank continue pump stupid trash,False
beauty beast made billion dollar,False
upset cave downgraded super badassscarygigantic animated legit cave wall,False
pretty sure dad tried make learn trade kept playing street urchin dad died mom pleaded try make work still listen nope got keep playing working black magician came tricked retrieve lamp etc talking animated movie btw rather original story arabian night,False
good god right,False
power would pay gottfried stop working voice verbal equivalent hemorrhoid,False
two wraparound teeth,False
disney movie perfect setting tone right beginning song circle life lion king two world one family tarzan mus intro hercules aladdin one unique yet perfect,False
original aladdin china middleeastern origin old middleeastern tale like found book thousand one night whenever storyteller wanted emphasize far away something would say took place china benchmark really fuckin far away source love middle eastern folklore related though tiger native arabia royalty undoubtedly imported,False
teach fan love fucking tell love love fucking move else,False
half italian hair two day become walking biohazard,False
thank,False
whoop dropped monster scepter use magnum king dom,False
seeing make miss robin williams rip genie free,True
original musical well problem remake well,False
one guy youtube wrote aladdin look way clean another guy responds wow racist fuck wrong young folk today know racist mean using word everytime people different heritage involved gosh,True
right caste jake gylenhall role,False
scary part might end preferable time tell,False
stage show made genie outrageously camp takenoshit fashionista completely different could outdo robin williams think turned well,False
oh hoping would played steve full house,True
look like first one cheese,True
use original recording,False
great familiar falcon yet also completely new different filming style fact falcon never seen inner atmosphere fight,False
pizza time seriously though want get moved spiderman arc play new game,False
would find much groooomiiiiiing,False
seen actress cast almost definitely,False
point story recruited jafar disguise maybe instead sneaking aladdin prison time pose kind wealthy benefactor get decent clothes nice apartment,False
well color completely unimpressed,True
let u hope pick actor based voice fame butcher song least dub sing,False
would liked eddie murphy,False
wrong,False
diamond dude come salon,False
whip blue dong,False
clocked gold monkey holding ruby trailer hoping get touched forbidden treasure moment,False
exactly going complete shit honest almost find disrespectful robin williams bc one would given damn movie,False
forget legend tarzan awesome show pulled lot original source material,False
look like b movie even disney screw cave wonder make look lame,True
anyone notice smith name end credit got version watched youtube,False
miss robin williams,True
sorry one jump bust,False
need peabo bryson,False
agree saw beauty beast get popularity exactly cartoon people wanted watch classic cartoon watch classic cartoon,False
feeling,True
defeated swallowing whore,False
sploosh,False
actually kind like idea much liveaction remake disney mulan disney taking source material making new movie,False
suspension disbelief,False
imagination cave voice quite scary twenty instead five,False
dammit making miss robin williams best dedication,True
respect like jungle book boring film also giant monkey singing voice tywin lannister,False
thing seeing movie remake marketed original viewer reality remake marketed child enjoy something new gave example frozen superheroes taking account kid movie something new probably would watch otherwise said would something parent watched young new refreshing like frozen marvel movie kid thinking child enjoy movie far even think bad finally example implying complaining health issue saying sound like guy think kid one thing without enjoying another,False
man disney idea left make live action old cartoon movie cartoon old tv show probably half decent movie nothing seen certainly nothing original exciting purely aimed stalgia next generation yawn,True
danny devito jasmine father mia khalifa jasmine say,False
concur thank,False
song shang mushu yu either,False
hey riot,False
probably adam sandberg carrot top,False
know genie voice creativity voice actor giving twist character robin williams require adjustment person huge challenge scrutiny require exceptional performance accepted let alone embraced public truly wait see movie really really hope disney try cut corner also stay relatively close animated version think disney taking quite big gamble making movie get exactly right success still excited new movie happen often anymore,True
permanent five clock shadow seems guy street either smooth bearded,False
nala obviously sexiest disney princess,False
true guy ritchie going make shot shot remake guy ritchie he going thing,False
according article,False
hate trend hollywood baking teaser trailer trailer teaser proper teaser showed sand cave figure front aladin grabbing lamp enough get idea real action,False
arabiiiiiskaaaa naaaaatt,False
smith know pretty bland uninteresting diet coke comedian sure win average person though dog,False
worry excited,False
oh nice look like rajah,False
oh yeah scene like ballroom dance scene beauty beast falling love scene,False
phenomenal power itty bitty living space,False
king arthur movie awesome,False
god damn dave chappelle isaac newton comedy going get another one long long time like george carlin richard pryor bill hick rolled one somehow managed three could time bit pimp blackmailing top prostitute long sanity could handle still managed make shit funny,False
also used power moped,False
everybody glossed fact said next summer set release date almost month start summer,True
robin williams found,False
thought two hundred and forty something checked youtube setting three time despite saying hd,False
tell king arthur one shit,False
played smith,False
frank welker reprising role cave wonder sound bit like,True
twenty-five thing missed aladdin trailer,True
personally like whole new world musician catchy song sound track sucker catchy melodic theme,False
hope aladdin brown,True
know malevolent favorite far nice twist classic story beauty beast terrible agree like revamps,False
wash hair shampoo actually really easy,False
yeah know probably see critic think one smith genie really unappetizing malwan jafar lame well nobody thought ben affleck could act till argo guess see,False
mean like two scene seen cave wonder lamp nearly enough call carbon copy,False
