comment,parent
post one youtube video message want,False
oh god going crush jasmine,False
dude know,False
inb4 whitewashing shitstorm,True
holy crap aladdin steve full house never knew year,False
pink ranger noice,False
sometimes remake mulan original song want movie well china turning well known chinese story goofy musical play well chinese government authorize film release lion king remake feature scar song prepared,False
link gave video available time saw trailer tv looked youtube video immediately,False
jesus look like going great,True
expecting riffraff poor street rat like aladdin would really unruly hair buy hair clean every time look closer,False
possible thing make remotely watchable guy ritchie directing,True
recast robin williams genie,True
sinbad,False
id prefer dave chapelle smith anyway smith obviously able hold candle robin williams think would fair compare someone he anyhow especially genius williams think ought careful expect carbon copy original hold smith standard,True
better super serious drama lame romantic comedy better fullon goddamn musical,True
use torturous dick corset movie used lessintense version,False
gt robin return sequel came back king thief promised two sequel directtovideo release would think robin williams aggrieved offense would used leverage better movie,False
film save one wonderful energy something could really help project like aladdin hope style translates might minority hope get personal touch like raimi oz great powerful great film best moment pure raimi ie picket fence pov shot,False
bring one hundred and twenty precursor orb power cell could think heard voice,True
guy gettin real tired reboots let good good,True
seen concept art blue use work toy r u corporate,False
might hate one jump ahead,False
true big,False
hello,False
trailer teaser difference angry internet bamboozled,True
nothing missing robin williams treasure meant much growing sad he gone get watch without,True
remember hearing movie based original story aladdin animated movie trailer make seem like retread animated movie hope case kind looking forward hoping would try something little different,False
oh shit pink ranger awesome,False
disney renaissance great time aladdin vest sixteen year old ariel bikini strangely attracted lioness nala sex eye,False
seen look blue even teased instagram,False
many different way read coke dong infused orgy love,False
something look last shot someone said looked clean think might sure maybe something else,True
want fuck big tassel,False
frank welker voiced cave original along abu rajah brought back one already sold,False
teaser capture seems point remake first place pure nostalgia absolutely nothing wrong,False
fogell shut fuck take vest look like aladdin,False
miss robin williams much,True
winter coming,False
gilbert gottfried better,False
going smith good actor really challenge long time choose movie work playing smithtype got chop needed needed starting lose steam guaranteed top box office draw,False
really like aesthetic everything yellow blue look fake,True
jesus christ nitpicking thread crazy goddamn teaser,True
sorry candleshoe improved upon,False
say want film watching trailer new star war movie music blazing watching millennium falcon fly across desert best,False
compressed cgi desert ya,False
gt e nt monkey got monkey one made lol,False
irritating,False
gone full method cut,False
mean expect r rated hold barred aladdin also somehow magically robin williams back yeah disappointed expecting disney movie directed guy ritchie element original basic plot perhaps live action could interesting feel like either bash love movie based quick trailer teaser might cool let u wait see,False
trailer waste time anyone expected see character actual footage basically animated poster,True
show someone,False
cinderella done little mermaid happening pinocchio happening lion king two thousand and nineteen dumbo two thousand and nineteen bambi unannounced toy story happening monster inc happening,False
sand natural glitter earth,False
cinemacon saw extended behind scene footage showed blue looked like normal guy awkwardly long goatee,False
often hotter hot,False
better way reveal liveaction remake two minute cgi landscape,True
loved aladdin original disney movie first movie saw theater expecting anything hoping fun movie watch fan boy also hater id rather jump conclusion especially conclusion ruin childhood memory,False
unfortunately cave wonder apparently,False
wait fucking kidding oh god thank goodness take away original,False
really think movie would done mostly well without well probably close harley quinn joker seemed like big draw,False
better hot,False
touche,False
look lovely june,False
better hot,False
uh remade one,False
hell give shirt,True
wish could agree despite two viewing theater literal thing recall film kunis franco awful impersonation classic counterpart monkey think jd voiced,False
giving jasmine song broadway show,True
"alright got small youtuber channel forty-three sub top ten upcoming movie trailer twenty million, one hundred and eighty-two thousand and nineteen channel want post give shoutout would appreciate",False
lot good waaaayyys,False
yknow really feel like excited live action aladdin movie considering much adore original hope good far working,True
iago talking parrot understand,False
mean animation entrance head ground whole cave underground change necessarily bad,False
wish,False
prince ali genie jasmine,True
talking iago ultra bummer turned role palace guard right hand man,True
hotter hot,False
yes aww excited movie,False
yeah turn wear shirt desert get sunburn,False
okay excited reddit set way thinking excited excited could really good,False
know,False
like make movie original disappear forever like remake still got original,False
want least one montage plan happening someone narrates,False
allah forbid daughter,False
iago magic lamp friend like,False
please good please good please good,True
think reasonable move able recreate beat robin williams performance trying even imitate make people think option go entirely new direction,False
nine hundred and eleven,False
kind meh live action movie smith playing genie colour intrigued,False
fuck fuck disney messing masterpiece fuck paycheck least try write something original yes know previous version first telling story,True
three hundred and ten aladdin little chinese boy,True
please pleasw shit,True
say john oliver different movie different bird,False
mulan one actually excited,False
first time seen aspect ratio youtube around living rock,True
think saw dick,True
live action version also super popular,False
think saw dick tho,False
omg omg omg screaming like little girl okay first aladdin always absolutely favorite movie ever since child tell many time saw movie came vhs many time listened cd soundtrack released little brown boy indian felt like first movie character ever could relate aladdin genie jasmine flying carpet abu cast freaking awesome thirty-three year old still favorite movie time ever come across tv always stop watch said trailer voice said diamond rough omg chill everywhere like yes let u goooooooooo showed aladdin said fuck dweeb completely let disappointed actor brown heart broken high hope movie rest genie hand,True
kind nothing trailer ask least teaser longer cgi fly arounds logo curious see many dubious casting choice controversy racial ignorance win funny see get praise really make people look like moron,True
gotten sloan entourage,False
saga slow theme cover continues,False
show jasmine fuck,False
boy parade scene going insane,True
barely anything though,False
make teaser consider properly teased,True
shame get shaq good playing genie,False
opening theme give chill picturing watching big screen,True
made miss robin williams,True
trailer sand fucking sand,True
boi abu,True
unnecessarily long teaser basically four shot could literally shown ten second,True
true suppose seen challenging role quite time range maybe he lacking great script he probably lost steam think he still hugely popular people going crash box office aladdin sure planning see theatre,False
agrabah far background good thing bomb,True
fabulous harry love feather,False
jafar agrees,False
oh shit got see,True
dumbo around april think three live action disney movie many month,False
beat punch joke,False
god hope prof skeptic wrong remake justice sherlock holmes pretty decent aladdin done like sherlock great,False
pretty sure voice original,False
yea better big fuckin tiddies way watching movie super fucking hot,False
oh hello,False
relieved disney whitewash actor,False
image jasmine twirling innuendo,False
would fuck without ball tickle though,False
gt naomi scott midriff eh ya go,False
hugely popular time get movie star people show coming end probably see theater nostalgia use sinemia three movie month would easy choice check liked jungle book beauty amp beast well enough,False
called monkey spunk natural great hold,False
well guess one disney film hurt,False
wondering gilford gottfried going play voice parrot probably though since let go aflac twitter joke disney let go james gun old twitter joke shame plus robin williams passing surprised got voice cave wonder though kind disappointed look expecting something grand massive realistic v stone statue type look especially today special effect,True
would like see fight jasmine fan fan girl el dorado,False
eyebrow good enough,False
going feature smith rapping,True
awful math fifteen year since original film genie released,False
call saladin sword dodger,False
kazaam shaq,False
hell look like shaq shazam,False
make animated remake,True
hellfire hunckback notre dame,False
think would better fit lion king adaptation he mancheetah,False
yoda revealed aladdin dad confirmed,False
honestly never seen word whelmed overwhelmed underwhelmed never really thought word,False
take money,False
oh surprise think going heart attack die surprise,False
obviously guy,False
thought one like aww shit realized aladdin got even excited,False
aladdin xy,False
holy crap actually look amazing dumpsterfire beauty beast really get hope one still wish would stop tho,True
oh boy fully cgi iago smith genie movie long way go assuage doubt,True
get pursuit happiness quality smith earth quality smith think weird casting choice praying pan,False
need sugar water,False
neither good movie though probably care viewer disney shareholder,False
imagine iago without gilbert gottfried voice genie without robin williams going jarring good bad,True
sultan bad guy season two legion,False
hope genie right,True
lot good waaaaays,False
holding breath little faith smith genie mostly due fact fear smith really worry performance genie,True
rajah remake,False
really rioting lol,False
close get seeing childhood favorite first time,False
gt sterile retread animated classic based trailer seems aladdin even character design seem interesting see smith tackle genie copy exactly shit unoriginal go far direction shit ruining classic character tough shoe fill,False
much hair perfectly coiffed like stepped hair salon right cave wonder,False
make want play snes game watch original movie heck even tv series whole thing yet,True
precious,True
aladdin ton makeup,True
yes exactly expecting huge tiger like cave entrance looking like statuestone side mountain especially wanting golden scarab fly middle desert side cliff hidden easily find would think plus wanted something looked menacing lifelike made sand technology rebuild day able put something together way better might screwed whole budget special effect genie carpet monkey since let u face monkey would able much cartoon version well making sound like saying human word time magical stuff ninety location rest film look spectacular going kind pissed could even make cave wonder look decent even make rest movie look better especially disney old money bag flipping bill movie,False
cool cave wonder lamer,True
wonder include racist chine cat,False
get personally understand fucking smith went holy fucking hell,False
make billion dollar nowhere near good original,True
wait til dune,False
saw aladdin new york summer song brought house one amazing entertainment sequence ever seen gave chill,False
could rub mine,False
wanted need see genie kind wanted sort line al touching lamp release date,False
nah everyone cinderella improves original would argue king louie ten time scarier jungle book remake,False
yeah going lie literally anyone voice gilbert gottfriend going feel wrong,False
"fox news four thousand, four hundred and ten araby",True
would first time played robin williams inspired character never forget mr featherbottom,False
cruella aristocats,False
unnecessarily long teaser reason minute half long basically four shot taken twenty second top hacked together couple minute,False
definitely early real opinion buuut damn get aladdin broadway vibe shiny,False
tbh killed couple thing king arthur enjoyed holmes,False
got better way say,False
know random animator get bird flight movement right feel like perfected,True
unnecessarily long teaser reason minute half long basically four shot taken twenty second top hacked together couple minute,False
cli tor,False
banger mouth,False
bullshit trailer,True
guess cookie monster finding work voiceovers good,True
enjoyed man youncle awesome done well,False
honest performance good downplaying would change fact one highlight movie,False
yah find either good cinderella especially bad course anything disney shit gold mean still shit even going touch smith yah remain skeptical opinion meantime go eat bag dick ok,False
want kind fresh prince,False
confirmed blue leaked footage,False
poor abu,False
understand well yes disney discovered essentially make money telling story thereby put forth effort creating something new bummed getting,True
anyone want movie though probably alright bring tre original,True
seriously fucking animated cartoon impressive imposing dun goofed,False
featuring mac o mojave,True
yeah seriously wanted see hot ripped aladdin,False
prepared always number one hellfire close second,False
farm,False
welp time another rewatch,False
teaser show want lol,False
built spare part,False
gilbert gottfried voice iago,True
expect occur preparation aladdin return agrabah obtaining genie,False
seriously tho street urchin hair slicked back pompadour,False
sing would actually work movie,False
look like seriously,False
still hole wall cool giant head ground,False
one actor shown he selling movie,True
disney never really created anything new always adapted people story well pretty much run people story remaking,False
titan go,False
yea going dawg,True
rmildlyinteresting,False
look good,True
aladeen,False
ruined great chance bring gilbert gottfried back would thing make movie worth seeing otherwise still huge disney cash grab fuck movie,True
fucking squeezed dry,False
going suck cg nightmare,True
present derelicte,False
guy ritchie,True
look shit,True
going copy original make cgi genie robin williams stuff might well butcher,True
maybe kid retarded,False
witness,False
remake amazing animated movie live action important actor died,True
"reminds lot movie one thousand, nine hundred and ninety-three street kid princess talking parrot really tall bad guy movie look interesting",True
dodge sword lago,False
starring sand,True
gt foreign market love smith hide behind cgi character maybe could infinity war josh brolin augment face keeping recognizable,False
brand,False
could think whole time please jaden smith,True
show know going robin williams know going imitation remind everyone hole left death,False
odd always assumed lion king coming,True
imdb even aladdin listed top billed cast got beat two character never even heard,False
coarse,False
ohh lot hand holding film bet,False
lot video much stuff see give c,True
already bin laden,False
practically hear billion dollar dropped disney doorstep,False
liked arthur favorite part pulling dark soul move excalibur dude literally greatsword stomp one point,False
thanks hate,True
gilbert godfrey voice parrot fucking done,False
genre called magic realism world start realism something fantastic happens outside world realism even event rest world still bound reacting way would realism situation bird money able talk along would started place realism spell cast point allowed bird voice could magic realism,False
get guy internet know one,False
yo wavelength brudda thought,False
trailer come,True
know going honest trailer title,False
looking forward seeing navid negahban sultan dude killed legion,True
literally smith ponytail nice,False
make sense cartoon le live action film,False
men black,False
beauty beast remake earn billion,False
disney destroys aladdin luke star war hope unless fire politically left leaning leader,True
genie played smith sooo,False
gt film save one one,False
going rap remix,False
google smith,False
huh trailer show ninety-nine plot every single joke movie climactic scene sorcery,True
even notice looking bad nowhere near top list thing wrong film far emma watson sing wish alist actor keep taking film major singing role would stop vainprideful thinking sing let professional dub voice singing section least hire actor sing,False
crazy beautiful almost fifty jasmine fairly young,False
le sand eastern seaboard trailer,True
wait,True
like said anywhere desert decided side mountain,False
even emma watson singing,False
love epic music listening repeat rest year come epic scene epic shot color palette absence dialog probably best made teaser trailer year hope others generous dialog said like sinister look aladdin face compared cluelessgoofy look face original moment,True
holy shit god never seen woman look bothered,False
know see jasime better back as,False
classy expect attractive character played attractive actress,False
like teaser trailer actual movie trailer,True
wow thinking day aladdin one disney movie without villain song completely forgot jafar reprise though jafar song would cool reprise good forgive,False
think hot ready,False
dat music,True
think inception trailer see bwwwwwaaappppp,False
would marry foreign prince met large dowry,False
motherfucking farouk legion,False
aladdin actor disneyland wear shirt vest,False
cgi ruined movie,True
teaser,False
ugh made want fucking vomit honestly friend like fun vivacious campy musical number made great shit sounded like trying fucking inception soundtrack,False
said interested offered,False
learned smith angry want dan castellaneta genie perfect amp x200b fact smith mean cgi smith vest,False
ok,True
going hard want watch yes love aladdin man love robbin williams genie childhood loved wall acting original intrigued robbin williams,True
admit got goosebump upon hearing diamond rough,True
need iago voiced actor,False
mulan li shang though still excited also terribly sad,False
think going different direction better idea someone else try recreate robin genie either way still hard live original performance,False
nothing teaser even remotely interest,True
would watch could watch practically perfect animated version,True
comment offensively aladeen aladeens sent aladeen,False
chance good though look jungle book thing happening,False
show vest match inside belair academy blazer worst film ever made,False
hell,True
show pearl shining glimmering splendid tell sharehold last graph profit line open eye give plunder plunder sideways reaping nostalgia mine movie pearl newfound source revenue care told remake blow scheming,True
giant wish offensive line right,True
soundtrack brings back good memory,True
smith got higher billing film lool,True
much,False
genie feel like could easily tag end without trailer feel pretty bare,True
live action aladdin guess,False
keep getting deleted several posted already keep getting deleted,True
sure thing,True
disney always impressed teaser,True
well see anything made le excited see anything understand teaser trailer anger get excited get u hyped two three shot substance dialogue human character,True
teaser trailer wish showed bit look interesting,True
he got good age,False
teaser trailer think title post changed,False
please tell abu,True
feel like teaser official trailer opinion still interested though wait see,False
smith aladdin,False
much think target audience though,True
gilbert gottfried marykate ashley olsen walk bar say bartender give u two asshurts bartender say make as hurt olsen twin say well bob saget hand chocolate milk made wake three hour later lying stomach,True
arabian niiiiiiiiiiiiiiiiights,False
felt like watching new star war trailer,True
rip robin williams,True
look like mod waiting preferred poster,True
look closely show cave wonder lion instead tiger reason see jafar looking pretty badass got big hat feather staff everything looking pretty dope shown,True
teaser tease something generic cgi landscape shot,False
non disney yt channel trying steal view uploading,False
cmon disney know thanos ruined turn dust effect everybody,True
fuckin nut benecio del toro jafar ambiguously brown enough anything,True
show much aesthetically look great cave wonder look cool,True
going awesome pretty hyped see,True
hype cast really lot genie jasmine jafar three second aladdin,True
giant wish offensive line right,True
earlier thread get deleted pretty whelming trailer get old movie love live action money please,True
show genie fuck,True
wish robin williams still star genie,True
oh come could show u least shot genie,True
one thread sure get deleted lol,False
great teaser playing nostalgia enough glimpse new make excited surprised actually got see aladdin teaser trailer honestly thought going end zooming lamp,True
willing give shot,True
glad amazon prime blacked commercial,True
sure sounded like one beginning,False
posted one actual disney yt post got deleted yeah,False
teaser sorry reddit happy disney movie middleeastern people available people next year cartoon many u qualify white fuck yeah happy aladin jasmine favourite princess growing really hope movie good new generation idol side world look,False
look like talented student visual effect showreel,True
made friend like sound menacing wait,True
ah old giving nostalgia nothing else move,True
easily best part loved movie kid,False
nostalgia hell drug,True
funny iago cave wonder even mentioned get attention entirety confirmed cast,False
first trailer posted official disney account europe,False
wait hear simultaneous complaint fact reboot thing differently original come ill see competently made film disney make shit ton,True
disney officially uploaded yet,False
already know genie make break film many rest probably jasmine,False
favreau directing fully confident great job jungle book liveaction,True
watching know one thing sure movie lot sand,True
disney uploaded several country specific account wall deleted,False
hint friend like brought back lot memory number doordie movie whole thing ride genie song,False
wanted see something maybe genie,False
ya hoping smith pop say ever friend like shit cut,False
working title fresh prince ali baba,False
guy ritchie directing favreau,False
cast jasmine better hot,False
look like pretty good nostalgia cash grab think anyone would want one shot guy playing aladdin look little older would expect,True
think guy ritchie know he,False
fucking point disney live action remake besides making money,True
kind arabian night,True
aaahhhhhhhrabiaannn niiiights,True
ah fuck right lion king favreau directing,False
officially uploaded lol,False
teaser release soon enough,False
show blue smith naomi scott midriff fuck,True
one posted also deleted youtube rest set private first one public third party channel,False
iago,True
cave wonder mansized hole wall,True
brings back memory aladdin first film saw theater remember look forward,True
seventeen year give crick neck,True
teaser need show movie seen already show something character,True
teaser trailer,False
trailer much giant going,True
literally recycled voice clip original movie cave wonder sure good thing bad thing,True
know hear music get excited remember beauty beast happened williams unfortunately passed expectation immidiately start prepping huge meh movie,True
liked opening shot desert everything else much say anything bad trailer nothing special,True
hopefully smith sad sack shit like every movie past ten year give fun sassy smith please,True
another billion,True
naomi scott,False
teaser trailer better teaser trailer year ago remember x3 teaser trailer literally logo slowly animated,False
growing animated og dearly loving underwhelming nothing wow desert looked fake cave entrance cool inside meh man meh vfx ready least one money shoot might well wait release trailer,True
hate sand coarse get everywhere,True
cave wonder le impressive,True
smith second biggest star cast nasim pedrad pretty much get whatever want,False
aladdin get hair silky smooth dirt poor excuse,True
yeah odd especially smith hyping u seeing blue released world,False
nothing beat robin hopefully smith put good show,True
bet genie star next trailer liking seeing far though,True
like naomi hott right,False
perfect proof point lol,False
hate sand get everywhere,False
pink ranger power ranger add check box,False
clicked link still set private,False
shirt vest literally unwatchable,True
curious smith genie look like,True
believe aladdin going infinity war sequel,True
gt desert looked fake ninety-nine sure desert shot real,False
aladdin shirtless though,True
early report cinemacon footage shown say impression dance weird comedic drag number think fun smith back,False
