"","Parent","Comment","Anger","Anticipation","Disgust","Fear","Joy","Sadness","Surprise","Trust","Negative","Positive","Synzhet","Bing","Afinn","NRC","Emotion"
"896","False","saw karen gilian think cheerful enough",0,0,0,0,1,0,1,0,0,1,0.5,2,2,1,""
"897","False","badass karen gillian character make watch movie",0,1,0,1,0,0,0,0,0,0,0.4,0,-3,0,""
"898","True","chris tucker better kevin hart height joke funny jack black portraying teenage girl sound like could pretty damn funny tired dwayne johnson schtick video game get lost also alan parish made jumanji sound like living hell creature supported someone eaten hippo people cracking joke clearly survive look like jumanji easy mode",2,1,3,2,1,3,0,2,8,3,2.35,0,4,-5,""
"899","False","know think robin williams good think nostalgia alone",0,1,0,0,1,0,1,1,0,1,0.15,1,1,1,""
"900","False","well zathura jumanji space jumanji title could totally mistaken going memory excited thing get juice box biotch",0,1,0,1,1,0,1,2,1,2,0.55,1,1,1,"Trust"
"901","False","maybe meet someone else got sucked know never know certain name jumanji basic premise fairly certain people would catch reference",0,0,0,0,0,0,1,1,0,1,1.3,0,1,1,""
"902","True","anyone else getting tired trailer trying use old song try sell trailer yes successful gotg decentish queen suicide squad trailer think",1,1,0,1,1,1,0,1,2,1,0.05,-1,0,-1,""
"903","False","next reboot decade two vr outdated fuck",0,0,0,0,0,0,0,0,0,0,-2,-1,-4,0,""
"904","False","tertumteetiddlytumdiddlydee",0,0,0,0,0,0,0,0,0,0,0,0,0,0,""
"905","False","unfair core aspect original person turn roll dice turn something good bad would happen augment reality deal problem could another turn ripped completely away still watch bit sad even attempt maintain",2,5,2,3,2,3,2,2,3,5,-1.2,-3,-6,2,"Anticipation"
"906","False","could agree looked alright jumanji connection seems really unnecessary",0,0,0,0,0,0,0,0,0,1,-0.1,-1,1,1,""
"907","True","well seems opposite reaction everyone else movie look bad seems generic seems magc",1,0,1,1,0,1,0,0,1,0,0.05,0,-3,-1,""
"908","False","curvy overweight difference curvy thick overweight etc",0,0,0,0,0,0,0,0,0,0,-0.5,-1,-1,0,""
"909","False","game described character curvy",0,0,0,0,0,0,0,0,0,0,0,0,0,0,""
"910","True","know supposed game fan power given",0,0,0,0,0,0,0,0,0,0,0,0,3,0,""
"911","True","feel like everyone forgot zathura included like thirty minute ago",0,0,0,0,0,0,0,0,0,1,1.1,1,1,1,""
"912","True","breakfast club mixed tron",0,0,0,0,0,0,0,0,0,1,0.6,0,0,1,""
"913","True","entire movie going mostly four grown adult pretending sound like teenager add jack black sounding like blonde valley girl yeah thanks good sony",1,1,0,0,1,1,1,1,2,1,1.35,2,7,-1,""
"914","False","huh guess aware called something else",0,0,0,0,0,0,1,0,0,0,0,0,0,0,"Surprise"
"915","False","nnno",0,0,0,0,0,0,0,0,0,0,0,0,0,0,""
"916","False","gt basic premise even remotely basic premise basic premise jumanji thing coming game people getting suck",0,1,0,0,0,0,0,0,1,0,-0.5,-1,-3,-1,"Anticipation"
"917","False","movie different yes inside still alien hunted one alien sequel hunted multiple alien taking horrorfamilydrama movie make autistic comedy",0,1,1,1,0,0,0,0,1,0,0.7,0,2,-1,""
"918","False","probably would watched trailer moniker though guess work",0,0,0,0,0,0,1,0,0,0,0.25,1,0,0,"Surprise"
"919","False","hmm never thought",0,1,0,0,0,0,0,0,0,0,0,0,0,0,"Anticipation"
"920","False","movie best movie son bitch",1,0,1,1,0,1,0,0,1,0,-0.5,0,-2,-1,""
"921","False","well remake otherwise remake think mean reimagining reboot case correct",0,0,0,1,0,1,0,0,1,1,1.4,2,0,0,""
"922","True","wow took successful concept packed mystery lore emotion turned forgettable lowbrow garbage surprise",0,2,1,1,2,0,2,1,1,2,1.35,0,5,1,""
"923","True","smelllll rock cookin piece shit movie totally fucking destroyed jumanji motorcycle street fighter kick reason put jumanji movie get people like watch know dead body fuck sony ruining classic franchise",3,1,1,2,0,1,0,0,3,3,-3.9,-3,-18,0,"Anger"
"924","False","boardgames like really old sure many example roll move style board game middle 1800s likely original jumaji board game actually real thing would likely made late 1800s early 1900s",0,1,0,0,0,1,0,1,1,1,0.5,1,2,0,""
"925","False","zathura also person jumanji",0,0,0,0,0,0,0,0,0,0,0,0,0,0,""
"926","False","watched trailer kid got excited see family action adventure movie big hit around",1,2,0,0,1,0,1,1,1,3,1.5,1,6,2,"Anticipation"
"927","True","see people lambasting trailer movie praising original jumanji kind pretentioussounding loved original look like live film goddamn people look fun interesting conceptspin others mentioned removed jumanji name people might saying instead criticizing remake alright go material different feeling everyone sucked jumanji world suffering bullying parental issue movie suck good hope criticism content rather comparing first one",2,4,2,2,6,3,3,5,4,8,0.35,-1,8,4,"Joy"
"928","False","mean still going go see like goosebump",0,0,0,0,0,0,0,0,0,0,0.5,1,2,0,""
"929","False","worked great land lost ghostbusters two thousand and sixteen wild wild west bewitched lost space",0,0,0,0,0,1,1,0,2,1,-0.25,0,0,-1,""
"930","False","mean probably make absolute bank doubt actor would agreed jumanji doubt fuck",0,0,0,1,0,1,0,3,1,2,-1.5,-2,-4,1,"Trust"
"931","False","kid movie ffs",0,0,0,0,0,0,0,0,0,0,0,0,0,0,""
"932","True","felt hated start near end help feel might dumb fun",0,2,0,0,1,0,0,0,1,1,-0.5,-1,0,0,"Anticipation"
"933","False","zathura semi sequel jumanji",0,1,0,0,0,0,0,0,0,0,0,0,0,0,"Anticipation"
"934","False","yea know point sequel already evil self emmersion eff whole reality game business",1,1,1,1,0,1,0,0,1,0,-0.75,-1,-3,-1,""
"935","False","jumanji aged well part optimistic feel like movie understands part jumanji actionadventure movie video game pretty silly poking fun",0,2,0,0,3,0,0,1,1,2,3.05,4,8,1,"Joy"
"936","False","one hundred artstyle creature original based around century old board game lore without aesthetic jumanji would normal jungle loved cartoon adaption growing actually managed convey aesthetic design film also jumanji based around victorian era big game hunter character coolest part film similar design really disappointing",0,2,1,3,0,2,0,0,3,1,1.05,1,3,-2,"Fear"
"937","False","new movie tone old one also child movie fact seemingly lost several",0,1,0,0,1,1,0,1,1,1,0.65,-1,-3,0,""
"938","True","really disappointed trailer get sucked jungle even look ominous brightly light perfect weather tropical area trailer happened game unleashing thing real world always felt like parish kid got really shitty roll",1,2,1,2,1,1,0,3,2,2,-0.4,-1,3,0,"Trust"
"939","False","loved rundown",0,0,0,0,0,0,0,0,0,0,0.25,1,3,0,""
"940","True","hmm rock kevin hart destined shit",1,1,1,0,0,0,0,0,1,1,-0.75,-1,-4,0,""
"941","True","actually want see expecting intrigued guess like seeing one trope stuck another trope body seeing play hope get played lot film",0,2,0,0,1,0,2,1,0,1,1.55,0,3,1,""
"942","False","uh jumanji robin williams adaptation book early 80 adaptation book original movie",0,0,0,0,0,0,0,0,0,0,0,0,0,0,""
"943","False","yeah saw child care trailer though awesome look like lot fun",0,2,0,0,2,0,0,0,0,2,3.45,3,13,2,""
"944","True","jesus fuck look like bland summer movie set failure choosing jumanji shoe fill stupid",0,0,1,1,0,1,0,1,3,0,-2.75,-3,-5,-3,""
"945","False","shit hope",1,1,1,0,1,0,1,1,1,1,-0.25,-1,-2,0,""
"946","False","strongly disagree come man kid movie",1,0,0,0,0,0,0,0,1,1,0.1,-1,-2,0,"Anger"
"947","False","game transforms one want buy board game also tragic missing child like alan parrish parallel spoiler",0,2,0,1,1,2,0,0,3,1,-0.95,0,-1,-2,""
"948","False","autistic comedy ad hominem transition serious horror comedy evil dead",2,0,2,2,0,2,1,0,2,0,-2.25,-2,-5,-2,""
"949","False","identical alan parrish parallel raise stake spoiler",0,0,0,0,0,1,0,0,1,0,-0.8,0,0,-1,"Sadness"
"950","False","yea also look like good kid movie know might nice reddit twenty-five got register credit cardprove age would nice",0,1,0,0,1,0,1,2,0,2,2.15,3,8,2,"Trust"
"951","True","know people hold original jumanji high regard",0,0,0,0,0,0,0,0,0,0,0,1,0,0,""
"952","True","wrong comment section really got kind nostalgia goggles ripping way harder deserves really liked trailer totally sold movie",0,0,0,0,1,0,0,1,1,1,0.25,0,2,0,""
"953","False","mythos probably different know yet going play",0,0,0,0,0,0,0,0,0,0,0,0,0,0,""
"954","True","classic sony",0,0,0,0,0,0,0,0,0,1,0.5,1,0,1,""
"955","False","sure great year posted almost 15b sale oh wait video game 91b",0,1,0,0,0,0,0,0,1,0,0.25,1,3,-1,"Anticipation"
"956","True","know guy enough kevin hart shtick",0,0,0,0,0,0,0,0,0,0,-0.25,1,0,0,""
"957","False","fatality drax win",0,0,0,1,0,1,0,0,1,0,0,1,1,-1,""
"958","False","trailer failed show parallel many missing kiddestroyed family like alan spoiler",0,0,0,1,0,2,0,1,2,0,-1.3,0,-2,-2,"Sadness"
"959","False","seem hurt force awakens lol",2,0,0,2,0,1,0,0,2,0,-1.35,-1,1,-2,""
"960","True","karen gillan pretty fourday weekend",0,1,0,0,1,0,0,1,0,1,0.75,1,1,1,""
"961","True","one noticing trend rock staring remake ultimately flop time saw instantly though oh boy go",0,2,2,0,0,1,0,0,3,4,0.15,1,-2,1,""
"962","False","gt one probably",0,0,0,0,0,0,0,0,0,0,0,0,0,0,""
"963","True","kevin hart playing kevin hart usual",0,0,0,0,0,0,0,1,0,1,0.4,0,0,1,"Trust"
"964","False","studio touch ever make sense",0,0,0,0,0,0,0,0,0,1,0,0,0,1,""
"965","True","jumanji",0,0,0,0,0,0,0,0,0,0,0,0,0,0,""
"966","False","comment make sad right film indeed theme whole thing missing kid ruined family year ago spoiler",1,0,1,2,0,3,0,0,3,0,-1.75,-1,-6,-3,"Sadness"
"967","True","fun fact cousin bradley played peter original aware think disrespectful robin williams trailer fuck change video game continue end game wash beach stupid probably funny movie trashing something great look way comical jumanji movie cash grab",3,3,1,3,3,1,0,3,3,3,0.6,-3,5,0,""
"968","True","bad sony",1,0,1,1,0,1,0,0,1,0,-0.75,-1,-3,-1,""
"969","False","gt decent action film low standard ya got",0,0,0,0,0,0,0,0,0,2,0.75,1,0,2,""
"970","True","heh get pitch script least casting choice studio exec film done great disservice mankind wait",1,1,1,0,0,1,0,0,2,2,0.55,0,3,0,""
"971","True","look far better good thing long future trailer fuck absolutely see shit",1,2,1,0,1,0,1,1,1,1,-0.2,0,-3,0,"Anticipation"
"972","False","mean pretty fitting pace going",0,2,0,0,2,0,0,2,0,2,1.15,1,1,2,""
"973","False","amazing post great description everything make original jumanjii freaking classic even realize kid van pelt dad little older finally put together realized amazing movie even music god really strange mixture wonder sadness felt real",0,2,1,1,3,3,1,4,1,5,0.65,1,7,4,"Trust"
"974","True","well something",0,0,0,0,0,0,0,0,0,0,0.8,1,0,0,""
"975","False","action scene look interesting well done thus decent action film would definition decent",0,0,0,0,0,0,0,0,0,3,2.3,3,2,3,""
"976","True","say going sequel feel hella like reboot mention initial teaser showed jumanji board game seems like going totally irrelevant movie look like entertaining capacity jumanji title",0,3,0,0,1,0,0,1,1,2,0.5,1,4,1,"Anticipation"
"977","False","gt look okay baywatch movie yeah faith rock lead silly action movie slowly degrading thought rundown going start amazing career generation arnold stallone bit comic chop like opposite tom hank come picking script safe say successful movie lot really bad one memorable one",1,5,2,2,5,2,1,4,4,9,1.65,3,10,5,""
"978","False","international trailer say big letter game evolved video game probably gang involved",1,1,0,1,0,0,0,0,1,0,-0.55,0,1,-1,""
"979","False","called jumanjii would le critical",0,0,0,0,0,0,0,0,0,0,-0.6,-1,0,0,""
"980","True","course rock jack black need cameo adam sandler david spade kevin james wisecracking monkey effing",0,0,0,0,0,1,0,0,1,1,-0.25,-1,0,0,"Sadness"
"981","True","still tell need know",0,0,0,0,0,0,0,0,0,0,0,0,0,0,""
"982","False","baywatch movie look okay trailer dogshit awful garbage opening shot last",2,0,2,2,0,2,1,0,3,0,-1.65,-2,-4,-3,""
"983","False","gt well remake",0,0,0,0,0,0,0,0,0,1,0.8,1,0,1,""
"984","True","nooooooooooooo brendan fraser",0,0,0,0,0,0,0,0,0,0,0,0,0,0,""
"985","False","like good forty anime lol",0,1,0,0,1,0,1,1,0,1,1.25,2,8,1,""
"986","False","jonas brother meet perhaps make sense kid 80",0,0,0,0,0,0,0,1,0,2,0.4,0,0,2,"Trust"
"987","True","please stop",0,0,0,0,0,0,0,0,0,0,0.6,0,0,0,""
"988","False","unintentional tiein back future",0,0,0,0,0,0,1,0,0,0,0,0,-2,0,"Surprise"
"989","True","everyone anything abortion movie exiled actual jumanji jungle",0,0,1,2,0,1,0,0,1,1,-0.4,0,0,0,"Fear"
"990","False","actually kind like idea game want played established original make sense would try adapt modern game get people play",0,0,0,0,2,0,0,1,0,4,2.8,2,5,4,"Joy"
"991","True","nope",0,0,0,0,0,0,0,0,0,0,0,0,0,0,""
"992","False","agree another hollywood attempt premarketing film built audience wonder make original movie nowadays remake reboots reimaginings want something know going make money lot people thread saying people would complaining called jumanji saying would saying close original see original set world jumanji set world none character special skill avatar eaten hippo tone melancholy dark seems like another teen comedy draw silliness name substance",1,3,0,0,2,2,1,1,1,6,1.75,0,1,5,"Anticipation"
"993","False","use jumanji moniker going ignore everything made jumanji cult classic first place",0,0,0,1,0,0,0,0,2,1,-1.25,0,-1,-1,"Fear"
"994","False","fucking shit fuck fucking needle shooting fucking plant fucking hate thing gave fucking fear fucking plant case shoot fucking needle pretty sure girl dy sting finishing game revers death",7,2,3,7,1,3,1,1,8,2,-5.85,-6,-19,-6,""
"995","False","want seem like reboot continuation video game smart idea",0,1,0,0,0,0,0,0,0,0,1,2,4,0,"Anticipation"
"996","False","get sued sword art online",0,1,0,0,1,1,1,0,0,1,-0.2,-1,-2,1,""
"997","False","essentially jem movie part deux",0,0,0,0,0,0,0,0,0,0,0,0,0,0,""
"998","False","yes already grown kid movie",0,0,0,0,0,0,0,0,0,0,0.8,0,1,0,""
"999","False","eyebrow shot money dwayne man really like",2,1,0,1,1,1,2,1,1,1,0.7,1,2,0,""
"1000","True","movie giving similar vibe movie",0,0,0,0,0,0,0,0,0,1,0.25,0,0,1,""
"1001","True","want point gag hot girl turning jack black surprised would never happen game ever played image character select screen show playing",1,1,1,0,0,1,1,1,2,0,-1,1,-1,-2,""
"1002","True","nick jonas rescuing rock le believable bunch teen getting sucked atari",0,0,0,0,0,0,0,0,0,1,0.55,0,0,1,""
"1003","False","well opinion jumanji vastly superior brendan frasier mummy look people got riled recent month dark universe see fanboy rage dying soon although hopefully j2 turn better tom cruise show",2,0,1,1,0,2,0,1,2,1,0.25,-1,1,-1,""
"1004","False","gt show robin williams jungle though responding tv series show character jungle lot like entire show",0,0,0,1,0,0,0,2,0,0,0.5,1,2,0,"Trust"
"1005","False","missed reference joke",0,0,0,0,0,0,0,0,1,0,0.1,-2,0,-1,""
"1006","True","know anything anout remake looking picture conclude two thing one film nothing original jumanji know one made damn thing famous first place two movie shit",2,0,2,0,0,0,0,0,2,2,-1,-1,-4,0,""
"1007","False","kind like idea game evolves time old one discovered time board game older unpopular le likely played alot people playing always tended bit open mind whereas new one discovered older video game one people going look huge desire play nowadays unlike found way back previous one found would huge deal like super mario rolling thought right",0,4,1,0,3,2,1,3,1,3,4.3,2,9,2,"Anticipation"
"1008","True","pure trash friend pepperoni rob want see disowned friend notice",1,0,2,1,1,2,0,1,2,1,1.3,0,1,-1,""
"1009","True","trashhhh",0,0,0,0,0,0,0,0,0,0,0,0,0,0,""
"1010","False","ugh contradictory rule else every sequel would doomed failure strike balance find mean two extreme ie nothing like original end carboncopy original end make something catch22 else could claim every situation find happy medium ie life catch22 instead exceptionally difficult balance strike opposing force use phrase fine line delicate balance",2,2,1,5,1,2,1,2,5,2,-0.65,-1,-1,-3,"Fear"
"1011","False","first comparison make argument made another fast furious movie time get sucked car nightrider kit style modern link maybe disney car still vain original fact personal growth stopping bad guy though sweet car idea",3,2,2,1,1,1,1,3,3,2,-2.35,-1,-3,-1,""
"1012","False","would better call welcome jungle start brand new franchise",0,1,0,1,0,0,0,0,0,0,2.1,2,4,0,""
"1013","True","actually look really good like way changed dynamic game",0,1,0,0,1,0,2,1,0,1,1.75,3,5,1,"Surprise"
"1014","True","hard watch without robin",0,1,0,1,0,0,0,0,0,0,-0.25,-1,-1,0,""
"1015","False","two thousand and five called zathura flopped theater pretty good movie though",0,2,0,0,2,0,1,2,0,2,1.5,2,4,2,""
"1016","True","uh van pelt final bos",0,0,0,0,0,0,0,0,0,0,-0.6,0,0,0,""
"1017","False","getting sucked game part original jumanji",0,0,0,0,0,0,0,0,0,0,-0.25,-1,0,0,""
"1018","True","see character resolution mile away",0,0,0,0,0,0,0,0,0,0,0,0,2,0,""
"1019","True","know good look pretty enjoyable",0,2,0,0,2,0,1,2,0,2,2.5,3,6,2,""
"1020","False","everyone would said totally jumanji rip",0,0,0,0,0,0,0,0,0,0,-0.25,-1,0,0,""
"1021","True","actually made think tropic thunder weird way looking forward watching look pretty funny",0,1,1,0,1,0,0,1,1,2,1.9,-1,3,1,""
"1022","False","interesting see explain school basement",0,0,0,0,0,0,0,2,0,2,0.75,1,2,2,"Trust"
"1023","False","jumanji variety pretty bad game able come life",1,1,1,1,1,1,0,1,1,1,0.25,1,-2,0,""
"1024","False","jack black teenage girl",0,0,0,0,0,1,0,0,1,0,-0.25,0,0,-1,"Sadness"
"1025","False","could used black mirror excuse transported another place new technology implanted brain would much realistic compared saw",0,0,0,0,0,1,0,0,2,1,0.5,0,-1,-1,"Sadness"
"1026","True","girl dome god character annoying actually almost everybody show terrible course",2,1,1,2,1,1,0,2,2,1,-1.5,-2,-4,-1,""
"1027","False","ad hominem insult",1,0,1,0,0,1,1,0,1,0,-1,-1,-2,-1,""
"1028","False","ya ya frick office parody park rec",0,0,0,0,0,0,0,0,0,0,-0.25,-1,0,0,""
"1029","False","retro game going curiousity cheap looking unknown xbox one game",0,1,0,1,0,0,0,0,2,0,-1,-2,0,-2,""
"1030","True","dwayne rock every goddamn movie johnson",0,0,0,0,0,0,0,0,0,1,-1,0,-3,1,""
"1031","True","even come comment anymore full people testing water wondering okay like hate something based trailer either get board fellating get board shitting god sake make mind ever see",1,2,1,2,1,1,0,1,1,2,-1.05,0,0,1,""
"1032","False","board game qualifier type game",0,1,0,0,0,0,0,0,0,0,0,0,0,0,"Anticipation"
"1033","True","sword art online old atari game jumanji name slapped recognition could",0,1,0,0,1,1,1,0,0,1,0.6,0,2,1,""
"1034","False","video game still game know specifically need board game people would still make connection",0,1,0,0,0,0,0,0,0,0,0,0,0,0,"Anticipation"
"1035","True","welp look awful",1,0,1,1,0,1,0,0,1,0,-0.75,-1,-3,-1,""
"1036","False","well jumanji spin zathura could given game different title one find jumanji zathura board game decideing play another find computer game play instead",0,1,0,0,0,0,0,1,0,1,0.8,1,0,1,""
"1037","False","would ice creamgelato chef special",0,0,0,0,1,0,0,0,0,1,0.8,0,0,1,"Joy"
"1038","False","cartoon go jungle though",0,0,0,1,0,0,0,0,0,0,0,0,0,0,"Fear"
"1039","True","releasing day star war quite bold move",0,1,0,1,1,0,0,1,1,2,0.35,0,0,1,""
"1040","True","fast jumanjiest meet freaky friday breakfast club",0,0,0,0,0,0,0,0,0,1,0.6,1,0,1,""
"1041","False","yeah multiple kevin hart short joke trailer alone mean skipping one schtik exhausted year ago bet extended jack black fart le ten minute get screen",0,0,0,0,0,2,0,0,3,0,-1,-2,-1,-3,"Sadness"
"1042","False","imagine like whatever created board game lure people jungle world create manifestation would attract current civilization",0,1,0,2,1,0,0,1,1,2,2,0,3,1,"Fear"
"1043","True","people mad make original jumanji go away still watch problem",1,1,1,3,0,2,0,0,2,0,-1.5,-2,-5,-2,"Fear"
"1044","False","jumanji board game sentient entity capable shapeshifting form order better appeal intended prey",0,3,0,1,0,0,0,0,1,1,1.55,3,3,0,"Anticipation"
"1045","False","well studio could know produce something original instead rehashing older film",0,0,0,0,0,1,0,0,0,0,0.8,1,0,0,"Sadness"
"1046","True","jumanji dark soul four die first bos",0,0,0,1,0,2,0,0,1,0,-1.35,-2,-3,-1,"Sadness"
"1047","False","wrong game plan better san andreas",0,1,0,0,0,0,0,0,1,0,0.05,0,0,-1,"Anticipation"
"1048","False","jungle jumanji rundown",0,0,0,1,0,0,0,0,0,0,-0.25,0,0,0,"Fear"
"1049","True","actually look lot entertaining trailer released recently",0,1,0,0,1,0,0,0,0,1,0.75,1,2,1,""
"1050","True","look entertaining people shitting without giving chance look like remake sort sequel know youtube comment savage tho think youtube comment section brings worst people",1,2,0,1,1,0,1,0,1,3,-0.05,0,3,2,"Anticipation"
"1051","True","nooooooo",0,0,0,0,0,0,0,0,0,0,0,0,0,0,""
"1052","False","obvious product placement sony film ssssssssssssssshocking",0,0,0,0,0,0,0,1,0,1,0,0,0,1,"Trust"
"1053","False","gt nothing remotely jumanji except name tension undertone suspense horror original movie see new movie know already",2,1,1,2,0,1,2,0,1,0,-0.7,-1,-1,-1,""
"1054","True","look terrible",1,0,1,1,0,1,0,0,1,0,-0.75,-1,-3,-1,""
"1055","False","jungle hunt actual atari game could named",0,0,0,1,0,0,0,0,0,1,0.4,0,0,1,"Fear"
"1056","True","hollywood make anything original anymore",0,0,0,0,0,0,0,0,0,0,0,0,0,0,""
"1057","True","release date two week star war flop written",0,1,1,1,1,1,0,1,2,1,0.1,0,-4,-1,""
"1058","True","rundown sequel hoping",0,1,0,0,0,0,0,0,0,0,0.35,0,2,0,"Anticipation"
"1059","True","ghostbusters two thousand and seventeen hollywood soulless",0,0,1,1,0,1,0,0,1,0,-0.5,0,0,-1,""
"1060","False","zathura job",0,0,0,0,0,0,0,0,0,1,0,0,0,1,""
"1061","False","pitfall",1,0,1,1,0,1,1,0,1,0,-0.8,0,0,-1,""
"1062","False","course using insult descriptor type comedy certainly misrepresentation misrepresentation ad hominem allows dismiss entire movie guise created byfor people mental disorder would autistic comedy even",1,0,1,1,0,2,1,0,4,0,-2.4,-3,-5,-4,"Sadness"
"1063","True","look like best sequel tropic thunder ever",0,1,0,0,0,0,0,0,0,0,1,2,5,0,"Anticipation"
"1064","False","game want played",0,0,0,0,0,0,0,0,0,0,0,0,1,0,""
"1065","False","true part board game game remained jungle must wait dice read five eight show jungle location board game consequence landing specific spot board",0,2,0,1,0,0,0,1,1,0,0,0,2,0,"Anticipation"
"1066","False","really ripoff author wrote book zathura dope as movie anyway",0,0,0,0,0,0,0,1,0,1,-0.5,-2,0,1,"Trust"
"1067","True","ok sold prepared get cynical hate seems like fun time",1,3,1,1,1,1,0,1,1,2,0.5,0,2,1,"Anticipation"
"1068","True","never seen original look like worst thing world",0,0,0,0,0,0,0,0,0,0,0,0,-1,0,""
"1069","True","expecting much still disappointed movie instead jumanji movie",1,1,1,0,0,1,0,0,1,0,-1,-1,-2,-1,""
"1070","True","definitely look like lot fun also definitely rock one trick sharing weird pic shot like showed rapper music video ten year ago",1,1,1,1,2,2,2,0,3,3,0.7,0,4,0,""
"1071","True","look awful deathnote look awful inhumans look awful going back pubg",1,0,1,1,0,1,0,0,1,0,-0.75,-1,-3,-1,""
"1072","False","like someone else mentioned jumanji game come real world one much different especially character taking different body inside game apart game interacts people seem many similar quality going tying name like clickbait title",0,0,0,0,0,0,0,2,0,2,0.75,1,4,2,"Trust"
"1073","False","look like good potentially good film",0,1,0,0,1,0,1,1,0,1,1.25,2,5,1,""
"1074","False","may allow dismiss ad hominem would explicitly deny argument insult like debate call someone idiot sure would allow dismiss opponent argument pretense idiot would explicitly claim argument wrong simply idiot happening",4,1,3,1,0,1,1,0,7,1,-4.55,-5,-6,-6,"Anger"
"1075","True","really dislike kevin heart going try like movie",1,0,1,0,0,0,0,0,1,0,-0.5,0,0,-1,""
"1076","False","work die hard three came way favourite",0,0,0,1,0,1,0,0,1,0,-0.75,-1,-2,-1,""
"1077","False","look anything like jumanji recognize anything well name tv screen",0,0,0,0,0,0,0,0,0,0,1.3,2,2,0,""
"1078","False","seriously could another sequel journey land time",0,3,0,1,1,0,0,0,0,2,0.4,0,0,2,"Anticipation"
"1079","True","better original kid kid wild imagination would think adventure rock kid bound crap watching",0,1,1,0,0,0,1,0,3,2,0.05,-1,1,-1,""
"1080","False","problem jumanji thing movie suck character thing literally reason stick jumanji name robin williams original",0,0,0,1,0,1,0,0,2,1,-0.9,-2,-5,-1,""
"1081","True","actually look bad possibly enjoyable like whole character game concept karen gillan nice second seen",1,0,1,1,0,1,0,0,1,0,1.65,2,4,-1,""
"1082","False","people compared goosebump jumanji monster coming life",0,1,0,1,0,0,0,0,1,0,-0.5,-1,0,-1,""
"1083","False","ghostbusters ask recognizable movie also would whine someone remade independence day classic blockbuster",0,2,1,0,1,1,1,1,1,3,2.35,1,3,2,"Anticipation"
"1084","False","thought world end bit meh although looking imdb probably minority think would better without alien maybe high expectation given much love shaun dead hot fuzz",1,2,1,1,1,0,0,0,2,2,-0.3,2,2,0,"Anticipation"
"1085","True","yo token black dude",0,0,0,0,0,1,0,0,1,0,-0.25,0,0,-1,"Sadness"
"1086","False","hey least fishing old let u get real 90 depth antiquity property churn remake whatever look like decent enough action flick point jumanji name slapped",0,0,0,0,0,0,0,2,0,5,1,3,2,5,"Trust"
