"","Parent","Comment","Anger","Anticipation","Disgust","Fear","Joy","Sadness","Surprise","Trust","Negative","Positive","Synzhet","Bing","Afinn","NRC","Emotion"
"1460","True","gt jumanji welcome jungle also known jumanji two upcoming american 3d fantasy comedy adventure film standalone sequel one thousand, nine hundred and ninety-five film jumanji movie meant reboot original jumanji feel like people freaking much",0,2,0,1,0,0,0,0,0,1,2.4,1,7,1,"Anticipation"
"1461","False","point say enjoyable film making point untouchable gem cinema",0,0,0,0,1,0,0,0,0,1,1.25,2,5,1,"Joy"
"1462","False","yeah found searched script",0,0,0,0,1,0,0,1,0,2,0.6,0,1,2,""
"1463","False","phrasing anymore",0,0,0,0,0,0,0,0,0,0,0,0,0,0,""
"1464","True","rock movie click bait cinematography",0,0,0,1,0,0,0,1,1,1,0,-1,0,0,""
"1465","False","nostalgia right",0,0,0,0,0,0,0,0,0,0,0.8,1,0,0,""
"1466","False","seems lot firepower assuming gun runner something like",1,0,0,1,0,0,0,0,1,0,0,1,1,-1,""
"1467","False","missed",0,0,0,0,0,0,0,0,0,0,-0.5,-1,-2,0,""
"1468","False","big deal glad share info",0,3,0,0,3,0,1,2,0,3,1.75,1,5,3,""
"1469","False","ironically make want watch even le want throw moneysupport film look like lackluster money grab via slapping old name",2,2,0,1,1,0,1,1,2,1,0.35,-1,3,-1,""
"1470","False","gt script start game fished ocean vice president chaos ensuing would much preferred version fact imagine one mike penny try pas law ban animal yous",1,1,0,1,0,1,0,3,3,2,-0.95,-2,-4,-1,"Trust"
"1471","True","stupid spoiler first trailer fuck movie",0,0,0,0,0,1,0,0,2,0,-2.8,-2,-6,-2,"Sadness"
"1472","True","surprised bad trailer actually conceit funny selfaware",1,0,1,1,0,1,1,0,2,0,-0.45,-3,1,-2,""
"1473","False","entire day must running tally disappointment",0,0,1,0,0,1,0,0,1,0,-1,-1,-2,-1,""
"1474","False","really pitfall movie",1,0,1,1,0,1,1,0,1,0,-0.8,0,0,-1,""
"1475","True","oh gawd oh gawd rockbottom rockbottom",0,0,0,0,0,0,0,0,0,0,0,0,0,0,""
"1476","True","sooo sorry robin williams horror jumanji fundamentally creepy kid horror movie",1,0,1,1,0,1,1,0,1,0,-2.5,-2,-1,-1,""
"1477","True","second rock movie called welcome jungle weird",0,0,1,1,0,0,0,0,1,1,0.25,0,0,0,""
"1478","False","except journey franchise based jules verne book land lost something completely different",0,1,0,1,1,1,0,0,1,3,0.05,-1,-3,2,""
"1479","True","journey center earth three like",0,1,0,1,1,0,0,1,0,2,1.15,1,2,2,""
"1480","False","gave thought completely perverted original name making another vanilla hollywood action comedy people ever get tired seeing shitty twenty-one jump street style movie",0,1,1,0,1,0,0,0,2,3,-1.1,-2,-4,1,""
"1481","False","jungle spanish jungla selva",0,0,0,1,0,0,0,0,0,0,0,0,0,0,"Fear"
"1482","False","get weird though way game power undo time thirty year someone win change course history",0,1,1,1,0,0,0,0,2,0,0,0,2,-2,""
"1483","True","could look worse",0,0,0,1,0,1,0,0,1,0,-0.75,-1,-3,-1,""
"1484","True","based thread apparently supposed precious original jumanji",0,1,0,0,1,0,1,0,0,1,0.5,1,0,1,""
"1485","False","perfect point especially strange console one seen played game",0,1,0,0,1,1,0,1,0,2,0.5,0,2,2,""
"1486","False","honestly bother jumanji supposed come magic source want played book source created jumanji also created zathura appeal kid interested space people play board game like used magically updated would played",0,2,1,0,0,1,0,0,1,1,1.1,2,3,0,"Anticipation"
"1487","False","jumanji brand recognition bet people thread clicked video recognized name premise similar enough get away biggest complaint comedy instead horror movie original jumanji terrifying ten year old self",2,0,1,1,0,1,1,0,2,0,-2.25,0,1,-2,"Anger"
"1488","False","right like tron breakfast club got together make little junglebaby jumanji",0,0,0,0,0,0,0,0,0,1,1.9,2,2,1,""
"1489","False","november rain",0,0,0,0,0,0,0,0,0,0,0,0,0,0,""
"1490","False","disagree completely going repurpose old material people every right compare original problem one hollywood want make challenging emotional film like original jumanji seem know anymore shit million formulaic action comedy bullshit",2,0,1,1,0,1,0,0,3,2,-0.0499999999999999,-3,-8,-1,"Anger"
"1491","False","mean video game version never ending story",0,0,0,0,0,0,0,0,0,0,0,0,0,0,""
"1492","False","credit worth",0,0,0,0,0,0,0,1,0,2,1.15,1,2,2,"Trust"
"1493","False","way register movie basically fan theory weone character see original jumanji board game old room shrug reaction look back suddenly video game form something subtle like would enough suggest game change",0,2,0,1,0,0,1,2,0,0,0,1,5,0,""
"1494","True","touch nothing involved robin williams",0,0,0,0,0,0,0,0,0,0,0,0,0,0,""
"1495","True","utter shite",0,0,0,0,0,0,0,0,0,0,0,0,0,0,""
"1496","True","lmao awful",1,0,1,1,0,1,0,0,1,0,-0.75,-1,1,-1,""
"1497","False","fabled neogeo home system quiet asian kid used claim back 6th grade knew family recently migrated asian country could dispute",1,0,0,0,0,1,0,1,1,1,-0.5,0,-2,0,""
"1498","False","yeah know exactly like kevin hart",0,0,0,0,0,0,0,0,0,0,0.5,1,3,0,""
"1499","False","shit completely agree jumanji great concept actually excited see strike jumanji thought trailer made look like shit thing probably would interested",2,2,2,0,1,1,1,1,2,4,2.05,1,6,2,""
"1500","False","well thing going",0,0,0,0,0,0,0,0,0,0,0.8,1,0,0,""
"1501","True","like pretending remake original jumanji new one subtitle welcome jungle childhood jumanji safe coz feel like redo like expansion pack",1,0,0,1,2,0,0,1,1,3,2.9,3,4,2,"Joy"
"1502","False","golden retriever",0,0,0,0,0,0,0,0,0,0,0.6,1,0,0,""
"1503","False","gt going fun thrill ride entertainment movie ad people talk like",0,3,0,1,3,0,2,1,0,4,2.95,3,6,4,""
"1504","False","go watch original",0,1,0,1,0,0,0,0,0,0,0,0,0,0,""
"1505","True","karen gillian",0,0,0,0,0,0,0,0,0,0,0,0,0,0,""
"1506","False","mean jumanji movie game becomes real life definitely look like reimagining idea fun one",0,1,0,0,1,0,0,1,0,2,1.5,2,6,2,""
"1507","True","watched even remember teenager got trouble really need called jumanji could called anything else welcome jungle would fine",0,0,0,1,0,0,0,0,0,0,0.25,1,2,0,"Fear"
"1508","True","even make way trailer refuse accept thing",0,0,0,0,0,0,0,0,1,0,0.25,-1,-1,-1,""
"1509","True","ugh even call jumanji controlled game literally think common even look game part play almost role movie",0,0,0,0,0,0,0,0,0,0,-0.25,-1,-2,0,""
"1510","False","fucking call jumanji",0,0,0,0,0,0,0,0,0,0,-1,-1,-4,0,""
"1511","False","think capture feeling well feel like wanted",1,1,1,1,1,1,1,1,2,1,0.95,2,3,-1,""
"1512","False","literally saw tonight movie fantastic",0,0,0,0,0,0,0,0,0,0,0.75,1,4,0,""
"1513","True","going straight garbage original good like eight let u act like cinematic masterpiece comedy star rock jack try hard funny black",0,2,1,0,3,1,1,2,2,4,3.75,0,13,2,"Joy"
"1514","False","nah thanos going kill sure think whole point arc give audience sort emotional response killed father",0,1,0,1,0,1,0,1,1,0,-1.25,-2,-6,-1,""
"1515","True","fuck guy look fun",0,1,0,0,1,0,0,0,0,1,-0.25,0,0,1,""
"1516","False","expecting trope principle come check see notice game console go turn dooming cast eternity inside game either principle get bored start playing game forcefully taking control either cast member game enemy",1,2,1,1,0,1,0,0,1,1,-1.25,-2,-4,0,"Anticipation"
"1517","True","insanely stupid could taken original concept way shit robin williams",1,0,1,0,0,0,0,0,2,0,-2.15,-3,-6,-2,""
"1518","False","lol invited bus last exam",0,0,0,0,0,0,0,0,0,0,0,0,3,0,""
"1519","True","look fucking amazing hilarious",0,0,0,0,1,0,1,0,0,1,0.5,1,2,1,""
"1520","False","sucking",0,0,0,0,0,0,0,0,0,0,0,0,0,0,""
"1521","True","kevin hart legitimately ruin everything ugh hey another rancid turd garbage fire trailer",0,0,2,2,0,1,0,0,3,0,-2.25,-3,-7,-3,""
"1522","True","sure called jumanji",0,0,0,0,0,0,0,0,0,0,0,0,0,0,""
"1523","False","really hate guy rock hart black fuck dude every movie definitely look like something tropic thunder would made fun lol",1,1,1,1,1,2,0,0,2,2,-0.75,0,2,0,"Sadness"
"1524","False","point jumanji compels play first scene original two child actively resist magic attempt throw away like one ring lord ring ancient piece artifact somehow lull civilized man partake ancient form entertainment lost time reason jumanji call find shedding civilized mind reverting human baser instinct player know want play ancient board game nagging feeling make want play anybody especially problem child finding old video game room supposed clean detention one hundred going attempt play point original jumanji rhyme reason child compelled play due magic new one child bored would rather play game detention",1,7,2,2,5,4,2,6,8,8,1.85,-2,-2,0,"Anticipation"
"1525","False","everyone acting like jumanji incredible experience whose legacy preserved fun kid movie",0,1,0,0,1,0,0,0,0,1,2.35,3,6,1,""
"1526","False","tagline first wonder",0,0,0,0,0,0,0,0,0,0,0,1,0,0,""
"1527","True","nooooo",0,0,0,0,0,0,0,0,0,0,0,0,0,0,""
"1528","False","yea hipster shit jumanji casablanca movie trying like old one us premise people need calm get high horse",1,0,1,0,0,0,0,1,1,1,0.75,1,0,0,""
"1529","False","nah really deep",0,0,0,0,0,0,0,0,0,0,0,0,0,0,""
"1530","True","know might actually give one shot",1,0,0,1,0,1,1,0,1,0,-0.4,0,0,-1,""
"1531","False","would say subjective objective look like shit action film cgi meh bad stuff like girl flying dragon kick explosion look way par personally hated everything trailer nothing half assed reimagining jumanji everything looking plain bad",3,1,2,4,0,1,1,1,4,3,-1.6,-2,-8,-1,"Fear"
"1532","True","mean actually okay love original jumanji series like straight remake would probably earn ire trying upstage late robin williams damned damned situation nostalgia people one hell drug seems glad get see jumanji",2,1,1,1,2,2,0,1,4,4,-0.0500000000000001,0,1,0,""
"1533","True","always rock kevin hart",0,0,0,0,0,0,0,0,0,1,0,0,0,1,""
"1534","True","watched gym think people looking think may cackled lord hope best part trailer look hilarious",0,1,1,0,2,0,2,2,1,3,2,2,7,2,""
"1535","False","jumanji welcome jungle patience play background",0,1,0,1,0,0,0,1,0,1,1,2,2,1,""
"1536","True","redeeming quality rock kevin heart together",0,0,0,0,0,0,0,0,0,1,1,1,2,1,""
"1537","False","honestly thought seriously stretch go",0,1,0,0,0,0,0,0,0,0,0,0,0,0,"Anticipation"
"1538","False","react much",1,0,0,1,0,0,0,0,0,0,0,0,0,0,""
"1539","False","maybe good thing",0,1,0,0,1,0,1,1,0,1,0.75,1,3,1,""
"1540","False","think look like interesting concept great hook comedy though scared hammer dofferences charactertheir original self death",1,1,1,1,0,1,1,0,1,1,1.4,1,4,0,""
"1541","False","would watch",0,1,0,1,0,0,0,0,0,0,0,0,0,0,""
"1542","True","think actually look good people give chance good one grew actually think new ghostbusters good",0,1,0,0,1,0,2,1,0,1,1.8,1,5,1,"Surprise"
"1543","True","way look really stupid bad least making jumanji reboots",1,0,1,1,0,1,0,0,2,0,-1.75,-2,-5,-2,""
"1544","False","see hoarded gpu went",0,0,0,0,0,0,0,0,0,0,0,0,0,0,""
"1545","False","woah really love movie maybe time dive book",0,1,0,0,1,0,0,0,0,1,0.75,1,3,1,""
"1546","False","people sucked game called jumanji possible qualifier need",0,0,0,0,0,0,0,0,0,0,-0.25,-1,0,0,""
"1547","True","look like fun",0,1,0,0,1,0,0,0,0,1,1.25,2,6,1,""
"1548","False","might need watch like much kid",0,1,0,1,0,0,0,0,0,0,0.5,1,2,0,""
"1549","False","part get sucked video game reminds tron",0,0,0,0,0,0,0,0,0,0,-0.25,-1,0,0,""
"1550","True","next flubber remake sentient fidget spinner",0,0,0,0,0,0,0,0,0,1,-0.8,-1,0,1,""
"1551","True","movie look fun concept actually pretty good jumanji feel one would second thought original game jumanji",0,4,0,0,3,0,1,2,0,3,2.65,3,8,3,"Anticipation"
"1552","False","freddi fish reverse sherlock high right idk going",0,0,0,0,0,0,0,0,0,0,0.8,1,0,0,""
"1553","False","mean tron making tron",0,0,0,0,0,0,0,0,0,0,0,0,0,0,""
"1554","False","check wiktionary five minute believe",0,0,0,0,0,0,0,0,0,0,0,0,0,0,""
"1555","False","breakfast tron",0,0,0,0,0,0,0,0,0,1,0.6,0,0,1,""
"1556","True","watch reboot unless woman sisterhood currentyear",1,1,0,1,0,1,1,1,0,1,0.5,0,0,1,""
"1557","False","personally disagree think trailer look fun solid six hundred and ten fun action film really last memory far awful really understand people painting dumpster fire one thousand, four hundred and ten film based trailer alone",2,1,1,2,1,1,0,0,2,3,-0.85,0,-3,1,""
"1558","True","rock already movie called welcome jungle",0,0,0,1,0,0,0,0,0,1,0.5,1,2,1,"Fear"
"1559","False","son watched enjoyed complaint",1,0,0,0,0,0,0,0,1,0,0.25,0,0,-1,"Anger"
"1560","False","paradise city would perfect maybe trailer two",0,1,0,0,1,0,0,1,0,1,1.25,2,6,1,""
"1561","False","nah dude tron",0,0,0,0,0,0,0,0,0,0,0,0,0,0,""
"1562","True","kill",0,0,0,1,0,1,0,0,1,0,-0.75,-1,-3,-1,""
"1563","True","opinion look like total trash nothing like jumanji called journey centre earth three smell another bomb rock like baywatch also minor gripe remakesreboots whatever new jumanji sounded cool seriously video game kid would get otherwise god tell studio note kid play board game change child original came child rarely played board game fact jumanji mysterious board game helped",2,5,2,5,3,2,2,2,3,5,1.45,-2,3,2,""
"1564","True","look like shit",1,0,1,0,0,0,0,0,1,0,-0.25,0,-2,-1,""
"1565","True","probably good great good damnit sequel jamanji deserves part movie series standalone",0,2,0,0,1,0,1,2,0,1,0.25,2,2,1,""
"1566","True","terrible",1,0,1,1,0,1,0,0,1,0,-0.75,-1,-3,-1,""
"1567","True","breakfast club sex tron jumanji filmed",0,1,0,0,1,0,0,1,0,2,0.7,0,0,2,""
"1568","False","yeah really problem reboot read guess open fresh take concept movie interesting kid combination unique story setting great humor remember tensionfear movie partly life turned upside dangerous way end really kid timeless robin williams growing see handle teenager aspect new story",0,0,0,2,0,1,2,0,2,2,3.6,2,6,0,""
"1569","False","scott pilgrim",0,0,0,0,0,0,0,0,0,0,0,0,0,0,""
"1570","False","would take meant living world one funniest people decided nothing worth seeing tomorrow",0,1,0,0,0,0,0,0,0,1,1.55,1,2,1,"Anticipation"
"1571","False","honestly though dude everything",0,0,0,0,0,0,0,0,0,0,0,0,0,0,""
"1572","True","whatthe fuck",0,0,0,0,0,0,0,0,0,0,-1,-1,-4,0,""
"1573","False","fuck robin williams classic legacy something remade tampered",0,0,0,0,0,0,0,0,0,1,0.1,0,-4,1,""
"1574","True","jumanji one always best jumanji rip robin williams",0,0,0,0,0,0,0,0,0,0,0.25,0,3,0,""
"1575","False","zathura actually good arguably better jumanji",0,1,0,0,1,0,1,1,0,1,1.15,2,5,1,""
"1576","False","saying jumanji untouched quite open idea sequel fact wanted sequel time lore jumanji much potential however good sequel one stay true lore core orignal movie movie billed sequel direct reboot could another level bad trailer fails everything made jumanji jumanji look trailer say yeah jumanji look trailer say look like typical rock actionadventurecomedy flick",1,3,1,1,1,1,1,3,1,4,0.4,-1,3,4,""
"1577","False","pitfall movie",1,0,1,1,0,1,1,0,1,0,-0.8,0,0,-1,""
"1578","True","look like okay movie prefered jumanji another robin williams film",0,0,0,0,0,0,0,0,0,0,0.5,2,2,0,""
"1579","True","watching trailer super thinking stupid poor idea remake till got rock jack black kevin hart turned right around potential good especially jack black mentality valley girl",0,1,0,0,1,1,1,1,2,3,0.55,1,2,1,""
"1580","True","favorite part title nothing movie",0,0,0,0,1,0,0,2,0,2,0.75,1,2,2,"Trust"
"1581","True","two jumanji two furious starring dwayne rock johnson",1,0,1,0,0,0,0,0,1,1,-1,-1,-3,0,""
"1582","False","night spoken morris day tune thanks sir madam p",0,0,0,0,0,0,0,1,0,1,0.85,0,2,1,"Trust"
"1583","False","decent seems bit much otherwise agree",0,0,0,0,0,0,0,0,0,2,1,1,1,2,""
"1584","True","hahaha rock anything",0,0,0,0,0,0,0,0,0,1,0,0,3,1,""
"1585","False","book zathura jumanji came box set",0,0,0,0,0,0,0,0,0,0,0,0,0,0,""
"1586","True","look forgettable could called anything else",0,0,0,0,0,0,0,0,0,0,0,0,-1,0,""
"1587","False","hear hear thematically best cornetto bunch opinion",0,0,0,0,0,0,0,0,0,0,0.5,1,3,0,""
"1588","False","end day irrelevant movie good good suck could call citizen kane ii still going suck however set compared something else since people already based expectation want see",0,2,0,0,1,0,1,1,2,3,-0.5,-1,1,1,"Anticipation"
"1589","False","personally think connection lot people would make jumanji really old movie tron two new really tron jungle boogie",0,0,0,1,0,0,0,0,0,0,0.8,0,0,0,"Fear"
"1590","False","yeah much tron concept",0,0,0,0,0,0,0,0,0,0,0.4,0,1,0,""
"1591","True","ruin movie throwback title one wanted remade since star dead called avatard",0,1,0,1,1,1,0,2,1,2,-1.15,-2,-5,1,"Trust"
"1592","False","accidentally put post",0,0,0,0,0,0,1,0,0,0,-0.6,0,-2,0,"Surprise"
"1593","False","saw yesterday great probably best movie seen year",0,0,0,0,0,0,0,0,0,0,1,2,6,0,""
"1594","False","yep trailer look like might turn something fun every baywatch trailer looked like definitely going pretty bad",1,2,1,1,2,1,0,1,1,2,1.25,2,4,1,""
"1595","True","jumanji except video game yeah going hell pay",1,1,1,1,1,1,0,1,1,1,-0.9,-1,-4,0,""
"1596","False","gt cast look hilarious also already tell going happen get leave game make personal realization nerd gain selfconfidence getting respective asskickers film jock learns respect people spending time one weakest among group selfcentered mean girl learns nicer people forced exact opposite see gt oh even money nerd couple hooking jock getting mean girl likely resulting jack black kissing kevin hart uncomfortable gay humor funny need character caricature geek jock mean girl pretty girl",1,6,0,1,5,2,3,4,5,5,3.4,3,9,0,"Anticipation"
"1597","False","throwin many big word understand going take disrespect",1,0,0,0,0,0,0,1,1,1,-0.5,-1,-1,0,""
"1598","False","version netflix",0,0,0,0,0,0,0,0,0,0,0,0,0,0,""
"1599","False","look absolutely horrible waste money importantly time",2,2,2,1,1,0,1,1,2,1,-1.15,-2,-4,-1,""
"1600","False","go home comment robot drunk",0,0,0,0,0,0,0,0,0,0,-0.5,-1,-2,0,""
"1601","False","good joke every fucking thread christ wait kid go back school already",0,2,0,0,1,0,1,2,2,1,0.1,-1,1,-1,""
"1602","False","think find friendship game card",0,0,0,0,1,0,0,1,0,1,0.5,0,2,1,""
"1603","False","yes also represents jungle much stampede monsoon",0,0,0,1,0,1,0,0,1,0,-0.2,-1,-1,-1,""
"1604","True","though",0,0,0,0,0,0,0,0,0,0,0,0,0,0,""
"1605","False","parrish jungle",0,0,0,1,0,0,0,0,0,0,0,0,0,0,"Fear"
"1606","True","dreading crap reveal pleasantly surprised watch complaint",1,1,1,1,0,0,1,0,2,0,-1.7,-1,-7,-2,""
"1607","False","yes filmmaker already said going find allen stuff home lived",0,0,0,0,0,0,0,0,0,0,0.8,0,1,0,""
"1608","False","liked",0,0,0,0,0,0,0,0,0,0,0.5,1,2,0,""
"1609","False","yeah dy even half peter half money alan getting shot face sarah insane still aunt cop either drown get crushed eaten townspeople dying whole movie face massive flood ect pretty fucked think",5,2,2,7,2,4,2,4,5,3,-2.1,-2,-11,-2,"Fear"
"1610","False","gt passed away inherited original board game first movie ended tying brick thing dropping river girl another country find",0,1,0,0,0,0,0,0,0,0,0,0,0,0,"Anticipation"
"1611","False","one character get sucked see adventure also tv show",0,1,0,0,0,0,0,1,0,1,0.25,-1,2,1,""
"1612","False","point whether written script jumanji jumani sick bastardization jumanji",0,0,1,0,0,1,0,0,1,1,-0.75,-1,-2,0,""
"1613","False","eat shit",1,0,1,0,0,0,0,0,1,1,-0.15,-1,-4,0,""
"1614","False","giving people want",0,0,0,0,0,0,0,0,0,1,0.25,0,1,1,""
"1615","True","robin william say really want jumanji remake strange feeling get wrong film look fine jumanji almost original source material even acknowledged planing movie happened classic family adventure mysterious board game warp world around player turning event make upset people willing publish movie like name jumanji even come close original source material titled jumanji cash grab even rabin williams say want remake fan original hurt see type remake done movie full heart charm",6,5,1,4,2,4,2,2,7,7,0.45,-1,7,0,"Anger"
"1616","True","simple question spider still handle puppet one original",0,0,1,1,0,0,0,0,0,1,0,-1,0,1,""
"1617","False","swear sony one movie seems like hodgepodge quilt board meeting ramblings think anything nice",0,1,0,0,0,0,0,1,0,1,0.9,2,3,1,""
"1618","False","look like atari knockoff sort graphic looked like atari",0,0,0,0,0,0,0,0,0,0,0.5,1,2,0,""
"1619","True","feel like probably get crap saying jungle last thing would wearing shirt missing bottom half girl got suffer mosquitobug bite guy get run around worrying eaten alive",0,2,1,3,1,3,0,1,6,1,-2.35,-2,-7,-5,""
"1620","False","sure zeroth law exist yet movie although never really say movie would come way robot book since book take place course many year primitive robot movie advanced robot thinking movie technically using zeroth law justify action overtly say",0,0,0,0,0,0,0,1,0,2,0.4,0,1,2,"Trust"
"1621","True","k wtf anyone else see nick jonas flying helicopter",0,0,0,1,0,0,0,0,0,1,0.1,0,-4,1,"Fear"
"1622","False","seriously first thirty second miffed afterwards looked like decent movie reason piggyback completely different film studio exec genius use publicity made name point rename bomb",1,0,0,1,0,1,1,0,1,4,2.15,2,1,3,""
"1623","False","website whole obsessed thing fail",0,0,0,0,0,0,0,0,0,0,-1.15,-1,0,0,""
"1624","False","think best idea remake could took idea crazy game centering around jungle went new direction jumanji title people would rag ripoff jumanji",1,0,0,2,0,1,0,1,1,2,0.3,-1,1,1,"Fear"
"1625","True","fucking meh",0,0,0,0,0,0,0,0,0,0,-1,-1,-4,0,""
"1626","False","look like really funny good movie fact jumanji make disappointed could easily made really good movie left jumanji besides cheap marketing gimmick",1,1,1,0,1,1,1,2,2,1,0.15,-2,7,-1,"Trust"
"1627","False","tron",0,0,0,0,0,0,0,0,0,0,0,0,0,0,""
"1628","False","yea lol asked",0,0,0,0,0,0,0,0,0,0,0,0,3,0,""
"1629","True","initially looked like breakfast club remake could decent film imagine jungle could place parrish robin williams experienced spoke original movie would get see different set character cope situation perhaps figure way leave game jumanji supposed board game unknown origin suppose could also manifest video game unknown origin",0,2,0,2,0,1,1,1,3,4,1.45,1,1,1,""
"1630","False","sequel",0,1,0,0,0,0,0,0,0,0,0,0,0,0,"Anticipation"
"1631","False","edgar wright film usually safe bet",0,0,0,0,1,0,0,1,0,1,0.75,1,1,1,""
"1632","True","coworker said realistic board game magical old video game system think dead inside hearing say",0,2,0,1,1,0,1,1,1,1,0.35,1,-3,0,"Anticipation"
"1633","False","admit really aware morris day time saw jay silent bob strike back",1,1,0,0,0,0,0,0,1,0,-0.15,0,-2,-1,""
"1634","True","surprised zathura mentioned itt",0,0,0,0,0,0,1,0,0,0,0,0,0,0,"Surprise"
"1635","True","honestly giving tropic thunder vibe predict movie sleeper hit",1,1,0,0,0,0,0,0,1,1,0,0,0,0,""
"1636","False","like last exam tuesday asked right get wagner lol",0,0,0,0,0,0,0,0,0,0,1.3,2,5,0,""
"1637","False","work post production house movie coworkers one department seen actually remake direct sequel",0,2,0,0,0,0,0,0,0,2,0.35,1,0,2,"Anticipation"
"1638","True","year",0,0,0,0,0,0,0,0,0,0,0,0,0,0,""
"1639","False","sequel reason different form addressed film",0,1,0,0,0,0,0,0,0,1,0.6,0,0,1,"Anticipation"
"1640","False","sequel remake think going worry tbh lore still source coworkers seen tape told many detail",0,2,0,1,0,1,0,0,1,1,-0.75,-1,-3,0,"Anticipation"
"1641","False","yeah room great movie",0,0,0,0,0,0,0,0,0,0,0.5,1,4,0,""
"1642","False","sure someone genuinely like",0,0,0,0,0,0,0,0,0,0,1.3,1,2,0,""
"1643","False","vitriol everywhere sort controversial",1,0,0,0,0,0,0,0,1,0,-0.75,-1,-2,-1,"Anger"
"1644","False","would always use atari two thousand, six hundred pac man sound effect",0,0,0,0,0,0,0,0,0,0,0,0,0,0,""
"1645","False","go link riamverysmart",0,0,0,0,0,0,0,0,0,0,0,0,0,0,""
"1646","True","yeah look like bullshit",0,0,0,0,0,0,0,0,0,0,0,0,-1,0,""
"1647","False","got agree may still go see look like kind silly actioncomedy movie loved robin williams jumanji liked basically identical zathura well seem similar trailer still perk interest anyway name aside",0,0,0,0,2,0,0,1,1,4,4.55,3,10,3,"Joy"
"1648","False","excited",0,1,0,0,1,0,1,1,0,1,0.75,1,3,1,""
"1649","False","course believe initial reaction watched original kid see take idea change felt wrong first like rediscovered something show game toy loved kid remembered thing loved seems ruined spoil memory realized remake new adaption movie enjoyed kid brand new movie similar concept different take concept think movie look good wait see lore come tie original",1,2,2,2,1,1,1,2,4,2,1.95,1,6,-2,""
"1650","True","like premise instead repackaging canned b like remake",0,0,0,0,0,0,0,0,0,1,0.75,1,2,1,""
"1651","True","another classic ruined",1,0,1,1,0,1,0,0,1,1,-0.25,0,-2,0,""
"1652","False","else going get guy staring feeding attention",0,0,0,0,0,0,0,0,1,1,0,0,0,0,""
"1653","False","story time kid practiced like month able people eyebrow worked one eye tho kid much dedication",0,1,0,0,1,0,1,1,0,2,2.25,2,4,2,""
"1654","False","fucking fat thumb swear typed",0,0,1,0,0,1,0,1,1,1,-1.6,-2,-6,0,""
"1655","True","okay little jumanji could named something else guess hoping connection make sell better somehow premise seems interesting though idea done found trailer funny sure well comedy hold",0,0,0,0,1,0,1,1,0,2,5.1,2,11,2,""
"1656","False","yeah go fifth generationlooking console 10yearolds today remember playing kid original movie set one thousand, nine hundred and ninety-five would make sense feaure console made 90",0,0,0,0,0,1,0,0,0,2,0.25,0,1,2,"Sadness"
