"","Parent","Comment","Anger","Anticipation","Disgust","Fear","Joy","Sadness","Surprise","Trust","Negative","Positive","Synzhet","Bing","Afinn","NRC","Emotion"
"1","False","would rather see jack black rob vaccine autism schneider day week",1,0,1,1,0,2,0,0,2,1,-0.25,0,-2,-1,"Sadness"
"2","False","watched first time maybe fifteen year month ago thought really held well",0,2,0,0,0,0,0,0,0,0,0.8,1,0,0,"Anticipation"
"3","True","meh",0,0,0,0,0,0,0,0,0,0,0,0,0,0,""
"4","False","maybe trying pick retro hipster rgaming",0,0,0,0,0,0,0,0,0,1,0,0,0,1,""
"5","False","like international trailer said game evolved interesting see new perspective look like actually civilization organized crime everything",1,0,0,0,0,0,0,1,1,3,2.5,1,1,2,""
"6","False","gt even realize kid van pelt dad little older finally put together realized amazing movie family owned vhs kid one like eight movie owned watched bunch realize year alan dad van pelt played actor",0,1,1,0,1,1,1,1,0,1,0.8,2,6,1,""
"7","True","childhood destroyed",1,0,0,1,1,1,0,0,1,1,-0.15,0,-3,0,""
"8","False","mind updating videogame honestly mind original something mindless action even action horror oriented suspense whenever rolled dice",1,1,1,2,0,1,2,0,1,1,-1.5,-1,-2,0,""
"9","True","feel like person liked trailer think look fun win oscar love cast made laugh damn likable movie fun board reason jumanji movie maybe jumanji game change form time make likely trick people make sense modern day would become video game trick kid instead board game old movie lot nightmare fuel say one dark scary part never tell trailer calm tit people wait see really bad ask remaking original taking away enjoyment making something new movie called jungle game everyone would complain jumanji ripoff winning reddit hope movie decent family comedy adventure hater another meltdown like ghostbusters got decent review",3,7,3,4,5,5,4,2,8,10,3.9,1,17,2,"Anticipation"
"10","False","hah hah nice tool",0,0,0,0,0,0,0,0,0,0,0.5,1,3,0,""
"11","True","nah look terrible",1,0,1,1,0,1,0,0,1,0,-0.75,-1,-3,-1,""
"12","False","hope fails",0,1,0,0,1,0,1,1,0,1,0,-1,0,1,""
"13","False","robin williams thing",0,0,0,0,0,0,0,0,0,0,0,0,0,0,""
"14","False","closed tab trailer playing revealed found game form console gaming system board game",0,1,0,0,1,1,0,2,0,2,0.85,0,0,2,"Trust"
"15","False","watched one scary movie day fuck film funny remember teen went nut stitch every scene feel cringy forced austin power goldmember hand still fucking hilarious",0,0,0,1,1,0,1,0,1,1,-1.2,-3,-5,0,""
"16","True","rock arguing people twitter terrible baywatch remake sequel trash look like arguing twitter",1,1,2,1,0,2,0,0,2,2,-0.75,-1,-1,0,""
"17","False","nostalgia helluva drug",0,0,0,0,0,0,0,0,0,0,-0.1,0,0,0,""
"18","True","loving karen gillan hair back normal",0,0,0,0,1,0,0,1,0,1,0.75,1,2,1,""
"19","True","hoping twenty-one jump street surprised baywatch",0,0,0,0,1,0,1,0,0,1,0.6,0,2,1,""
"20","True","calling principal know game magic sent purpose",0,0,0,0,0,0,0,1,0,1,0.65,1,0,1,"Trust"
"21","True","funny thing dwayne johnson already film called welcome jungle two thousand and three",0,0,0,1,0,0,0,0,0,0,1.3,0,6,0,"Fear"
"22","True","agree everyone movie look fun good branded jumanji feeling going find stupid way tie original",1,3,1,1,3,1,2,2,2,4,1.25,1,7,2,""
"23","False","would surprised made cameo evil hunter guy",1,1,1,2,0,2,1,0,2,0,-0.75,-1,-3,-2,""
"24","True","god hope remake spiderman fifth time charm",0,3,0,1,2,0,1,2,0,4,1.25,1,6,4,"Anticipation"
"25","False","gt remember much mystery classic jungle oh really never shown movie described robin william character problem exactly point trying make problem respect original story essence done could still decent movie fact look kind appealing nothing jumanji",0,2,0,2,2,1,1,3,1,4,1.35,2,4,3,"Trust"
"26","False","african witch doctor creates cursed game want played game posse mind adapt whatever form need order played mythos secured",2,0,1,3,0,1,0,1,2,2,0.7,-1,3,0,"Fear"
"27","False","wonder much 91b super nintendo cartridge",0,0,0,1,0,0,0,0,0,0,0.5,2,3,0,"Fear"
"28","False","gt look like generic transported gameanother world rpg movie yeah many movie go theater without running least two body displacement rpg movie",0,0,0,0,0,0,0,0,0,0,0.5,1,3,0,""
"29","True","somebody wrote script kid getting sucked video game studio people decided retcon new jumanji movie hollywood magic",0,0,0,0,0,0,0,0,0,1,0.8,0,0,1,""
"30","False","slap name going get people go honestly would looked jumanji connected",1,0,0,0,0,0,1,0,1,0,-0.5,-1,0,-1,""
"31","True","one hyphenated word cringeinducing much forced humor much modern day popculture reference shoved throat everything funny tell trailer going awful fond memory original recently thought maybe could make decent followup trailer changed mind",1,1,1,2,0,1,0,1,2,2,1.65,2,4,0,"Fear"
"32","False","squirrelrushed",0,0,0,0,0,0,0,0,0,0,0,0,0,0,""
"33","False","course stick original expecting fact first saw going breakfast club thing thought interesting take went shit turn avatar jungle full people nothing essence jumanji",1,2,1,1,0,0,0,1,1,4,0.6,0,-2,3,"Anticipation"
"34","False","think robin williams bit made people apprehensive movie mean loved robin williams people acting like every movie ever untouchable classic honestly thought jumanji one weaker film although pretty good",0,4,0,1,2,0,1,2,1,3,1,3,7,2,"Anticipation"
"35","True","would trailer film interested seeing cynical cashgrab decision call jumanji going literally bank title recognition maybe appeal sensibility appreciate work relying instead left scratching head feel regarding assume ultimately harmless family adventurecomedy original jumanji actual depth essentially child horror film whole concept pretty horrifying throw robin williams dated cgi monkey shenanigan set good balance comedy drama adventure look like mess slapstick action meant appeal sure exactly love god hollywood call thing different name jumanji welcome jungle fine audience want originality anyways would rather quasiremake set failure considering direct remakerebootwhatever even star war basically remake forbidden fortress like rock kevin hart enough sell movie target demographic without called jumanji endrant",1,9,5,7,6,5,3,8,5,19,5.05,7,14,14,"Anticipation"
"36","True","seen whole film need go cinema",0,0,0,0,0,0,0,0,0,0,0,0,0,0,""
"37","False","yeah see make better even reference alan parrish announced show enough realize tone essence completely place world created one thousand, nine hundred and ninety-five movie",0,0,0,0,0,0,0,1,0,1,0.95,2,3,1,"Trust"
"38","False","essence jumanji top story supernatural game fit",0,1,0,0,0,0,0,1,0,1,0,1,3,1,""
"39","False","really thought held remarkably well definitely aimed younger audience humor hit way found lot thing interesting never noticed kid",1,2,0,0,1,0,0,1,1,4,3.15,4,4,3,"Anticipation"
"40","True","people going shit bad honestly look like fun action movie original special place heart grew think turning jumanji video game work rock jack black reason alone go check excited let u give chance",2,2,2,1,3,2,2,1,3,6,1.8,2,2,3,"Joy"
"41","True","applaud going different direction movie rather direct remake feel like completely different movie took premise original change everything else",0,0,0,1,0,0,0,0,0,2,1.65,2,4,2,"Fear"
"42","False","exactly time critic even saw jumanji great movie pretty sure review mostly negative lot nostalgia talking jumanji sacred work art movie alright lot kid took great liking think look fun",0,4,0,0,4,2,1,2,2,4,1.85,3,6,2,""
"43","False","well retro tend predates gotg talking specifically vietnamwar era association anything set jungle silly",0,0,0,1,1,0,0,1,1,0,0.55,0,-1,-1,""
"44","False","oh yah drax created writer intended foil thanos however popular early really replaced adam warlock captain marvel marvell slightly reworked around annihalation became thanos main adversary would personally prefer adam warlock seeing unlikely actually fully introduced infinity war feel drax guy deed",1,2,0,2,1,0,1,4,2,8,1.75,1,2,6,"Trust"
"45","True","nothing ever top original going something really cool board game real life consequence still watch movie today still enjoy know time different know kid rarely playing board game thing get remake sequel look half bad though jumanji name make susceptible scrutiny",1,6,1,2,1,1,0,3,3,5,-0.1,1,2,2,"Anticipation"
"46","True","oh man karen gillian hot",1,0,0,0,0,0,0,0,0,0,-0.25,1,0,0,"Anger"
"47","True","sound like bad idea look like good movie feel conflicted",1,1,1,1,1,1,1,1,1,1,-0.5,0,2,0,""
"48","False","yeah look fairly okay like kind film keep thinking probably see time instead end torrenting six month later actually watch six month later got long trip forgot download anything watch",0,3,0,1,1,0,1,2,0,2,1.5,2,4,2,"Anticipation"
"49","False","liked board game actually pretty creepy felt old primal underlying horror forced modern child face danger nature successfully elevated whole getting sucked video game premise lack seems like could still pretty fun movie think lost favorite quality original story even one thousand, nine hundred and ninety-five movie",1,4,1,3,4,3,1,2,5,4,0.45,2,8,-1,""
"50","False","sorry skimming reddit thread saw mention jumanji called jumanji brought mind lot discussion seen took part reddit well friend family whenever movie copy name previous movie explain always huge peeve mine whenever get brought heard people dismissive already opinion title alone movie look like could fine follows footstep goosebump decently fun movie seeing comment say really humankind remaking going terrible trailer look dumb stuff",1,1,1,1,2,1,0,3,3,5,-0.9,-1,1,2,"Trust"
"51","False","would define remake",0,0,0,0,0,0,0,0,0,1,0,0,0,1,""
"52","True","personally love idea updating classic movie way reflect cultural relevance look fun heart right place",0,1,0,0,2,0,0,0,0,3,2.8,4,7,3,"Joy"
"53","False","yeah actually seems much decent thought would still playing welcome jungle bit onthenose",0,1,0,1,0,0,0,0,0,1,1,2,3,1,""
"54","False","yeah idea called jumanji look cool see trailer seem anything original game called jumanji lead rhino stampede someone loved original remake since announced seems like best case scenario",0,0,0,1,0,1,0,0,1,3,1.75,4,8,2,""
"55","True","earth could use boardgame going find basement",0,0,0,0,0,0,0,0,0,0,0,0,0,0,""
"56","True","christ reddit lighten look fun",0,1,0,0,1,0,0,0,0,1,1,1,4,1,""
"57","False","apparently homage character sure intruiged",0,0,0,0,0,0,0,0,0,1,0.5,1,0,1,""
"58","False","friend",0,0,0,0,1,0,0,1,0,1,0.8,0,1,1,""
"59","False","looooot people like tfa close anh one act like plenty sub",0,0,0,0,0,0,0,0,0,0,0.5,1,2,0,""
"60","False","something take core idea behind source make something new",0,0,0,0,0,0,0,0,0,1,0.8,0,0,1,""
"61","True","like think video game reimagine thing work better today see",0,0,0,0,0,0,0,0,0,0,1.55,3,4,0,""
"62","False","board game actually experiencing something resurgence recent year board game basically generation board game",0,1,0,0,0,0,0,0,0,0,0.4,0,0,0,"Anticipation"
"63","False","similar planet ape thing going exploring element original sort accepted moved",0,0,0,0,0,0,0,0,0,0,1.4,0,1,0,""
"64","True","going assume first two hundred comment turfed trailer look like shit stupid premise bad actor lame action total misunderstanding source material",3,0,2,1,0,2,0,0,4,1,-2.75,-4,-11,-3,"Anger"
"65","True","original movie movie look actually fun interesting jumanji sequel look terrible",1,2,1,1,1,1,0,0,1,2,0.75,1,3,1,"Anticipation"
"66","True","well look horrible",1,0,1,1,0,0,0,0,1,0,0.05,0,-3,-1,""
"67","True","going go see kevin hart lost viewer",0,0,0,0,0,1,0,0,1,0,-0.75,-1,-3,-1,"Sadness"
"68","True","movie everything wrong world",0,0,0,0,0,0,0,0,1,0,-0.75,-1,-2,-1,""
"69","True","look like lot fun love cast",0,1,0,0,2,0,0,0,0,2,2,3,9,2,"Joy"
"70","True","pointless trivia uk dwayne johnson movie rundown called welcome jungle",0,0,0,1,0,1,0,0,1,0,-0.5,0,0,-1,""
"71","False","childhood would destroyed movie release existing copy original jumanji movie would disappear sudden meanwhile wait actually happen choose movie watch watch childhood safe yesterday",1,3,0,3,2,1,1,1,3,2,-0.25,1,-3,-1,""
"72","False","kevin hart dwayne johnson josh gab generic comedy lineup poor karen",0,0,0,0,0,0,0,0,0,0,0,-1,-1,0,""
"73","True","kevin hart dwayne johnson josh gab generic comedy lineup poor karen",0,0,0,0,0,0,0,0,0,0,0,-1,-1,0,""
"74","True","understand demographic film way anyone demographic would play video game old parent maybe",0,0,0,0,0,0,0,0,0,0,0,0,0,0,""
"75","False","game actually adapts time like sentient shit changed appearance board game council know kid day would probably toss game trash",1,3,2,0,0,1,0,1,2,1,-0.35,-1,-2,-1,"Anticipation"
"76","False","head canon film either confirms denies",0,0,0,0,0,0,0,0,0,0,-0.75,-1,-2,0,""
"77","True","lot complaint look original jumanji kid stumbling onto perceived retrogaming taken wild ride modernize problem updated atari original story full heart though one need able tell good tale well live name said trailer look fun least interested",1,2,1,1,2,2,2,1,3,5,1.05,0,7,2,""
"78","True","originally going completely skip movietired childhood abusedbut actually look like decent reimagining worried tone though first one bit melancholy offset humor magic first one one look like flat action humor said might actually go watch one cast least looking great",0,2,0,1,1,2,0,0,3,5,1.75,3,2,2,""
"79","True","would say keep mind sony film look shit pump goosebump ghostbusters two thousand and sixteen pixel adam sandler film angry bird movie earth remember want world profitable franchise ninety big budget stuff pump shit look remarkably similar goosebumpspixelsghostbusters loved movie love hated surprised jumanji disappoints",2,0,2,0,1,0,1,1,2,2,-0.5,-1,-2,0,""
"80","False","gt bummed continuation board game story supposedly direct sequel original thinkhope continuation expect",0,4,0,0,0,0,1,1,0,1,0.4,0,0,1,"Anticipation"
"81","True","feel like breakfast club mixed spy kid three trailer give shot",1,0,0,1,0,1,1,0,1,1,0.7,1,2,0,""
"82","False","five people including someone mom put 10k graphic designer title paid",0,0,0,0,0,0,0,1,0,3,1.2,0,0,3,"Trust"
"83","False","wish could american movie still keep scottish accent though usually play american make kind sad",0,0,0,0,1,0,0,1,0,1,0.8,-1,1,1,""
"84","False","agreed premise could actually really funny jack black mentality teenage girl nerdy guy rock promise",0,0,0,0,1,1,0,2,1,3,2.05,0,6,2,"Trust"
"85","True","garbage another movie made spreadsheet insult audience intelligence",1,1,2,1,1,1,1,1,2,1,-1,-1,-3,-1,"Disgust"
"86","False","talking rundown well commercially critically audience",0,1,0,0,0,0,0,0,0,0,0.55,1,0,0,"Anticipation"
"87","False","agree seems nothing like book modern retelling video game board game",0,1,0,0,0,0,0,0,0,1,1.6,2,3,1,"Anticipation"
"88","True","youmagicleafformula",0,0,0,0,0,0,0,0,0,0,0,0,0,0,""
"89","False","found studio intern",0,0,0,0,1,0,0,1,0,1,0.6,0,0,1,""
"90","False","look like comedic action reviling fact get see jack black act like teenage girl",0,0,0,0,0,1,0,1,1,1,0.5,1,2,0,""
"91","True","way shit amazing opportunity look worse financial outlook life",1,1,1,1,0,1,0,0,2,1,-0.5,-1,-1,-1,""
"92","False","jungle game psht called jumanji look like ripped lot",0,0,0,1,0,0,0,0,0,0,0.25,0,2,0,"Fear"
"93","False","imagine case nothing trailer say jumanji got super loose jungle connection sure giant spider man eating plant creepy monkey crazed jungle man evil hunter literally nothing iconic jumanji also twenty-two year since original came like really people psyche enough immediate recognition",2,1,2,7,0,3,0,0,4,0,-2,0,1,-4,"Fear"
"94","True","absolute garbage movie would spoil shit infested dumpster wrong hollywood anyone give money dead brain piece shit literally ruining entire movie industry",2,1,3,0,1,0,1,1,4,2,-4.9,-7,-14,-2,"Disgust"
"95","True","robin williams going make cameo film",0,0,0,0,0,0,0,0,0,0,0,0,0,0,""
"96","False","oh cool perhaps name school something",0,0,0,0,0,0,0,1,0,1,0.75,1,1,1,"Trust"
"97","False","heard sacrifice newborn baby copy sold otherwise loses magic becomes viva pinata",0,0,0,0,1,0,0,0,1,1,-0.15,0,0,0,"Joy"
"98","False","find ingenious really cool way bring new old look good",0,1,0,0,1,0,1,1,0,3,3.05,3,4,3,""
"99","False","stupid as way end character like seems like huge let honest opinion",1,0,1,1,1,1,0,1,1,1,0.25,1,3,0,""
"100","True","rock going pissed another one movie get terrible review",1,0,1,1,0,1,0,0,1,1,-1.75,-1,-7,0,""
"101","False","basically tron jumanji love",0,0,0,0,1,0,0,0,0,1,0.75,1,3,1,"Joy"
"102","True","people pretending like original jumanji somehow worthy fierce protection movie average hell certainly enjoyable act like trying make sequel wonderful life deeply offended jumanji worth",4,1,2,2,1,2,1,2,4,3,2.25,4,5,-1,"Anger"
"103","True","actually look like fun movie",0,1,0,0,1,0,0,0,0,1,1.25,2,6,1,""
"104","False","mean title jumanji welcome jungle expecting gnr song marketing",0,1,0,1,0,0,0,1,0,1,0.5,1,2,1,""
"105","False","agree view implication witch doctor cursing video game console others seem made seem like game mind like parasite okay",2,0,3,2,0,1,0,1,3,3,-0.65,-1,3,0,"Disgust"
"106","True","someone seen original look surprisingly okay said reading first film two definitely related would way inclined see movie original title rebootremake thing scream movie studio investor insecurity",1,1,1,2,0,0,2,2,2,2,-1.25,-2,-2,0,""
"107","False","modern console already trash laying school basement look like year",0,0,1,0,0,2,0,1,1,1,0.85,1,2,0,"Sadness"
"108","True","look like could fun movie wish called jumanji though since completely different type movie original",0,1,0,0,1,0,0,0,0,2,2.45,2,7,2,""
"109","False","one case think george lucasing would best fix ie keep movie exactly replace awful cg monkey effect aged poorly new believable one",1,0,1,2,0,2,0,0,3,0,0.6,0,-2,-3,""
"110","True","cast look hilarious also already tell going happen get leave game make personal realization nerd gain selfconfidence getting respective asskickers film jock learns respect people spending time one weakest among group selfcentered mean girl learns nicer people forced exact opposite see oh even money nerd couple hooking jock getting mean girl likely resulting jack black kissing kevin hart uncomfortable gay humor funny",1,5,0,1,4,2,3,3,4,4,3.4,3,8,0,"Anticipation"
"111","False","gt set world shit think general audience smart enough recognize good movie whether based existing property movie suck get shit movie like twenty-one jump street paved way successful",1,3,1,0,3,0,1,3,2,4,1.15,3,2,2,""
"112","False","original tone never lost remakereboot feeling see gritty reboot something originally lighthearted",1,1,1,1,1,2,1,1,2,1,0.05,-2,-1,-1,"Sadness"
"113","False","could stop shitting old ip",0,0,0,0,0,0,0,0,0,0,-1.2,0,-1,0,""
"114","False","want straight jumanji remake go watch zathura see pointless",0,1,0,1,0,1,0,0,1,1,-0.15,-1,0,0,""
"115","True","lolno",0,0,0,0,0,0,0,0,0,0,0,0,0,0,""
"116","False","think speaks acting kid easy miss becomes van pelt way totally understood missed",0,0,0,0,0,0,0,0,0,0,-0.3,-1,-3,0,""
"117","False","well guess different understanding essence",0,0,0,0,0,0,1,1,0,1,1.8,1,0,1,""
"118","True","going see original spite trailer",1,0,0,0,0,0,0,0,1,0,-0.5,-1,0,-1,"Anger"
"119","False","make sense given ending first one board happens wash beach right next someone moving person person",0,1,0,0,1,0,0,0,0,1,0.8,1,0,1,""
"120","False","watched first time month ago thought good",0,3,0,0,1,0,1,1,0,1,0.75,1,3,1,"Anticipation"
"121","False","basing ghostbusters absolutely shit based trailer fact people want reboot",1,0,1,0,0,0,0,1,1,0,-0.75,-1,-3,-1,""
"122","False","want see work forget remake look like lighthearted fun",0,1,0,0,1,0,0,0,1,2,1.8,3,7,1,""
"123","False","disagree made jumanji stand alone like kevin hart dwayne johnson together worried collaring two movie obviously first going way better enjoy fat around steak",1,1,1,0,1,2,0,1,3,1,-0.3,0,-1,-2,"Sadness"
"124","True","look like nothing good",0,1,0,0,1,0,1,1,0,1,1.25,2,5,1,""
"125","True","telling isla fisher",0,0,0,0,0,0,0,0,0,0,0,0,0,0,""
"126","False","rundown great movie",0,0,0,0,0,0,0,0,0,0,0.25,1,3,0,""
"127","False","always model robot total recall partially robocop someone really cool script idea someone studio go put franchise tweak script little bit bigger budget branding behind",0,0,0,0,0,0,0,1,0,3,1.15,1,1,3,"Trust"
"128","True","actually look pretty fun",0,2,0,0,2,0,0,1,0,2,1.5,2,5,2,""
"129","False","never understood name could affect reasonably intelligent aware person perspective anything",0,0,0,0,0,0,0,1,0,1,2,2,2,1,"Trust"
"130","False","geez fuck wanting enjoy something right",0,1,0,0,1,1,0,1,1,1,0.55,1,-2,0,""
"131","False","except hippo joke end trailer completely remove stake film protagonist original jumanji sense fucked game fucked apparently eaten hippo funny joke version",1,0,0,1,0,1,0,0,2,2,0.75,-2,2,0,""
"132","False","except hippo joke end trailer completely remove stake film protagonist original jumanji sense fucked game fucked apparently eaten hippo funny joke version",1,0,0,1,0,1,0,0,2,2,0.75,-2,2,0,""
"133","True","fucking updated board game videogame bail",0,1,0,0,0,0,0,0,0,0,-1,-1,-4,0,"Anticipation"
"134","False","retro right",0,0,0,0,0,0,0,0,0,0,0.8,1,0,0,""
"135","False","completely different type movie feel happened total recall remake remake fun action movie nothing really offensive total recall would done better least term critical reception used remake",1,1,1,0,1,0,0,0,1,4,1.1,0,4,3,""
"136","False","actually original sacred masterpiece",0,0,0,0,1,0,0,0,0,1,1,1,4,1,"Joy"
"137","True","expected look fucking god awful actually look alright still pumped see anything review likely determine consider seeing theater seems okay",1,2,1,2,1,1,0,1,1,1,-1.75,-2,-6,0,""
"138","False","think great idea learn",0,0,0,0,0,0,0,0,0,1,1.3,1,3,1,""
"139","True","think look like fun wild time lion",0,2,0,1,1,0,1,0,1,2,1.1,1,6,1,"Anticipation"
"140","True","look shit",1,0,1,0,0,0,0,0,1,0,-0.75,-1,-4,-1,""
"141","False","loved rundown",0,0,0,0,0,0,0,0,0,0,0.25,1,3,0,""
"142","True","get mildly positive reaction people freak death note sub need bury",1,1,1,1,0,2,1,0,1,0,-0.8,-1,-2,-1,"Sadness"
"143","False","mean baby driver use titular song marketing",0,0,0,0,1,0,0,0,0,1,0.6,0,0,1,"Joy"
"144","False","agree tfa bland derivative garbage act like make two billion dollar",0,0,1,0,0,0,0,0,2,1,-0.25,-1,2,-1,"Disgust"
"145","False","total bullshit tabletop gaming popular tyan ever could updated boardgame much cooler boardgame need digital nonsense",0,0,0,0,0,0,0,0,1,0,-0.75,-1,-3,-1,""
"146","True","original kind scary occult board game wish kept rest mmmm yeah see hit twenty yos thirty generation young j1 came much",1,2,1,1,2,0,1,1,2,3,0.55,-1,2,1,""
"147","False","know presented movie kid play weird game get sucked jungle world would said like jumanji",0,0,1,1,0,0,0,0,1,0,0,-1,0,-1,""
"148","True","think look good actually kind excited see final product",0,2,0,0,3,0,2,3,0,3,2,2,8,3,""
"149","False","contrarian say thing acting like financial success",0,1,0,0,1,0,0,0,0,1,1.25,2,4,1,""
"150","False","think main emphasis adapting modern audience think could great know overdone tried hard",0,1,0,0,0,0,0,0,0,1,0.75,0,2,1,"Anticipation"
"151","True","call pitfall",1,0,1,1,0,1,1,0,1,0,-0.8,0,0,-1,""
"152","False","dunno watching thinking going make movie worthwhile",0,0,0,0,0,0,0,0,0,0,1,1,0,0,""
"153","False","could yet something film linking unlikely think change somehow modernise especially hate stigma remake get day",2,0,2,3,0,2,0,0,2,1,-1.75,-3,-4,-1,"Fear"
"154","False","along line misunderstanding",1,0,0,0,0,1,0,0,1,0,-0.75,-1,-2,-1,""
"155","False","indie meme gamers use vr everyone know implant real game",0,0,0,0,0,0,0,1,0,1,0.25,0,0,1,"Trust"
"156","False","think smart enough conversation lol said specifically gt made like original would bland remake everyone would hate everyone hate force awakens rate imagine much value exchange let run along",2,0,1,2,0,1,0,1,3,2,-0.85,1,3,-1,""
"157","True","whelp may shit named something else look okay kind meh really though need made jumanji ii",1,0,1,0,1,0,0,1,1,1,-0.25,-1,-2,0,""
"158","False","gt gt catch22 made totally unrelated everyone would commenting much ripping jumanji gt also catch twenty-two made like original would bland remake everyone would hate sure anyone actually read catch22",1,0,1,1,0,1,1,0,2,1,-0.75,-1,-1,-1,""
"159","False","full penetration",1,0,0,1,0,0,0,0,1,1,-0.4,0,0,0,""
"160","False","need make movie",0,0,0,0,0,0,0,0,0,0,0,0,0,0,""
"161","True","main problem trailer different original every single character walking talking stereotype actual personality",0,0,0,1,0,1,0,0,2,2,-0.7,-2,-4,0,""
"162","False","fact original stupid comedy mean nothing",0,0,0,0,0,0,0,1,1,0,-0.5,-1,-1,-1,"Trust"
"163","True","kevin hart mistake",0,0,0,0,0,1,0,0,1,0,-0.75,-1,-2,-1,"Sadness"
"164","True","amy pond",0,0,0,0,0,0,0,0,0,0,0,0,0,0,""
"165","False","rock movie everyone expected action flick",0,1,0,0,0,0,0,0,0,2,0.25,0,0,2,"Anticipation"
"166","False","thank",0,0,0,0,0,0,0,0,0,0,0.5,1,2,0,""
"167","False","called jumanji people would complain jumanji ripoff way",1,0,0,0,0,1,0,0,1,0,-1,-2,-2,-1,""
"168","True","checked first ten second trailer wow hope whoever thought choke mayonnaise",1,2,0,0,1,1,1,1,1,1,0.25,0,4,0,"Anticipation"
"169","False","hope saw one movie allow additional twenty-five second riffing nerd taller move mean happen hope",0,2,0,0,1,0,1,1,0,1,1,0,3,1,"Anticipation"
"170","False","zathura space jumanji",0,0,0,0,0,0,0,0,0,0,0,0,0,0,""
