"","Parent","Comment","Anger","Anticipation","Disgust","Fear","Joy","Sadness","Surprise","Trust","Negative","Positive","Synzhet","Bing","Afinn","NRC","Emotion"
"348","False","backgammon backgammon one oldest board game known two player game playing piece moved according roll dice player win removing piece board opponent backgammon member table family one oldest class board game world backgammon involves combination strategy luck rolling dice pm exclude exclude subreddit faq information downvote remove v023",2,3,1,2,1,1,1,0,3,2,-0.25,1,6,-1,"Anticipation"
"349","False","carton actually pretty decent",0,1,0,0,1,0,0,1,0,2,1.25,2,1,2,""
"350","False","remember original film main character sucked board granted due roll dice however given information apparent another world inside game however agree tone new film completely take away tone original dislike",1,1,1,0,0,0,0,0,1,5,1.5,-2,0,4,""
"351","False","work ghostbusters",0,0,0,0,0,0,0,0,0,0,0.25,1,0,0,""
"352","False","remake though supposed basically sequel like someone else find game play",0,1,0,0,0,0,0,0,0,1,0.5,1,2,1,"Anticipation"
"353","False","work lot time stop hollywood though",0,1,0,0,0,0,0,0,0,0,-0.15,1,-1,0,"Anticipation"
"354","False","want remake",0,0,0,0,0,0,0,0,0,1,0,0,1,1,""
"355","False","knew world inside watched animated series decent despite criticism jungle setting think jungle crossing urbancity life much fun interesting bigger budget production today would superior choice",1,2,0,1,2,1,0,2,1,7,2.65,3,6,6,""
"356","False","yeah name jumanji like said call welcome jungle",0,0,0,1,0,0,0,0,0,0,1,2,5,0,"Fear"
"357","False","definitely super nintendo controller",0,0,0,0,0,0,0,0,0,0,0.5,1,3,0,""
"358","False","gt rundown significant box office failure grossing eighty-one million worldwide compared eighty-five million budget absolutely right still received well critic audience twenty-three bad",1,1,2,2,0,2,0,1,3,1,0.2,0,-6,-2,""
"359","False","claimed good movie yet critic viewer widely praised nothing box office",0,1,0,0,2,0,1,1,1,2,0.25,0,4,1,"Joy"
"360","False","gt actually board game five thousand year old yes explicitly said game like went specify roll move style board game obviously game like chess mancala backgammon others around long time talking type game roll dice move spot space saysdraw card type game",0,3,0,0,0,0,0,0,0,0,1.3,1,3,0,"Anticipation"
"361","False","wait wait baby driver good serious question really drawn trailer looking cheesy guy recommend give chance",0,2,0,0,2,0,2,2,1,4,2.1,1,7,3,""
"362","True","torn love actor individually trailer looked bad",1,0,1,1,1,1,0,0,2,1,-0.5,0,-2,-1,""
"363","False","remake jumanji going take artistic liberty",0,1,0,0,1,0,1,1,0,3,1.1,1,0,3,""
"364","False","like original jumanji wasis going anywhere need sequel totally detached people jerk favorite nostalgic classic ignore film entirely",1,1,0,0,1,0,1,1,1,2,0.5,1,-1,1,""
"365","False","think kid today might emotionally stunted like really sad look 90 back child movie pretty heavy",0,2,0,0,2,0,0,1,1,2,0.85,0,1,1,""
"366","True","guess today bad trailer day",1,0,1,1,0,1,1,0,1,0,-0.75,-1,-3,-1,""
"367","False","get wrong agree one hundred and ten never fan way make movie nowadays everything joke witty comment hate tone hollywood created past eight year excellent example tone shown star war ep seven particularly scene kylo ren poe knee poe say talk talk talk something like completely unnecessary joke otherwise great franchise fuck late two thousand",1,1,1,2,3,2,0,2,5,6,1.15,-1,3,1,"Joy"
"368","False","think calculate many people reel manufactured nostalgia v many people alienate messing childhood base",1,0,1,0,1,0,0,1,1,1,0.1,-2,0,0,""
"369","False","see disrespectful sure even possible conclude either way yet gt problem exactly point clear know point suggested would different brought board game bikers stuff",1,1,1,2,0,2,0,0,2,0,-1,-1,-1,-2,""
"370","False","yeah small indie company like capybara game dpad studio blizzard",0,0,0,0,0,0,0,0,1,0,0.5,1,3,-1,""
"371","False","even woman role going men",0,0,0,0,0,0,0,0,0,0,0,0,0,0,""
"372","False","element",0,0,0,0,0,0,0,0,0,0,0,0,0,0,""
"373","False","bingo even know afraid",0,0,0,1,0,0,0,0,1,0,-0.75,-1,-2,-1,"Fear"
"374","False","agree comment zathura basically jumanji space sequel see lot others make connection two sibling play magical board game take adventure obstacle arriving turn also joined adult connection board game also adapted story author",1,4,0,1,1,1,1,1,1,5,1.6,0,1,4,"Anticipation"
"375","True","like watched original movie kid watched animated show run tv enjoyed look decent enough thing lacking riddle solve get",0,0,0,0,1,0,1,1,1,2,2.2,3,5,1,""
"376","True","fan video game let u real going see cast johnson hart black three funny dude basically u watching antic worth price matinee admission",0,0,0,0,0,1,0,1,1,2,1.55,0,9,1,""
"377","False","guess clearly gone dramatically different direction tone cast entire plot different instead game world brought pulled game world adult cast kid trapped body instead child judging trailer think pretty difficult actually compare movie guess name invite anyways fence weather hurt help",1,3,0,2,3,1,2,2,1,3,0.35,-2,0,2,""
"378","False","zathura responsible dax crush",0,0,0,0,0,0,0,1,0,1,0.25,-1,1,1,"Trust"
"379","True","regardless anyone opinion movie doomed come five day star war",0,1,0,2,1,1,0,1,2,1,-0.9,-1,-4,-1,"Fear"
"380","True","make childhood hurt must ruin everything love",1,0,0,2,2,2,0,0,2,2,-0.15,-1,-1,0,""
"381","False","gt others really taste said man person eating dog shit",1,0,1,0,0,0,0,0,1,0,-0.75,-1,-4,-1,""
"382","False","show robin williams jungle though point show sucking sure",0,0,0,1,0,0,0,1,0,0,0,0,0,0,""
"383","True","wait next great bitchfit reddit cry ruined childhood",1,1,1,1,1,2,0,0,3,1,-0.65,-1,0,-2,"Sadness"
"384","False","make jumanji movie people would bitched sucked game much like jumanji matter win think movie look awesome seeing theater often",0,0,0,0,0,0,0,0,0,0,1.35,2,11,0,""
"385","True","going best separate source fun different jumanji think easy",0,1,0,0,1,0,0,0,0,1,2.05,3,8,1,""
"386","False","played different gnr song fuck people",0,0,0,0,0,0,0,0,0,0,-1,-1,-4,0,""
"387","True","man rock kind bunch garbage",0,0,1,0,1,0,0,1,1,2,0,-1,1,1,""
"388","False","way similarity kid house board game theme board game different idea much similar random teenager getting sucked video game player",0,1,0,0,0,0,0,0,1,0,-0.35,-1,0,-1,"Anticipation"
"389","False","sound like spunk man juice",0,0,0,0,0,0,0,0,0,0,0.5,1,2,0,""
"390","False","assassin creed",1,0,0,1,0,1,0,0,1,0,-0.5,-1,0,-1,""
"391","False","watched awhile remember liking kid",0,0,0,0,1,0,0,1,0,1,0.5,1,2,1,""
"392","False","planet ape idea ape took planet jumanji actually like game",0,0,0,0,0,0,0,0,0,0,0.5,1,2,0,""
"393","False","early review phenomenal seen",0,0,0,0,0,0,0,0,0,0,1,1,0,0,""
"394","True","fuck boardgame",0,0,0,0,0,0,0,0,0,0,-1,-1,-4,0,""
"395","False","people keep saying guessing excited average hollywood garbage best attempt finding way discredit valid argument",1,2,1,0,1,0,1,1,3,1,-0.55,0,5,-2,"Anticipation"
"396","True","shit allllllllllll",1,0,1,0,0,0,0,0,1,0,-0.75,-1,-4,-1,""
"397","False","edgar wright made bad movie yet",1,0,1,1,0,1,0,0,1,0,-0.75,-1,-3,-1,""
"398","True","movie look actually really interesting excited see movie",0,1,0,0,1,0,1,1,0,2,1.5,2,5,2,""
"399","True","wanted dislike trailer call another forgettable hollywood remake saw jack black gave tiny bit hope acting always amuses",1,1,1,0,1,1,1,1,2,2,-0.75,-1,-1,0,""
"400","False","sure rock save probably go oh boy go nothing elbow drop hippo stomach hippo puke jack black say ew oh gee literally even rock wink camera kiss bicep rollicking adventure continues",1,2,3,0,3,1,1,1,2,5,1.1,0,5,3,""
"401","False","people saying true",0,0,0,0,0,0,0,0,0,0,0.5,0,2,1,""
"402","False","yeah could said spiritual successorsequel jumani would perfectly fine",0,0,0,0,0,0,0,0,0,0,0.85,3,6,0,""
"403","False","guy think game morphing board game something else good idea old people",0,2,0,0,1,0,1,1,0,1,0.75,1,3,1,"Anticipation"
"404","False","sure talking zathura jumanji exact premise even close two",0,0,0,0,0,0,0,0,0,0,0.25,0,0,0,""
"405","False","frame karen gillian",0,0,0,0,0,0,0,0,0,0,0,0,0,0,""
"406","False","sound right",0,0,0,0,0,0,0,0,0,0,0.8,1,0,0,""
"407","False","original definitely comedic moment actionadventure movie core feel like version definitely steer comedic angle actually fine real emotional attachment original outside hey watched younger enjoyed seems loosely thematically connected original",0,0,0,0,0,0,0,1,0,4,2.25,3,6,4,"Trust"
"408","True","graphic made video game really bad like come spending two hundred million cgi even may realistically low re retro game graphic",1,0,1,1,0,1,0,0,1,0,-0.25,0,-1,-1,""
"409","False","book based written guy also wrote polar express",0,0,0,0,0,0,0,0,0,0,0,0,0,0,""
"410","False","used think crazy see nut",1,0,0,1,0,1,0,0,1,0,-0.75,-1,-2,-1,""
"411","False","gt probably",0,0,0,0,0,0,0,0,0,0,0,0,0,0,""
"412","False","said well commercially",0,0,0,0,0,0,0,0,0,0,0.8,1,0,0,""
"413","True","ohhh god seriously cgi look shit kevin heart dwayne johnson everything movie going bomb",2,1,1,2,1,1,1,1,2,1,-1.5,-2,-4,-1,""
"414","True","put nail coffin childhood",0,0,0,1,1,1,0,0,1,1,0,0,0,0,""
"415","False","great hold day",0,0,0,0,0,0,0,0,0,0,0.5,1,3,0,""
"416","False","seems everyone accepts crap fed problem",0,0,1,1,0,1,0,0,2,0,-0.7,-2,-4,-2,""
"417","False","exactly film seems missing seems like comedic romp wood full silly joke based breaking character stereotypical role society pretty popular girl becomes jack black nerdy guy becomes rock plain girl becomes hot ultimately probably learn lesson x type person meet eye fine movie concept jumanji original jumanji like fable game called people drum people needed learn lesson sort like going unappreciative rich kid let u le fortunate people take fall mistake let u see like life stuck horrifying wilderness twenty year maybe straighten robin williams character ended faced mistake losing everything ultimately deciding step better person game ultimate test character survived stronger wiser person hopefully learned lesson failed would die",2,5,1,4,3,9,0,2,9,8,1.95,-1,7,-1,"Sadness"
"418","False","grew movie think game changing throughout year adapt modern age good idea",0,1,0,0,1,0,1,1,0,2,2.15,2,3,2,""
"419","False","dissapointing expecting something never going follow movie news somewhat closely would known comedy first talk",0,1,0,0,0,0,0,0,0,1,0.9,0,1,1,"Anticipation"
"420","True","take away familiar face bad made tv movie",1,0,1,1,0,1,0,1,1,1,0.05,-1,-3,0,""
"421","True","jungle look scary enough",0,0,0,1,0,0,0,0,0,0,-0.75,0,-2,0,"Fear"
"422","True","cringed grunted mild amusement dropped game character continued cringing",0,0,0,0,1,0,0,0,0,1,-0.6,-1,2,1,"Joy"
"423","True","studio announces new jumanji reddit wish studio would make new idea studio show trailer revealing premise twist jumanji game idea reddit pissed jumanji may cycle unrealistic expectation continue",0,2,0,0,0,0,0,2,0,2,0.5,-2,-3,2,""
"424","False","might get downvoted hell think jumanji video game film great idea hear idea pissed originally thought straight reboot sequel meaning take place continuity previous film board game jumanji becoming video game twenty-two year since last film mean cursed board game game least level selfaware may bit behind hence boardgame boardgames taken massive dip popularity 8bit video game 4k want played power make significant change order make sure happens literally hunting prey know much explore movie actually good potential pretty badass story telling add existing lore",3,7,1,5,2,2,1,3,4,4,1.85,3,2,0,"Anticipation"
"425","False","zathura different book",0,0,0,0,0,0,0,0,0,0,0,0,0,0,""
"426","False","mean member berry",0,0,0,0,0,0,0,0,0,0,0,0,0,0,""
"427","False","see seen movie since kid might forget mistake fun watched recently adult came away thing mentioned aged well surprisingly",0,2,0,0,1,1,1,0,2,1,0.3,1,1,-1,"Anticipation"
"428","False","totally agree",0,0,0,0,0,0,0,0,0,1,0.5,0,1,1,""
"429","False","sure understand mean",0,0,0,0,0,0,0,0,0,0,0,0,0,0,""
"430","False","probably loved jurassic world huh",0,0,0,0,0,0,0,0,0,0,0.5,1,3,0,""
"431","True","okay black kid kind person h football star great choice never make black guy generic sport guy",0,2,0,0,3,1,0,2,1,4,1.75,1,5,3,"Joy"
"432","True","ludicrous sexualisation classic shame",0,0,1,1,0,1,0,0,2,1,-1,-1,-5,-1,""
"433","True","look surprisingly good legitimate reinvention",0,2,0,0,1,0,2,1,0,1,1.55,1,3,1,""
"434","False","agree much actual idea jumanji horrifying murder child horror another world human sadness player life also made perfect really amazing dark two thousand and seventeen gritty style sequel could done pumped preteen comedy trash",2,3,4,3,2,6,2,2,6,4,-1.2,-4,7,-2,"Sadness"
"435","True","way many modern vehicle expecting 1920s expedition theme based hart black looked jeep forty dirt bike huey really make jungle seem special level civilization machine",0,2,1,1,1,1,0,3,2,4,2,0,-2,2,"Trust"
"436","False","jumanji exactly marvelesque hot property see could renamed original ip",1,0,0,0,0,0,0,0,0,0,-0.25,1,0,0,"Anger"
"437","False","zathura book actually sorta sequel jumanji book",0,1,0,0,0,0,0,0,0,0,0,0,0,0,"Anticipation"
"438","False","seems like pile kid change body get special skill near idea original",0,0,0,1,1,0,0,0,0,1,2.1,2,2,1,""
"439","True","expected trailer shitshow movie look legitimately fun watch definitely miss lore aged feeling old jumanji movie though",1,4,1,2,2,1,1,1,1,2,1,0,3,1,"Anticipation"
"440","True","feel like entirely unrelated movie name jumanji attached fact also really care watch jack black ogle dwayne johnson as two hour see baywatch",0,1,0,1,0,1,0,1,1,0,1.25,1,4,-1,""
"441","False","gt probably",0,0,0,0,0,0,0,0,0,0,0,0,0,0,""
"442","False","saw last night pretty good movie edgar wright style easter egg visual queue really great love car chase movie slow part admit saw amc prime theatre really really upped enjoyment soundtrack",0,2,0,0,3,0,1,2,1,4,4.2,4,9,3,"Joy"
"443","False","jumanji also tron",0,0,0,0,0,0,0,0,0,0,0,0,0,0,""
"444","False","maybe fewer connection concept appears least thought saw trailer",0,1,0,0,0,0,0,0,0,0,0.4,0,0,0,"Anticipation"
"445","True","mainstream tron guess",0,0,0,0,0,0,1,0,0,0,0,0,0,0,"Surprise"
"446","False","different premise got overexplain shit",1,0,1,0,0,0,0,0,1,0,-0.5,-1,-4,-1,""
"447","True","torn one hand would hated remake exact story line hand mind thought new creative spin",0,1,0,0,0,0,0,0,1,2,0.55,0,-3,1,"Anticipation"
"448","False","seriously mummy like hollywood trying piss childhood movie",0,0,0,0,1,0,0,0,0,1,0.5,1,-2,1,"Joy"
"449","True","look fucking cool wait watch loved original one love one well",0,2,0,1,1,0,0,0,1,2,1.55,3,3,1,"Anticipation"
"450","False","okay want crossover",0,0,0,0,0,0,0,0,0,0,0,0,1,0,""
"451","False","look way okay tho",0,0,0,0,0,0,0,0,0,0,0,0,0,0,""
"452","False","hero world need",0,1,0,0,1,0,1,1,0,1,0.75,1,2,1,""
"453","True","going go limb say movie probably suck seen trailer looking poster think know direction taking one getting",0,0,0,0,0,0,0,0,1,0,-0.75,-1,-3,-1,""
"454","False","slapped jumanji name would get attention",0,0,0,0,0,0,0,0,0,1,0.25,0,0,1,""
"455","False","sony thinking usually bedfellow",0,0,0,0,0,0,0,0,0,0,0,0,0,0,""
"456","False","change body sucked game original board game robin williams game piece video preset character represent get sucked big stretch",0,1,0,1,0,0,0,0,0,0,0,-1,1,0,""
"457","False","phrasing",0,0,0,0,0,0,0,0,0,0,0,0,0,0,""
"458","False","reddit name expect",0,1,0,0,0,0,1,1,0,1,0.4,0,0,1,""
"459","False","exactly anything else premise seems fundamentally flawed miss point",0,0,0,0,0,0,0,0,0,0,-0.75,-2,-5,0,""
"460","False","one watch cartoon though",0,1,0,1,0,0,0,0,0,0,0,0,0,0,""
"461","False","expecting mushroom growing pile shit godawful",1,1,1,0,0,0,0,0,1,0,-0.2,-1,-3,-1,""
"462","False","putting jumanji name title marketing bullshit",0,0,0,0,0,0,0,1,0,1,-0.5,-1,-4,1,"Trust"
"463","False","yeah lore made rich cheapened",0,0,0,0,0,0,0,0,0,0,0.5,1,3,0,""
"464","True","extremely mixed feeling mostly negative one",1,1,1,1,1,2,1,1,2,1,-0.5,-1,-1,-1,"Sadness"
"465","False","explosion end",0,0,0,1,0,0,1,0,1,0,-0.6,0,0,-1,""
"466","True","expected actually like turn give story",0,1,0,0,0,0,0,0,0,0,0.5,1,2,0,"Anticipation"
"467","False","well like dwayne johnson shit movie still shit movie even best thing",1,0,1,0,0,0,0,0,1,0,1.05,2,1,-1,""
"468","False","iirc advertised world jumanji actual movie tie together",0,0,0,0,0,0,0,0,0,1,0.4,0,0,1,""
"469","False","talk like never eaten delicious shitcovered mushroom",0,0,0,0,1,0,0,0,0,2,1.4,2,5,2,"Joy"
"470","False","exactly jumanji sure fun mindless action film remember lot people called year ago going video game dammit right lol",0,1,0,0,1,0,0,0,0,2,1.3,1,5,2,""
"471","False","take nostalgia glass zathura better jumanji",0,0,0,0,0,0,0,0,0,0,0.8,1,2,0,""
"472","False","one said",0,0,0,0,0,0,0,0,0,0,0,0,0,0,""
"473","False","hbo last night greatly enjoy guilt make wonder even put name jumanji title hook realize often result huge disappointment see hook thus compare original",0,2,2,0,1,2,0,2,2,2,-1.25,0,-2,0,""
"474","True","seems like journey center earth series rock already little tron thrown made sequel reimagining modern take story think major problem changed board game computer game console finite lifespan become outdated obsolete due technological advance board game literally dug telling old could played added air mystique around came instruction right box could playable hundred generation",0,4,0,3,2,2,1,3,1,7,2.55,1,-2,6,"Anticipation"
"475","False","know aware original book sequel jumanji written author",0,1,0,0,0,0,0,1,0,1,0,0,0,1,""
"476","True","anyone else catch glimpse nick jonas piloting helicopter end",0,0,0,0,0,0,1,0,0,0,0,0,0,0,"Surprise"
"477","False","remake spiritual sequel",0,1,0,0,0,0,0,0,0,1,0.1,1,0,1,"Anticipation"
"478","False","ask look extremely generic cheap joke look special",0,0,0,0,1,0,0,0,2,1,0.9,-2,2,-1,"Joy"
"479","False","seriously need tie name jumanji getting sucked video game good premise connect classic movie people compare",0,1,0,0,1,0,1,1,0,2,1.25,1,3,2,""
"480","False","member",0,0,0,0,0,0,0,0,0,0,0,0,0,0,""
"481","True","aaaaaaaaaand another one ruined thanks hollywood",1,0,1,1,0,1,0,0,1,0,-0.15,-1,0,-1,""
"482","False","different movie seen oh well raskreddit thread glory hole surprised anything anymore",0,1,0,0,1,0,1,1,0,1,1.55,2,2,1,""
"483","False","yep exactly great layered film care got poor review solid as film lol scared hell loved kind moved past shallow popcorn film fine people like",1,0,1,1,1,1,0,1,1,2,1.7,1,11,1,""
"484","False","reboot though",0,0,0,0,0,0,0,0,0,0,0,0,0,0,""
"485","True","got honest put minute video game yes reimagining hate word got use something interesting ancient mysterious boardgame felt like something mummy worked going rip though nothing really tear yet concept",2,1,2,3,1,2,1,2,2,3,2.3,1,4,1,"Fear"
"486","False","retarded hollywood producer omg people today b abke two relate board game11 beta make video game soul creativity like one thousand movie done huuuuuurrrr",0,1,0,0,0,0,0,0,0,1,1.4,0,0,1,"Anticipation"
"487","False","happy clearly remaking original entirely different film",0,1,0,0,1,0,0,1,0,1,1.25,2,4,1,""
"488","False","edgar right make really good movie trailer probably made like goof",0,1,0,0,1,0,1,1,0,1,1.8,2,5,1,""
"489","True","really love original thankful entirely different film avatar type premise look really good really funny hope see jack black rock make",0,2,0,0,4,1,2,2,1,6,3.8,2,14,5,"Joy"
"490","False","whoooooooosh",0,0,0,0,0,0,0,0,0,0,0,0,0,0,""
"491","False","fred listen keep board game make player piece fidget spinner get",0,1,0,0,0,0,0,0,1,0,-0.9,-1,0,-1,"Anticipation"
"492","False","clearly original",0,0,0,0,0,0,0,0,0,0,0.5,1,1,0,""
"493","True","zero interest actually look kind awesome looking forward",0,0,0,0,1,0,0,1,0,3,2.2,1,7,3,""
"494","False","plus original jumanji comedy tragedy liked way new movie going yucking going stupid plus stand kevin hart",0,0,0,1,0,1,0,0,2,0,0.05,-1,-1,-2,""
"495","False","sequel right actually want remake original",0,1,0,0,0,0,0,0,0,1,0.8,1,1,1,"Anticipation"
"496","True","actually look light hearted fun excited watch",0,3,0,1,2,0,1,1,0,2,2.1,2,7,2,"Anticipation"
"497","True","first trailer spoilery thought",0,1,0,0,0,0,0,0,0,0,0,0,0,0,"Anticipation"
"498","True","might like",0,0,0,0,0,0,0,0,0,0,0.5,1,2,0,""
"499","True","plot like half anime past five year even put jumanji title second film rock called welcome jungle",0,0,0,1,0,0,0,1,0,2,1,1,4,2,""
"500","True","look okay baywatch movie karen gillan though great",0,0,0,0,0,0,0,0,0,0,0.5,1,3,0,""
"501","True","old looking high schoolers",0,0,0,0,0,0,0,0,0,0,0,0,0,0,""
"502","True","would look good jumaji moniker making jumaji film set world shit otherwise objectively look like decent action film",1,1,1,0,1,0,1,1,1,3,1.25,2,1,2,""
"503","True","sold wait going fun thrill ride entertainment movie",0,4,0,1,3,0,2,1,1,3,1.8,2,4,2,"Anticipation"
"504","True","may sound like geek naysayer loved lore original century old board game link another world torment player huge fan premise based trailer lambast solely basis either",1,1,0,1,0,1,0,0,2,0,0.4,0,9,-2,""
"505","True","realize probably needed updated current audience fan sorta bummed",0,1,0,0,0,0,0,0,0,0,0,0,3,0,"Anticipation"
"506","True","look terrible like baywatch central intelligence",1,0,1,2,1,1,0,1,1,1,0.25,1,-1,0,"Fear"
"507","True","meh",0,0,0,0,0,0,0,0,0,0,0,0,0,0,""
"508","False","yeah sure would want spoiled child movie magical board game think might put everything right end last minute rock fight someone background heroically",1,3,0,1,2,0,1,0,1,3,2.05,2,-1,2,"Anticipation"
"509","True","look alright really hope get game bleeding real world though fun original",0,2,1,1,2,1,1,2,1,3,1,0,6,2,""
"510","True","movie fun game",0,1,0,0,1,0,0,0,0,1,0.75,1,4,1,""
"511","False","first reaction expected dare make jumanji video game even make sense realized unfair comparing original looking trailer movie look pretty good probably backstory kid original made video game know could",1,4,1,0,2,1,1,3,1,3,1,2,2,2,"Anticipation"
"512","True","another horrible shit show avoid robin williams would turn grave",2,0,2,3,0,1,0,1,4,0,-2.5,-2,-10,-4,"Fear"
"513","True","actually like way could go jut might actually watch theatre",0,1,0,1,0,0,0,0,0,0,0.5,1,2,0,""
"514","False","look interesting movie like concept occupied player could make interesting act movie except kevin hart look like still playing kevin hart",0,0,0,0,0,0,0,0,1,1,1.55,2,4,0,""
"515","True","look like lot fun jumanji reboot would right",0,1,0,0,1,0,0,0,0,1,2.05,3,6,1,""
"516","True","sold one hesitant action definitely excited love karen gillan plus movie look fun lighthearted taking seriously sometimes movie try go dark reason one wait",0,3,0,0,3,1,1,1,1,5,2.45,1,9,4,""
"517","True","yet someone going rape childhood give retarded movie new title instead unneccesary reboot name",1,0,1,1,1,1,0,1,1,2,-0.1,-2,-6,1,""
"518","True","look worse possibly imagined",0,0,0,1,0,1,0,0,1,0,-0.75,-1,-3,-1,""
"519","True","really enjoyed trailer look good family movie change video game get using old console make relevant game",0,1,0,1,1,1,1,2,0,3,2.8,2,5,3,"Trust"
"520","True","real life",0,0,0,0,0,0,0,1,0,1,0.25,0,0,1,"Trust"
"521","True","fuck even shit look like generic transported gameanother world rpg movie might fine thing slapping jumanji name nothing remotely jumanji except name tension undertone suspense horror original movie also video game original board game mystery",3,3,2,2,0,1,3,0,2,0,-2.9,-2,-5,-2,""
"522","True","jack black girl curvy guy body know going pull performance going go see karen gillan",0,0,0,0,0,1,0,0,1,1,0.15,0,0,0,"Sadness"
"523","False","summed exact feeling admittedly see first film son showed interest several month back aired one hbo channel really like idea game resurfacing hand unsuspecting player would read really brief mention sequel hinted would look jungle world inside game though guess premise video game avatar appealing target demographic bummed continuation board game story",1,4,1,2,1,1,3,1,2,3,1.4,1,6,1,"Anticipation"
"524","False","yeah sticking movie hoping give chance fucked shackling jumanji mean pretty neat premise term saying certain never done feel interesting unique risk riding jumanji name guess favour accused trying hard like original",1,2,0,2,1,0,3,1,2,3,3,3,4,1,"Surprise"
"525","True","game named jumanji would even know sequel good thing bad thing hope bring similarity world also wonder nick jonas game character trapped point hour half video game trailer show first thirty minute content many question",1,3,1,1,3,1,2,4,1,4,0.6,0,0,3,"Trust"
"526","False","ha guy jeep sounded similar j peterman seinfeld",0,0,0,0,0,0,0,0,0,0,0,0,2,0,""
"527","False","badass karen gillian character make watch movie",0,1,0,1,0,0,0,0,0,0,0.4,0,-3,0,""
"528","True","look like entertaining movie also got karen gillan plus",0,1,0,0,1,0,0,0,0,1,1.25,2,4,1,""
"529","True","think playing many concept mashing together probably would liked see sucked crazy game world interact top character theme way",1,1,0,1,0,1,0,1,1,1,-0.1,0,2,0,""
"530","False","got say found lackluster nebula first gotg phenomenal vol two also got love good old amelia pond",0,1,0,0,3,0,1,2,1,3,2.6,2,6,2,"Joy"
"531","False","saw youtube comment jumanji game want played make sense would transform video game likely played video game point",0,0,0,0,0,0,0,0,0,1,0,0,1,1,""
