"","Parent","Comment","Anger","Anticipation","Disgust","Fear","Joy","Sadness","Surprise","Trust","Negative","Positive","Synzhet","Bing","Afinn","NRC","Emotion"
"1130","True","absolutely loved tear eye certain point fault movie would definitely recommend watching incredible",0,0,0,0,0,1,0,1,1,1,1.8,2,6,0,""
"1131","False","really know felt like first half going checkpoint checkpoint without delving deep anything",0,0,0,0,0,0,0,0,0,0,0.5,1,2,0,""
"1132","True","saw today ramus malek awesome freddie mercury feel like one oscar front runner good movie though music obviously top notch familiar queen history say sure accurate going theater someone worked box office mentioned movie queen freddiey mercury subtle distinction correct anyone thinking one hundred focused freddie think bisexual older woman theater shit another older group woman sitting next saw getting emotional lot part",1,2,1,0,2,2,1,4,1,6,4.95,7,9,5,"Trust"
"1133","False","harsh entirely untrue glossed important point nothing interesting anything besides ending",0,0,0,0,0,0,0,1,1,2,0,0,0,1,"Trust"
"1134","False","felt like montage band ending",0,0,0,0,0,0,0,0,0,0,0.5,1,2,0,""
"1135","False","would preferred left thing rather going great detail none",0,0,0,0,0,0,0,0,0,0,1.3,1,3,0,""
"1136","False","feel though really tell deep enough story freddie",0,0,0,0,0,0,0,0,0,0,-0.25,1,0,0,""
"1137","False","wish could disagree care getting band back together scene live aid thing amazing overall story telling first half bunch checkpoint zero depth",1,0,0,0,0,0,0,1,1,2,2.55,0,5,1,""
"1138","False","yeah think length may played much factor demand surviving band member movie one hundred and thirty minute already delving deeply freddie mind would added another one thousand, five hundred and twenty minute worth could also used introspection band member even casual fan like know brian may made awesome guitar red special dad phd astrophysics sound pretty interesting right like said proper band biopic would better served 6part netflix series",1,1,0,0,2,0,0,2,1,5,6.25,8,18,4,""
"1139","False","think made paint gay disease made show plenty evidence floating around even someone like freddie mercury suddenly go lol gay totally fine mentally someone best friend gay road inner peace acceptance one filled personal misery sometimes heartbreak even someone outside appeared king world like mercruy one simply decides gay movie great job showing going",2,1,2,2,2,2,1,4,2,5,2.45,4,14,3,"Trust"
"1140","True","fuck hater loved saw amc dolby theater like concert good teared time job well done",0,2,0,0,1,0,1,1,0,2,1.05,2,1,2,"Anticipation"
"1141","False","lot",0,0,0,0,0,0,0,0,0,0,0,0,0,0,""
"1142","False","literally got back seeing amc dolby showing lmao",0,0,0,0,0,0,0,0,0,0,0,0,4,0,""
"1143","False","sacha baron cohen biopic",0,0,0,0,0,0,0,0,0,0,0,0,0,0,""
"1144","False","made queen well queen harmony group uncanny ability take genre music make sound good style even supposed sellout shit like work sound better ninety percent stuff time need weigh movie gratiouitis gay coke sex party tell decent version queen story",1,4,1,1,4,1,2,4,2,6,4.8,6,7,4,""
"1145","False","chance get nominated",0,0,0,0,0,0,1,0,0,0,0.25,0,2,0,"Surprise"
"1146","False","strange",0,0,0,0,0,0,0,0,0,0,-0.5,-1,-1,0,""
"1147","False","wish wife",0,0,0,0,0,0,0,0,0,0,0.8,0,1,0,""
"1148","False","yeah actually record producer made record way movie using real tape expected much recording session go deep much really need know history microphone stand lol",0,1,0,0,0,0,0,1,0,2,0.65,0,4,2,""
"1149","False","lol p",0,0,0,0,0,0,0,0,0,0,0,0,3,0,""
"1150","False","guy pitched bohemian rhapsody",0,0,0,0,0,0,0,0,0,0,0.6,0,0,0,""
"1151","False","whitewashed kind sasha baron kohen get play freddie band want dirty laundry told movie",0,0,1,0,1,0,0,1,1,1,-0.25,-1,1,0,""
"1152","False","one lol",0,0,0,0,0,0,0,0,0,0,0,0,3,0,""
"1153","False","saw local alamo drafthouse dolby atmos thought",0,1,0,0,0,0,0,0,0,0,0,0,0,0,"Anticipation"
"1154","False","oh god think myers pulled tom cruise",0,1,0,1,1,0,0,1,0,1,0,0,1,1,""
"1155","False","took minute two also pretty damn good comparison almost character",1,2,1,0,2,0,1,2,1,2,0.75,1,2,1,""
"1156","False","personally begging end think could handled six year aid sickness dying looking like husk glad ended live aid still teary eyed",1,1,2,2,1,2,0,0,3,2,-0.3,-1,0,-1,""
"1157","False","seeing freddie get sick die movie would gutted glad show",0,1,1,1,1,2,0,1,2,1,-0.75,-1,-2,-1,"Sadness"
"1158","False","ramus malek could get best actor nom performance freddie mercury",0,0,0,0,0,0,0,0,0,0,0.9,1,3,0,""
"1159","False","thought saw real footage big screen either side stage live aid performance",0,1,0,0,0,0,0,1,0,2,1.9,0,1,2,""
"1160","False","chance way wrote made seem like film way happening",0,0,0,0,0,0,1,0,0,0,0.75,1,4,0,"Surprise"
"1161","False","ah understand unintentionally vague purpose brevity probably edit clearer",0,0,0,0,0,0,1,0,2,0,-0.35,0,-2,-2,"Surprise"
"1162","False","live wa",0,0,0,0,0,0,0,0,0,0,0,0,0,0,""
"1163","True","please watch imax dolby sound phenomenal oh screw hater wanted dark grittier version celebration queen freddy alludes plenty malek deserves oscar nomination least",0,2,0,1,1,1,1,1,0,2,2.25,0,1,2,"Anticipation"
"1164","True","people actually enjoyed uninspired garbage wow disrespect queen like hollywood manipulative fake malek great however besides two half hour bore skip",1,0,1,0,0,1,0,0,6,0,-1.25,-1,1,-6,""
"1165","False","wondering got screen time oh yeah pick whole mic stand sometimes would minded cutesy touch spent little time bigger question still glad saw movie admit guilty pleasure hard completely resist great lead performance singalong queen greatest hit",2,2,0,0,1,1,0,0,4,5,1.8,3,8,1,""
"1166","False","thank almost tear laughing hard cut one else seems mention piece movie history",0,0,0,0,1,0,0,0,0,1,0.6,0,1,1,"Joy"
"1167","False","though joke myers actually movie say fuck kind movie",0,0,0,0,1,0,0,1,1,1,0.1,-2,0,0,""
"1168","True","live aid segment looked like donation started roll surpass one billion mark queen performing wonder case interesting even though volunteered play last minute queen performed prior david bowie based list live aid performer interwebnet",0,0,0,1,0,1,0,0,1,4,3.85,4,6,3,""
"1169","True","thought somebody actually seen movie yet seems people praising thread praising part iconic song playing question point even going see movie best part something one hear radio given moment day",0,1,0,0,0,0,0,0,0,2,1,2,6,2,"Anticipation"
"1170","False","honestly felt music added bonus really loved movie",0,1,0,0,2,1,1,0,0,2,1.6,2,3,2,"Joy"
"1171","False","saw dolby may try imax next",0,0,0,0,0,0,0,0,0,0,0,0,0,0,""
"1172","False","ok actual criticism",1,0,0,0,0,1,0,0,1,1,-0.6,-1,-2,0,""
"1173","False","dun dun dun dun dun dun dun",0,0,0,0,0,0,0,0,1,0,0,0,0,-1,""
"1174","True","anyone going mention massively corny scene freddie get diagnosed aid trade aaaayo sick fellow",0,0,1,0,0,1,0,2,1,2,0.65,-1,-2,1,"Trust"
"1175","False","good ep",0,1,0,0,1,0,1,1,0,1,0.75,1,3,1,""
"1176","False","need learn anything new want learn watch fucking documentary fuck sake",0,1,0,1,0,0,0,0,0,1,-0.4,-2,-7,1,""
"1177","False","reading someone write john great vocalist made laugh maybe confused join film clip give illusion contributing harmony swear seen john say documentaryinterview somewhere wished could carry tune find though",0,0,1,0,2,0,2,2,2,5,1,0,3,3,""
"1178","False","exactly hoping really hope make movie band performed live aid finish performance",0,1,0,0,1,0,1,1,0,2,2.5,0,4,2,""
"1179","False","see anything wrong still thought great movie",0,1,0,0,0,0,0,0,1,0,-0.25,0,1,-1,"Anticipation"
"1180","False","back",0,0,0,0,0,0,0,0,0,0,0,0,0,0,""
"1181","True","story good damn every time song played theater practically started shaking wanted something like tap foot snap finger bob head know movie good want join happening screen",1,2,1,1,1,0,1,1,2,2,0.75,1,5,0,"Anticipation"
"1182","False","disagree entirely",1,0,0,0,0,0,0,0,1,0,-0.5,-1,-2,-1,"Anger"
"1183","False","sacha baron cohen never close considered cast true whatsoever sbc cast spent almost decade working going made left project band decided going let music used film band whole freddy",0,0,0,0,1,1,0,0,1,2,1.1,0,2,2,""
"1184","False","read maybe see reading second time",0,1,0,0,0,0,0,0,0,1,0.1,0,0,1,"Anticipation"
"1185","True","better commitment one thousand, nine hundred and ninety-one",0,0,0,0,0,0,0,0,0,0,1.3,2,4,0,""
"1186","False","enjoyed story told know even though teen height fame movie good acting really good left wanting know",0,1,0,0,1,1,1,1,1,2,2.5,3,6,1,""
"1187","True","many iconic song crazy",1,0,0,1,0,1,0,0,1,0,-0.75,-1,-2,-1,""
"1188","False","see vague statement",0,0,0,0,0,0,0,1,1,1,-0.75,-1,-2,0,"Trust"
"1189","False","caught wayne world reference straight away clue mike myers omg",0,1,0,0,0,0,0,0,0,0,0.6,0,1,0,"Anticipation"
"1190","False","feel like ton 2010s movie two hour compilation",0,0,0,0,0,0,0,0,0,0,0.5,1,2,0,""
"1191","False","made exact joke almost word word girlfriend leaving theater realize unoriginal",0,0,0,0,0,0,0,1,1,1,0.6,-1,0,0,"Trust"
"1192","False","mine quiet goddamnit",0,0,0,0,0,1,0,0,0,1,0.25,1,0,1,"Sadness"
"1193","True","curious anyone know said freddy cremated zoroastrianism custom zoroastrian neither bury cremate dead rather consumed carrion bird typically freddy cremated would anything religious faith family knowledge anyone know anything also enjoyed musical choice bit disconcerting several song shown historical timeline fat bottomed girl rock two main example",1,2,1,0,2,3,1,2,1,6,0.9,-1,1,5,"Sadness"
"1194","True","hey song freddie sung tributed mary find thanks",0,0,0,0,0,0,0,0,0,0,0.6,0,2,0,""
"1195","False","thought ramus well sure slim picking find person replicate freddy must honor play iconic performer",0,1,0,0,0,0,0,1,0,3,2.8,2,2,3,""
"1196","True","kid visiting family germany year freddy passed know queen commercial played constantly think budweiser dilly dilly constantly advertising queen anthology album ended show must go felt song would somehow included near movie given ended little disappointed played credit marked like madman wife thought drunk mean kind song burned memory two week german television rip freddy",2,1,1,1,1,1,0,4,2,4,-1.1,-4,0,2,"Trust"
"1197","False","yes story surprise plot believe movie showcase iconic freddy one greatest musician ever live",0,0,0,1,1,0,1,0,0,1,1.9,0,4,1,""
"1198","True","fairly easy tell film skimming whole story instead providing starry eyed montage amazing band rise rise felt much like writer forgot band really know going icon rise fame look everything next huge thing like bohemian rhapsody song exact tepid initial reaction record exec said would still lot fun regardless performance scene got better better better live aid gave absolute chill start finish",0,4,0,0,3,0,0,2,0,8,7.3,5,15,8,"Anticipation"
"1199","False","yeah also scar forehead looked unconvincing lol",1,0,1,1,0,1,0,0,1,0,-1,-2,2,-1,""
"1200","False","ideal audience movie someone like queen much fair pretty much everyone like queen least little bit reallife inconsistency go right head put aside notion film faithful biopic went wanting see recreation iconic queen moment respect amazing",0,4,0,0,3,1,0,3,2,6,5.85,7,14,4,"Anticipation"
"1201","False","honestly felt cheated dive freddie death ready cry",1,2,1,1,0,2,1,0,2,0,-1.2,-2,-6,-2,""
"1202","False","4dx probably unnecessary overkill prioritize theater great sound system get movie",0,0,0,0,0,0,0,1,0,0,-0.35,-1,3,0,"Trust"
"1203","False","easter egg",0,0,0,0,0,0,0,0,0,0,0,0,0,0,""
"1204","False","love life night opera acoustic live version found live killer",1,1,0,1,3,1,1,2,0,3,0.35,0,3,3,"Joy"
"1205","True","honestly felt cheated dive freddie death ready cry",1,2,1,1,0,2,1,0,2,0,-1.2,-2,-6,-2,""
"1206","False","mike myers character saying something along line love car song kid bang head car homage wayne world opening scene bohemian rhapsody",1,0,1,1,1,1,1,0,1,2,1.85,2,3,1,""
"1207","True","something film felt familiar mean entire story kind seems lifted every music inductry biopic story felt like seen one hundred time already ramus malek awesome freddie film surrounding honestly felt paint number feel like lifetime style biopic love live aid concert end though",0,1,0,0,3,1,0,2,0,5,4.75,3,11,5,"Joy"
"1208","False","hahah scene came introduced friend leaned said oh queen fucked got chuckling bit",0,0,0,0,1,0,0,1,0,1,0.6,0,-3,1,""
"1209","False","bother twenty year inevitable beyonce lady gaga biopics come inaccuracy skewed timeline hell already happened horrific britney spear lifetime movie last year like used bunch tabloid script",4,2,2,3,0,2,0,0,5,1,-4.65,-4,-7,-4,"Anger"
"1210","False","took everything sing clap",0,2,0,0,2,1,0,2,0,2,0.85,0,0,2,""
"1211","False","close second time loser record exec screen",0,1,0,0,0,0,0,0,0,0,-0.5,-1,-3,0,"Anticipation"
"1212","False","like going concert listen phone atmosphere dude feeling behind music get amplified entire focus sens",1,1,1,1,2,2,1,1,1,3,1.95,1,3,2,""
"1213","False","wait film apologise mary sexuality",0,1,0,0,0,0,0,0,1,0,-0.25,0,-1,-1,"Anticipation"
"1214","False","homophobic portray homosexualitybisexuality careful respectful way",0,0,0,0,0,0,0,1,0,2,1,1,2,2,"Trust"
"1215","False","really one mention wife kid others like well ok freddie going freddie put going issue continual lateness anything else",0,0,0,0,0,0,0,0,1,0,1.05,1,2,-1,""
"1216","False","recliner seat theater everyone practically lying pretty laxed",1,1,1,0,1,0,0,1,1,1,0.25,0,1,0,""
"1217","False","paul dead arya took face destroy queen",0,0,0,0,0,0,0,0,0,0,-1.5,-2,-6,0,""
"1218","False","still cried probably go movie ended high note cried reality wish life could ended triumphant moment reality pain suffering went",0,1,1,2,1,2,0,1,2,1,-1.2,-1,-1,-1,""
"1219","False","bohemian rhapsody night opera critically acclaimed widely accepted fan album went triple platinum u bohemian rhapsody number one british chart pretty long time think movie fairly accurately portrayed release song",1,4,0,1,2,1,1,4,0,3,3.85,4,7,3,""
"1220","False","movie lot fudging timeline live aid performance eighty-five movie got right freddie get diagnosed aid like eighty-seven eighty-eight year end movie",0,0,0,0,0,0,0,0,0,1,2.7,2,2,1,""
"1221","False","even show movie best friend pressure tie mother ton unused song shame stop show must go saved credit make sense",0,1,1,1,2,2,0,4,3,4,0.85,0,2,1,"Trust"
"1222","False","completely fabricated movie understanding bob geldof man put whole thing together one asking donation interview live aid section started told story found right queen went made around 1million heart broken knew needed started get bbc broadcasting get tv plead people start donating really interview showed happened got station stadium queen started radio gaga stop watch said seeing entire crowd one hundred thousand people clap unison incredible thing would ever seen reality bowie played introduced video think cbs put together footage famine ethiopia broadcast stadium television feed basically showed starving child even clothing watch footage absolutely heart breaking donation started rolling yes lot band last minute movie go insane story event created entire thing put together twelve week literally every single band announced agreed officially perform many announced band even together duran duran would seen room together let alone perform bob geldof went press conference listed basically every popular music act seventy eighty said people going play event even asked complained basically told okay well announce play one wanted say refused play charity event like pretty insane",2,5,0,3,6,4,0,5,5,13,5.6,0,-2,8,"Joy"
"1223","False","simply true cast movie production working movie script director producer basically said want make star movie queen backing whatsoever equivalent michael scott declaring bankruptcy",1,2,1,1,1,1,0,2,1,6,1.1,0,2,6,""
"1224","True","obvious complaint pacing timeline aside biggest complaint cut entire song live aid performance played crazy little thing called love hammer fall stand song freddie play guitar",2,0,0,1,1,2,0,1,3,3,0.15,-2,-2,0,""
"1225","False","yeah agree maybe word properly meant queen probably full blown cocky confident six minute rock opera well radio might felt good imagine acting like wrote bohemian rhapsody know would quite looking like yet like take time song become public much common act unsure public react first sure def case artist know onto something big liked film portrayed music video scene mediocre review one favourite moment interesting depiction something necessarily iconic second released know became",2,4,0,3,4,3,2,4,2,11,5.65,4,13,9,""
"1226","False","sound like real moron say sbc even close considered cast real fucking moron cast actually left fucking project stop saying stupid shit attention",1,0,1,0,0,0,0,1,3,2,-2.9,-3,-12,-1,""
"1227","False","oh sure think really believe want single freddie really friendship kenny everett dj gave advanced copy accidentally played radio became single part one hundred factual could well see insisting record label song single",0,0,0,0,1,0,1,2,1,3,1.2,2,2,2,"Trust"
"1228","False","yeah like ninety history edited fit movie timeline place given movie take place nineteen million, seven hundred and one thousand, nine hundred and eighty-five entire aid subplot never movie freddie diagnosed eighty-seven movie take lot liberty definitely spice thing fit narrative trying push fine make mostly entertaining movie truth kind bummer unfortunately get entire live aid performance reason cut crazy little thing called love set played think maybe hammer fall notable song freddie ever played guitar guess ran time sad another three minute would kill movie",2,3,1,2,5,3,2,4,4,9,3,0,5,5,"Joy"
"1229","False","blew fucking mind",0,0,0,0,0,0,0,0,0,0,-1,-1,-4,0,""
"1230","False","first thought see always oh look petyr baelish quickly followed perhaps wondering would shoot man throwing plane",1,1,0,1,0,0,0,0,1,0,-0.5,0,-1,-1,""
"1231","False","yep tortured soul ended cry movie ended deeply depressing seeing someone create beauty yet genuinely tortured movie end triumphant note reality six year followed filled pain agony suffering probably looked like fool walking theater eye beet red full tear",1,1,3,3,3,5,0,1,6,4,-2.35,-4,-4,-2,"Sadness"
"1232","False","longer cut entire song seemingly reason",0,0,0,0,0,0,0,0,0,1,0.35,0,-1,1,""
"1233","False","fuck bryan singer",0,0,0,0,0,0,0,0,0,0,-1,-1,-4,0,""
"1234","False","hahaha oh shit awesome catch sure next time",1,1,1,0,0,0,1,0,1,0,-0.15,0,3,-1,""
"1235","True","pretty happy used show must go credit",0,2,0,0,2,0,0,4,0,3,1.9,2,4,3,"Trust"
"1236","False","clap along although head respect around lol said sad cut crazy little thing called love reason live aid set",1,2,0,1,3,1,0,2,1,5,1.6,0,3,4,"Joy"
"1237","False","joke",0,0,0,0,0,0,0,0,1,0,0.6,-1,2,-1,""
"1238","True","ramus malek freddie justice rest actor played band mate uncanny well especially brian may fantastic movie live aid performance gave chill smile kudos team",0,0,0,1,2,0,2,4,1,6,5.45,3,11,5,"Trust"
"1239","False","would kick ball led zeppelin since reunionperformance live aid first time five year bonham died atrocity",2,1,1,1,0,1,0,0,2,1,0.15,-1,-6,-1,"Anger"
"1240","False","graham king said hire actor director script sacha leave project pre production stage director screen play also sound like real fucking cunt moron",0,2,0,0,1,1,1,3,2,6,-1.2,-2,-11,4,"Trust"
"1241","False","india dead placed roof tall tower called tower silence exposed bird element think tower outside india zoroastrian community cremate dead zoroastrian priest presiding",0,0,0,0,0,0,0,1,1,3,-0.65,-1,-4,2,"Trust"
"1242","True","okay concert scene entertaining actor good could fleshed character plot judgmental vibe movie towards freddie lifestyle reminded little much john belushi biopic wired",0,2,1,0,2,0,1,1,1,2,1.5,1,5,1,""
"1243","False","know mean may quite touted bohemian rhapsody way talk today",0,0,0,0,0,0,0,0,0,1,1,-1,-2,1,""
"1244","False","also mike myers insisted bohemian rhapsody inclusion ww",0,0,0,0,0,0,0,1,0,0,0.6,0,0,0,"Trust"
"1245","False","interested really went check queen documentary queen day life",0,0,1,0,0,1,0,0,0,1,0.5,0,2,1,""
"1246","False","use pressure soft background song left paul",0,0,0,0,0,0,0,0,1,0,0.1,1,-1,-1,""
"1247","False","gt remaining queen band member mean brian may roger taylor specifically",0,0,0,0,0,0,0,0,0,0,0,0,0,0,""
"1248","False","love car play",0,0,0,0,1,0,0,0,0,1,0.75,1,3,1,"Joy"
"1249","False","think assumed everyone knew wayne world famous borap scene",0,0,0,0,0,0,0,0,0,1,0.5,1,2,1,""
"1250","False","chronically tired able catch show least day later finally paid",0,1,1,0,1,0,2,2,1,1,-0.35,-1,-2,0,""
"1251","False","firing wrong snake sound like came right got",0,0,1,1,0,0,0,0,2,0,-0.3,1,-2,-2,""
"1252","False","better context catch feel place",0,0,0,0,0,0,1,0,0,0,0.8,1,2,0,"Surprise"
"1253","False","opinion many movie within tv show scene think jack black fake drama office",0,0,0,0,0,1,0,1,2,0,-1.25,-1,-3,-2,""
"1254","False","could almost hear fat bastard voice come mike voice point despite performance understated manage",0,0,2,0,0,2,0,1,2,1,-0.7,-2,-5,-1,""
"1255","False","wide shot live aid performance actually noticed used real footage freddie screen beside stage loved",1,0,0,1,0,1,1,1,1,2,1.75,1,3,1,""
"1256","False","absolutely many year event cover around two hour course never going perfect however succeeded making feel like actually watching listening queen band point disbelief take everyone involved completely convincing role portrayed favourite moment seeing mary david jim watching freddie perform live aid total awe seeing sheer presence friend captivated everyone audience feeling must incredible alone gave sense much charisma freddie stage final concert movie done well watching actual event youtube afterwards felt almost surreal thoroughly enjoyed movie despite fault would recommend anyone ever enjoyed queen music music",1,3,1,1,4,3,1,6,2,10,9.4,9,19,8,"Trust"
"1257","False","sorry subtle thought completely forced cute half",0,1,0,1,0,0,0,0,1,2,0.15,0,0,1,""
"1258","False","film pretty cheesy really stand amp x200b corny might worked narrative going amp x200b amp x200b",0,1,0,0,1,0,0,1,0,1,1.25,1,1,1,""
"1259","False","sister leaned said something getting office said shrek",0,0,0,0,0,0,0,0,0,0,0,0,0,0,""
"1260","True","one favourite scene freddie talking mary sexuality apartment hear freddie playing music festival background",0,1,0,0,2,1,1,0,0,2,1.1,0,2,2,"Joy"
"1261","False","propaganda artistic choice bit difference",0,0,0,0,0,0,0,0,1,2,0.25,-1,-2,1,""
"1262","False","corny going reflected devastating loneliness people died aid 80 90 endured people afraid could contact hiv near someone aid victim died lonely death rejected family reliant friend volunteer comfort death terrible time",5,4,4,8,3,6,1,4,8,5,-2.6,-7,-13,-3,"Fear"
"1263","True","good part movie ramus malek freddie nailed nailed",0,1,0,0,1,0,1,1,0,1,0.75,1,3,1,""
"1264","False","mean scar sick guy assumed kaposi sarcoma lesion",1,0,2,2,0,3,0,0,3,0,-1.25,-2,-4,-3,"Sadness"
"1265","True","going cinema monday bohemian rapsody first man",0,0,0,0,0,0,0,0,0,0,0.6,0,0,0,""
"1266","True","saw imax best thing say great sound design aidan gillen always glad see narrative pretty weak lot feel like every musician biopic ever made kind thought past walk hard spoofed formula great effect honestly great music boilerplate feel like last thing biopic freddie mercury andslashor queen like paint number take salvador dali point ramus malek give good performance given carried talent charisma anything given director screenwriter honestly lot seems going kind suspension bridge effect using affection popular song hoping transfer affection movie proxy work mostly song playing good time ball want song stop story would come back focus generic feel like sacrilege talking group sure story freddie mercury queen fascinating fascinating mean told dull fashion finale live aid good though like song sound design great recommended get theater good sound setup cheap",0,5,0,1,6,2,1,7,4,12,9.45,9,29,8,"Trust"
"1267","False","also upvote knowing commitment",0,0,0,0,0,0,0,0,0,1,1.1,1,2,1,""
"1268","False","make movie",0,0,0,0,0,0,0,0,0,0,0,0,0,0,""
"1269","False","first man definitely ever seen rock biopic already seen bohemian rhapsody first man film want make sure see big screen home tv",0,0,0,0,0,0,0,0,0,1,0.85,0,2,1,""
"1270","True","seen discussed subtilty truck stop scene brilliant juxtaposition freddie discussion mary wanting join trucker bathroom fun subtile got point across said ramus performance perfection mike myers surprised quite bit",0,3,0,0,3,1,2,3,1,5,2.65,3,11,4,""
"1271","True","saw movie last night thought felt little bland since thought left freddie might actually went focused queen would preferred movie freddie mercury think movie drag bit would recommend big fan queen music want learn lot freddie movie",0,1,0,0,1,1,0,1,1,3,2.55,-1,8,2,""
"1272","True","saw yesterday honestly fucking loved sure narrative original one hundred factual biopic ever pacing perfect performance absolutely amazing gave goosebump ramus malek brought freddie mercury back life movie ask",0,1,0,0,1,0,0,1,0,1,1.15,2,6,1,""
"1273","False","think material solo biopic way could squeezed movie already went two hour would cut performance two would pissed people even",0,0,0,0,0,0,0,0,0,0,-0.85,0,-5,0,""
"1274","False","yeah exactly canned think funny moment yeah",0,0,0,0,0,0,0,0,0,0,0.8,-1,5,0,""
"1275","False","one hundred certain already pitched studio exec somewhere",0,0,0,0,0,0,0,0,0,0,0.8,0,1,0,""
"1276","True","freddie sung mama want section borap piano got emotional",0,0,0,0,0,0,0,0,0,0,0,0,1,0,""
