"","Parent","Comment","Anger","Anticipation","Disgust","Fear","Joy","Sadness","Surprise","Trust","Negative","Positive","Synzhet","Bing","Afinn","NRC","Emotion"
"499","False","people hating act weird fucking understand one hundred accurate showing sake entertainment ahh whatever came theater speechless fucking energetic inspiring awesome loved",1,1,1,0,1,0,1,2,2,3,1.9,2,3,1,"Trust"
"500","False","saw convinced crazy",1,0,0,1,0,1,0,1,1,0,-0.15,-1,-1,-1,""
"501","False","spotify playlist soundtrack solid stuff really wish played brighton rock somehow",0,0,0,0,0,0,0,0,0,2,1.05,1,3,2,""
"502","False","really like biggest disappointment never really felt like queen family like freddie kept saying really wish expanded friendship",0,0,1,0,1,1,0,1,1,1,0.8,0,3,0,""
"503","False","look like jimmy fallon future",0,0,0,0,0,0,0,0,0,0,0.5,1,2,0,""
"504","True","read cast list saw tom hollander really close tom holland",0,0,0,0,0,0,0,0,0,0,0,0,0,0,""
"505","False","claim also lie brian may producer discounted vehemently never version film freddie died middle roger taylor said sbc never took freddie seriously enough",1,0,1,0,0,1,0,0,1,1,-1.35,-2,-4,0,""
"506","True","loved scene wembley stadium concert cry like bitch gone soon freddy",1,0,1,1,0,2,0,0,2,0,-0.75,0,-1,-2,"Sadness"
"507","False","really contrasting opinion haha think il go first man",0,0,0,0,0,0,0,0,0,0,0,0,3,0,""
"508","False","really know anything zoroastrianism read book article freddie want know start wikipedia follow link outward freddie burial far know service cremated usual way fact funeral director organised father peter freestone freddie pa one thousand, nine hundred and eighty death one freddie best friend time peter written couple interesting book life freddie like died",2,3,1,2,1,3,1,5,2,5,0.65,1,3,3,"Trust"
"509","True","star born served",0,1,0,0,1,0,0,1,0,1,0.6,0,0,1,""
"510","False","would put br ahead star born",0,1,0,0,1,0,0,1,0,2,1.4,0,0,2,""
"511","False","created fiction drama band never feud due freddie solo career relationship executive important make really explore real drama could",1,2,0,0,0,0,0,2,1,3,-0.5,0,2,2,""
"512","True","huge fan queen left house saw movie last night loved know sad happy melancholy end guess fact single new song movie bit disappointing",0,1,0,0,1,2,1,2,2,1,-0.2,-1,4,-1,""
"513","False","know inconsistency oversight movie plus acting terrible friend much fun watching movie especially imax big screen loud speaker time felt actually queen concert loved played song full without cut fan queen music highly recommend watching theater want accurate depiction freddie mercury life go watch documentary",1,3,1,2,3,2,0,3,3,6,1.65,0,10,3,""
"514","False","know theater preview look like elton john one coming summer called rocket man",1,1,1,0,0,0,0,0,1,0,0.5,1,2,-1,""
"515","True","honestly fan ramus freddie something felt freely admit uninformed sound purely figure rest band stunning though really enjoy film whole",0,1,0,0,2,0,0,3,1,4,2.7,1,8,3,"Trust"
"516","False","wait reference",0,1,0,0,0,0,0,0,1,0,-0.25,0,0,-1,"Anticipation"
"517","False","eye",0,0,0,0,0,0,0,0,0,0,0,0,0,0,""
"518","False","even compare sure musician star born mile ahead br many way",0,1,0,0,1,0,0,1,0,2,1.4,0,0,2,""
"519","False","think visibly fake teeth",0,0,0,0,0,0,0,0,1,0,-0.75,-1,-3,-1,""
"520","False","mm played record exec foster said something bohemian rhapsody along line something teenager headbanging spoiler reference scene wayne world",0,0,0,0,0,1,0,0,1,0,-0.2,0,0,-1,"Sadness"
"521","False","looking well wanted know backstory legendary song career trajectory fuzzy best",0,1,0,0,0,0,0,0,0,2,2.05,2,3,2,"Anticipation"
"522","False","seem real despite real band weirdly asib felt real",0,0,0,0,0,0,0,1,0,1,-0.55,-1,0,1,"Trust"
"523","False","heard freddie raw dog several woman film call everyone bro maybe misinformed certainly offended misinformation",1,0,0,0,0,1,0,0,1,0,-1.75,-1,-6,-1,""
"524","False","honestly though ray foster real person show much know god damn seen wayne world either oof thanks though",1,1,1,1,1,0,0,3,1,2,0.1,-1,1,1,"Trust"
"525","False","imagine screenwriter go time director always film scene love ultimately get cut slow movie redundant imagine could made chronologicallyaccurate movie flow well chronologicallyinaccurate movie flowed much better really easy criticize sideline take lot work make movie feel right case thing probably shift around make overall better product",1,2,1,2,1,2,0,1,3,4,2.45,3,3,1,""
"526","True","ok enjoyed felt real felt like remaining queen member wanted give fair treatment past friend pulled punch much also came away movie looking like angel real drama band member friendly banter annoyance late wish could known band member sure freddie interesting one bunch mean sideline rest band felt like trying tell story band mercury succeed either eye bother anyone else homosexuality introduced outside truck stop bathroom stereotypical place pick aid seem respectful almost laughable happened think sexual orientation handled well either know also making band manager guy yoko ono group seemed cookie cutter insight relationship either gay together make anything happened meaningful also badly paced understand time jump going one aged parent movie whole felt awkwardly edited style tour montage press conference experimental filmmaking could went long way say malek killed role nail film would worked level think big fan queen likely enjoy like hit fun see big screen story though felt like needed fleshing",3,7,2,2,7,3,3,9,9,15,6.15,6,16,6,"Trust"
"527","False","good sure best part movie shocked get nominated",0,1,0,0,1,0,1,1,0,1,0.75,1,4,1,""
"528","False","interesting tidbit usually give creative liberty movie real life event damn seemed revisionist polished",1,1,1,0,1,0,1,2,1,5,2,3,4,4,"Trust"
"529","False","star born much better movie even like much",0,1,0,0,1,0,0,1,0,1,1.9,2,4,1,""
"530","False","wow story thank taking time share amazing",0,2,0,0,1,0,0,1,0,1,2,3,11,1,"Anticipation"
"531","False","make wish even one tiny shred talent musically though",0,0,0,0,0,0,0,0,0,1,1.3,1,3,1,""
"532","False","part bored",0,0,0,0,0,0,0,0,0,0,-0.5,-1,-2,0,""
"533","False","agree thought made perfectly clear without game throne graphic sometimes best leave imagination",0,1,0,0,0,1,1,1,1,2,2.35,3,7,1,""
"534","False","check documentary youtube story far justice could long think around three hour split two separate fifteen hour half go great detail live aid came pretty fantastic story believe documentary called live aid rockin world something along line give real appreciation determined people believe",0,2,0,0,2,0,0,4,1,6,5,2,14,5,"Trust"
"535","False","second kind wish bowie would show lol",0,0,0,0,1,0,0,2,0,1,1.3,0,6,1,"Trust"
"536","False","link first part documentary actually think reality far dramatic movie could justice much went think could properly tell story two hour documentary three hour long",0,1,0,0,0,0,0,1,0,1,2,1,2,1,""
"537","True","sure bot troll seen film love gay sad aid hard time memorializing freddy grew tell hide also fight others played suncity apartheid friend margret thacher sorry love lost death closet closet racist friend billionaire make good person admit though absolute got kick fact homophobic young buff male wearing wife beater arm band without knowing turning gay ultimate revenge well played freddie fuck",5,6,1,5,4,3,4,3,6,7,-1.85,-5,-16,1,"Anticipation"
"538","False","great post super confused mary begin knowing gay know fact life behind starting like engaged woman kind fly face born way introduce homosexuality following trucker bathroom really stereotype chose really blew mind decision",0,1,0,0,2,0,0,3,2,3,1.95,1,6,1,"Trust"
"539","False","zuh",0,0,0,0,0,0,0,0,0,0,0,0,0,0,""
"540","False","think people view freddy villan never deal depression similar life freddy one hundred tragic character",0,1,0,0,1,1,1,1,2,1,-1,-2,-2,-1,""
"541","True","getting hate coming film critic must admit love queen aside inaccuracy stuff film biopic show made mercury band special thought ramus malek excellent freddie mercury showing good bad side making likeable guy overall totally getting mannerism tee well also showing bisexuality without smacking across face plus music damn complain soundtrack fun star born liked overrated critic plus loved ended live aid single greatest performance frontman mercury day showed greatest frontman rock glad go decline aid although greatest stuff band live aid bohemian rhapsody get eight hundred and ten",4,6,3,2,8,4,1,4,6,10,4.75,1,13,4,"Joy"
"542","False","yup mj bowie name drop solidifies",0,0,0,0,0,0,0,0,0,0,0,0,1,0,""
"543","False","accurate disingenuous",0,0,1,0,0,0,0,1,1,1,0,0,0,0,""
"544","False","ramus able convince sure anyone would able essentially became freddie sure could ask",0,1,0,0,0,0,0,1,0,1,0.5,0,1,1,""
"545","False","saw star born day enjoyment kind inverted started really liking star born end kind hoping would speed thing finish really care ending bohemian raphsody hand never really grabbed start plenty thing liked generic could really get enjoying music whenever came go movie theater especially since lead basically lipsynching story feel bland last thing would expect movie group like queen said enjoyed live aid sequence thought ended stronger note still feel like star born better movie",0,5,0,0,5,1,1,5,1,8,10.6,8,20,7,""
"546","False","expecting new song like purpose would serve film seems like odd thing include biopic deceased musician understand labelled queen biopic let u honest freddie centric movie genuinely asking",1,1,1,1,1,2,0,2,2,2,2.2,1,2,0,""
"547","False","saw imax theater well live said sequence fantastic sound system one favorite moment movie year",0,0,0,0,1,0,0,2,0,1,2.3,3,6,1,"Trust"
"548","False","exactly felt movie humorous used real freddie mercury quote well perfect ratio song story focussed lot music song made really interesting certainly deserve bad review",2,3,1,1,3,2,1,3,2,7,3.65,3,4,5,""
"549","False","exactly felt movie humorous used real freddie mercury quote well perfect ratio song story focussed lot music song made really interesting certainly deserve bad review",2,3,1,1,3,2,1,3,2,7,3.65,3,4,5,""
"550","False","saying look directly camera wink",0,0,0,0,0,0,0,0,0,0,0,0,0,0,""
"551","True","thought movie lot fun definitely felt fabricated lot area overall movie documentary kind fluff little bit make entertaining ramus malek fantastic really appreciated way handled freddie mary relationship sense made effort show freddie truly loved attracted due gender took advantage imax part amc alist subscription really happy live aid scene speaker godly eight hundred and ten p fuck bryan singer deserve directorial credit",1,5,0,0,5,0,0,6,0,11,7.35,6,19,11,"Trust"
"552","False","saw twice first one regular theater second one imax ending scene worth every penny watching imax",0,0,0,0,0,0,0,0,0,1,0.75,1,2,1,""
"553","False","watch movie",0,1,0,1,0,0,0,0,0,0,0,0,0,0,""
"554","False","thank link live aid underestimated part music history showcasing wide genre artist top name recording industry rest peace many def check",0,2,0,0,2,1,0,2,0,5,3.05,3,5,5,""
"555","False","likely freddie devout would mattered zoroastrianism fascinating unfortunately seek convert good information difficult obtain know several site always looking better thank info",0,3,0,1,2,0,1,2,0,5,1.95,3,9,5,"Anticipation"
"556","False","well barely acceptable publicly lgbt til last fifteen year find bad offensive freddie could openly come term sexualityrepressed sexuality straight away length journey differs everyone born way mainstream social movementmindset gain serious traction til least two thousand and eight gt introduce homosexuality following trucker bathroom really stereotype chose really blew mind decision agreed",2,2,2,2,2,1,0,1,4,4,1.9,1,-2,0,""
"557","False","star born one best movie year bohemian rhapsody one biggest disappointment year",0,1,1,0,1,1,0,1,1,1,0.7,0,1,0,""
"558","False","gt revisionist yes bothered like even tweaking event sake making fit movie agenda behind change",0,0,0,1,0,0,0,0,0,0,1.2,0,2,0,"Fear"
"559","True","really fun enjoyed expected movie musical glad",1,4,0,0,3,1,1,1,0,3,3.1,3,9,3,"Anticipation"
"560","True","see bob geldof played dermot murphy talking calling donate money sitting next elton john looked like might played taron egerton would make sense rocketman starring egerton elton john directed dexter fletcher replaced brian singer last two week shooting bohemian rhapsody random dude look like egerton made look like elton john like think little easter egg set two movie universe ramus malek make uncredited cameo mercury rocketman though might expecting much april two thousand and eighteen egerton officially cast fletcher announced director believe directing fletcher bohemian rhapsody took place january two thousand and eighteen guy think",2,2,1,1,1,0,1,2,2,3,0.55,1,3,1,""
"561","False","sorry trying funny would nice though like song recorded never released slip movie must many song wrote produced whatever reason never got released dreaming",0,0,0,0,0,0,1,0,1,1,1.65,0,7,0,"Surprise"
"562","False","metreon sixteen think van ness dollar two cheaper alamo also sixteen paying see imax otherwise paying upcharge",0,0,0,0,0,0,0,0,0,0,0,1,0,0,""
"563","False","gt theater sang along entire live aid reproduction would quite unhappy happened showing",1,0,1,0,0,1,0,0,1,1,0.25,-1,-2,0,""
"564","False","describes relevant context behind wayne world scene got role show clip wayne world bohemian rhapsody colbert night honestly know possible comprehensive without around time seeing firsthand wayne world repopularized",0,1,0,0,0,0,0,2,0,2,2.15,1,2,2,"Trust"
"565","False","way biopics set universe nice catch tho rewatch see",0,0,0,0,0,0,1,0,0,0,0.5,1,3,0,"Surprise"
"566","False","oh shit saw trailer rocketman right movie started remember specific scene remember actor played elton john looked like real blinkandmissit moment think might onto something gt like think little easter egg set two movie universe ramus malek make uncredited cameo mercury rocketman beginning live aid cinematic universe",1,0,2,0,0,0,0,1,2,2,1,1,-3,0,"Disgust"
"567","False","gt really appreciated way handled freddie mary relationship sense made effort show freddie truly loved scene two together proposal scene think freddie coming bisexual scene man chemistry look eye actor real heartbreaking nearly teared lot scene two together emotional core movie whatever problem misssteps movie least nailed part",0,1,0,1,0,1,0,2,1,4,0,0,0,3,"Trust"
"568","False","honestly sound like want offended actively looking antigay stuff ate acting like typical modern day progressive professional getting offended snd calling political corectness police looking way deep movie antigay meaning real life band never said anything negative freddies sexuality gay lead singer band right ffs",1,0,0,1,0,2,0,3,2,5,1.7,4,-1,3,"Trust"
"569","False","need apoligize yeah way could seen happen play credit something",0,1,0,0,0,0,0,1,0,1,0.4,0,1,1,""
"570","True","good movie surpriseddisappointed scene mentioning flash gordon highlander soundtrack",0,1,0,0,1,0,1,1,0,1,0.75,1,3,1,""
"571","False","meh downvote away caught glitz glamour new movie anyway six month time going thread talking movie majority say okay happens time biggest movie people predictable come film",0,1,0,0,1,0,0,1,0,1,2.45,1,0,1,""
"572","False","took way long realize ray foster played mike myers something said brain went sounded like fat bastard holy shit",1,1,3,0,0,2,0,0,3,1,-1.5,-1,-7,-2,"Disgust"
"573","False","paul kissed freddy first time whole theater got really tense could hear collective breathes held thought wtf thinking course gay stuff queen movie",0,2,0,0,0,0,0,0,0,0,-0.75,-1,-6,0,"Anticipation"
"574","False","wayne world reference clue",0,1,0,0,0,0,0,0,0,0,0,0,0,0,"Anticipation"
"575","False","bad flasg city name screen montage",1,0,1,1,0,1,0,0,1,0,-0.75,-1,-3,-1,""
"576","False","totally agree point",0,0,0,0,0,0,0,0,0,1,0.5,0,1,1,""
"577","False","gt well also showing bisexuality without smacking across face mean like film always heterosexual relationship",0,0,0,0,0,0,0,0,0,0,0.7,2,2,0,""
"578","True","care queen music interested movie would recommend loved burton ed wood without familiar subject beforehand could kind effect",0,0,1,0,2,2,0,3,1,5,4.4,2,11,4,"Trust"
"579","False","amc sorta city hall seven matinee",0,0,0,0,0,0,0,0,0,0,0,0,0,0,""
"580","True","feel like trying queen biopic freddie mercury biopic suffered focused one gone really depth would amazing lot stuff band felt rushed like running time said favourite bit definitely one whole band together casting three member really good really wish movie also felt little cliche time especially whole perfect way different good theme course important part queen story probably way subtly plus story arc family also little rushed make sense dad would accept live aid concert thing would probably good material individual movie everything crammed together individual element story arc really chance shine shame really feel like bit waste really good cast",0,3,2,1,2,1,2,4,2,7,4.15,2,17,5,"Trust"
"581","False","could recommend honestly music best part last twenty minute recreation iconic live aid performance honestly movie felt like decided pick one queen iconic song found contrived convenient way show band came moved next scene first half plot second half mostly gay men predator ruin person life worst travesty fake teeth ramus malek wearing would recommend unless big queen fan",0,1,1,2,3,3,0,3,3,7,2.95,-2,1,4,""
"582","True","movie brutal think positive response get critic hate comment people came see psuedoperformance queen hit music fantastic could put cd hear want see story movie story least maybe last half film first half director read queen wikipedia page jumped one interesting factoid next nothing band gelling together struggle trying make life road freddie stereotypical cruising truck stop real look made sound every actual story element superficial director figured throwing queen song background would seen positively finally get sort plot basically paul prenter predatory gay man split band never split dragged freddie deviant homosexual lifestyle ended freddie getting comeuppance contracting aid movie missed huge easy opportunity portray gay icon blew last gripe mention though list go movie took liberty timeline actual event hell take freddie teeth",5,3,3,4,3,4,2,5,9,9,-0.35,-7,-5,0,""
"583","False","see though paul dude predator gay dude predator jim hutton fine partying like crazy kill gay",1,0,0,2,0,2,0,0,2,0,0.05,0,-1,-2,""
"584","False","happened singer really curious know happened",0,0,0,0,0,0,0,0,0,0,0.4,0,1,0,""
"585","False","yeah feel everybody thing far concerned watching reproduction one legendary rock set people going sing",0,1,0,1,1,2,0,1,0,3,0.75,0,-1,3,"Sadness"
"586","True","bit nervous going movie last night seen eh negative review online heard total disregard historical accuracy enjoyed movie much thought going fun movie one could stop watch every time appears hbo cable future issue beyond timeline stuff got relax bit one portrayed sexuality heard laugh around theater first narrative inkling freddie homosexuality involved dramatic truck stop bathroom scene felt like nasty stereotype unless book specifically cite awakening truck stop bathroom freddie feel like super weird choice really sugarcoated gave pg13 version freddies later life drug alluded powder table real scene time consequence drinking relationship character seemed choppy messy like one scene freddie fire manager suggesting going solo five minute pass make decision anyway one scene attempt reach mary appears moved life scene later mary trying reach freddie role reverse way conflict arose felt disjointed lot time came nowhere like scene missing something overall movie watchable like easy fun watch award type movie hoping month ago although would like see least acting nod malek fabulous still fun popcorn type biopic",2,7,3,6,3,4,3,3,11,5,-1.55,-4,1,-6,"Anticipation"
"587","False","depth relationship paul freddie freddie jim poorly done film needed villain paul convenient jim hutton movie five minute show freddie changed relationship show audience freddie like bc dating respectable gay man like jim",0,1,0,1,0,0,0,3,2,3,0.05,2,0,1,"Trust"
"588","False","get",0,0,0,0,0,0,0,0,0,0,0,0,0,0,""
"589","False","agree characterization bad nowhere near gay men predator",1,0,1,1,0,1,0,0,1,1,-0.25,-1,-2,0,""
"590","False","made even funnier got wayne world reference missed making",0,0,0,0,0,0,0,0,0,0,0,-1,2,0,""
"591","False","addition reaction towards mercury appearance characterized shorter hair thick mustache compared previous year zandra rhodes outfit longer hair blackpolished nail prompted audience member throw razor blade onstage mikal gimore wrote rolling stone two thousand and fourteen like identity mercury perceived brazenly gay rock amp roll hero wanted would amp x200b crazy audience reaction character film mirror fan reaction decade ago",2,2,0,2,1,1,1,1,2,2,0.25,0,5,0,""
"592","True","good cheesy fan service bio pic showcase raw talent mercury like note note dramatic reenactment live aid gig easily running inspired pop live performance ever also liked owning critic hated bohorap came historical accuracy bothered village people stache result exploration german gay disco scene correlate rock era still much glam period pg13 also held story back get target audience teenager queen often gateway band great totally downplayed sex addiction destructive others left lifetime movie sad freddie story much darker icarus",1,4,1,1,3,0,3,4,4,6,0.9,-2,6,2,""
"593","True","give ramus malek oscar enough said",0,0,0,0,0,0,0,0,0,0,-0.25,1,0,0,""
"594","True","love car running joke hilarious especially radio dj mistook main single side lmao",0,0,0,0,2,0,1,0,1,4,2.75,1,11,3,"Joy"
"595","True","watched clip live aid performance day seeing result blown away recreation ramus amazing",0,2,0,0,1,0,0,0,0,2,2.7,1,4,2,"Anticipation"
"596","True","odd pacing surface level play everything safe go indepth god musical performance truly awesome freddie spirit truly captured scene may definitive queen movie ramus malek still deserves oscar nomination",1,2,0,1,3,1,1,5,0,7,4.2,1,5,7,"Trust"
"597","True","fun movie malek killed great matching even smallest detail said sure movie supposed guess promo piece thr band",0,1,0,0,1,0,1,0,0,1,0.75,1,4,1,""
"598","True","kept thinking jim hutton going announce peter deadpool two",0,0,0,0,0,0,0,0,0,0,0,0,0,0,""
"599","False","really clue gay truck stop okay dressed flamboyant feminine posture mean knew gay wish introduced movie earlier tact felt like really struggle either saw guy thought cute suddenly gay gay icon could played better modern audience",1,3,0,1,0,1,1,1,1,2,3.05,3,4,1,"Anticipation"
"600","False","yikes",0,0,0,0,0,0,0,0,0,0,0,0,0,0,""
"601","False","go see see",0,0,0,0,0,0,0,0,0,0,0,0,0,0,""
"602","False","critic score rt also five hundred and ten",0,1,0,0,1,0,1,0,1,1,-0.75,-1,-2,0,""
"603","False","think real target demographic movie people generation assuming midtolate90s born younger millennials obviously know band probably born would already become classic rock big influence u parent",0,0,0,0,0,0,0,1,1,5,1.65,1,1,4,"Trust"
"604","False","meh catch hit streaming service maybe buy watching pantomime imitation would ever compare watching real band perform",1,0,0,0,0,0,1,1,2,1,-0.25,0,0,-1,""
"605","False","singer behavior set apparently unprofessonal could invite friend argue actorscrew member especially malek dissappeared stopped showing set fox fire hire another director article good job covering",1,3,0,1,4,0,2,5,1,6,1.5,1,2,5,"Trust"
"606","False","went friend see soon came two u watched got immediately started silentlyyelling littlefinger came onscreen",0,1,0,0,1,0,0,1,1,2,0.8,0,1,1,""
"607","True","liked true biopic entertaining casting spot ramus malek became freddie hope one day get real biopic gritty detail",0,2,0,0,2,0,1,2,0,3,2.25,1,8,4,""
"608","False","wow experience must land opportunity",0,1,0,0,0,0,0,0,0,2,1,1,6,2,"Anticipation"
"609","False","felt like remember music awesome least younger folk starting listen queen read somewhere",0,0,0,0,1,1,0,0,0,2,1.95,2,6,2,""
"610","False","definitely deserves oscar nomination",0,0,0,0,0,0,0,0,0,1,0.6,0,0,1,""
"611","False","definitely think nominated probably win golden globe least",0,0,0,0,0,0,0,0,0,0,1.1,2,4,0,""
"612","False","knew start bojack swear rewatched lot scene lot trouble identifying voice maybe watch mr robot idk",0,2,0,1,0,0,0,1,0,1,-0.35,-1,-4,1,"Anticipation"
"613","True","enjoyed thought would could way better pacing stake non existent said ramus malek truly deserves oscar nom portrayal mercury",0,1,0,0,0,0,0,0,0,0,1.8,2,4,0,"Anticipation"
"614","False","care music movie saw love music wanted see malek freddie",0,0,0,0,2,1,0,0,0,2,2.35,1,5,2,"Joy"
"615","False","duet bowie",0,0,0,0,0,0,0,0,0,1,0.4,0,0,1,""
"616","False","literally people expecting thing happened theater went small missouri rural town like goddamn least fifty none come surprise",0,1,0,1,1,0,1,0,1,1,0.1,1,-1,0,""
"617","True","enjoyed queen music want explore looked fifteen studio album got intimidated worry made guide depending liked",0,2,0,1,1,2,0,1,1,2,1.2,1,0,1,""
"618","False","really want see setting unfortunately drive like three hour get sort city offering kind theater maybe home thanksgiving break",0,0,0,0,2,0,1,2,0,2,0.55,-1,5,2,""
"619","False","yeaahhhh great honestly really curious creative decision went scene genuinely enjoyed movie whole overly critical",0,0,0,0,0,0,0,0,0,1,2.85,2,8,1,""
"620","False","musical",1,1,0,0,1,1,1,1,0,1,0.6,0,0,1,""
"621","False","right never understood antipirating ad shown theater paid attend someone going record movie phone ad much deterrent",0,0,0,0,0,0,0,0,0,0,0.2,0,-2,0,""
