"","Parent","Comment","Anger","Anticipation","Disgust","Fear","Joy","Sadness","Surprise","Trust","Negative","Positive","Synzhet","Bing","Afinn","NRC","Emotion"
"1","True","movie started unintentional comedy really bad got better best part live aid would preferred sascha baron cohen take",1,0,1,1,0,1,1,0,1,1,2.85,1,1,0,""
"2","False","movie best editing rigged",0,0,0,0,0,0,0,0,0,0,0.5,1,2,0,""
"3","True","movie went thought oddly put together scene seem go together eclectic seemed go really long hit criticism bohemian rhapsody song sure reading way far writersdirector really made way purpose kind blew mind thought",2,2,0,0,1,1,0,1,2,2,-0.65,-2,0,0,""
"4","True","ending lit",0,0,0,0,0,0,0,0,0,0,0,0,0,0,""
"5","False","watching movie want comment movie already two hour long much cover",0,1,0,0,0,0,0,1,0,0,0,0,1,0,""
"6","False","yeah get common problem making movie like would put le put true thing actually happened particularly freddie relationship band mary austin lot major inaccuracy movie make almost fan fiction true depiction band freddie",0,0,0,1,0,1,0,0,1,1,-0.4,-2,6,1,""
"7","False","yeah alive read history half hour since watching ridiculous two active band member come good family men freddie come guy ruin everything seen much mary though still loved freddie though completely understood loneliness",1,2,1,2,2,2,1,2,3,3,0.15,-1,4,0,""
"8","False","well freddie mary relationship fractured lead believe stayed good friend throughout freddie life also band freddie infighting fall out movie lead believe either break solo album anything really never stopped touring together",0,1,0,0,2,1,2,2,1,3,1.7,1,3,2,""
"9","False","believe movie got nominated oscar enjoyed much",0,0,0,0,0,0,0,0,0,0,1,1,2,0,""
"10","True","much love movie especially live aid scene freddie apology one worst scene entire movie apology really bad justify anything",1,0,1,1,1,1,0,0,1,3,1.1,-1,-4,2,""
"11","True","anyone think movie would better live aid scene showed actual clip know fantastic job scene using real clip would feel emotional something narcos done time time great effect",0,1,0,0,0,0,0,1,0,4,3.7,3,9,4,""
"12","False","kobe bryant three six mafia",0,0,0,1,0,0,0,0,1,0,-0.8,0,0,-1,"Fear"
"13","True","opinion watching film first time mixed critic audience score rt loved disliked think queen input large part problem dull band happened create awesome music phenomenal interesting frontman creates problem movie band member much input need divide screen time music highlight thought origin scene certain song done much better music film bit ramus malek delivered really captivating charismatic performance oscar worthy sure seems like nice guy glad also felt kind hypocritical time like one second freddie delivering line wanting poster boy aid etc next lathering aid real thick steady film really tried make freddie poster boy small part incredible human also incredibly serious often taking serious devoid many laugh despite kept glued invested two hour runtime must testament film entertainment value right live aid performance fantastic finale great way wrap thing",1,7,2,1,7,5,4,6,8,12,13.65,11,24,4,""
"14","True","opinion watching film first time mixed critic audience score rt loved disliked think queen input large part problem dull band happened create awesome music phenomenal interesting frontman creates problem movie band member much input need divide screen time music highlight thought origin scene certain song done much better music film bit ramus malek delivered really captivating charismatic performance oscar worthy sure seems like nice guy glad also felt kind hypocritical time like one second freddie delivering line wanting poster boy aid etc next lathering aid real thick steady film really tried make freddie poster boy small part incredible human also incredibly serious often taking serious devoid many laugh despite kept glued invested two hour runtime must testament film entertainment value right live aid performance fantastic finale great way wrap thing",1,7,2,1,7,5,4,6,8,12,13.65,11,24,4,""
"15","True","thank guy honestly saw way better expected reading comment movie put thought would shit really surprised entertaining think everyone become much editing expert movie pretty good much bad say great job concert especially live aid end put movie comment give go",2,5,2,1,3,1,2,3,2,7,4.25,4,6,5,"Anticipation"
"16","True","official discussion suspiria beautiful boy posted tomorrow 9pm cst",0,1,1,0,1,0,0,1,1,2,1.4,1,3,1,""
"17","True","found lot choice weird come showing significant portion history telling story go trouble manager record label never show death two leg written first manager show band grinding top pop never show sending bohemian rhapsody music video instead showing became start entire music video phenomenon amp x200b sort felt element queen story sheffield built song start band freddiemary story little tease jim hutton aid story end enough drown rest movie amp x200b would watch three individual movie compilation made feel entire time better movie teased never commits one vision amp x200b oh major prop playing dire straight insanely good sultan swing live aid got way deep amp x200b odd wtf talking david bowie work together one thousand, nine hundred and eighty-one song play movie",2,8,3,5,3,5,4,5,7,10,1.45,-1,-6,3,"Anticipation"
"18","True","mike myers telling queen teenager ever headbang bohemian rhapsody car worth price ticket alone",0,0,0,0,0,0,0,0,0,1,0.75,1,0,1,""
"19","True","think pretty good credit rolled played actual clip queen feel like musical performance movie captured singing seeing clip also realize much spitting image sacha baron cohen would",1,3,0,0,3,1,2,4,0,5,3.8,3,6,5,"Trust"
"20","True","movie place found majority time quite bored musical part ramus malek star though hope get big opportunity",1,5,0,0,5,1,2,5,0,6,2.8,-1,3,6,""
"21","True","decent film concert ending fun emotional way close help wonder grittier sasha baron cohen version would like",0,1,0,0,1,0,0,0,0,2,1.75,4,8,2,""
"22","True","deal little finger touching dial end waiting disaster never came",1,1,1,1,1,1,2,1,1,1,-0.75,-1,-2,0,"Surprise"
"23","True","anyone see 4dx wondering since four tmobile code rather watch reclining seat 4dx",0,1,0,1,0,0,0,0,0,0,0,0,0,0,""
"24","True","enjoyed film think ramus really killed",0,0,0,0,0,0,0,0,0,0,0.5,0,-1,0,""
"25","True","ending movie one favorite moment ever theater",0,0,0,0,1,0,0,1,0,1,0.75,1,2,1,""
"26","True","pretty average bland movie man anything strange",0,1,0,0,1,0,0,1,1,1,-0.25,-1,0,0,""
"27","False","waiting bowie cameo ala name drop",0,0,0,0,0,0,0,0,0,0,0,0,-1,0,""
"28","False","first moment movie camera follows freddie stage face obscured car door totally shot composition even reminded quick cameo watchman intro",1,0,0,1,0,1,1,1,1,1,-1.4,-1,0,0,""
"29","False","saw dolby atmos sound incredible felt like actual concert probably going see imax",0,0,0,0,0,0,0,0,0,1,1.4,2,2,1,""
"30","True","got chill live aid segment felt like actually close clapping along radio ga ga",0,0,0,0,0,0,0,0,0,2,1.4,0,2,2,""
"31","False","lady theater actually part haha",0,0,0,0,0,0,0,0,0,0,0,0,3,0,""
"32","True","inb4 sacha baron cohen version could better brian may wanted freddie die middle movie band sanitized story etc think necessary post side story since reddit accepted truth sbc told first context sbc said gt member band say said know great movie got amazing thing happens middle go happens middle movie go know freddie dy go happens second half movie go see band carry strength strength sacha also spoke wanted nittygritty detail bandmercury band want side story according producer graham king gt lot talk script freddie dy halfway movie band well never ever case movie bookended live aid concert start end live aid gt sacha clearly passion play freddie mercury script nothing done time producer screenplay director going ever hire cast member sacha wanted sign deal got mad kind kicked two thousand and eleven interview king say pretty much like changed version recently brian may said whole controversy gt sacha became arse nice time sacha kicking around idea went told untruth happened would go away say want make gritty film gt kind people ever ducked truth think queen fan say brian wrong lot official band product could easily paint whole picture everything perfect band freddie went studio house drink tea cooky reality official documentary deal freddie promiscuity drug usage party various controversy etc interview talked devastating effect aid freddie would brian may try clean story already approved lot material detail sbc wanted much anything seems like brian wanted real story told gt much negotiating difficulty king managed obtain movie right brian may roger taylor queen longtime manager jim beach opinionated early day movie wanted king recall told may making film documentary stick every minute history every song okay get away like said queen subreddit bandfreddies real story way interesting movie shame king want stay close brian insist source one source two source three",5,7,3,6,8,6,1,13,11,17,9.6,4,21,6,"Trust"
"33","True","one okay movie suck trailer definitely way excited ramus malek carried movie",0,1,0,0,1,0,1,1,1,1,0,0,0,0,""
"34","True","got say loved parallel whole bohemian rhapsody long single ending concert scene way longer conventional musical ending man going go queen kick awhile loved",2,2,0,0,1,1,1,1,1,1,1.2,1,3,0,""
"35","False","wonder movie would looked supposed freddie die middle sure would worked",0,0,0,1,0,1,0,0,1,0,-0.5,1,-3,-1,""
"36","True","movie poster child average suck though man far average",0,1,0,0,1,0,0,0,1,1,-0.15,-1,-3,0,""
"37","True","enjoyed movie lot however could spent time delving queen timeline skipped around lot",0,1,0,0,0,0,0,0,1,0,0.75,1,2,-1,"Anticipation"
"38","True","scene freddie alone massive house mary break call got rest movie could feel loneliness",0,0,0,1,0,1,1,0,1,1,-1.6,-2,-2,0,""
"39","True","loved scene mike myers referencing teen never roll window bang head bohemian rhapsody amazing joke",1,0,1,1,0,1,1,0,2,0,2.2,1,9,-2,""
"40","False","gt supposed freddie die middle sure would worked bryan may wanted make movie freddie died half movie follows rest band something one truly interested",0,0,1,1,0,2,0,0,1,2,-0.5,-1,-4,1,"Sadness"
"41","False","good joke stop yelling theater oh god amazing",0,2,0,1,2,0,1,2,1,2,1.45,1,9,1,""
"42","True","despite controversy preproduction production film still thought pretty decent hard make bad movie filled music somewhat number term story guy playing freddy mercury mannerism charisma",1,3,1,1,2,2,0,1,2,4,1.45,0,-3,2,"Anticipation"
"43","True","much fun watching absolutely going take away film",0,1,0,0,1,0,0,0,0,1,0.75,1,4,1,""
"44","True","glad dexter fletcher got executive producer credit finishing film",0,1,0,0,1,0,0,1,0,3,1.55,1,3,3,""
"45","False","exactly said replied",0,0,0,0,0,0,0,0,0,0,0,0,0,0,""
"46","False","big take away movie felt sad felt portrayed never knew",0,0,0,0,0,0,0,0,0,0,-0.25,-1,-1,0,""
"47","False","honestly genius",0,0,0,0,0,0,0,0,0,1,0.5,1,0,1,""
"48","False","lyric matching point life incredibly touching although story gritty real life still enjoyed movie found acting fantastic ramy killed really became freddie going",0,0,0,0,1,0,0,2,0,2,2.65,1,3,2,"Trust"
"49","False","totally forgot portion movie character movement stage performance spot",0,0,0,0,0,0,0,0,0,0,0.4,0,-1,0,""
"50","True","really feel malek freddie movie anyone else",0,0,0,0,0,0,0,0,0,0,0,0,0,0,""
"51","False","reallu",0,0,0,0,0,0,0,0,0,0,0,0,0,0,""
"52","False","okay pal",0,0,0,0,0,0,0,0,0,0,0,0,0,0,""
"53","False","dire strait",0,0,1,1,0,1,1,0,1,0,-1,-1,-3,-1,""
"54","False","yeah wtf never addressed",0,0,0,0,0,0,0,0,0,0,0,0,-3,0,""
"55","False","bowie big disappointment",0,0,1,0,0,1,0,0,1,0,-0.75,-1,-1,-1,""
"56","True","went movie excited enjoy lot said think potential casting excellent enough grittiness build certain part timeline lot skipping around movie felt tad bit slow couple point odd considering disappointed first saw movie run time freddie interesting could included another two hour still would enough either way enjoyed ramus performance really carried movie",1,3,1,0,3,1,1,3,1,6,4.4,3,9,5,""
"57","False","yeah agree scene movie captured magic real band",0,0,0,0,0,0,0,1,0,2,1,1,2,2,"Trust"
"58","False","real life brilliant sound engineer trip khalaf changed sound limiter queen sounded louder band scene except jim beach changing limiter",0,1,0,0,2,0,1,2,0,2,1,0,4,2,""
"59","True","sound like overall movie ok ramus malek absolutely kill freddie",0,0,0,1,0,1,0,0,1,0,-0.25,0,-1,-1,""
"60","False","good booksdocumentaries recommend tell interesting story queen",0,1,0,0,1,0,1,2,0,3,2,3,7,3,"Trust"
"61","False","ah coulda sworn meant john reid shade touching make sense beach",0,0,1,0,1,0,0,0,1,1,0,0,0,0,""
"62","False","dad favorite part around fantastic movie",0,0,0,0,1,0,0,1,0,1,1.5,2,6,1,""
"63","False","pal buddy",0,1,0,0,1,0,0,1,0,1,1,0,0,1,""
"64","True","takeaway like queen queen like movie said love queen really liked pacing weird beginning set band enjoyed whole thing",0,0,1,0,1,0,0,0,1,1,2.5,3,7,0,""
"65","False","buddy guy",0,1,0,0,1,0,0,1,0,1,1,0,0,1,""
"66","False","guy faggot",0,0,0,0,0,0,0,0,0,0,-0.8,0,-3,0,""
"67","False","expect anything queen music glad got sultan swing solo playing background trailer",0,2,0,1,2,1,1,1,0,3,1.75,1,3,3,""
"68","True","part enjoyed film asbolute trainwreck early review said read review saw couple headline saying bad structurally film mess poorly paced tendency yadda yadda thing would seem important script felt like bear minimum queen story know queen well known sure anything would want know band anyone else circle could find easy movie character development important felt like know character relationship grew close started calling family said reason enjoyed film acting phenomenal felt like everyone gave good performance little especially ramus malek fun watch felt really portrayed mercury well least knowledge best part film ever melodrama push aside band stage playing ramus malek queen music script flim enjoyable great bad horrible hallmark movie like 2pac biopic give film two vh1 behind music five side note way beside point matter random observation second film year black guy poc theater third count mille twenty-two like two random black guy sat next none matter random observation another side note sake argument consider queen greatest band time see personally top five mostly heard much music outside greatest hit personal greatest band time probably clash followed ramones beatles queen probably somewhere top ten purely bohemian rhapsody alone",7,5,3,4,3,4,1,6,10,10,6.45,9,15,0,"Anger"
"69","True","came back theater queen favorite band time freddie opinion greatest vocalist time hill willing die anticipating film year happy ended live aid performance chill choked little early felt film polished clean wish would shown creative process making song many story historical note creation song yet film basically performed perfectly also felt film feel two hr fifteen min long good pacing could longer overall fun film hit key note really enjoyable thought little stylized make sense ramus great freddie really mannerism voice perfect clearly respected material ask",1,7,0,1,6,1,1,5,2,10,10.9,13,31,8,"Anticipation"
"70","True","legit laughed as realized character told queen one would play bohemian rhapsody radio played mike myers bohemian rhapsody become popular u featured wayne world",0,0,0,0,0,0,0,0,0,1,2.3,1,4,1,""
"71","True","best actor nomination malek easy unless singer connection sink whole thing funniest joke brian may hair slightly larger scene",0,0,1,0,0,0,1,1,1,1,3.05,0,6,0,""
"72","False","nobody recognized tell car",0,0,0,0,0,0,0,0,0,0,0,0,0,0,""
"73","False","miami beech",0,0,0,0,0,0,0,0,0,0,0,0,0,0,""
"74","True","thought almost worked spite favorite moment whenever queen playingsinging queen second favorite band beatles time chance hear theater delightful recreating live aid entirety sublime foursome actor good job conveying respective musician men playing brian may john deacon particular spot loved running gag deac butt joke actual movie movie really lacking whole thing felt stale safe moving moment moment without real sense urgency excitement historical inaccuracy ton break two different category one hand simple timeline mixups like queen developing rock far later actually happened fat bottomed girl coming year recorded side change actually affect story band history case biggest sin movie making freddie villain band middle act according movie freddie got swept paul prenter decided go solo leaving rest band go without coming sens return group begs take back let record coincides live aid band miraculous comeback yeah queen never stopped recording recorded together time formed day freddie died beyond surviving trio recording swan song album old freddie recording yes freddie released solo album rest freddie mercury personal life movie would u believe freddie wild drug sexaddicted hedonist course absolutely rest well maybe john deacon brian may arguably sexaddicted freddie man wrote fat bottomed girl personal experience cry loud movie trio family men time freddie partying way fine movie want take liberty film documentary case let u call biopic bio graphy part cast aside order concoct narrative writer surviving band member thought would cinematic therein lie biggest problem movie made without freddie input obviously john deacon retired twentyfive year coincidentally aforementioned butt joke freddie dead almost thirty brian roger carry however creative guru film coincidentally come best roger witty brian measured meanwhile deacon dork freddie selfdestructive time bomb rub wrong way freddie say hey went band final year decided credit group song sad see slanted view screen slanted favor two four music great deny direction brian singer infamously fired failing show work name kept credit due dga regulation despite finishing movie film retains fingerprint flash cleverness cutesy angle interesting camera trick stick sea blandness little else say filmmaking standpoint far intrigued elton john movie rocketman coming next year look like antibiopic mixing element fantasy surreal music great like queen elton john great catalogue hit pull wild ride life put screen hope turn villain movie way one",7,10,5,8,10,9,11,13,21,26,4.9,-1,17,5,"Trust"
"75","True","phenomenal performance ramus watching final concert amc dolby worth",0,0,0,0,0,0,0,0,0,1,2.15,2,2,1,""
"76","False","cohen erran morad character closest get freddie",0,0,0,0,0,0,0,0,0,0,0,0,0,0,""
"77","False","queen documentary queen day life queen killer queen freddie documentary freddie mercury untold story freddie mercury great pretender book real life mark blake queen unseen written freddie roadie excellent want know day day touring life queen complete work basically encyclopedia band freddie mercury intimate memoir man knew best peter freestone",0,2,0,0,2,0,0,4,1,4,1.15,4,10,3,"Trust"
"78","False","want see end imax",0,0,0,0,0,0,0,0,0,0,0,0,1,0,""
"79","True","loved ramus absolutely nailed freddy could done story pacing time see movie made people loved queen",0,1,0,0,0,0,0,0,0,0,0.5,1,3,0,"Anticipation"
"80","False","saw red purple carpet premier six thousand, five hundred people every single song movie audience acting like show rock highlight",0,1,0,0,0,0,0,1,0,2,1.6,2,4,2,""
"81","False","think delving queen library would see coming side true believer discography incredibly eclectic groundbreaking way think rock band ever top three question think two pick",0,2,0,0,0,0,0,2,0,5,3.1,3,4,6,""
"82","True","everything felt like presented solved struggle wish movie substance freddie man many arc life movie seems scratch surface wish would stuck one element life delve put rest backburner movie almost drag along weird whole time ramus killing freddie never cared mary never cared jim never cared band wish would focused one relationship time skip kept taking movie every problem solved moved time skip hurt film would good moment struggle",3,2,1,4,1,4,1,1,6,3,-1.15,-6,-5,-3,""
"83","True","loved played pressure scene paul prenter trashing freddie medium seemed like clever way addressing rumor freddie bowie",0,0,0,0,0,1,0,0,2,1,1,2,6,-1,"Sadness"
"84","True","first see imax dolby atmos saw dolby sound incredible felt like actually live aid last twenty minute movie fault still say really enjoyed ramus killed concert scene incredible felt like first half rushed loved second half focused freddie personal struggle although still could gone depth inaccuarcies bother honest almost music biopics said live aid sequence bumped movie really go great perfectly recreated powerful emotional way end film eight hundred and ten although bit biased huge queen fan guess feeling going big hit box office audience going love two show tomorow night primetime local theater almost soldout",5,3,3,4,5,5,2,6,6,7,4.45,3,19,1,"Trust"
"85","False","david bowie watchman intro",0,0,0,0,0,0,0,1,0,1,-0.4,0,0,1,"Trust"
"86","True","brian may opening 20th century fox theme great think casting department spot picking right people band know kid jurassic park going film seeing good job john deacon surprise overall film entertaining humour worked well eg everything roger love car venture much depth time particularly first half movie really pick towards end",0,3,1,1,4,0,2,3,1,7,5.45,8,13,6,"Joy"
"87","True","great live aid scene bummed include half rock played going champion also felt like played show must go first half credit would powerful playing stop covering freddie death felt slightly inappropriate",3,3,3,2,2,2,1,4,2,6,2.6,2,4,4,"Trust"
"88","True","really enjoyed critic response seems harsh definitely better four thousand, nine hundred and fifty-nine really nailed live aid performance",0,0,0,0,0,0,0,0,1,1,1.45,0,0,0,""
"89","False","going happen sacha want happen",0,1,0,0,0,0,0,0,0,0,0,0,1,0,"Anticipation"
"90","True","thought fantastic movie sure said already certain element one hundred feel dull moment think ramus killed truly mesmerized sheer amount effort must made capture embodiment freddy every actor choice felt good one felt place except mike myers totally okay clever costume point hope get recognition sheer amount drama surrounding behind scene thought might le cohesive time tell little lacking fluidity loved nonetheless remotely like queen would highly recommend go looking documentary enjoy killer music",0,5,0,0,4,2,2,5,3,9,3.7,5,18,6,""
"91","False","yeah sure right best thing film got interested digging little deeper queen straight crack top five instance think much beatles earlier year saw yellow submarine theatre always partial door beatles",0,1,1,0,0,1,0,1,1,2,1.65,2,9,1,""
"92","False","look apparently one responsible putting song wayne world course led chart resurgence casting role seemed like nice tribute",0,0,0,0,0,0,0,2,0,2,2.25,3,9,2,"Trust"
"93","False","exact quote right",0,1,0,0,0,0,1,0,1,1,0.8,1,0,0,""
"94","False","great comment interesting read",0,0,0,0,0,0,0,0,0,1,1.25,2,5,1,""
"95","False","gt tell car head bang",1,0,1,1,0,1,1,0,1,0,0,0,0,-1,""
"96","True","lot people website subreddit particular ton preconceived notion movie whether looked generic romanticizing sensationalizing freddie making pg13 assuming movie made one going make eight year ago sacha baron cohen production lot issue name whatever reason vocal majority reddit wanted hate movie well say humble opinion wrong movie fucking rocked address freddie personal life way absolutely require rrating also shy away fact asshole honestly shocked much highlighted unlikeable fed public idolization hold back brian roger closely tied production sure going refrain showing much nope regarding ramus malek worried would see impersonating freddie actually believe freddie nailed good anyone could possibly freddie entire band great fuck entirely convinced go back time snag young brian may play movie good could go movie main point want make one people decided movie came going bad go movie open mind perfect film stretch hell lot fun great time movie",4,7,5,3,5,5,3,6,8,11,-2.7,-4,-14,3,"Anticipation"
"97","False","person playing yes adrian vight standing outside studio fifty-four photo taken bowie ziggy stardust era leaning car greets adrian way venue",0,0,0,0,0,0,0,1,0,1,1.6,0,2,1,"Trust"
"98","True","hey guy movie along mid90s live show sunday wondering want comment featured show either reply add pc comment get thought next post credit show",0,1,0,0,0,0,0,2,0,1,0.8,0,1,1,"Trust"
"99","False","weird think bland mainly acting good",0,1,1,0,1,0,1,1,2,1,0,-1,1,-1,""
"100","True","may obvious answer guitar solo playing right live aid performance",0,0,0,0,0,0,0,1,0,2,2.2,1,0,2,"Trust"
"101","True","friend assumed three hour movie thought live aid sequence end second act hilarious seeing face end photo came realised",0,1,0,0,2,0,1,1,0,3,2.8,1,3,3,"Joy"
"102","False","day life great one youtube think",0,0,0,0,0,0,0,0,0,0,0.5,1,3,0,""
"103","False","played theatrics story like lot movie freddie also given aid diagnosis one thousand, nine hundred and eighty-seven two year live aid",0,1,0,1,0,0,0,1,1,1,1.25,1,2,0,""
"104","True","opening credit freddie getting ready live aid hauntingly beautiful",0,1,0,0,1,0,0,1,0,3,2.95,2,3,3,""
"105","False","dite strait sultan swing",0,0,0,1,0,0,0,0,0,0,0,0,0,0,"Fear"
"106","True","someone super familiar history band low expectation film coming enjoyed ton acting superb movie evoked strong emotion tearing point really enjoyed lot",0,2,0,0,0,0,0,1,0,3,4.3,4,12,3,"Anticipation"
"107","False","acting unsurprisingly pretty phenomenal agree really glossed lot shit like howto biopic movie cliche complete tweaking timeline actual event purely dramatic effect",1,1,1,0,1,0,0,2,1,4,2,1,0,3,"Trust"
"108","True","solid seventy-five",0,0,0,0,0,0,0,0,0,1,0.25,1,2,1,""
