"","Parent","Comment","Anger","Anticipation","Disgust","Fear","Joy","Sadness","Surprise","Trust","Negative","Positive","Synzhet","Bing","Afinn","NRC","Emotion"
"1857","False","weird take paul fully clothed waiting bos wake work day mention completely sober freddie kid waking halfnaked hungover plus night clear paul hand kid freddie knowingly implying regular occurrence event plus idea paul sex random guy freddie place freddie sleeping left guy freddie find paul cleaned came back start day work freddie assistant like pretty good example far people reach try deny freddie homosexuality film freddie telling paul get rid guy waking ashamed confronts mary still struggling homosexuality paul handle thing part whole villain paul leading freddie towards homosexuality plotline awful film",2,4,3,2,3,2,1,5,6,5,-1.2,0,-1,-1,"Trust"
"1858","True","saw movie yesterday ramus malek great job great actor fan since saw mr robot however honestly believe sacha baron cohen would better casting pick tried make malek look like freddie mercury much possible much resembles freddie mercury behind side scene see ramus malek wig kind destroys illusion movie read turned old band member want cast sacha conflicting idea think idea make resemble freddie outrageous controlled unique taste personally think band member trying preserve freddie image think point film show u side would really see creative narrative already know also like much artistic freedom utilized director upon reading queen history found several key point movie happen way irl kind felt betrayed tl dr acting great plot twisted version reality people behind scene called shot terrible job probably driven self interest",2,1,1,2,3,2,4,5,4,12,2.35,-1,4,8,"Trust"
"1859","True","freddie mercury singing whole time ramus malek sing movie",0,2,0,0,1,1,0,1,0,1,0.6,0,0,1,"Anticipation"
"1860","False","kind wondering stop showed toward end movie felt kind jarring song place belong",0,0,0,1,1,1,0,1,1,1,-0.4,-1,1,0,""
"1861","False","well subjective people liked br star born guess get decide huh feel bad amp x200b",1,1,1,1,1,1,1,1,1,1,1.15,1,-1,0,""
"1862","False","laughed hard like embarrassingly long time",0,2,0,0,0,0,0,0,0,0,0.55,-1,2,0,"Anticipation"
"1863","False","rgatekeeping",0,0,0,0,0,0,0,0,0,0,0,0,0,0,""
"1864","True","little finger",0,0,0,0,0,0,0,0,0,0,0,0,0,0,""
"1865","False","lot marc martel read somewhere else combination freddie mark ramus familiar marc martel worth watch also",0,1,0,1,0,0,0,1,0,2,1.55,1,2,2,""
"1866","False","exactly told wife many missed opportunity editing song scene would much mote powerful ending recording show must go freddy death",2,3,2,2,1,1,1,2,1,2,0,-1,0,1,"Anticipation"
"1867","False","actually bisexual gay romantic relationship men woman longest meaningful relationship according woman",0,1,0,0,1,0,0,1,0,1,1,2,2,1,""
"1868","False","thank felt homophobic entirely sure overeeacting thanks making feel le crazy",1,0,0,1,0,1,0,0,1,0,0.35,0,2,-1,""
"1869","False","gt real life band never said anything negative freddies sexuality gay lead singer band right ffs aware movie exclusively thing band said real life current singer",0,0,0,0,0,1,0,1,1,2,0.55,1,-2,1,""
"1870","False","gt pg13 rating sure else could done address bisexuality sinister edge way portray almost relationship men tie sexual attraction men debauchery personal spiral also really show happy enjoying anything related exaggerating villain role one gay character also help",2,2,2,4,2,1,0,5,4,3,-0.15,1,5,-1,"Trust"
"1871","False","gt bother anyone else homosexuality introduced outside truck stop bathroom stereotypical place pick aid cruising sex truck stop public place reality lot gay men yeah handling sexuality whole mess",0,2,1,0,1,0,0,2,3,4,-1.05,-3,-4,1,""
"1872","False","heh shaun dead",0,0,0,0,0,0,0,0,0,0,-1,-1,-3,0,""
"1873","True","wish could seen live aid concert fourteen uk summer though remember watching tv remember big deal",0,1,0,0,1,0,1,1,0,2,2.3,0,2,2,""
"1874","False","saw colbert show said personified every shitty musicmovie producer ever displeasure dealing specifically pulling hard get bohemian rhapsody wanye world first place instead welcome jungle",0,0,1,1,0,0,0,1,1,1,0,-1,-4,0,""
"1875","False","also part deacon start playing another one bite dust remember reading pretty much whole thing bass guitar got taylor drum loop cool riff happened around hear",0,2,0,0,1,0,0,2,2,3,0.5,1,2,1,""
"1876","False","holy moly thanks sharing voice sound much like freddie",0,0,0,0,0,0,0,0,0,1,1.35,2,4,1,""
"1877","False","stating fact smart as",0,0,0,0,0,0,0,1,0,0,0.5,1,1,0,"Trust"
"1878","False","awesome thanks",0,0,0,0,0,0,0,0,0,0,1.2,1,6,0,""
"1879","False","also totally expecting see bowie turn pressure immensely popular",0,1,0,0,0,0,0,0,1,0,0,1,2,-1,"Anticipation"
"1880","True","lucy boynton would perfect play debbie gibson biopic",0,1,0,0,1,0,0,1,0,1,0.75,1,3,1,""
"1881","False","fact relevance",0,0,0,0,0,0,0,1,0,0,0,0,0,0,"Trust"
"1882","False","best heard freddie sexual preference yes",0,0,0,0,0,0,0,0,0,0,1.3,1,4,0,""
"1883","False","chaos ladder",1,0,0,1,0,1,0,0,1,0,-0.75,-1,-2,-1,""
"1884","False","baron cohen wanted show sex drugfuelled party dwarf walking around wearing plate cocaine would worse paul definitely villain story one happened gay gay spill detail mercury sex life press think portrayal direct dig queer community brief glimpse gay bar seems enjoying relationship jim hutton lovely well",0,3,0,2,3,3,1,4,3,4,0.75,1,2,1,"Trust"
"1885","False","think sacha would reduced everything freddie cocaine orgy would hard music justice happy route took gratuitous sex scene replaced actual conversation freddie partner freddie never addressed sexuality publicity everyone assume would want movie based entirely also every single biopic twisted hollywood want sell ticket agree sacha look way like freddie ramus",0,2,1,0,3,2,0,3,1,7,4.3,0,8,6,""
"1886","True","saw last night finally drama feel manufactured also feel like never fully fleshed freddie kind struggle strict upbringing sexuality kind drug alcohol every time freddie drink movie band tell gone far leave disgust lol wut going portray drunk least go full steam like spent entire movie tiptoeing around pg13 rating trying achieve freddie announcing band aid potential powerful scene fall flat kind reminded room lisa mom tell breast cancer lisa reaction basically ugh fine mom care blaming band breakup started solo career real dick move rest band",5,4,4,5,4,7,2,6,8,10,-0.45,-6,-4,2,"Sadness"
"1887","False","oh yeah thinking pool stick hitting scene",0,0,0,0,0,0,0,0,0,1,-0.6,0,1,1,""
"1888","False","yup real factual disservice many band member freddie",1,0,1,0,0,1,0,1,1,1,-0.25,-1,0,0,""
"1889","False","comment sasha baron cohen film seen say one see homophobic",0,0,0,0,0,0,0,0,0,0,0,0,0,0,""
"1890","False","hand freddie character dignified never try hurt anyone never lash come across sincere meek best possible way character greatly respect idea real freddie like private would say film disparaged",2,1,0,2,1,2,0,3,2,4,1.25,4,5,2,"Trust"
"1891","False","tear tear sadness joy nostalgia jostling position",0,0,0,0,1,1,0,1,1,1,0.25,0,3,0,""
"1892","False","lack gay sex straight sex either",0,1,0,0,1,0,0,1,1,1,-0.05,-1,-1,0,""
"1893","False","amazing rebuttal argument invented brava",1,0,0,0,0,0,0,0,1,0,-0.1,1,4,-1,"Anger"
"1894","False","gt also like much artistic freedom utilized director upon reading queen history found several key point movie happen way irl kind felt betrayed one know queen history",0,1,0,0,3,0,0,4,0,6,2.3,2,3,6,"Trust"
"1895","False","hahaha thanks amp x200b try address gayasvillain trope basing opinion homophobic",0,0,0,0,0,0,0,0,0,0,0.6,0,5,0,""
"1896","False","across board homophobic one thing entire juxtaposition mary austin queen good stabilizing force life paul homosexuality predatory obstacle greatness decision make member queen responsible married men comparison freddie",2,2,0,2,2,1,2,3,4,3,-0.85,0,1,-1,"Trust"
"1897","False","yeah see sure mary queen stabilizing force guess hard real life brian may roger taylor executive producer final yay nay certain creative decision omitting roger two solo album freddie though fair married men freddie amp x200b remember address freddie relationship hutton postlive aid together seven year death seemed wonderful private quiet life together hollywood want emotional story suppose return queen abandon paul life focused queen ticket sale",2,1,1,3,1,3,3,2,4,7,3.2,3,8,3,""
"1898","False","agree point got mo incredibly distracted mouth",1,0,0,0,0,0,1,0,1,1,0.8,1,-1,0,""
"1899","False","oh knew recognized somewhere could really put finger",0,0,0,0,0,0,0,0,0,0,0,0,0,0,""
"1900","True","ramus absolutely incredible movie also liked attention detail like pepsi soda live aid",0,0,0,0,0,0,0,0,0,2,2.75,3,4,2,""
"1901","False","even jawline freddie mercury ramus malek",0,0,0,0,0,0,0,0,0,0,0,0,0,0,""
"1902","False","let introduce big book british smile",0,0,0,0,1,0,1,1,0,1,1,1,3,1,""
"1903","True","remembet watching live aid concert tv kid stunned queen performance therei new hit song liked real big fanthen live aid show jaw dropping expecting muchit worth seeing movie history led scene",1,1,0,1,0,0,1,2,2,3,3.85,4,3,1,"Trust"
"1904","False","gf friend last one stop laughing",0,0,0,0,2,0,0,1,0,2,1,0,1,2,"Joy"
"1905","False","part made whole theater laugh unison",0,0,0,0,1,0,1,0,0,2,0.9,0,1,2,""
"1906","False","whole bit band coming back together right charity concert done multiple concert together shortly said gig",0,2,0,0,1,0,0,0,0,1,1.6,1,0,1,"Anticipation"
"1907","False","good way look story liveaid performance came concert honestly good",0,1,0,0,1,0,1,1,0,1,1.15,1,3,1,""
"1908","True","movie incredible idea critic care even queen fan",0,0,0,0,0,0,0,0,1,0,0.75,0,3,-1,""
"1909","True","saw movie today pretty good seems little rush yet long time actor fake teeth really distracting job knew like several queen song literally knew anything band lead singer knew interesting character end end bigger appreciation band journey",1,6,0,1,4,0,1,3,2,7,2.9,3,7,5,"Anticipation"
"1910","True","part film deserves oscar makeup department freddie mercury man distinctive facial structure ramus malek turned face someone else without making look fake camera angle incredible ramus extremely convincing freddie huge queen fan kind distracting looking stuff know happenhappened completely different time order make dramatic narrative",1,2,0,0,1,0,0,3,2,3,1.45,1,3,1,"Trust"
"1911","False","yeah could really make real jerk came across like",1,0,0,0,0,0,1,1,0,1,0.25,0,0,1,""
"1912","False","knew gay knew asian neither knew kissed dude movie learn watching",0,0,0,0,0,0,0,0,0,1,0.8,0,0,1,""
"1913","False","yeah british love queen",0,0,0,0,1,0,0,0,0,1,0.75,1,4,1,"Joy"
"1914","False","agree one thousand and ten amazing seeing range night museum mr robot crazy buster wood freddie mercury amazing career hand",1,1,0,1,0,1,0,0,1,2,0.25,0,3,1,""
"1915","False","reminded male version chloe moretz",0,0,0,0,0,0,0,0,0,0,0,0,0,0,""
"1916","False","really liked live aid fail queen played fuck movie generic people allowed like like rt spread far audience critic like movie made template used howard stern interview fill scene old anecdote",0,1,0,0,0,0,0,1,2,1,-1.25,-2,-4,-1,""
"1917","False","actually quite numerical metacritic rotten tomato show people like br star born would make claim make sure around come oscar time laugh face tell told",0,2,0,0,2,0,1,2,0,2,1.1,0,0,2,""
"1918","False","mean young howard stern",0,1,0,0,1,0,1,0,1,1,-0.35,-1,0,0,""
"1919","False","people want see queen biopic",0,0,0,0,0,0,0,0,0,0,0,0,1,0,""
"1920","False","bit marc martel pretty obvious writing love life freddie voice break rehearsal livepart somewhere 70 mostly adlib stuff really",0,1,0,0,2,0,1,2,0,3,1.25,1,4,3,""
"1921","False","impressive fact live aid scene first scene shot",1,0,0,1,0,1,1,1,1,1,1.35,1,3,0,""
"1922","False","enough foam beer literally unwatchable",0,0,0,0,1,0,0,0,0,1,-1.25,0,0,1,"Joy"
"1923","True","came say john deacon last part film look exactly like live version wyborn coraline",0,0,1,0,0,0,0,1,1,0,0.5,1,2,-1,""
"1924","False","right really understand hate movie extremely entertaining fun",1,2,1,1,2,1,0,0,1,2,1.55,2,3,1,""
"1925","True","surprised sub positive responsive hated movie everything unbelievably trite especially like got explain make queen stand rock band say something cliched outsider loner weirdo right opposed conformist rock band 70 eyerolling line like every minute occasional funny bit quipping get distracting ramus malek good good even although quite see oscar buzz still highlight movie barring music movie even manages ruin musical scene slam dunk even movie like one fuck city tour name popping screen little sound effect give absolutely sense scale scope tour look good live aid fun song gave goosebump fact try make seem like great act altruism fall fucking flat movie given absolutely reason care live aid expects heart warmed something band performing together cheap unnecessary attempt raising stake",4,7,0,6,4,4,5,5,7,11,0.5,-6,9,4,"Anticipation"
"1926","False","admit wrote product placement never occurred going screen accuracy",0,0,0,0,0,0,0,0,0,0,0.6,0,-1,0,""
"1927","False","tommy carcetti",0,0,0,0,0,0,0,0,0,0,0,0,0,0,""
"1928","False","gt felt like one vh1 band movie 90 like temptation pump brake kid portrayal david ruffin national treasure",0,1,0,0,1,0,0,1,1,1,0.75,1,4,0,""
"1929","False","already got purple rain movie though",0,0,0,0,0,0,0,0,0,0,0,0,0,0,""
"1930","False","honest hoping prince universe play right closing credit okay got instead even rather nose",1,0,2,1,1,1,0,2,0,3,3.15,2,4,3,""
"1931","False","know anything queen either watched movie reading got home found even disband shown film live aid reunion concert probably added disbanding dramatic effect highlight concert several youtube video article show great detail good start",0,3,0,0,2,0,1,4,0,5,4.35,2,8,5,"Trust"
"1932","True","wactehd movie loved like queen music though know much freddy band good experience theater seeing mr robot surprised first heard playing get mousatche really looked part",0,1,0,0,2,1,2,1,0,2,2.35,3,8,2,""
"1933","False","high saw theatre last night caught guard screamlaughed chicken moment nobody else theatre thought funny apparently",0,1,0,2,0,0,0,1,0,1,0.55,-1,4,1,"Fear"
"1934","False","blew mind",0,0,0,0,0,0,0,0,0,0,0,0,0,0,""
"1935","True","shot live aid movie illustrates speed sound travel across crowd fucking awesome",1,0,0,1,0,1,1,0,1,1,0.2,0,0,0,""
"1936","True","farm go one never let go",0,1,0,0,0,0,0,0,0,0,0,0,0,0,"Anticipation"
"1937","False","yeah think era mike myers cheap long past",0,1,0,0,0,0,0,0,1,0,-0.5,-1,1,-1,"Anticipation"
"1938","False","yes reminded",0,0,0,0,0,0,0,0,0,0,0.8,0,1,0,""
"1939","True","love mike myers makeup",0,0,0,0,1,0,0,0,0,1,0.75,1,3,1,"Joy"
"1940","True","enjoyed ended really early far timeline life",0,0,0,0,0,0,0,0,0,0,1,1,2,0,""
"1941","False","people handle someone gay even get head around idea bisexuality think sleep men gay would matter many woman also sleep lot sophistication",0,0,0,0,0,0,0,0,0,0,0,0,1,0,""
"1942","False","jonathan byers stranger thing would bad",1,0,1,2,0,1,0,0,2,0,-1.25,-2,-3,-2,"Fear"
"1943","False","would insane given film le polish aged look transitioned real footage filmgoers would idea unless course huge queen fan b realllllly knew facial feature freddie",1,0,0,1,0,0,0,1,1,3,-0.5,-1,2,2,""
"1944","False","sure talkact like bowie since st character different bowie yeah definitely look like bowie",0,0,0,0,0,0,0,0,0,0,0.5,1,3,0,""
"1945","False","several time mistaken",0,1,0,1,0,0,0,0,1,0,-1,-1,-2,-1,""
"1946","False","confirmed intimate relationship woman breakup mary far understand sexualism full blown gay long lasting true love asexual mary",0,2,0,0,2,1,0,2,1,4,1.5,1,5,4,""
"1947","False","good luck watching original scene theatre quality audio set mean nice gig home watch queen live performance every compare theatre experience",0,3,0,1,2,0,2,1,0,2,2.4,3,11,2,"Anticipation"
"1948","True","saw last night really enjoyed left completely satisfied wife familar band could stop talking perfect telling freddie life queen run band honestly would like know going hollywood movie expecting one hundred honest telling movie made people know queen song know incredibly popular band arguably one greatest frontman ever ramus nailed felt really captured power freddie moment walking onto stage song certain scene band much cliche romanticized story band thing place timing album etc nailed thing like musical exploration relationship around bandfreddie well music incredibly strong may minority keep hearing alot people wanting see cohen version movie personally know take seriously find time see character think ali g show make job sad deters bit great performance malek put always going could performance unjustified opinion fun movie would recommend going open mind remember movie",2,5,1,2,6,4,1,5,4,9,9.6,10,27,5,"Joy"
"1949","False","outsider loner weirdo thing cliche someone start trend",0,1,0,2,0,0,0,0,1,1,-2.2,-3,0,0,"Fear"
"1950","False","nobody coming see otis",0,1,0,0,0,0,0,0,0,0,0,0,0,0,"Anticipation"
"1951","False","freddie fucked need label",0,0,0,0,0,0,0,1,0,0,-0.8,0,-4,0,"Trust"
"1952","False","beggin leave _and refuse let go_",0,0,0,0,0,1,1,0,2,0,-1,-1,-3,-2,""
"1953","True","despite simplistic shallow time pleased film entertaining ramus completely obliterated role freddie mannerism expression flamboyance felt every aspect freddie amazingly represented every stare gesture movement made also felt pain started feeling cast aside yes moment meant emotional barely scratch surface much detail dude life still film incredibly bold brave representing partner choice well funny quite entertaining going earn good money",3,6,1,3,6,2,4,3,3,12,7.7,1,14,9,""
"1954","True","crazy mary dad played simon pegg fat suit makeup",1,0,1,1,0,2,0,0,2,0,-1.25,-2,-2,-2,"Sadness"
"1955","False","gt felt every aspect freddie amazingly represented every stare gesture movement made also felt pain started feeling cast aside really many saying freddie certainly flamboyant outside performance drawn also freddie effeminate seen mean malek great actor fantastic like rest film aspect performance rang hollow",1,1,1,2,2,3,2,1,4,4,1.25,2,7,0,"Sadness"
"1956","False","haha room comparison spot think someone randomly say legend fred sound like bad dub even make sense context scene could see coming right room",1,1,1,1,0,1,1,0,1,1,0.3,0,2,0,""
"1957","False","even freddie like real life actually script fault matter much influence malek still follow deeply center character malek trying protray whether inconsistency real mercury know biopic movie job protray mercury got intrigued malek performance guess forgot",0,0,0,0,0,1,1,2,3,5,1.2,-1,2,2,"Trust"
"1958","True","anyone live aid irl feel see reenacted dis make good job presenting film",0,1,0,0,1,0,1,1,0,3,1.75,1,3,3,""
"1959","False","think kind presented live aid one band highlight wanted end high note freddy said want life focus tragedy cautionary tale ended",0,0,0,2,1,1,0,1,1,4,1.55,-2,3,3,"Fear"
"1960","True","loved movie little shallow care like queen like movie get blood going also ramus malek great gwilym lee bryan may fantastic could found better person play one time fave guitarist nice see accurately portrayed",0,1,0,0,1,0,0,1,0,1,5.75,7,19,1,""
"1961","False","full queen live aid performance recently uploaded youtube seeing movie twice watching actual performance lot thing pretty spot check",0,1,0,0,1,0,0,1,0,4,2.55,1,1,4,""
"1962","False","queen fan since seventy-three read lot seen lot interview never seen anyone describe freddy sort as sure like human being moment always seemed likable person though doubt johnny rotten would agree",0,0,0,1,0,1,0,1,1,1,0.25,0,4,0,""
"1963","False","watching knew comment reference wayne world learned playing foster awesome cameo",0,0,0,0,0,0,0,0,0,0,0.6,1,4,0,""
"1964","True","fantastic movie feel like need book tickes queen machine awesome coverband",0,0,0,0,0,0,0,1,0,0,1.85,3,10,0,"Trust"
"1965","True","check iconic vintage queen tshirts find anywhere else free shipping worldwide fifty release bohemian rhapsody great movie",0,0,0,0,0,0,0,0,0,0,1.6,2,4,0,""
"1966","False","gt many saying freddie certainly flamboyant outside performance know source freddie quote heard even friend reporting said usually sound pretty flamboyant lot darling guess possible way two hundred and forty-seven heard would terribly unusual either",0,2,0,0,3,1,2,3,1,4,1.1,0,-1,3,""
"1967","False","scene walking trailer stage got goosebump incredible",0,0,0,0,0,0,0,0,0,0,0.5,1,0,0,""
"1968","False","real freddie pretty distracting teeth becomes especially evident see shot side singing one concert",2,2,0,1,1,1,1,3,2,3,0.6,0,1,1,"Trust"
"1969","False","maybe lil bitch actually teared revealed illness band scene win paying much attention technically correct scene done",1,0,1,2,0,2,0,0,2,1,-0.4,0,-3,-1,""
"1970","False","agree push stuff far enough also apparently freddie bi really gay bunch male female sexual partner throughout life movie kind made declaration gay shot coke table never really get addressed get rearranging thing happened movie would end live aid show question big falling never actually happened drama already enough need add even",1,0,0,1,1,2,1,2,2,6,1.8,0,3,4,""
"1971","False","feel like know freddie asshole much performer impossible little bit swollen ego cared people around still bit lead singer syndrome think balanced well",1,0,1,0,0,1,0,0,3,3,-0.0499999999999999,1,-1,0,""
"1972","False","name documentary",0,0,0,0,0,0,0,0,0,0,0,0,0,0,""
"1973","False","know much history going usually see movie based true story look two movie think inaccurate ruined argo post little bit inaccuracy get way live aid needed last scene big moment queen story happened still needed movie feel like big fault big falling never happened would liked little drugalcohol habit whatever",1,0,1,1,0,3,0,0,4,1,-0.8,-3,4,-2,"Sadness"
"1974","False","perfectly casted especially brian may though",0,0,0,0,0,0,0,0,0,0,0.5,1,3,0,""
"1975","False","thought girl end fucking world second",0,1,0,0,0,0,0,0,0,0,-1,-1,-4,0,"Anticipation"
"1976","False","gt think sacha would reduced everything freddie cocaine orgy say sacha would written script",0,0,0,0,0,1,0,0,1,1,-0.25,0,0,0,"Sadness"
"1977","False","ooohhh really paying attention part thought kind sabotage waiting something bad happen thanks clearing",2,2,2,2,1,2,1,1,2,2,-0.15,-2,-1,0,""
"1978","False","stated wanted include insane party freddie nude waitstaff dwarf tray cocaine head sure would influence script",1,0,0,1,0,1,0,0,3,3,-0.4,-1,-2,0,""
"1979","False","right",0,0,0,0,0,0,0,0,0,0,0.8,1,0,0,""
"1980","False","similar facial feature",0,0,0,0,0,0,0,0,0,1,0,0,0,1,""
"1981","True","saw movie yesterday really enjoyed thing pretty much jersey boy treatment queen think original musical middling film adaptation exactly deep uncompromising look trouble freddie mercury rest band probably would difficult pull single film without treading lot ground musician biopics tbh upbeat love letter queen work others said live aid performance really highlight film",1,3,1,1,3,1,1,3,1,6,4.85,2,5,5,""
"1982","True","review going incredibly biased since absolutely massive queen fan according stats played queen song fifteen thousand time brian may reason play guitar think one point one hundred bootlegged concert pretty much predisposed like movie totally get people would like superficial totally really care liked even condense lot mix thing eg making john deacon join band time freddie simply true fat bottomed girl playing first u tour despite coming one thousand, nine hundred and seventy-eight john deacon singing making bohemian rhapsody actor got play brian john fucking amazing totally unreal attention detail amazing especially live aid scene watched time wish count absolutely nailed small little thing like making fun lyric sweet lady freddie cat named delilah also good song innuendo freddie party go watch hard life see getting overall hollywood version band frankly queen song meant heard loud really complain much",1,7,2,1,4,2,2,5,6,9,5.25,1,18,4,"Anticipation"
"1983","False","really queen fan either really enjoyed maybe point flaw inaccuracy way diehard queen fan really give shit critic think movie thought fucking great yes good time",1,3,1,0,1,1,1,1,3,1,-0.75,-2,0,-2,"Anticipation"
"1984","False","neil foxroberts would like word",0,0,0,0,0,0,0,1,0,1,0.5,1,2,1,"Trust"
"1985","False","yes private pretty ashamed malik hand playing squirrel time freddie",0,2,1,0,1,1,0,1,1,1,0.55,0,0,0,"Anticipation"
"1986","False","prepare disappointed",1,1,1,0,0,1,0,0,1,1,-0.9,-1,-2,0,""
"1987","False","interview usually quite reserved often shy seen film trailer seemed malek playing freddie character played stage still incredible feat pull seeing film look like heightened reality expecting actually historical experience",0,2,0,0,1,0,1,0,0,2,1.1,3,1,2,"Anticipation"
"1988","False","teenager going headbang car best line ever",0,0,0,0,0,0,0,0,0,0,0.5,1,3,0,""
"1989","False","ask around liveaid happened",0,0,0,0,0,0,0,0,0,0,0,0,0,0,""
"1990","False","caught reference wayne world right away like minute later even though would already realized mike meyers playing character clicked appreciated",0,0,0,0,0,0,0,0,0,0,2.05,3,4,0,""
"1991","False","exactly right became queen fan wayne world",0,0,0,0,0,0,0,0,0,0,0.8,1,3,0,""
