"","Parent","Comment","Anger","Anticipation","Disgust","Fear","Joy","Sadness","Surprise","Trust","Negative","Positive","Synzhet","Bing","Afinn","NRC","Emotion"
"737","False","think song fan message think played well musically felt heavyhanded standing guard advocating helping poor could evidence enough convince father especially since song soliloquy hear character also feel vein original music maybe nostalgia care",0,1,0,1,1,1,0,3,0,4,2.15,2,6,4,"Trust"
"738","True","holy crap jafar casting ton evil feeling naomi scott pretty good movie pretty good soundtrack",2,3,3,2,3,2,2,3,3,4,0.5,1,-1,1,""
"739","True","ok litertally got done watching movie writing sitting seat enjoy lot oeiginal coming ome grew original full stop one replace robin williams rip excellent job take character could feel essence character ever feel like ever trying copy robin good thing add lot think needed think ppl would unfairly say like original overall song great much better character development original jafar probably gripe remake original could feel intimidating evil one could notbut overall say go see worth onee sit",1,3,1,1,3,1,1,3,2,7,1.65,2,11,5,""
"740","False","yea great genie blew away seen new live action aladdin know good smith genie musical epitome bringing unique style different robin williams",1,2,0,0,2,1,3,3,0,5,3.25,2,6,5,""
"741","True","huge fan jasmin handmaid thought hilarious stole every scene also like changed arrangement song arabian night felt especially fresh part big fan new song felt different older one seemed stick little however thought editing second time sung awesome think actually favorite live action remake far one thousand and ten movie ended theater actually applauded seen happen",0,3,0,0,2,1,1,1,0,4,4.65,4,16,4,"Anticipation"
"742","False","absolutely true mark looking something mad never cold independent believable top",1,1,1,1,0,1,0,1,2,1,0.05,0,1,0,""
"743","True","loved joke genie continuing forget aladdin name friend like",0,0,0,0,1,0,0,1,2,1,2.3,1,7,-1,""
"744","True","favorite part jasmine singing going get driver license",0,0,0,0,1,0,0,1,0,1,0.75,1,2,1,""
"745","False","considering work man uncle expecting lot action scene whole cave scene prince ali song brilliant though",0,2,0,0,1,0,0,1,0,3,2.1,1,4,3,"Anticipation"
"746","False","oh gotcha",0,0,0,0,0,0,0,0,0,0,0,0,0,0,""
"747","True","felt like actually good one minor plot hole jasmine could rubbed lamp instead sequence trying get alladin",0,1,0,0,1,0,1,1,0,1,1.25,1,5,1,""
"748","False","heard khaled fled theatre",0,0,0,1,0,0,0,0,0,0,-0.8,0,0,0,"Fear"
"749","True","realized anyone else think song speechless could pas bond song sound like something could part bond title great song",0,0,0,0,0,0,0,1,0,1,1,2,5,1,"Trust"
"750","True","pro smith far surpassed expectation genie provided seventy-five energy humor movie dalia also awesome genie relationship cute colorful beautiful look hilarious dance scene con absolutely awful new song sung jasmine questionable accent everyone agrabah quasi middle eastern accent jasmine aladdin jafar whiny insecure psycho instead intimidating villain jasmine aladdin chemistry ehh",2,1,2,3,3,2,1,2,4,5,-0.4,1,4,1,""
"751","False","agree opinion affleck batman bright spot bvs batman saw jl totally different batman bvs plus plenty wrong dceu movie batman would argue enchantress leto joker steppenwolf poor cgiwriting jl poor writing bvs martha anyone eisenberg lex worse batman",1,0,0,1,1,1,1,0,3,2,-1.6,-3,-5,-1,""
"752","False","alluding",0,0,0,0,0,0,0,0,0,0,0,0,0,0,""
"753","False","yeah bugging first seemed like character really desire treasure touching order break rule like aladdin necklace ruby",0,1,0,1,1,0,1,2,0,1,1.1,0,6,1,"Trust"
"754","True","new song place like someone realized needed transition guard changing side could wrap film instead putting thought sensical transition hit u nowhere pop ballad girl power guard decide see error way return sultan message great even thought song catchy maybe bonus track soundtrack hit shelf plot point sloppy execution place compared tone scene",2,3,1,3,1,2,2,2,5,3,0.1,1,1,-2,""
"755","False","thank underrated gem deserves due one best original superhero movie ever made",0,0,0,0,1,0,0,0,0,1,1.5,3,8,1,"Joy"
"756","False","god made universe exists outside bound time constraint universe made hence infinite eternal declares heaven throne earth footstool name jesus christ douknowhim coming soon much time left woe worth day see ezekiel three thousand and thirteen john three hundred and sixteen amp x200b amen",1,3,2,3,2,2,0,3,4,5,1.8,1,6,1,""
"757","False","decide second finish movie",0,0,0,0,0,0,0,0,0,0,0,0,0,0,""
"758","False","least five time felt like six even three still many time lame cliche happen",0,2,0,0,0,0,0,0,0,0,-0.5,-1,0,0,"Anticipation"
"759","True","wow aladdin lowkey huge release recall thought coming much later",0,2,0,0,0,0,0,0,0,0,0.5,1,5,0,"Anticipation"
"760","False","credit movie lol",0,0,0,0,0,0,0,1,0,1,0.4,0,3,1,"Trust"
"761","False","really high hope chiwetel ejiofor scar feel like great job",1,1,1,1,1,1,1,1,1,2,1,1,5,1,""
"762","False","asking sequel live action remake actually bad idea much like taking idea king thief flesh aladdin character appreciated jasmine necessary character change made aladdin one sidelined title character",2,1,3,3,0,2,1,1,2,4,-0.15,1,1,2,""
"763","True","movie needed hakim",0,0,0,0,0,0,0,0,0,0,0,0,0,0,""
"764","True","overall thought good enjoyed aladdin alltime favorite classic disney movie next lion king beauty amp beast little worried first worked end first minute weakest think arabian night fine whereas like one jump ahead also like made jasmine afraid jump guess trying get become outspoken whatnot original think already pretty defiant made sad changed thought smith amazing job making genie thought movie improved moment character introduced fine jafar dhalia little plot cute well upset get jafar reprisal prince ali really waiting thought speechless little place song appeared movie loved actual song also thought great made genie human though guess mean sequel getting liveaction treatment completely fine good movie though glad went go see",4,5,0,4,6,3,2,4,6,16,8.3,10,22,10,"Joy"
"765","False","liked prince ali feel like whole new world hold magic cartoon original wide shot carpet starlittered sky backdrop least expecting jasmine skim water hand flew water felt like let u go back forth closeup actor clearly gimble front green screen broll landscape night",1,1,0,1,1,1,1,1,1,3,2.75,4,5,2,""
"766","False","sequence gladly accept shotforshot remake",0,0,0,0,0,0,0,0,0,1,1.5,1,1,1,""
"767","False","right thought missed something setting exception",0,1,0,0,0,0,0,0,0,0,0.3,0,-2,0,"Anticipation"
"768","False","exactly wanted one great box office greatly rewatchable heard read one think way finger crossed",0,0,0,0,0,0,0,0,0,0,0.5,1,3,0,""
"769","False","remember ago casting announced big rumor hugh jackman would scar one hundred",1,0,1,1,0,2,0,0,2,0,-0.5,-2,-1,-2,"Sadness"
"770","False","guy ritchie production popped screen idea completely floored",0,1,0,0,0,0,0,0,0,2,0.25,-1,0,2,"Anticipation"
"771","True","loved jasmine alladin perfectly cast loved chemistry whole new world throughout enjoyed two thousand and nineteen update jasmine character totally sultan",0,0,0,1,0,0,0,0,0,0,2.8,3,8,0,"Fear"
"772","False","heihei moana",0,0,0,0,0,0,0,0,0,0,0,0,0,0,""
"773","False","oh man kind imagining australian scar know feel yet",1,0,1,1,1,1,0,1,1,1,0,-1,0,0,""
"774","False","yes",0,0,0,0,0,0,0,0,0,0,0.8,0,1,0,""
"775","False","buy reddit account ya know marketing firm approached account offered two hundred",0,0,0,0,0,0,0,1,0,0,0,0,0,0,"Trust"
"776","True","first ten minute dire idk heck happened editing pacing pick smith good naomi scott good job song really shoehorned place unfortunately made story jafar action make little sense original genie first song prince ali arrival song really well done thought",0,3,1,1,1,1,2,2,1,6,0.15,-1,0,5,"Anticipation"
"777","False","every actor autotuned",0,0,0,0,0,0,0,0,0,0,0,0,0,0,""
"778","False","think easter egg though mean caught reference nicholas brother",0,0,0,0,0,0,0,1,0,1,0.4,0,0,1,"Trust"
"779","True","well decent dj khalid",0,0,0,0,0,0,0,0,0,1,1.3,2,0,1,""
"780","True","got theater late walked tail end arabian night miss anything beginning",0,0,0,0,0,1,0,0,1,0,-0.25,-1,-2,-1,"Sadness"
"781","False","frank welker cave wonder abu rajah think first animated reprise voice acting original",0,0,0,0,1,0,0,1,0,2,0.4,0,0,2,""
"782","False","audience score rt high ninety-one iirc feel like go movie ready pick apart enjoy different take animated disney classic like critic definitely feel disappointed unsatisfied",1,4,2,0,3,2,1,1,3,5,0.7,2,-2,2,"Anticipation"
"783","False","list 5x",0,0,0,0,0,0,0,0,0,0,0,0,0,0,""
"784","False","honestly iago pretty scary",0,1,0,0,1,0,0,1,0,1,0.25,0,-1,1,""
"785","False","wrong",0,0,0,0,0,0,0,0,1,0,-0.75,-1,-2,-1,""
"786","False","saw touring cast jafar previously played scar well fun little disney villain connection",1,1,1,2,1,1,0,0,2,1,0.05,1,2,-1,"Fear"
"787","False","youtube rewind better knowing thing",0,0,0,0,0,0,0,0,0,1,1.4,1,2,1,""
"788","False","one actually fell pretty flat people theater seemed bored thought prince ali captured spirit original pretty well though probably agree one jump ahead awful",1,2,1,1,2,2,0,1,2,6,2.2,-1,-2,4,""
"789","False","conclusion disney better sequel one jafar",0,1,0,0,0,0,0,0,0,0,0.8,1,2,0,"Anticipation"
"790","False","actually thought might go mentioned mother second",0,2,0,0,1,1,0,1,1,1,0,0,0,0,"Anticipation"
"791","False","judge movie trailer especially cgi one",0,0,0,0,0,0,0,0,0,0,0,0,0,0,""
"792","False","well would necessarily need australian accent think hugh singing voice really amp sadistic yet showman aspect scar",1,0,1,1,0,1,0,0,1,0,-0.7,0,-2,-1,""
"793","False","yes sweeping jasmine hair gesture think",0,0,0,0,0,0,0,0,0,0,0.8,1,1,0,""
"794","False","everything seen great rogue one firefly dodgeball wreck ralph one amp two zootopia moana etc also fantastic dollhouse another show cancelled time godamn great dollhouse",1,1,2,1,0,1,1,1,2,0,-0.8,0,4,-2,"Disgust"
"795","False","gt jasmine solo number tried picturing one thousand, nine hundred and ninety-two animated form could much like beast solo song live action batb reminded actually really liked song shoehorned pretty awkwardly",1,1,0,1,2,0,0,1,1,3,1.9,3,5,2,"Joy"
"796","False","link disneyvevo youtube playlist anyone want go back 90 2000s smith use rap end movie dj khalad two thousand and nineteen loved need release another album",0,0,0,0,0,0,0,1,0,0,0.5,1,4,0,"Trust"
"797","True","seem like actually fly around world whole new world",0,0,0,0,0,0,0,0,0,0,1.3,1,2,0,""
"798","True","wish filmed stretch fall carpet aladdin first kiss movie actually made really appreciate good acting animation really liked movie although mena could sing naomi especially naomi superb naomi scott going big star life going change overnight acting tremendous great adaptation hat guy ritchie",0,4,0,1,4,2,2,3,1,5,6,4,19,4,""
"799","False","guy ritchie filmed big snake scene king arthur sure want",0,0,1,1,0,0,0,0,1,1,0.1,0,2,0,""
"800","False","yes momentarily turn mummy saying bringing people back dead",0,0,0,0,0,0,0,0,0,0,-0.2,-1,-2,0,""
"801","False","notice prince genie created background color similar fresh prince beliare pink green",0,0,0,0,1,0,0,1,0,2,1.1,1,1,2,""
"802","True","quick question rajah tiger remain dead end movie",0,0,0,0,0,0,0,0,0,1,-1,-1,-3,1,""
"803","False","right curious whether still rule kill anyone",0,0,0,2,0,1,0,1,1,0,0.45,0,-2,-1,"Fear"
"804","False","along ending short dance sequence credit",0,0,0,0,1,0,0,2,0,2,1,0,0,2,"Trust"
"805","True","overall liked movie however three thing like one iago brought back gilbert gottfried two opening scene used agrabah palace middle desert instead middle ocean three think wayne brady would better genie smith think smith would better jafar",1,0,1,1,0,1,0,1,1,0,1.3,2,6,-1,""
"806","False","sherlock one amp two snatch king arthur legend sword man uncle give shot though exactly quality loved every one entertaining like style nice change pace loved scene sherlock two game shadow",1,1,0,2,1,1,1,0,1,2,1.95,4,12,1,"Fear"
"807","True","overall really sweet fun movie good ninety-three version course thing really worked one naomi scott beautiful killed jasmine speechless song fit massoud also quite charming ali new girl aka nasim pedrad hilarious two smith mostly good awkward moment def felt confusion direction friend like prince ali absolute banger made comedic moment really work especially jam speech three tone film whimsical nice take live action jungle book beauty beast felt serious time bollywoody cartoony overall played strength four costume set design also really fantastic script direction mostly good weirdly paced moment jafer bad advertised finale also felt bit lackluster much better expecting said make want watch ninety-three version",4,7,1,6,8,1,4,5,5,15,8.25,6,29,10,"Joy"
"808","False","smith never disappointed film seen looked great trailer tone aladdin recognizing excited lived exceed expectation bring sequel remake",1,4,1,0,2,1,1,2,1,4,1,2,4,3,"Anticipation"
"809","False","first trailer occasionally final render time thing still rendered day release example like comparison gotg one ape cyborg necessarily mean final cgi great better likely long video trailer v final film thor ragnarok spiderman homecoming jurassic world fallen kingdom justice league black panther",0,2,0,0,0,1,0,1,1,3,2.05,2,7,2,"Anticipation"
"810","False","notice colour fresh prince colour title logo fresh prince belair smith made fresh prince",0,0,0,0,0,0,0,2,0,2,1.1,1,1,2,"Trust"
"811","False","jafar said powerful universe something like little grey area specific enough genie theoretically one powerful being universe soooo",1,1,1,1,1,0,0,1,0,1,1,3,3,1,""
"812","False","think song felt place could song frozen think message change jasmine story make perfect sense make way sense ruling monarch aladdin",0,1,0,1,1,0,0,1,0,2,0.5,0,3,2,""
"813","False","well waiting die soooo",0,0,0,1,0,1,0,0,1,0,0.05,0,-3,-1,""
"814","False","gt cataloging ha ha yes fellow human store information use later certainly paid individual damage control disney help alter general public opinion towards weakness film hydraulic noise intensify",1,2,1,0,0,1,0,2,3,5,1.11022302462516e-16,-3,0,2,""
"815","False","favorite movie watch uh kind weird tbh",0,1,1,1,2,0,0,2,1,2,1,0,2,1,""
"816","True","literally fault movie way except genie acknowledging carpet came lamp everything good",0,1,0,0,1,1,1,1,1,1,0.25,0,3,0,""
"817","False","fresh prince easter egg genie explaining specific wish prince created tv show colour also example showed earlier cave original cartoon design",0,0,0,0,0,0,0,1,0,1,1.9,0,2,1,"Trust"
"818","False","remember disney pay lot money curate content public opinion going see lot within thread",1,3,0,0,3,0,1,3,0,4,1.1,0,-1,4,""
"819","False","technically musical star born lady gaga would sing live including bradley cooper would appear like though intensive cutting different scene dancing",2,3,1,1,3,3,1,3,1,4,2.9,1,1,3,""
"820","True","loved actually really loved favorite remake far somebody quote entirety aladdin ninety-two verbatim change made story structure see pretty positive least necessary adaptation think even living rock last thirty year seen original would still enjoyable experience thing noticed changed jafar meet aladdin jafar disguise first allows aladdin get know jafar least little get background jafar coming motivated act also allows genie meet jafar explain aladdin type person climax movie everyone met know set jafar final wish better aladdin parkour master impressive live action draw whatever want live action someone actually stunt genie arrival original instantaneously change film completely different tone happens around third way lyric change agrabah longer barbaric prince ali longer slave nice touch brush friday salaam nasim pedrad hi kind weird smith romantic partner outofmovie know way older actually think serf purpose kind similar gilbert gottfried exsnl cast member establishes movie comedy genie show movie take much broadway musical cartoon film dance scene come con course smith singer since genie give three song autotune noticeable think speechless really add anything choice put middle action scene aside baffling movie clearly shot small set miss iago even think parrot named iago subplot captain guard well set aladdin fuck bad first impression kind kill credibility recovery disney made lot feminist original bad thing story support often really mean jafar wrong say jasmine lived sheltered life would make good sultan read book still got end chasing dude maybe mulan get right",5,8,4,8,8,6,5,14,10,24,11.25,7,11,14,"Trust"
"821","False","yeah foced super hard garbage",0,0,1,0,0,0,0,0,1,0,0,-1,2,-1,"Disgust"
"822","False","nah know bring incredibly forgettablebland performance role required lot charisma evil ness",1,0,1,1,0,1,0,0,1,0,1.45,1,-1,-1,""
"823","False","think lot slow mo tight shot people face",1,0,0,1,0,1,1,0,1,0,-0.65,-1,0,-1,""
"824","False","example king arthur sherlock sherlock two movie tend really energetic frantic pace",0,1,1,1,0,0,1,0,1,2,0.1,0,1,1,""
"825","False","also seems need actually grip instead moving stepping kicking",1,0,0,0,0,0,0,0,0,0,0,0,0,0,"Anger"
"826","False","flew around realistic way",0,0,0,0,0,0,0,0,0,0,0.6,1,0,0,""
"827","False","song basically thought process stand back song ended realized",0,1,0,0,0,0,0,0,0,0,0,0,0,0,"Anticipation"
"828","False","yeah exactly thought thought worked well",0,1,0,0,0,0,0,0,0,0,1.05,2,1,0,"Anticipation"
"829","False","mean know lamp worked",0,0,0,0,0,0,0,0,0,0,0.25,1,0,0,""
"830","False","oh yeah kind mouth",0,0,0,0,1,0,1,1,0,1,0.5,0,3,1,""
"831","False","lot thing unnecessary one grateful make adaptation previous one future one absolute blast love animation love live action much cgi progressed since child make want see classic older film upgraded remade continue sequel see story keep making terminator predator ghostbusters alien rambo die hards pirate caribbean mad max fury road alice wonderland etc seen single sequel remake listed like would definitely watch every one",4,4,2,6,2,4,1,1,6,8,1.1,1,3,2,"Fear"
"832","False","sure movie watched bunch time trying say movie like",0,1,0,0,0,0,0,0,0,0,0.5,1,2,0,"Anticipation"
"833","False","want shoot hercules like wonder woman sort lol",1,0,0,1,0,0,0,0,1,0,0,2,5,-1,""
"834","False","theory",0,1,0,0,0,0,0,1,0,0,0,0,0,0,""
"835","False","highly highly doubt reference youtube rewind highly",0,0,0,1,0,1,0,1,1,0,-0.75,-1,-1,-1,""
"836","True","looking forward magic carpet ride scene whole new world maybe expectation high felt disappointed capture magic animation",1,1,1,0,0,1,0,0,2,2,0.55,0,-2,0,""
"837","True","stretch aladdin meet genie way end whole new world movie best",0,0,0,0,0,0,0,0,0,0,1.3,1,3,0,""
"838","False","touched tempted stealing matter",0,0,1,1,0,0,0,0,2,0,-0.5,-1,-1,-2,""
"839","False","guy absolutely talented entire time thinking chandler quote friend michael flatley scare bejesus leg flail independent body amount coordination brother amazing",1,3,0,1,1,0,2,2,2,3,1.85,1,3,1,"Anticipation"
"840","False","could see jim carey smith killed version robin williams around see maybe",0,0,0,0,0,0,0,1,0,0,-0.5,-1,-3,0,"Trust"
"841","False","really heard actually reprising",0,0,0,0,0,0,0,0,0,0,0,0,0,0,""
"842","False","agreed well reprise prince ali",0,0,0,0,0,0,0,1,0,2,1.9,1,1,2,"Trust"
"843","False","husband made good point said he seen done lot bollywood movie probably",0,1,0,0,1,0,1,1,0,1,0.75,1,3,1,""
"844","False","see genie small boat two child along wife see pas large fancy boat kid say wish boat like genie tell judge thing appearance decides tell story aladdin start sing arabian night",0,4,0,0,3,1,0,1,1,3,3,2,3,2,"Anticipation"
"845","False","felt even tanned role really like look casting since og jasmine pronounced feature also could get smg image head naomi scott killed great honestly real gripe film musical transition jarring laced well number themselved mostly fin transition weak",1,1,0,1,1,2,1,2,1,4,1.15,-1,0,3,""
"846","True","honestly appreciate change made story killed potential make sequel spoiler gt spoiler lt making genie lose form human gt spoiler lt opinion way many song version crappy one yes musical much point stand plot point finally idk spoiler gt spoiler lt making jasmine sultan make sense measure mad woman empowerment anything want empower character least make sense gt spoiler lt movie good however well animated good choice cast except jafar actor suited role going smith amazing job genie respect fact thing attempt copy robin williams overall good movie good remake really hope revert back fuck make sequel really looking forward king thief since one favorite",4,7,4,5,7,5,6,9,5,14,3.3,1,10,9,"Trust"
"847","False","went back listen soundtrack three part right bit odd great observation haha",0,0,0,0,0,0,0,0,0,0,1.05,1,4,0,""
"848","False","argument agree get feeling disney leaving away og jafar portrayal purpose given he political figure animated film hard sell bombastic energy believable real life villain way think disney cut song well think get going said agree say sound argument people simply saying bad agree",3,1,2,3,2,2,1,2,4,4,-0.65,-1,-3,0,""
"849","True","nadim",0,0,0,0,0,0,0,0,0,0,0,0,0,0,""
"850","False","send packing one way trip prospect take terminal dip asset frozzzzzen venue chosen end earth whoopee long ex prince aliiiiiiii mwa hahahaahahahahahaha",0,1,0,1,0,1,1,0,1,3,2.05,0,3,2,""
"851","True","everybody get stuff free jazmine sultan",0,0,0,1,0,0,0,0,0,0,0.5,1,1,0,"Fear"
"852","True","went expectation tried think either tribute film like stage play instead remake mind watched song great even though will rendition arabian night considerably le arabian enjoyed sound got really big toward end actually liked song film friend like prince ali seemed huge got energy like first time also much enjoyed song jasmine excellent singer last song toward end really felt like stage although really sure song needed care huge fan aladdin mostly much dorkier animated character jam scene worked got laugh sure genie think trying sassy think least way line trying convey line pretty funny jam scene party scene though way genie form animated pretty distracting problem human form overall hard compare animation thing like genie instrumental music background came two powerful nostalgia trigger besides pretty fun film",2,6,1,2,8,2,1,4,2,14,10.65,5,31,12,"Joy"
"853","False","said time dungeon would sort think anybody died",0,1,0,1,0,0,0,0,1,0,-1,-2,-3,-1,""
"854","False","parrot named iago jafar refers parrot using name one scene",0,0,1,0,0,0,0,0,1,0,0,0,0,-1,"Disgust"
"855","False","updated comment",0,0,0,0,0,0,0,0,0,0,0,0,0,0,""
"856","True","movie really visually stunning main score never friend like amazing loved smith take character really refreshing good",0,2,0,0,3,0,2,3,0,5,4.7,6,17,5,""
"857","False","mother name",0,1,0,0,1,1,0,1,1,1,0,0,0,0,""
"858","True","nasim killed felt like first true disney movie happened live action good musical",1,2,0,0,2,1,2,2,0,3,2.1,1,4,4,""
"859","False","gt friend like gosh darn bop bop",0,0,0,0,1,0,0,1,0,1,1.3,1,3,1,""
"860","False","well lot people missing key line smith genie say something along line character playing facade sooner later real shine took nod playing genie smith really accepted genie smith way said worth respecting think admits able match original going best",0,0,0,1,0,1,0,2,1,4,4.5,4,3,3,"Trust"
"861","False","smith start career music",0,2,0,0,1,1,0,1,0,2,0.6,0,0,2,"Anticipation"
"862","False","except 100x sexy",0,0,0,0,0,0,0,0,0,0,0.75,1,3,0,""
"863","True","great movie honestly",0,0,0,0,0,0,0,0,0,0,0.5,1,3,0,""
"864","False","waiting magic carpet one show rmoviedetails",0,0,0,0,0,0,0,1,0,0,0.25,1,0,0,"Trust"
"865","False","suppose little better lol",0,0,0,0,0,0,0,0,0,0,0.8,1,5,0,""
"866","True","sad tribute robin williams movie",0,0,0,0,0,0,0,0,0,1,0.1,-1,0,1,""
"867","False","also make jarring uneducated everything else problem lot addition upsetting idea belle succeed falling love beast beast servant practically die take romance story plus make really hard sincerely fall knowing happen book teleport people anywhere meaning beast longer trapped dark scary castle essentially go anywhere whenever would want sorceress putting spell castle community making practically punishing everyone town prince behavior original said old lady asked shelter cold door prince reject new version old lady interrupt prince party home enters castle without asking like maleficient sleeping beauty prince wrong wanting help someone storm house",5,3,0,7,4,11,3,4,15,8,-4.2,-9,-2,-7,"Sadness"
"868","True","loved movie loved opening credit much long shot agrabah arabian night great",1,1,0,1,0,1,1,1,1,1,1,2,6,0,""
"869","False","exception like star born really helped make better guess speechless aladdin live well rest recorded sound booth",0,1,0,0,1,0,1,1,0,2,3.5,4,4,2,""
"870","False","mad lol far",1,0,1,1,0,1,0,0,1,0,-0.75,-1,0,-1,""
"871","False","yes simplification music evaluate singer three metric tone pitch phrasing starting rapper known tone phrasing nobody would ever say could sing pitch hence autotune",0,1,0,0,2,2,0,1,0,2,2,0,1,2,""
"872","False","character called razoul",0,0,0,0,0,0,0,0,0,0,0,0,0,0,""
"873","False","bruh credit rolling light everyone leaving theatre literally small thing bitch",1,0,1,1,0,1,0,1,2,1,-0.6,-1,-5,-1,""
"874","False","working local theatre industry proud boy one oversung song audition performance casual professional rather five thousand and fifty omission haha",0,1,1,0,1,0,0,2,1,3,1.85,0,5,2,"Trust"
"875","False","one jump ahead seemed jarring first figured creative",0,0,0,1,1,1,0,0,1,3,1.05,0,2,2,""
