"","Parent","Comment","Anger","Anticipation","Disgust","Fear","Joy","Sadness","Surprise","Trust","Negative","Positive","Synzhet","Bing","Afinn","NRC","Emotion"
"2261","True","aladdin favorite disney movie amd hated take terrible acting aladdin jasmine jafar sultan jolly jafar way young like creep sinister turn snake jamsine sultan get put hour glass slow mo speed effect cheesy poor taste smith good choice cast genie funny going feeling whole beatboxing tapping thing also arabian night sung accent new one american accentthe lamp rubbed order make wish know lot people enjoyed movie absolutely terrible",3,3,4,5,4,2,3,4,5,5,3.7,-3,7,0,"Fear"
"2262","False","agree could done much better",0,0,0,0,0,0,0,0,0,1,1.3,1,3,1,""
"2263","False","agree much except using hugh jackman maybe goofier actor like jim carey",0,0,0,0,0,0,0,0,0,1,1,1,3,1,""
"2264","True","look massacred boy",0,0,1,0,0,0,0,0,1,0,0.25,0,0,-1,"Disgust"
"2265","False","terrible addition",1,0,1,1,0,1,0,0,1,0,-0.75,-1,-3,-1,""
"2266","True","say want say absolutely loved movie know probably best say liked way original albeit original great one seemed flow better humor taste also really liked redone music like prince ali song would put nine hundred and ten one thousand and ten honestly think newer movie enjoyed much last year two besides shazam saying like definitely understand criticism also think seen yet give watch definitely worth much",1,1,0,1,1,2,0,0,1,4,5.75,8,20,3,"Sadness"
"2267","True","cgi help movie",0,0,0,0,0,0,0,0,0,0,0,0,2,0,""
"2268","True","aladdin done great even feel like surpasses original reason first le optimistic genie lot believable someone seen power corrupt people thousand year would ready accept aladdin claim readily even still somewhat believe aladdin would true word second showed aladdin corruption lot better animated film even ten pick fact aladdin corrupted power jafar one humbled granting genie freedom movie even seven year old sister could figure aladdin better jafar climax story third like made jafar whole lot villainous giving street rat backstory aladdin might add foreshadowed aladdin corruption comparing main villain end movie gt instead toying aladdin jasmine sultan straight threatens kill aladdin barely able stop telling genie powerful lt feel like movie getting hate deserves lot come smith genie feel like perfect would rather cgi genie oversized chin hell thought looked creepy would terrifying think people go movie expecting aladdin trash remake aladdin would lot happier movie thought",4,6,7,8,5,5,1,7,9,13,2.65,2,-1,5,"Fear"
"2269","False","sure given character jasmine original moment even make sense strong original stand directly jafar problem happened really jarring time plus song stood bad way sound like written totally different time period rest music strong character also smart write strong chart say audience want see trying appeal emotion guard standing directly next sorcerer murder jasmine entire lineage one motion bad idea worked script said moment made rational sense like avenger woman power moment great really inspiring female fan especially younger one writing suffered sense character teleported location moment happen organically forced chart say make money add entire rest movie amazing wtf scene",4,6,2,6,2,5,2,4,6,10,2.2,4,3,4,""
"2270","False","avenger moment happened specifically sexist fan hated danvers reason russo bro decided teabag people",1,0,0,0,0,0,0,0,1,1,-0.65,-1,-4,0,"Anger"
"2271","False","thank god align original story jasmine actually character welcome change one",0,1,0,2,1,0,0,1,0,1,1,2,5,1,"Fear"
"2272","False","audition mistook preganglionic fiber postganglionic nerve end",0,0,0,0,0,0,0,0,0,1,-0.4,0,0,1,""
"2273","True","aladdin two thousand and nineteen full movie hd quality stream free without sign",0,0,0,0,0,0,0,0,0,1,0.5,1,3,1,""
"2274","False","gt would anyone look natural blue missing half body take thing serial killer would wonder six hundred alex",0,1,0,1,0,2,0,0,1,0,-0.9,0,-1,-1,"Sadness"
"2275","False","latin american version actually voiced real drag queen glorious",0,0,0,0,0,0,0,1,0,1,0.25,0,1,1,"Trust"
"2276","False","reservation honestly expected nothing pleasantly surprised movie year one afi top one hundred list absolutely pretty fun joked girlfriend smith fucking genie think nailed many scene laughing as writing acting bit corny guess like part suffered beginning act three film started take seriously luckily reverted back cartoony tone long fun watch song fun",0,6,0,1,3,0,2,3,0,4,1.65,3,7,4,"Anticipation"
"2277","False","great know thank",0,0,0,0,0,0,0,0,0,0,1,2,5,0,""
"2278","True","remember original well jafar turning sorcerer seemed really op like previous master wish maybe also jafar voice really lame weaksounding compared original",0,0,0,0,0,0,0,0,0,1,1.6,2,1,1,""
"2279","True","remember original well jafar turning sorcerer seemed really op like previous master wish maybe also jafar voice really lame weaksounding compared original",0,0,0,0,0,0,0,0,0,1,1.6,2,1,1,""
"2280","False","honestly went zero expectation enjoyed movie like idea honestly liked everything",0,1,0,0,0,0,0,0,0,1,2.25,3,6,1,"Anticipation"
"2281","True","feel like tried hard pull let go speechless even turn balcony voice sounded autotuned",0,0,0,0,0,0,0,0,0,1,0.25,0,1,1,""
"2282","False","jafar wished genie original fact incredibly powerful know people wish genie maybe hungry power",1,2,1,1,1,0,0,2,1,1,2.1,2,3,0,""
"2283","False","gt part big fan new song felt different older one seemed stick little good song yeah fit well could really tell written twenty year apart felt modern really seem fit arabian theme",0,1,0,0,1,1,1,1,0,1,3.6,3,9,1,""
"2284","False","eh yell throughout song actual song definitely smith rap song featured dj khaled vice versa good miss day smith would rap end movie",1,1,0,1,1,0,2,2,2,2,0.8,-1,1,0,""
"2285","False","honestly like smith play smith fun actually felt like fun movie",0,1,0,0,1,0,0,1,0,1,1.25,2,6,1,""
"2286","False","religion exists mean allah actually really existence genie kind run counter islam",0,0,0,0,1,0,0,2,0,2,0.5,0,2,2,"Trust"
"2287","False","happened original",0,0,0,0,0,0,0,0,0,0,0,0,0,0,""
"2288","False","knew would get trapped lamp",0,0,0,0,0,0,0,0,0,0,-0.5,-1,-2,0,""
"2289","True","get picture sonic genie please",0,0,0,0,0,0,0,0,0,0,1,0,1,0,""
"2290","False","original racist lyric heard since one thousand, nine hundred and ninety-two original theatrical showing changed home release unless watched theater version people heard altered lyric would wager lyric everyone remembers come vhs fair say would almost forgotten point people keep bringing",0,0,0,1,0,1,0,0,1,1,-0.75,0,-2,0,""
"2291","False","got downvoted thinking thing",0,0,0,0,0,0,0,0,0,0,0,0,0,0,""
"2292","True","ever wondered would like hollywood made mainstream bollywood film neither know",0,0,0,0,0,0,0,0,0,0,0.5,1,2,0,""
"2293","False","least google image suggested maybe better one",0,0,0,0,0,0,0,0,0,0,0.8,1,2,0,""
"2294","False","clutch fam",0,0,0,0,0,0,0,0,0,0,0,0,0,0,""
"2295","False","wait rumor included prepared live action lion king",0,2,0,1,0,1,0,1,2,5,1.05,-1,1,3,"Anticipation"
"2296","False","let get straight seen rocketman four time came today seen endgame four time took month really must loved one guess",0,1,0,0,0,0,1,0,0,0,1.1,1,4,0,""
"2297","False","huge fan bookend either mostly opening one felt entirely rushed short proper introduction",0,0,0,0,0,0,0,0,0,1,0.5,1,4,1,""
"2298","False","smith genie surprisingly favorite part film thought fantastic job emulating robin williams also adding spin character",0,2,0,0,1,0,1,2,0,2,1.5,2,6,2,""
"2299","False","released last week mate week earlier uk u opening night friday think sat",0,0,0,0,0,0,0,1,0,1,0.6,0,0,1,"Trust"
"2300","False","fair enough guess get movie least",0,0,0,0,0,0,1,0,0,1,0.5,2,2,1,"Surprise"
"2301","False","define objectively bad point criticism subjective good chunk people seen disagree",3,1,1,1,1,2,1,1,3,1,-1.5,-2,-4,-2,"Anger"
"2302","False","compared mastery genre defining animated one need remake something good perfect watching remembering magic energy original heartbreaking ok lot come robin williams performance performace therefore whole film film genie aladdin unique written specifically mind got heart originality one could never williams riffing never ending assault pure quick wit thought energy beaten film might ok lot people stand alone film heard anyone say loved remake stand alone film compared original animation fall long long way short mark",2,4,0,1,4,1,3,3,2,8,2.9,4,1,6,""
"2303","False","none objective",0,1,0,0,0,0,0,1,0,1,0.4,0,0,1,""
"2304","False","consider film meant remake original animated film two hour boring lazy attempt honouring ninety minute concise funny original classic heart passion enthusiasm compared original compared without cushion animation version aladdin internal logic message thoughtful kid movie right version whimsical enough fantasy charismatic enough love story film like high standard meet fails meet every single turn iago genie streetrat sultan capture original single person comparing film would say one come anywhere near animated version make objective",0,4,0,1,5,0,1,3,3,9,7.05,6,9,6,"Joy"
"2305","False","source material nothing disney aladdin",0,0,0,0,0,0,0,0,0,0,0,0,0,0,""
"2306","False","objective failure everyone would need agree point laid many people making opinion subjective objective ninety-four audience score clearly lot people disagree rewatched animated kid sorry liked live action different people different opinion saw heart passion enthusiasm liked smith genie liked genie addressed whole ego trip aladdin go oh man cartoon ego trip way worse thought nervousunsure gift presentation hilarious even liked much love story realistic one fall love like three day",1,7,1,2,7,3,5,3,4,10,4.15,3,6,6,""
"2307","False","hate right haha",1,0,1,1,0,1,0,0,1,0,0.05,0,0,-1,""
"2308","False","market going want bland white male protagonist sell ticket",0,1,0,0,1,0,0,1,1,1,-0.1,-1,1,0,""
"2309","False","really dense care manga whatever heck going talking movie disney movie two disney movie titled aladdin original one thousand, nine hundred and ninety-two remake two thousand and nineteen hard understand stay topic leave",0,0,0,0,0,1,1,0,1,1,0.25,-3,0,0,""
"2310","True","naomi scott hot",1,0,0,0,0,0,0,0,0,0,-0.25,1,0,0,"Anger"
"2311","False","like bringing princess bride great example live action movie full whimsy feel like disney sucked silly fun took seriously aladdin picture",0,2,0,0,3,0,0,1,1,5,2.7,1,8,4,"Joy"
"2312","False","nononono nuh uh aladdin disney aladdin based story like jungle book element original story cartoon adaptation totally valid remake one thousand, nine hundred and ninety-two movie yes exist vacuum influence original source material adaptation oh fucking make leave little piece shit",1,0,1,1,0,1,1,0,3,2,-0.7,-1,-6,-1,""
"2313","False","gt element original story cartoon adaptation totally valid stop right wrong original post comparing two movie nothing else lunatic keep talking book talking disney production original disney movie nothing china greece russia save magic carpet scene aladdin fly jasmine egypt et al one thousand, nine hundred and ninety-two movie set middle east end story wiggle room",1,1,1,1,1,0,0,1,2,2,-0.25,0,-4,0,""
"2314","False","wow thought better original",0,1,0,0,0,0,0,0,0,0,1.3,2,6,0,"Anticipation"
"2315","False","gt honestly found enjoying much deviated original wished done lot everything essentially shotforshot original fell flat new part much interesting kind wish adaptation remake would take liberty rarely match let alone eclipse original may well aim spirit first literal translation",0,2,0,0,4,1,1,5,1,7,4.9,3,6,6,"Trust"
"2316","False","see interesting find auto tune bad obviously two thousand and nineteen comparison emma watson beauty beast may well live musical first bit cringy agree found stride got cave part worried turned best part smith thought killed ill honest die hard fan animated disney movie still watch regular basis twenty-nine thanks begrudgingly watched live action version see far best adaptation far",5,3,3,6,5,6,1,4,5,8,1.25,-1,1,3,""
"2317","False","jafar looked really young moment got hand lamp smile looked stupid",0,1,0,0,2,0,2,1,1,2,0.15,0,0,1,""
"2318","False","shadowlands endless night good example lion king expanded musical motif original score well",2,3,0,2,4,2,3,3,1,6,2.35,2,3,5,"Joy"
"2319","False","felt jafar le villainous maybe lack expression compared smith genie okay part perfectly twelve way old animated genie twelve smith many year sister apart feel like giant age gap",1,0,1,2,1,0,0,1,3,1,-0.35,0,3,-2,"Fear"
"2320","False","damn commie tell",1,0,1,0,0,0,0,0,1,0,-0.75,-1,-2,-1,""
"2321","False","mean like dragonball evolution like last airbender",0,0,0,0,0,0,0,0,0,1,0.75,1,2,1,""
"2322","False","meant taking liberty done right neither two",0,1,0,0,1,0,1,1,0,1,1.3,2,0,1,""
"2323","True","loved casting except nasim pedrad dalia face look fake actually distracting know lot cast different mixed descent worked together nasims face americanizedlooking lip filler face filler botox obvious bad nose job looked place setting ancient agraba mention much stood next natural beauty bone structure naomi scott jasmine",2,1,2,2,1,2,0,2,4,4,-0.3,0,1,0,""
"2324","False","really liked handmaid nasim pedrad dalia disagree distracted face full plastic surgery filler completely ruined",3,0,1,2,0,2,0,0,3,2,-0.85,-1,-4,-1,"Anger"
"2325","False","movie pulling one thousand, nine hundred and ninety-two version element original story make relevant conversation",0,0,0,0,0,0,0,1,0,1,0.8,0,0,1,"Trust"
"2326","False","agreed count",0,0,0,0,0,0,0,2,0,2,0.5,0,1,2,"Trust"
"2327","True","captivated whole new world melody throughout movie love song also captivated naomi scott cleavage showing well love song sung either beautiful voice find smith genie cringy either fun movie surprised low score",0,2,0,0,4,0,2,1,0,4,4.25,4,13,4,"Joy"
"2328","False","ben kingsley",0,0,0,0,0,0,0,0,0,0,0,0,0,0,""
"2329","False","arab caucasian kept problem original kind agree face look bit weird though",0,0,1,1,1,1,0,1,2,2,0,-2,-1,0,""
"2330","False","yes great example surprised learn alan menken fact write jasmine new song normally good thing disney probably wanted next let go though right choreography anyone else notice",0,1,0,0,1,0,2,2,0,2,4.45,3,7,2,""
"2331","False","actually liked nasim lot thought mi cast jafar good final third rest film seemed corny believable intimidating figure like original lead perfect",0,3,0,0,2,0,1,2,0,4,3.05,5,8,4,"Anticipation"
"2332","False","know exactly talking",0,0,0,0,0,0,0,0,0,0,0,0,0,0,""
"2333","False","jam scene hardest laughed movie long time",0,2,0,0,0,0,0,0,0,1,0.8,-1,1,1,"Anticipation"
"2334","False","ahhh still good",0,1,0,0,1,0,1,1,0,1,0.75,1,3,1,""
"2335","False","excuse arab",0,0,0,0,0,0,0,0,1,0,-0.75,-1,-1,-1,""
"2336","True","serious question anybody else think really give jasmine good reason marry aladdin end version original expressed desire marry love one mostly want sultan really seem seeking marriage original aladdin generally goodlikable dude made big mistake involving lying identity one even pretend prince take jasmine hair jewelry say meet get back dick move see reason would marry end version wanted sultan aladdin kind jerk jerk original animated version anyway",2,3,1,2,6,1,3,4,3,9,3.15,-3,1,6,"Joy"
"2337","False","really wanted say perhaps would like see snakelike turn giant snake",0,0,1,2,0,0,0,0,1,0,0.25,1,2,-1,"Fear"
"2338","False","give shit lamp rubbed everything exactly cartoon make new exciting",1,1,1,0,1,0,1,0,1,1,0.8,0,-1,0,""
"2339","False","hell yeah brother respect opinion good look thing different angle adaption loved aladdin",1,2,1,1,2,1,1,3,1,3,1.35,2,5,2,"Trust"
"2340","True","never really put together idea four major character unhappy lot life robin williams fun entire time kid really pay attention life might bad awesome power suppose smith pessimism beginning really brought robin williams least way resonated better really brought slavery theme movie bettermore subtle way compared overthetop female empowerment jasmine genie would completely agree aladdin jasmine sense ennui beginning jafar dissatisfied well seen success making life doubt success continue ultimately lead becoming sultan",4,6,3,5,3,5,0,4,5,12,1.9,2,-1,7,"Anticipation"
"2341","True","issue aladdin jasmine avoiding guard start movie scene good left bummed rest movie turned around found footing",0,2,0,2,2,0,1,4,0,4,0.85,0,3,4,"Trust"
"2342","False","hmmmno",0,0,0,0,0,0,0,0,0,0,0,0,0,0,""
"2343","False","must respectfully disagree hormone",1,0,0,0,0,0,0,0,1,0,0.5,0,-2,-1,"Anger"
"2344","True","okay would love link thumbnail header discussion",0,0,0,0,1,0,0,0,0,2,1.15,1,3,2,"Joy"
"2345","False","sixteen anymore using experience",0,0,0,0,0,0,0,0,0,0,0,0,0,0,""
"2346","False","seeing woman hot naomi scott point seems plain power",1,0,0,0,0,0,0,0,0,0,-0.25,1,0,0,"Anger"
"2347","True","perplexed guy ritchie direct really wish sanjay leela bhansali direct epic like many shot tight many close ups thought smith pretty good liked comedic part wingman role reminded character hitched movie enjoyed much preferred never friend like song animation rather prince ali whole new world magic carpet ride much",1,3,0,1,3,1,2,4,2,5,7.2,5,10,3,"Trust"
"2348","False","go friend",0,0,0,0,1,0,0,1,0,1,0.8,0,1,1,""
"2349","False","arab caucasian indian",0,0,0,0,0,0,0,0,0,0,0,0,0,0,""
"2350","False","plainly obvious even read post original point one thousand, nine hundred and ninety-two movie remake set middle east nutter keep bringing adaption set country like bearing disney produced aladdin movie go get fresh air clearly brain getting enough oxygen",0,0,0,0,0,0,0,1,0,2,1.25,4,4,2,"Trust"
"2351","True","movie okay overall first thirty minute rushed acting terrible flow bad got closer smith genie got worried worse going get boy wrong smith carried movie hard idk back feeling okay thought going cherry top shit mountain turned reedeming quality movie meme month ago reason see shit show",4,4,5,4,1,5,1,4,8,5,-3.65,-6,-14,-3,""
"2352","False","oh agrabah right exist take influence different culture specifically different culture influenced source material",0,0,0,0,0,0,0,0,1,2,1.4,1,0,1,""
"2353","False","anything last airbender took liberty term plot bad movie way little changed going",1,1,1,1,1,1,1,1,1,1,-0.25,-1,-3,0,""
"2354","False","gt shackle realized fetish started",1,1,1,1,0,1,0,0,1,0,-0.6,0,0,-1,""
"2355","False","yeah awesome also want know double",0,0,0,0,0,0,0,0,0,0,0.6,1,6,0,""
"2356","False","woman hurt",1,0,0,1,0,1,0,0,1,0,-0.75,-1,-2,-1,""
"2357","False","metropolis gotham amp central city exist yet located america sokovia eastern europe gorilla city wakanda africa agrabah middle east rocket science",1,0,0,0,0,0,0,0,1,0,-0.25,0,0,-1,"Anger"
"2358","True","aladdin came going high school disney made many shitty movie 1980s beauty beast aladdin revolutionary many way plus christian kid allowed see anything pg sang score choir sang whole new world graduation song anyways loved movie love musical love smith love costume high production value love oldschool 1940s full musical cinematic experience love good cgi well especially animal great honestly past fantastic see liveaction also took two nephew seven nine dancing seat music bottle sugar soda movie either hiding face seat kissed scary part want look told ok laugh joke got good time enjoying movie like kid full immersion involvement story best part genie according seven year old think smith good job hate many people trash talking preview saying movie would suck good fun sang really well know sing quite hit swagger bwabwa oldschool broadway affectation robin williams knew well recreate awesomely good fun glad shared nephew",5,10,2,4,13,5,5,8,6,18,10.15,9,26,12,"Joy"
"2359","False","smith made quite happy role live long time multiple actor playing role mean many batman superman mention macbeth hamlet singing great reflected style fun showed everything really remember animated version well emotion subtlety would say half adult experienced movie child teen adult slightlygrownup joke robin williams adlibbed sad subtext apparent big kid smith presumably script add grown joke adult awesome anyway line really drawn robin robin adlibbed joke gag",0,5,1,0,5,0,0,4,2,7,5.65,3,13,5,""
"2360","False","cartoon jafar somewhat evil caricature drawn evil people immediately assumed looking snake staff live action jafar human evil beard evil eyeliner long pointy face hate say actor hot take hat stare camera like damn",4,2,4,3,0,2,0,0,6,2,-2.75,-2,-6,-4,""
"2361","False","good enough gilbert godfrey would odd hear voice also comforting",0,1,0,0,1,0,1,1,0,1,0.75,2,3,1,""
"2362","False","forget dungeon dragon movie best storytelling franchise ever 1000 book awesome character go original script time",0,1,0,2,0,0,0,0,2,1,0.1,1,6,-1,"Fear"
"2363","False","call crazy casting white kid maincharacter nonwhite role first step toward madness outside zuko kid actor somewhat dull lacked richness sparkle animated version katara aang otherwise hard cram complexity layering happened last airbender season let creator write script consult every casting decision",2,2,0,2,3,2,1,2,4,5,-1.1,-3,-5,1,"Joy"
"2364","False","gt jafar way young like creep sinister agree pretty creepy said going punish sultan taking thing love ie daughter",1,2,1,3,4,0,1,1,3,5,0.25,-1,3,2,"Joy"
"2365","False","bit funny smith genie thing concerned going movie turned best part rest felt kind rushed part though liked others disappointed near complete lack traditionalarabian style music brought amazing color costume detail music source material western style sad",1,0,1,1,2,3,0,2,2,3,0.55,-2,7,1,"Sadness"
"2366","False","gt audience score mean rotton tomato actually read quick faceless account audience member single one time post giving five star generic praise go ahead click review see empty really throw word objective say rt audience score objective standard use honestly music alone listen soundtrack tell high standard broadway quality would say casting quality broadway play course fair number performance standard actor posse obvious attribute creative team looking obviously needing aladdin lead able parkour freestyle dance stop realistic buzzword meaningless time",0,5,0,1,5,2,1,8,1,13,4.75,4,3,12,"Trust"
"2367","True","comment improvement original laughable heartbreaking",0,0,1,0,1,0,0,1,1,1,-0.5,-1,-1,0,""
"2368","False","yeah persian aladdin goddam arabian movie hollywood know difference indian middle eastern culture frustrating even seeing lot color clothing indian persian",0,0,0,0,0,0,0,0,0,1,0.1,-1,-1,1,""
"2369","False","aladdin actor looked bored",0,0,0,0,0,0,0,0,0,0,-0.5,-1,-2,0,""
"2370","False","yeah jafar never actually supposed scary person extremely arrogant proud point comedy iago work talking parrot parrot mock movie generic villain",1,1,2,1,1,0,0,1,3,1,-1.5,-1,-2,-2,"Disgust"
"2371","False","rebel soldier leia death star plan leia dun wan",3,3,1,3,1,3,1,1,4,2,-0.65,-1,-4,-2,""
"2372","False","agree genie touched slavery theme well somewhat similar one thousand, nine hundred and ninety-two movie female empowerment thing absolutely terrible artificial sounded introduced movie make political subtle new speechless song seems made empower jasmine nothing story song way better",2,0,2,2,0,2,0,0,3,3,4.15,3,1,0,""
"2373","False","mean actually listened read lyric whole new world open eye take wonder wonder sideways magic carpet ride",0,0,0,0,0,0,0,0,0,0,1.05,2,0,0,""
"2374","False","least got carpet moving aladdin mach fifty oh wait offscreen",0,1,0,0,0,0,0,0,1,0,-0.25,0,0,-1,"Anticipation"
"2375","False","ah okay see difference noticed disliked objective fact difference noticed disliked meaningless great way conversation differing opinion",1,1,0,0,0,2,0,2,2,1,-0.6,-1,-1,-1,""
"2376","False","titus drag would amazing would faithful hell source material",1,0,1,1,0,1,0,1,1,1,-0.05,0,2,0,""
"2377","False","ok permission enjoy",0,1,0,0,1,0,0,1,0,2,1.55,1,2,2,""
"2378","False","looking thank",0,0,0,0,0,0,0,0,0,0,0.5,1,2,0,""
"2379","False","bruh sonic boom would alert guard",0,0,0,1,0,0,0,1,0,1,-0.9,1,-1,1,""
"2380","False","thinking movie right really handmaid dalia another matter watching blacklist would sworn lotte verbeek play katarina look similar though",0,0,0,0,0,0,0,0,0,0,0.8,1,1,0,""
"2381","False","best review agree every point",0,0,0,0,0,0,0,0,0,1,1,1,4,1,""
"2382","False","thank middle eastern kept thinking look like rich arab housewife stop botox distracting",1,1,0,0,0,0,0,0,1,0,0.2,2,5,-1,""
"2383","True","smith probably best thing actor movie cautious put really fun show without becoming wacky caricature could tell took role seriously pretty good script work scenic design beautiful loved sweeping shot agrabah groundlevel shot city merchant beginning fire dance scene aladdin jasmine looking cool think directorcinematographer really uglydistracting shot time multiple scene thinking keep camera still stop moving around much really disappointed music coming musical theatre background really disliked mixing voice sound right environment sounded like actually actor sound booth rather character singing fantasy world huge fan alan menken like believe super involved decision past composition silenced song reprise called pretty damn bad pop vocal style jasmine riffing sucked lyric sooo bland pask paul overrated despite good la la land work production would better putting beyond palace wall musical adding another handmaiden story edits fine nothing offensive nothing amazing sure loved messed exposition guess drag everything two hour day overall decent movie worth watch fan aladdin want see beautiful representation agrabah see smith pretty good job genie five hundred and ten",7,9,4,5,7,6,5,8,9,15,5.25,7,20,6,"Anticipation"
