"","Parent","Comment","Anger","Anticipation","Disgust","Fear","Joy","Sadness","Surprise","Trust","Negative","Positive","Synzhet","Bing","Afinn","NRC","Emotion"
"1","False","plus sure mena could rocked like adam jacob song special also kind glad attempt one",0,2,0,0,3,0,0,1,0,3,2.55,2,7,3,"Joy"
"2","False","gt fun watch endgame lol",0,2,0,1,1,0,0,0,0,1,0.75,1,7,1,"Anticipation"
"3","False","goddamn turned jafar grima wormtongue",0,0,0,0,0,0,0,0,0,0,-1,0,-3,0,""
"4","False","one trailer original audio compared new trailer original animated scene side side exact sound file",0,0,0,0,1,0,0,0,0,1,1.2,0,0,1,"Joy"
"5","False","say bad purchasing good movie good original disney would win situation",1,1,1,1,1,1,1,1,1,1,0.5,1,4,0,""
"6","False","exact thought enough ritchie expecting snatchaladdin mashup lol",0,2,0,0,0,0,0,0,0,0,-0.25,1,3,0,"Anticipation"
"7","True","smith great genie role cringey favorite songdances friend like prince ali vibrant color choreographycinematography top notch naomi scott also really great jasmine man gorgeous",0,1,0,0,3,0,0,4,0,5,4.4,6,13,5,"Trust"
"8","False","rdouchebaggenie",0,0,0,0,0,0,0,0,0,0,0,0,0,0,""
"9","False","one thousand prepping aladdin two",0,0,0,0,0,0,0,0,0,0,0,0,0,0,""
"10","False","whatever make feel better",0,0,0,0,0,0,0,0,0,0,0.8,1,2,0,""
"11","False","mistaking billy magnussen making joke",0,0,0,0,0,0,0,0,1,0,-0.2,-1,0,-1,""
"12","False","maybe wrong know feel like making genie human jasmine marrying aladdin kind closed story",0,0,0,0,1,0,0,1,1,1,0.85,0,2,0,""
"13","False","played voice iago",0,0,0,0,0,0,0,0,0,0,0,0,0,0,""
"14","False","purchasing movie think good would make feel better guess seeing identifying side based purchase make feel better antidisney",0,1,0,0,1,0,2,1,0,1,2.05,2,5,1,"Surprise"
"15","False","yeah pretty much voice iago",0,1,0,0,1,0,0,1,0,1,0.75,1,2,1,""
"16","False","antidisney really antipeople like disagreeing people time backfire end day feel slimy suicidal",2,1,2,1,0,2,0,0,3,0,-1.55,-1,0,-3,""
"17","False","entirely opposed live action remake artistic vision whatsoever",1,1,0,1,0,0,0,0,1,4,0.55,0,1,3,""
"18","False","even remember slow mo fast forward cut sound like classic guy ritchie overendulgence forget snatch lock stock scene one rotates camera around yaxis absolutely reason",0,0,0,0,0,0,0,0,1,3,1.2,2,0,2,""
"19","False","gt way better beauty beast live adaptation reeeeeally low bar",1,0,0,1,1,0,0,0,1,1,0.8,2,5,0,""
"20","False","said enjoyed make sense would buy movie enjoyed right",0,0,0,0,0,0,0,0,0,1,1.8,2,2,1,""
"21","False","hand maid dalia nasim pedrad iranian descent",0,0,0,1,0,1,0,0,0,0,0,0,0,0,""
"22","False","totally make much sense",0,0,0,0,0,0,0,0,0,1,0,0,0,1,""
"23","False","hearing conflicting report prepared ill pissed",1,1,1,2,0,1,0,1,3,1,-1.75,-1,-7,-2,"Fear"
"24","True","actually really enjoyed movie set amazing mena massoud naomi scott even sultan became pretty charismatic character movie went manage screw marketing bad still bit skeptical jafar understand going different version bad guy feel like whiny kid sometimes overall might favourite life action disney movie yet definitely liked batb",1,1,1,2,1,1,0,2,2,3,2.4,3,8,1,""
"25","False","one hundred agreed plus music sounded like theme park show karaoke version thin cheap sounded like kid made bedroom shocking amp x200b heart illusion one",0,0,0,0,1,1,1,2,2,2,0.1,-2,1,0,"Trust"
"26","False","completely agree smith really stole show put personality passion role might compare legendary robin williams would really aim surpass respect smith touch role instead trying replicate williams also thank end genuine actually made feel quote moved final get jam voice style great",0,3,0,0,2,0,1,5,1,8,3.75,5,7,7,"Trust"
"27","False","yeah check",0,0,0,0,0,0,0,0,0,0,0,0,1,0,""
"28","False","director def made choice bad choice amp x200b like absolutely cringeworthy terrible 3rd act choice",2,0,2,2,0,2,0,1,2,2,-0.35,-1,-4,0,""
"29","False","genie shackle metatexual commentary disney contract",1,1,1,1,0,1,0,0,1,0,-0.6,0,0,-1,""
"30","False","personally really liked intro arabian night felt powerful panned agrabah",1,1,1,1,1,0,0,1,0,1,1.25,2,4,1,""
"31","False","changed chord underneath whole new world world would change something beloved fan insane",1,0,0,2,0,0,0,0,1,0,0.55,0,4,-1,"Fear"
"32","False","explained perfectly song felt place honestly felt like let go jammed",0,0,0,0,0,0,0,0,0,0,1,2,5,0,""
"33","False","laugh honest reaction endgame felt stupid mean aladdin felt stupid kid movie guess endgame lowbrow adult humor",1,0,1,1,2,1,2,1,1,2,0.75,1,3,1,""
"34","False","plastic disney plastic like made new technology animates action figure heart real love illusion selling nostalgiainacan empty",0,0,0,0,1,0,1,1,1,4,2.15,1,4,3,""
"35","False","difference singing skill jasmine turn sing whole new world jarring chuckle",0,2,0,1,2,2,1,2,1,2,2.2,0,0,1,""
"36","True","okay marketing smith disservice pretty good way match robin took path mostly worked liked friend like arabian nightsprince ali yeesh moment singing mena solid enough naomi scott favorite part movie chemistry mena okay best voice fantastic although meh speechless good song bad fit felt like watching greatest showman kind threw decent pop song movie went different direction jafar would preferred showier schemer animated movie guess marwan kenzari alright given lot weird direction choice really like one jump prince ali least favorite musical number movie going get geniedalia thing entirely sure many issue beauty beast watch lindsay elli video think aladdin good jungle book cinderella recent disney remake worth watch smithnaomi scott capture magic animation solid six hundred and ten",4,4,3,4,9,3,4,7,6,15,9.4,11,26,9,"Joy"
"37","False","song adaptation really play smith strength turned great",0,0,0,0,0,0,0,2,0,1,1,1,5,1,"Trust"
"38","False","actress iranian iranian tend fair skinned",0,0,0,0,0,0,0,0,0,1,0.75,1,2,1,""
"39","False","gt fan slowmo quick fast fwd used gt work specially one jump ahead aladdin jasmine take wooden cart moving slowmo singing slowmo going get movie guy ritchie directs inevitable death tax guy ritchie speed ramp",1,1,1,1,1,2,1,0,2,2,-0.55,0,1,0,"Sadness"
"40","False","w f n eight hundred and ten",0,0,0,0,0,0,0,0,0,0,0,0,0,0,""
"41","False","agreed storytelling horrible put entire intro jafar finding cave wonder first time montage jasmine new song right tone aladdin universe lighting absolutely amateurish moment answer dp unbelievably unexperienced 1st unit dp choose aladdin look rather natural charm actingsinging ability real humor film awkward humor forcing aladdin genie awkward talking woman many cut action scene know fact full take music sound like sixteen year old made bedroom think adding smithisms genie character song good idea something would immediately ridiculed laughed cgi genie incredibly bad high profile big budget film set look like set costume look like costume jafar scary even little bit hire guy ritchie known stylishly successful ultimately heartless emotionless film direct aladdin think loved aladdin",2,6,2,2,4,3,1,7,4,12,7.55,3,9,8,"Trust"
"42","False","enjoying thing grrr",0,1,0,0,1,0,0,1,0,1,0.75,1,2,1,""
"43","False","show contrast good music trash music",0,1,1,0,2,2,1,2,1,2,0.85,0,3,1,""
"44","False","naomi scott naomi scott like almost naomi scott scale one naomi scott",0,0,0,0,0,0,0,0,0,0,0.5,1,2,0,""
"45","False","genie deliberately fucked using grey area excuse",0,0,0,0,0,0,0,0,1,0,-1.55,-1,-6,-1,""
"46","False","probably aquaman kind movie five six time two character talking something behind explodes action scene start",0,2,0,0,1,0,0,1,0,2,0.15,0,2,2,"Anticipation"
"47","False","guy also said wanted make kid movie child lot director tend given opportunity",0,2,0,0,1,0,0,1,0,3,1.35,0,2,3,"Anticipation"
"48","False","well interesting take",0,0,0,0,0,0,0,0,0,1,1.55,2,2,1,""
"49","False","tell princess bleed",0,0,0,0,0,0,0,0,0,1,0.1,-1,0,1,""
"50","False","view agrabah great feel singing lent good time think biggest issue film come isolation v package isolation song set feel right immersed world everything work well opening quite yet one jump enjoying everything",0,3,0,0,3,1,1,2,1,3,3.35,4,8,2,""
"51","False","yeah mind going fast dance number work like combo slowmo work",0,0,0,0,1,0,0,1,0,1,1.35,3,3,1,""
"52","False","changed chord first freakin line one jump ahead reason make better",0,0,0,0,1,0,0,0,0,3,2.2,1,2,3,"Joy"
"53","False","jafar kingdom heart game well",0,0,0,0,0,0,0,0,0,0,0.8,1,0,0,""
"54","False","oh really also responsible ninety-one approval rating verified account rt",1,0,0,1,0,1,0,3,1,3,1.75,1,4,2,"Trust"
"55","False","read wrong first thought said one belting whole new world mad alone get",1,1,1,1,0,1,0,0,2,0,-1.3,-2,-7,-2,""
"56","True","fun fact robin williams may best genie second best actually guy",0,1,0,0,1,0,0,1,0,1,1.25,2,7,1,""
"57","True","fun fact robin williams may best genie second best actually guy",0,1,0,0,1,0,0,1,0,1,1.25,2,7,1,""
"58","False","verified ticket purchase right would argue anyone rushing see aladdin early probably also part target audience hence higher score say deserve take thing like consideration well",2,3,0,0,1,0,1,2,1,3,2.6,3,2,2,"Anticipation"
"59","False","pleading watch movie saying going watch movie go already hating smith performance think good one sure got smith personally money",2,3,0,1,2,0,2,3,1,2,0.6,0,0,1,""
"60","False","people could also disagree",1,0,0,0,0,0,0,0,1,0,-0.5,-1,-2,-1,"Anger"
"61","False","alright disney hack got score eighty-one audience really matter way look guy idiot",0,2,1,0,1,0,1,0,1,1,-1.5,-2,-2,0,"Anticipation"
"62","False","yeah still believe conspiracy angle could touch ridiculous saying could still drop",1,0,1,1,0,0,0,0,1,0,-1.25,-2,-6,-1,""
"63","False","wtf good mean",0,1,0,0,1,0,1,1,0,1,0.75,1,-1,1,""
"64","False","director claimed timethey gave key point hit got way let riff",1,0,0,0,0,0,0,1,1,1,0,0,0,0,""
"65","False","seeing glimpse oversized iago trailer knew would climax instead cobra jafar really bum",0,1,1,1,1,1,1,1,1,1,0.3,-1,0,0,""
"66","False","yup added drum whole new world",0,0,0,0,0,0,0,0,0,0,0.8,0,0,0,""
"67","False","kid bop anymore bang eachother meth",1,0,1,1,0,1,1,0,1,0,0,0,0,-1,""
"68","False","ugh shame",0,0,1,1,0,1,0,0,1,0,-1,-2,-4,-1,""
"69","False","original end aladdin two three",0,0,0,0,0,0,0,0,0,0,0,0,0,0,""
"70","True","wow naomi scott really acted circle around mena massoud kind charisma vacuum",0,0,0,0,1,0,0,1,0,1,2,2,8,1,""
"71","True","went expecting hate first hour average time better expected amp x200b came whole new world amp x200b fuck disney win love",1,3,1,1,1,1,0,0,1,1,1.1,1,2,0,"Anticipation"
"72","False","funny thought arabian night really good friend like prince ali let down compared original",0,2,0,0,2,0,1,2,0,3,3.45,1,10,3,""
"73","False","genie made jafar genie got feel try return jafar jafar would retaliate either making genie genie aladdin vengeance tricking sequel involved human genie jasmine going whirlwind find free genie aladdin would fun hell",3,2,1,2,1,1,0,0,4,1,-1.2,-1,1,-3,"Anger"
"74","True","came across tweet said sultan looked like joaquin phoenix gluedon beard know really",0,0,0,1,0,0,0,0,0,1,0.5,1,2,1,"Fear"
"75","True","wrote full review gist movie look amazing excepting blue genie sometimes smith work genie let work strength instead emulating robin williams naomi scott jasmine probably best part film",0,0,0,0,0,1,0,2,0,2,1.75,3,9,2,"Trust"
"76","False","liked naomi scott power ranger",0,0,0,0,0,0,0,1,0,0,0.5,1,2,0,"Trust"
"77","True","parrot coming lol iago got dragged lamp happen cartoon version since watched",0,2,1,0,0,0,0,0,1,0,-0.5,-1,2,-1,"Anticipation"
"78","False","holy shit joaquin",1,0,1,0,0,0,0,0,1,1,-0.5,0,-4,0,""
"79","False","oh damn depressing",1,0,2,0,0,1,0,0,2,0,-1.75,-2,-4,-2,"Disgust"
"80","True","people theater lost sloooow part prince ali bollywood dancing scene also pretty badass",0,1,0,0,1,1,0,1,1,2,1,-1,-5,1,""
"81","True","expected alright wow factor guess generation may seen original might pas enjoyable magic thing original part genie specifically written williams mind rather cast fact think original love right faverite time list know word word think scene williams riffing adlibbing fun animation drawn around rather drawn first scripted smith element fun contrived guess would matter played part would hard follow williams creation least attempt point even making film apart cold hard cash course hard watch live action remake original classic close people heart ok nowhere near bad dumbo film actually offensive memory original better beauty beast high benchmark mean",4,6,2,4,4,1,1,4,4,8,4.4,4,13,4,"Anticipation"
"82","False","ohhhhh yeah waste he way talented relegated personalityless bird",0,0,1,0,0,0,0,0,1,0,-0.25,0,0,-1,"Disgust"
"83","False","gt song okay one jump ahead issue voice getting drowned saw wife last night verge leaving agree audio hard hear song time like background noise drowned smith also vocal range power carry arabian night either jafar threatening slightest either",1,2,1,2,1,0,0,1,3,3,-0.25,-3,-2,0,""
"84","False","yes get dragged lamp cartoon",0,0,0,0,0,0,0,0,0,0,0.3,-1,0,0,""
"85","False","jesus christ massive hate boner movie",1,0,1,1,0,1,0,0,1,0,-0.75,-1,-2,-1,""
"86","False","fantastic",0,0,0,0,0,0,0,0,0,0,0.75,1,4,0,""
"87","True","one thought jaafar great first scene badass lot development people complain avout snake missed oldman disguise jaafar tour rewaaaaard also yago reduction",1,1,1,1,0,1,0,0,2,0,-0.85,-1,-5,-2,""
"88","False","saw february two thousand and eighteen grinning like idiot every time stage",0,1,1,0,0,0,0,0,1,0,-0.5,0,-1,-1,""
"89","False","ruined overwatch league grand final last year man need stay fandom belong",1,0,1,1,0,1,0,0,1,1,0,0,1,0,""
"90","False","gt arabian night gave chill listened google play day god",0,1,0,1,1,0,0,1,0,1,-0.1,-1,1,1,""
"91","False","yup filmed place city fun",0,1,0,0,1,0,0,0,0,1,0.75,1,4,1,""
"92","False","side go hard love",0,0,0,0,1,0,0,0,0,1,0.5,0,2,1,"Joy"
"93","False","would personally way smith genie",0,0,0,0,0,0,0,1,0,0,0,0,0,0,"Trust"
"94","False","nah thought jafar easily worst part film nearly intimidating imposing could take seriously villain",0,1,0,1,0,0,0,0,1,0,-2.5,-3,-6,-1,""
"95","False","live action dbz frieza stay form one whole story please",0,0,0,0,0,0,0,0,0,1,1.25,0,1,1,""
"96","False","feel like lot people keep saying one actually know sure lol ever even confirmed internet eat another rumor",0,0,0,0,0,1,0,1,1,2,1.35,0,5,1,""
"97","False","mean time leave anyway lol",0,1,0,0,0,1,1,0,1,0,-0.25,0,2,-1,""
"98","True","question everybody mind amp x200b smith well robin williams",0,0,0,0,0,0,0,1,0,1,0.8,1,0,1,"Trust"
"99","True","jasmine wished infinity gauntlet snapped everyone away silenced song",0,1,0,0,1,0,0,1,0,1,0.6,0,0,1,""
"100","True","enjoyed hoping would gone full bollywood musical number pretty fun movie smith pretty great aladdinjasmine well played downside music wise one jump ahead felt really clunky like enough music shame one underrated 90 disney song",1,3,1,1,5,3,1,3,1,8,5.5,5,10,7,"Joy"
"101","False","ooohhhh thas hot",1,0,0,0,0,0,0,0,0,0,-0.25,1,0,0,"Anger"
"102","False","alright",0,0,0,0,0,0,0,0,0,0,0,0,0,0,""
"103","False","scene beginning aladdin discombobulates people underground boxing ring",1,0,0,0,0,0,0,0,0,0,0,0,0,0,"Anger"
"104","True","look like pretty grain great time pretty much enjoyed entire thing aladdin dancing scene jasmine sing especially great honest really remember specific plot point original weighing aladdin memory game either way great time recommend pretty much anyone",1,3,1,1,3,2,0,4,0,4,4.6,5,12,4,"Trust"
"105","False","friend watched 10minute preview offered hollywood studio disney world noticed sped slowed everyone looked attributed potentially early cut saw movie looked equally awful",1,0,1,1,1,1,0,1,1,2,0.15,-2,-3,1,""
"106","False","definitely felt like mix bolly hollywood little bit really enjoyed",0,0,0,0,0,0,0,0,0,0,1.5,2,4,0,""
"107","False","trying",0,0,0,0,0,0,0,0,0,0,0,0,0,0,""
"108","False","holy shit actually name drop movie",1,0,1,0,0,0,0,0,1,1,-0.5,0,-5,0,""
"109","False","fun movie pretty surprising seeing hate",1,2,1,1,2,1,1,1,1,2,0.75,1,2,1,""
"110","False","congrats daddy sigh dun wan",0,0,0,1,0,1,0,0,2,0,0.6,0,0,-2,""
"111","False","honestly loved movie jafar weak point",0,0,0,0,0,0,0,0,0,0,0,0,1,0,""
"112","True","loved really thought mena naomi great chemistry loved genie moment gt rewound movie go back see abu hide lamp lt great first meeting prince ali jasmine awkward funny",0,1,0,1,0,0,0,0,0,1,1.9,0,7,1,""
"113","False","wrong",0,0,0,0,0,0,0,0,1,0,-0.75,-1,-2,-1,""
"114","True","thank come another one",0,0,0,0,0,0,0,0,0,0,0.5,1,2,0,""
"115","False","mean slapped",0,0,0,0,0,0,0,0,0,0,0,0,0,0,""
"116","False","grey area genie powerful full stop",1,1,1,1,1,0,0,1,0,2,0.35,1,0,2,""
"117","False","would glue beard",0,0,0,0,0,0,0,0,0,0,0,0,0,0,""
"118","False","jasmine holding back subtle nod film commitment female identity refusing warmth lover hand prefers stand alone belting independence icy uncaring void",1,2,1,0,2,1,1,2,1,3,1.2,2,0,2,""
"119","False","gt look like pretty grain grain thread least",0,1,0,0,1,0,0,1,0,1,1.25,2,3,1,""
"120","False","literally walking screening back screen behind heard another one burst laughing",0,0,0,0,1,0,0,0,0,1,0.6,0,1,1,"Joy"
"121","False","damm girl sing",0,1,0,0,1,1,0,1,0,1,0.6,0,0,1,""
"122","False","happy live world see package deal unserstand mindset remake ruining original ruin movie already made two movie nothing wrong",0,2,0,1,2,1,1,2,2,3,-1.25,-2,-3,1,""
"123","False","eh one best agree good yes nowhere near best",0,1,0,0,1,0,1,1,0,2,2.55,2,8,2,""
"124","True","scene aladdin present salton jasmine uncomfortable scene sat xd big cringe put hood eye",1,1,2,2,1,1,1,1,3,1,-1.25,-2,-1,-2,""
"125","False","aladdin dy",0,0,0,0,0,0,0,0,0,0,0,0,0,0,""
"126","True","thought incredibly bad robin williams like people seem attached grew dubbed version writing movie absolutely appalling rely lot tell show instead way around fail develop every character jasmine properly many scene iconic made develop character like aladdin abu feeding child saving princess getting arm chopped talking freedom etc rushed dumbed reduced blinkandyou willmissit moment cringed lot dialogue consisted hey mother dead parent dead friend monkey see alike fact character development movie botched one point aladdin make deal obviously evil undisguised jafar later act like total jackass consumed power caring power sure really pure kindhearted diamondintherough character original like writer focused much jasmine forgot character arc aladdin arc overcoming insecurity streetrat unworthy marrying jasmine none really given time explored speaking jasmine really going strong empowered woman thing mean zero problem strong female role model movie much next guy think mulan favorite disney princess actually tell show tell lot jasmine get entire song poor stayinthekitchen silenced woman many people seem praise song hate one say find cringeworthy yes need strong female role model way blatant political message shoved face comparing mulan great character arc development revolve around booby want show worthy one show strong female role model simply one motivation rooted desire protect everyone love desire want rule city woman oppressed silenced raise voice worthy voice filthy men show tell anyway biggest gripe movie biggest genie nothing smith robin williams genie character shamelessly completely utterly shattered adaptation beautiful thing original aladdin opinion great dynamic aladdin genie watching original movie loved seeing budding relationship real heartfelt started cry horror genie said nobody asked like genuinely felt touched started considering aladdin true friend even end movie really took genie relationship aladdin home original much matter many thousand time watch scene start cry like baby beautifully written touching new one producer seemed think meh want see aladdin genie become great friend guy gay lol much better improved version genie explicitly aladdin friend tell much face also help aladdin unless something going worry replace entire dynamic love interest genie fuck disney real progressive making whole movie woman strong exist find price step back make female character solely purpose generic love interest word describe much insult think movie original work bad",6,9,9,10,11,11,4,15,17,26,8.65,1,12,10,"Trust"
"127","False","trouble adding detail lot time feel like added placate people internet want write twenty biggest disney plot hole listicle also add problem give like townspeople paid praise gaston add story take away charisma gaston character make good villain also make sense everyone willing follow battle castle think actually hero great man eager listen",1,4,0,2,4,1,3,4,3,5,3.05,5,13,2,""
"128","False","really cartoon realises developing feeling bella want give present spending time cue library scene live action like book like stupid kind show library",1,4,1,1,3,1,2,4,2,5,1.35,0,4,3,""
"129","False","true specifically created character mind get agree role showed clip animated genie robin stand",0,0,0,0,1,0,0,0,0,2,1.4,0,3,3,"Joy"
"130","False","never get away",0,0,0,0,0,0,0,0,0,0,0,0,0,0,""
"131","True","would give solid seven hundred and ten main actor fit role quite perfectly especially naomi jasmine song pretty catchy love new rendition whole new world overall pretty enjoyable although part might feel dragged critique jafar villainy enough soso cgi one place scene jasmine suddenly break singing detained way everyone shitting beauty beast lol bad dumbo way way worse",2,1,1,3,3,2,2,1,3,6,1.15,4,7,3,""
"132","False","gt guy play jaffar look exactly like brett flight conchords like uncanny kept expecting say something funny totally devoid humor ah knew looked super familiar",0,1,0,1,0,0,1,1,1,1,3.1,1,11,0,""
"133","False","genie blue",0,0,0,0,0,1,0,0,0,0,0,0,0,0,"Sadness"
"134","False","reason easily could",0,0,0,0,0,0,0,0,0,1,0.6,0,0,1,""
"135","False","gt iago barely talk boy alan tudyk disney goto voice actor day king candy k2so shifty weasel zootopia big hero six apparently",0,1,1,0,1,0,1,1,1,3,1.75,1,3,2,""
"136","True","hey washing cat subtle vagina joke child would miss",0,1,0,0,1,0,0,0,1,1,1.2,-2,0,0,""
"137","False","yeah businessman villain wanted kill big hero six bummed alan tudyks iago line love alan tudyk",0,1,0,2,2,1,1,1,2,2,0,1,4,0,""
"138","False","thought thing thought wow would thought joaquin phoenix except would remembered seeing name cast list",0,1,0,0,0,0,0,0,0,1,0.5,1,4,1,"Anticipation"
"139","False","think singing really flat like going hoping see fresh prince energy song barely sounded like cared",0,0,0,0,0,0,0,0,0,1,2.2,2,5,1,""
"140","False","gt felt like watching greatest showman kind threw decent pop song movie movie lyricist team dear evan hansen starred son film producer think song pretty subpar usually one song one actually work every project",0,1,0,0,2,0,1,3,1,5,3.65,5,10,4,"Trust"
"141","False","thanks",0,0,0,0,0,0,0,0,0,0,0.6,0,2,0,""
"142","False","actually found jasmine character refreshing part movie see statement anything acted reminder actually come far last thirty year",0,0,0,0,1,0,0,2,0,3,1.1,1,0,3,"Trust"
"143","True","play lot original song",0,0,0,0,0,0,0,0,0,0,0,0,0,0,""
"144","False","actor play amahl farouk legion barely tell",0,0,0,0,0,0,0,0,0,0,0,0,0,0,""
"145","False","music one child grew loving song really want original remake please disney",0,1,0,0,3,1,0,1,0,4,2.95,1,4,4,"Joy"
"146","False","animation better storytelling better huge team people wheedling animated script year time liveaction film one two screenwriter coming script short amount time",0,2,0,0,1,0,0,1,0,2,1.45,1,3,2,"Anticipation"
"147","False","leaf wind squawk",0,0,0,0,0,0,0,0,0,0,0,0,0,0,""
"148","False","sorting best response saw either lukewarm stupid joke negative opinion sorting new commenting see quite people enjoyed movie",0,0,0,0,0,1,0,0,3,0,0.9,-2,3,-3,"Sadness"
"149","False","mean yeah jasmine felt far like fleshed complete character movie wished made say le stuff stuff good thing really worth anything stole lamp really great moment still think original rendition jasmine better even unsultan glory jasmine character would silenced whenever discussed forcing marry either sent personal tiger suitor told piss go jump balcony ran away threatened execute whoever felt something awful proclaimed loudly look discussing future prize even jafar take hold lamp still taking bullshit refuse bow enslaved throw wine might demigod could destroy father strong woman definitely silenced singing loudly giving heartfelt speech everyone voice silenced thing prove people take crap definitely like jasmine earns title sultan end new movie new addition put spin original story feel would much better earn since really much except talk deserves title first female ruler something nothing else",2,3,3,4,5,3,2,7,4,13,4,3,-5,9,"Trust"
"150","False","disagree jasmine original actually say anything literally nothing even song",1,0,0,0,0,0,0,0,1,0,-0.5,-1,-2,-1,"Anger"
"151","False","fuck wtf stand",0,0,0,0,0,0,0,0,0,0,-1,-1,-8,0,""
"152","False","think jasmine character moment biggest one ask",0,0,0,0,0,0,0,0,0,0,0,0,0,0,""
"153","False","loved smith friend like prince ali new world great naomi scott new song good feel like fit could listening twenty year like rest",0,1,0,0,2,0,1,3,0,4,4.85,4,13,4,"Trust"
"154","False","original new one",0,0,0,0,0,0,0,0,0,0,0.8,0,0,0,""
"155","False","agree disagree find original jasmine great character right even proactive aladdin",1,0,0,0,0,0,0,0,1,1,1.8,2,4,0,"Anger"
"156","False","agreed",0,0,0,0,0,0,0,1,0,1,0.5,0,1,1,"Trust"
