"","Parent","Comment","Anger","Anticipation","Disgust","Fear","Joy","Sadness","Surprise","Trust","Negative","Positive","Synzhet","Bing","Afinn","NRC","Emotion"
"1478","True","movie bad marketing bad first aladdin favorite animated movie sucker musical released soundtrack spotify noticed take slightly different r amp bhiphop vibe could resist glad caught dolby overall thought fresh take stand fan service wink original worked time though afraid would another beauty beast instead rehash original version felt like adaptation broadway musical even intro feel like play get main character presented glimpse arc accompanied version arabian night pay homage movie visually musically naomi scott jasmine far best character best improvement original time thought hearing lea salonga though shade brad kane massoud smith worked great iteration genie though worked way better screen still reason prince ali worked despite disney releasing one minute pay justice happening low point movie jafar think miscast rather intent play well theater going character look insignificant want interesting take parallel aladdin story borderline went typical marvel villain dark reflection protagonist end thought parallel worked got nothing jonathan freeman version though pretty disappointed saw jasmine stealing supposed best scene kept waiting snap actually terrifying villain animation happen jafar felt menacing iago alan tudyk good fit role far nitpicks go start affect much enjoyment movie halfsecond thought stuff thought credit rolled going disney avoiding villain transformation instead relying mascot without giant cobra jafar fall felt pretty rushed despite padded screentime iago also thought jafar needed song deleted song original movie would fit version proposed story time fan slowmo quick fast fwd used work specially one jump ahead aladdin jasmine take wooden cart moving slowmo singing slowmo one jump ahead reprise set also felt pretty weird hakim might well said yo prince ahmed supposed make feel bad feel bad okay whereas animated al humiliated people laughing hakim whisper part original dialog reprise felt ironically happy sad second reprise way better though proud boy cmon disney even broadway show arc peabo bryson gt zayn",7,11,5,10,13,6,3,12,14,22,8.6,9,22,8,"Joy"
"1479","True","disney hack working overtime",0,0,0,0,0,0,0,0,0,1,-0.25,-1,0,1,""
"1480","False","arabian night good feel like smith singing voice powerful enough carry really liked prince ali though sad reprise",1,2,1,1,2,0,1,3,0,3,2.35,4,7,3,"Trust"
"1481","False","begin disney live action trend removing villain song believe getting prepared lion king remake",0,1,0,2,0,0,0,1,1,6,0.35,0,1,5,"Fear"
"1482","False","appreciate reprise used narratively shame removed disney villain song legendary",0,0,1,2,0,1,0,0,2,1,-0.5,1,0,-1,"Fear"
"1483","False","would hell twist",1,0,1,1,0,1,0,0,1,0,-0.8,-2,-4,-1,""
"1484","False","like disney account helping ruin film industry fun watch endgame fun",0,2,0,2,1,1,0,1,1,1,1,2,6,0,""
"1485","False","kind original worked howard ashman died middle writing song movie fewer musical number towards middle also robin williams dominated second half",1,1,0,0,2,1,1,2,0,2,1.25,1,-1,2,""
"1486","True","great movie cast fit role nicely liked version adaption jafar movie total remake cartoon definitely brought nostalgic feel loved guy ritchie et al superb job added culture without appropriation adventure comedy love adorable flick",0,1,0,0,2,0,0,0,1,7,7,7,23,6,"Joy"
"1487","True","loved wish people would decide one genie jasmine standouts soundtrack awesome saw dolby audiocolors great fun price ali reprisejafar snake form disappointing unexplainable dealbreaker detective pikachu get pas messy plot get hate aladdin much charm going",1,1,3,2,1,2,0,0,4,2,1.4,1,13,-2,"Disgust"
"1488","False","alabamah",0,0,0,0,0,0,0,0,0,0,0,0,0,0,""
"1489","False","ali got jammed park rec",0,0,0,0,0,0,0,0,0,0,0,0,0,0,""
"1490","False","ending song went williams never friend like",0,0,0,0,1,0,0,1,0,1,1.3,1,3,1,""
"1491","False","would leave",0,0,0,0,0,1,1,0,1,0,-0.25,0,-1,-1,""
"1492","False","giant hourglass look horse two ass",0,0,0,1,0,0,0,1,1,0,-0.5,0,-4,-1,""
"1493","False","look ops edit",0,0,0,0,0,0,0,0,0,0,0,0,0,0,""
"1494","False","kind felt place tbh bust solo silenced convince general help make much sense",0,1,0,0,1,0,0,3,0,4,1.15,-1,5,4,"Trust"
"1495","True","genie child magical power",0,2,0,0,2,0,1,0,0,2,1.35,1,0,2,""
"1496","False","whole point make distance williams performance though",0,0,0,0,0,0,0,0,0,0,0.4,0,0,0,""
"1497","False","girlfriend argued joke dirty mind thank vindicating internet stranger",0,0,1,1,0,0,0,0,3,0,0.1,-2,4,-3,""
"1498","False","nothing think funny aladdin ended last night gushed girl great instead getting straight reddit guess people like thing",0,0,0,0,0,0,1,0,0,0,2.4,1,10,0,"Surprise"
"1499","True","film lot like venom great potential accumulation badstupid thing really brought understand people love though hell part fun perfectly watchable even touch original would pay full price blu ray sale like eight black friday would probably pick",2,2,2,2,3,2,0,1,3,5,1.1,3,10,2,"Joy"
"1500","False","thought rip robin williams thing upvote bait mean like situation appreciate current movie liked awkward humor especially dalia liked stupid recurring jam joke liked smith singer like way took genie obviously fair compare williams going get better williams fun sitting seat thinking two paragraph going post reddit going good time going",0,4,0,1,2,0,1,3,3,4,3.9,2,17,1,"Anticipation"
"1501","True","question someone hast seen movie yet true stay original smith butcher genie bad trailer portrayed genie justice",2,0,2,2,0,1,0,2,2,2,0.25,-2,1,1,""
"1502","False","really autotuned hell",1,0,1,1,0,1,0,0,1,0,-0.8,-1,-4,-1,""
"1503","False","worth smith good job going",0,1,0,0,1,0,1,2,0,3,1.5,2,5,3,"Trust"
"1504","False","audience laughing quite bit cleaning cat joke least dozen people side oh person said line dalia nasim pedrad comedian even way say clearly joke little surprising disney slid ton dirty joke disney moviesshows meant keep parent interested going child head",0,2,2,0,2,1,1,0,2,4,2.65,-1,4,2,""
"1505","False","nah solid 2nd hellfire take crown going much emotion complexity speaks u human level even today",0,0,0,0,0,0,0,1,1,2,-0.1,1,2,1,"Trust"
"1506","False","find prepared musically satisfying agree hellfire better emotional piece",0,1,0,0,0,0,0,1,0,2,1.8,2,4,2,""
"1507","False","decent understand different actor bring different personality character felt like genie low energy character smith film commit entirely however could preference make seem real attempt keep cgi budget check overall would recommend waiting renting",0,1,0,0,0,0,0,4,0,3,1.5,3,5,3,"Trust"
"1508","False","legit question honestly fathom certainly financially necessary maybe cementgild position alist director adding disney resume suppose reason enough want strengthen pedigree relish opportunity willing throw maybe",0,1,0,0,0,0,0,2,0,6,3.8,3,5,6,"Trust"
"1509","False","said bop automatically disagree taste sorry generation slang",1,0,0,0,0,0,0,0,1,0,-0.6,-2,-3,-1,"Anger"
"1510","False","always enjoyed place joke original always thought eluded genie magic timelessness pulled remake random substitution like yes genie know people beat box jasmine making people disappear screaming song want sultan cool thought differentgood way wrap thing understand empowering girl thing right cool thought part clunky made since soundedlooked much like belonged frozen",1,1,1,3,0,0,0,0,2,2,2.95,2,6,0,"Fear"
"1511","False","loved much probably see week maybe next weekend",0,0,0,0,0,0,0,0,0,0,0.5,1,3,0,""
"1512","False","originally sought singer could act switched casting actor sing aladdin two song mena naomi nailed",0,1,0,0,1,1,0,1,0,1,0.6,0,0,1,""
"1513","True","indian biased naomi scott mena massoud excellent singing acting charisma dancing white guy bollywood mama proud modest costume inspired little lovely silk brocade material blend story indiaarabiaegypt believable casting positive representation hakim also rocked jasmine getting agency",0,3,0,0,5,1,2,6,1,8,6.3,6,12,7,"Trust"
"1514","True","lot friend loved movie kind soso one going talk part jafar already sultan jasmine brought away speechless song like wtf whole time call hakim jafar object hakim wave hand jafar finish jafar sits back like seriously jafar motivation film second one yet let u hakim silence let u forget already frickin sultan lamp yeaaaaah",0,1,0,1,2,0,0,2,1,3,3,1,4,2,""
"1515","False","follows original pretty closely change expanding jasmine role bit almost original song albeit remixed smith actually best part mena massoud aladdin going",0,1,0,1,1,0,0,2,0,1,1.25,2,4,1,"Trust"
"1516","False","heavy hitter lion king circle life wait king hakuna matata feel love tonight incredibly iconic tough cut agree commenter hellfire best villain song poor unfortunate soul favorite musically think",0,1,0,2,2,2,0,1,4,5,5.55111512312578e-17,3,6,1,""
"1517","True","liked thought would time felt like one tv musical 1990s rodger hammerstein cinderella brandi whitney houston especially thought mena massoud pretty much perfect aladdin although change give jasmine role give smith time smith took emphasis away thought kind unfortunate aladdin one disney animated male protagonist felt almost like secondary character movie smith surprisingly decent",1,6,0,1,5,2,2,5,1,6,3.75,4,10,5,"Anticipation"
"1518","False","got instant visual titus cackling rise giant ursula end film pitiful insignificant fool god never wanted anything",1,1,1,2,1,1,0,1,2,1,-2.5,-3,-2,-1,"Fear"
"1519","False","mena nailed dancing definitely highlight complimented naomi think would cute funny jam scene cringy nailed awkwardness",0,0,1,0,0,0,0,0,1,2,1.4,-2,10,1,"Disgust"
"1520","True","movie jazmine ending sultan interesting guess going order merchant give food free since seems concept money even thought read lot book therefore deserves role new song wtf moment get triggered jafar go thanos guard wtf trying way hard emulate elsa failed miserably",1,2,0,2,2,1,2,4,1,5,2.35,-1,-7,4,"Trust"
"1521","False","really bad jafar supposed amazing terrifying nope one",1,0,1,1,0,1,0,0,1,0,-1.25,0,1,-1,""
"1522","False","mena like erol flynn gene kelly type hope get big naomi become alist movie star happen",0,3,0,0,2,0,1,2,0,2,1.85,1,5,2,"Anticipation"
"1523","False","think dorkier aladdin work somebody feel like prince absolutely depthelement forte element swashbuckler true character love jasmine feistier full vigor",0,0,0,0,1,0,0,0,0,5,3.9,3,10,6,"Joy"
"1524","False","really great excited see go next part whole new world hit really took aback powerful",2,2,1,1,2,0,1,2,1,2,2.55,3,8,1,""
"1525","False","also sounded like original singer mena brad kane voice interchangeable naomi jasmine always loved mena dancing friend like amazing naomi singing speechless nail",0,0,0,0,1,0,0,1,0,1,2.3,3,10,1,""
"1526","False","make sense wondering list three rule would removed prohibition killing",1,0,0,2,0,1,0,1,2,1,-1.75,-1,-3,-1,"Fear"
"1527","False","mena sound exactly like brad kane voice identical mena old school mgm musical movie actor naomi alister",1,1,0,0,1,1,1,2,0,1,1.1,1,2,1,"Trust"
"1528","False","brother said look like oscar isaac way kind cracked movie jafar say something familiar man brother leaned said voice look like poe dameron",1,0,0,1,1,0,0,3,1,3,1.7,0,4,2,"Trust"
"1529","False","love jasmine sultan aladdin queen consort love dynamic",0,0,0,1,1,0,1,1,0,1,1.25,2,3,1,""
"1530","False","yeah sultan hakim jafar upset could hire naveen andrew reprise role",1,1,0,1,1,1,0,1,1,1,-0.15,-1,-1,0,""
"1531","False","love idea jason mantzoukas damn bring back naveen andrew",1,0,1,0,1,0,0,0,1,1,0,0,1,0,""
"1532","True","loved dance number",0,0,0,0,1,0,0,1,0,1,1.1,1,3,1,""
"1533","False","mena gorgeous better actor singer dancer superior noah",0,0,0,0,1,0,0,0,0,2,2.05,3,4,2,"Joy"
"1534","False","cgi jafar transformation end horrid",1,0,1,1,0,1,0,0,1,0,-0.5,-1,-3,-1,""
"1535","False","mena super talented take back glad aladdin stand assessment jafar awful",1,1,1,1,1,1,1,1,1,1,1.25,2,3,0,""
"1536","False","bette midler woman nail ursula",0,0,0,0,0,0,0,0,0,0,0,0,0,0,""
"1537","False","disappointed song missing aladdin really need villain song anything hoping would expand toned jafar felt bit toothless time",1,1,1,2,0,2,0,0,3,0,-2.4,-1,-3,-3,""
"1538","False","nope voice make incredible great dancing impeccable going great throwback actor",0,0,0,0,0,0,0,1,0,1,1.5,3,3,1,"Trust"
"1539","True","confused jasmine shocked find prince ali jafar told everybody aladdin jasmine aladdin talk really magic carpet ride",0,0,0,0,0,0,0,0,0,2,0.25,-1,-4,2,""
"1540","False","credit lol",0,0,0,0,0,0,0,1,0,1,0.4,0,3,1,"Trust"
"1541","False","naomi gorgeous queen sarah michelle could get glory movie star naomi even smile dent nose",0,2,1,0,4,0,1,3,0,4,2.1,2,2,4,"Joy"
"1542","False","noticed also staying credit nice like original end people movie singing whole new world great job",0,0,0,0,0,0,0,1,0,2,2.7,3,8,2,"Trust"
"1543","False","saw saw magic carpet one collapsed giggle",0,0,0,0,1,0,0,0,0,1,-0.05,1,-2,1,"Joy"
"1544","False","fun movie",0,1,0,0,1,0,0,0,0,1,0.75,1,4,1,""
"1545","True","cringe humor everything hate modern movie",1,0,2,2,0,2,0,0,2,0,-0.4,0,-1,-2,""
"1546","False","thought aladdin first impression fuck worked well whole point idea flubbing everything yeah hard recover jasmine see trying know rather actually dick",0,1,0,0,0,0,0,0,0,1,0.9,0,-8,1,"Anticipation"
"1547","False","dodge saying prince cosplaying street rat",0,0,1,1,0,0,0,0,1,1,0.1,0,0,0,""
"1548","False","hakim razoul anyway hakim scrawny one original",0,0,0,0,0,0,0,0,0,0,0,0,0,0,""
"1549","False","assume jafar zapping back aladdin complete wardrobe change original line say word prince implying prince longer prince",0,0,0,1,0,0,0,1,0,2,0.6,0,0,2,""
"1550","False","jafar scary enough easily weak point movie",0,0,0,0,0,0,0,0,0,0,-1.25,-1,-4,0,""
"1551","False","think understood happened",0,0,0,0,0,0,0,0,0,0,0,0,0,0,""
"1552","True","bad part gilbert gottfried iago",1,0,1,1,0,1,0,0,1,0,-0.75,-1,-3,-1,""
"1553","False","gt saw dolby audiocolors great bass drop prince ali number maybe effective nonlive bass drop experienced least theater",0,0,0,0,0,0,0,2,0,3,2.5,2,4,3,"Trust"
"1554","False","rewatched genie claimed powerful universe",1,1,1,1,1,0,0,1,0,1,0.75,1,2,1,""
"1555","True","feel like live world pikachu say hell live world guy ritchie could let aladdin actually say look abu everyday see horse two ass deserve dammit ala still disney grave injustice absolutely loved movie tone perfect lead fantastic much fun want see",3,3,1,2,2,2,0,3,4,4,0.95,4,5,0,""
"1556","False","announced genie actually thing least worried movie totally board casting people need realize playing robin williams genie playing version",0,1,0,0,0,1,0,0,1,0,-0.75,-1,-3,-1,""
"1557","True","follow youtube channel kid target audience review kid film really trust people target demographic tell u good movie",0,2,0,0,1,0,1,2,0,1,1.25,2,4,1,""
"1558","False","oh yea loll b",0,0,0,0,0,0,0,0,0,0,0,0,0,0,""
"1559","True","skeptical new aladdin bad beauty beast remake awesome definitely go see",2,0,1,2,1,1,0,0,3,2,-0.1,0,2,-1,""
"1560","False","actually thought referenced cutting hand jasmine took bread shopkeep holding jasmine wrist aladdin came took hold saying want shopkeep replied yes put twist aladdin take bracelet",1,1,1,1,0,1,0,0,1,0,0.8,-1,1,-1,""
"1561","False","think none cut original movie hour half keep song still half hour pad want still find prepared much interesting song lion king instrumentation chorus used effectively especially build end melody crescendo king undisputed respected saluted give chill every time one accomplished composition disney movie",0,3,0,1,2,0,1,2,0,9,4.7,3,11,9,"Anticipation"
"1562","True","movie definitely fun watch favorite live action remake great job one smith best could genie making pleased smith smith trying remaster robin williams personally feel aladdin experience movie aladdin playshow disneyland always favorite rendition aladdin aladdin king thief personal favorite story hope live action continues far would say five hundred and ten",1,3,1,2,4,1,2,4,1,8,3.1,5,17,7,""
"1563","False","agreed sounded cool would love see effect used movie",0,0,0,0,1,0,0,1,0,3,2,2,5,3,""
"1564","False","also shot night understand faithful original would lot breathtaking could see everything clearly",1,0,0,1,0,1,1,1,1,1,1.35,3,9,0,""
"1565","False","guy fell wellhole thing",0,0,0,0,0,1,0,0,1,0,-0.5,-1,0,-1,"Sadness"
"1566","False","horse two ass great sure exchange good setup one jump ahead reprise guy said born street rat line really reason say",0,1,1,1,2,0,1,3,2,5,1.9,2,2,3,"Trust"
"1567","False","jfc song play end credit",0,0,0,0,0,0,0,1,0,1,0.4,0,0,1,"Trust"
"1568","False","wife said looked lot like eva longoria",0,0,0,0,0,0,0,0,0,0,0.5,1,2,0,""
"1569","False","way leave lyric rest u",0,0,0,0,0,1,1,0,1,1,-0.25,0,-1,0,""
"1570","True","saw movie real good bad review talking smith great job playing genie idea getting much hate flaw saw movie also pointing finger original movie well like wish prince really anything either movie also like last wish handled get turned genie wish original movie wish turned difference powerful genie mean genie like",3,2,3,3,2,3,1,4,3,5,2.95,2,3,2,"Trust"
"1571","False","damn thought dead",1,1,1,0,0,0,0,0,1,0,-1.75,-2,-5,-1,""
"1572","False","smith far best part movie let u honest great job filling epic role",1,0,1,1,1,1,0,2,0,3,2.55,3,8,3,"Trust"
"1573","True","eight year old daughter hated left early said kid asking thier parent leave idea true",0,0,0,0,1,1,1,0,1,1,0.35,-1,-2,1,""
"1574","False","like sped",0,0,0,0,0,0,0,0,0,0,0.5,1,2,0,""
"1575","True","enjoyed movie smith fantastic job genie liked made genie different animated version hearing friend like prince ali made want download soundtrack highly recommend seeing",0,0,0,1,2,0,0,3,1,5,5.05,5,14,4,"Trust"
"1576","False","jafar please shut jasmin reeeeeeeeeeeeeeeee",0,0,0,0,0,0,0,0,0,0,1,0,1,0,""
"1577","True","someone tell dog movie trailer making many screen blacked trailer almost get see movie",0,0,0,0,0,0,0,0,0,0,0,0,0,0,""
"1578","False","wait remake era disney sometimes milking nostalgia little bit much remaking reaallly old disney movie snow white jungle book 90 disney movie still fresh collective memory iconic fairly remade without copied may walt inspire someone disney board soon get trend",0,4,0,1,2,0,0,3,1,5,2.3,3,3,4,"Anticipation"
"1579","False","nobody left theater adult like ten people",0,0,0,0,0,0,0,0,0,0,0.5,1,2,0,""
"1580","False","gt sometimes milking nostalgia little bit much yep straight cashins make even awkward obvious play nostalgia shot shot remake really work entertain nostalgic audience boring create new story new generation please instead mediocre onetime cash movie younger generation honestly never remember",2,2,0,2,3,1,1,2,3,6,2.55,-1,-3,3,"Joy"
"1581","False","career dead",0,1,0,0,0,0,0,0,0,1,-1,-1,-3,1,"Anticipation"
"1582","False","oh agree working premise understood live action remake cutting one song specifically prepared",1,1,1,1,0,1,0,1,1,5,1.75,0,1,4,""
"1583","True","quite thought please put mena massoud everything forever dude charisma charm scene meet sultan fucking dying give man shit ton work naomi scott already knew talented killed gave jasmine much version nailed original song gave great pleasantly surprised smith version genie took small direction robin williams version felt like prefer williams smith great job though still eh blue human version way pleasant wish gave little screen time dalia going frame movie care version prince ali visually great musically weirdly flat unfortunate sore thumb rest great friend like much lived original jafar okay absurdly camp original outright bad think issue he clear motivation original jafar put upon advisor simple sultan yeah machination rule kingdom kind get manipulate one seems pretty beloved competent maybe take time show motivation wanting rule overall remotely eh rt meter seems imply far away better beauty beast step cinderella wish let guy richie go little crazier direction loved moment visual flair best work since man uncle strong seven hundred and ten hope build strength remake",5,5,3,5,6,6,3,11,9,15,9.2,5,26,6,"Trust"
"1584","False","make man song need",0,0,0,0,0,0,0,0,0,0,0,0,0,0,""
"1585","False","really weird moment really cool visual really good original song wish added song broadway show cut song original well",0,1,1,0,1,0,1,2,1,2,2.6,2,2,1,"Trust"
"1586","False","dog movie trailer every single film lately give away entire plot well",0,0,0,0,0,0,0,0,0,0,0.8,0,0,0,""
"1587","True","new lyric prince ali interesting go talking animal menagerie convincing bunch religious probably married woman adjust veil grovel yummy physique also like barge palace instead invited wait asked smith enthusiasm slays especially towards end sound shocked number animal brought",0,2,0,0,1,0,1,2,1,4,4.65,3,5,3,""
"1588","False","see think may actually hotter buffy smg crazy know",1,0,0,1,0,1,0,0,1,0,-0.75,-1,-2,-1,""
"1589","True","seen comment may big deal audience however anyone else feel like singing whole new world carpeting around whole world like animation rather around hood",1,2,1,1,1,0,1,1,1,1,1.8,1,3,0,"Anticipation"
"1590","False","oddly enough kind feel like tyduk hei hei iago",0,0,0,0,1,0,0,1,0,1,0.15,1,4,1,""
"1591","False","dj khaled hit noped theatre like need messing disney staple either",1,0,0,0,0,0,0,0,1,0,0.25,0,2,-1,"Anger"
"1592","False","article make seem like nothing getting cut finger crossed",0,0,0,0,0,0,0,0,0,0,0.25,1,1,0,""
"1593","False","seen comment may big deal audience however anyone else feel like singing whole new world carpeting around whole world like animation rather around hood",1,2,1,1,1,0,1,1,1,1,1.8,1,3,0,"Anticipation"
"1594","False","yeah agree really sure replied comment though haha guess wanted seem bit realistic trip around globe probably would taken week month",0,0,0,0,0,0,2,0,0,1,1.1,1,5,1,"Surprise"
"1595","True","went skeptical came honestly loving people going compare away original part pale somewhat compared predecessor lago jafar come mind brings wonderful spin original story think people fence really need give chance smith genie easily favorite part brought nice mix robin williams style well work wonderfully especially cartoony scene character really shine grinning ear ear friend like",0,0,0,0,5,0,3,5,1,6,5.25,7,18,5,""
"1596","False","think might died actually dunno well supposed water bottom theoretically could gotten help",0,0,0,0,0,1,0,0,1,0,0.3,0,-1,-1,"Sadness"
"1597","False","genie made gray area comment jafar needed specific else genie decide fulfill wish orginal genie know going happen 3rd wish version genie",0,1,1,0,1,1,0,0,0,1,1.55,0,2,1,""
"1598","False","nothing worse two bad thing aquaman dialogue song fix one remove best movie two thousand and eighteen",2,0,1,3,0,3,0,0,3,0,-1.25,-1,-3,-3,""
"1599","False","oh geez copy pasted without looking hah yes kind reminded u oh yeah smith song lol welcome miami flashed",0,0,0,0,1,0,0,2,1,1,1.8,1,9,0,"Trust"
"1600","False","live action abu",0,0,0,0,0,0,0,0,0,1,0.25,0,0,1,""
"1601","False","tried bring realism ground purpose live action",0,0,0,0,0,0,0,1,0,1,0.25,0,0,1,"Trust"
"1602","False","wanted power get revenge rule everybody pushing war sultanate",1,1,0,3,0,0,1,1,2,0,-1.5,-1,-4,-2,"Fear"
"1603","False","must missed something getting revenge kingdom something use bathroom really quick think missed something",1,1,0,1,0,0,1,0,1,0,-1.5,-2,-4,-1,""
"1604","False","watching movie get cast teeth jafar cartoon gnarly crooked teeth kind bared snarled dude nailed part character thought",0,1,0,0,1,0,0,1,0,1,-1,-1,2,1,""
"1605","False","awesome make tinkerbell effect right see thing",0,0,0,0,0,0,0,0,0,0,1.4,2,4,0,""
"1606","False","original specifically said wanted powerful genie world",1,1,1,1,1,0,0,1,0,1,0.75,1,2,1,""
"1607","False","wonder happened",0,0,0,0,0,0,0,0,0,0,0,1,0,0,""
"1608","False","yes genie think repercussion enslaved lantern version knew",1,0,1,1,0,1,0,0,1,0,0.3,0,-3,-1,""
"1609","False","want hercules remake maybe tarzan",0,0,0,0,0,0,0,0,0,1,0,0,1,1,""
"1610","False","funny thought couple different line movie like aladdin wish genie freedom delivery good original",0,3,0,0,2,0,1,2,0,3,4.2,2,12,3,"Anticipation"
"1611","False","saw yesterday literally first thing movie end pretty jarring unnecessary",0,1,0,1,1,1,0,1,1,1,-0.35,-1,1,0,""
"1612","False","bop head",0,0,0,0,0,0,0,0,0,0,0,0,0,0,""
"1613","False","wth bop",0,0,0,0,0,0,0,0,0,0,0,0,0,0,""
"1614","False","prisoner several year",1,0,1,1,0,1,0,0,1,0,-0.75,-1,-2,-1,""
"1615","False","ohhhhh totally missed bit okay bit clear",0,0,0,0,0,0,0,0,0,0,0,0,-1,0,""
"1616","True","better thought still bland cast good really missed jafar much screen needed something better",0,2,0,0,1,0,1,1,1,1,0.55,0,3,0,"Anticipation"
"1617","False","tsunami made joke",0,0,0,0,0,0,0,0,1,0,0.6,-1,2,-1,""
"1618","True","dear evan hansen aladdin story",0,0,0,0,0,0,0,0,0,1,0.5,0,2,1,""
"1619","False","yikes",0,0,0,0,0,0,0,0,0,0,0,0,0,0,""
"1620","False","mena gorgeous infectious personality",0,0,1,1,1,1,0,0,1,1,-0.5,1,-2,0,""
"1621","True","think cast valiant job movie lack emotional depth original remember miss genie scene end original cried watched first time kid still get teary eyed even adult many year compare new one match even take robin williams equation wish hurry much making one maybe made mulan tarzan first taking chance aladdin",0,2,0,0,0,0,1,1,1,3,-0.45,-1,-3,2,"Anticipation"
"1622","True","genie make prince look like one also genie sultan listen",0,0,0,1,0,0,0,0,0,1,1.1,1,2,1,"Fear"
"1623","False","apparently cuz captain guy flip flop",0,0,1,0,0,1,0,0,1,1,0,0,-2,0,""
